{"timestamp": "2026-09-09T20:32:27+00:00", "label": "t04-finallrfrac-10-900s", "solution": "T0.4", "description": "FINAL_LR_FRAC 0.05 -> 0.10", "launch_command": "NEURON_LOGICAL_NC_CONFIG=2 torchrun --standalone --nproc_per_node=4 train.py --num-steps 5000 --max-train-seconds 900 --out-dir out/t04-finallrfrac-10-900s --final-lr-frac 0.10", "git_commit": "fdc64f0", "git_dirty": true, "status": "keep", "wall_elapsed_seconds": 960.6, "run_log": "research/run-logs/t04-finallrfrac-10-900s.log", "checkpoint_path": "out/t04-finallrfrac-10-900s/final.pt", "training_seconds": 894.9, "budget_seconds": 1800, "target_steps": 5000, "max_train_seconds": 900, "startup_allowance_est": 53.6, "charged_seconds_est": 895.1, "over_budget": false, "total_seconds": 937.4, "compiled": true, "nki_relu2": false, "num_steps": 1099, "total_tokens_M": 144.0, "world_size": 4, "lnc": 2, "seq_len": 2048, "num_params_M": 55.7, "causality_passed": true, "causality_max_abs": 0.0, "public_val_bpb": 1.083256, "eval_seconds": 7.6, "eval_timeout": 1200, "eval_over_timeout": false}
{"timestamp": "2026-09-09T20:48:28+00:00", "label": "t04-finallrfrac-15-900s", "solution": "T0.4", "description": "FINAL_LR_FRAC 0.05 -> 0.15", "launch_command": "NEURON_LOGICAL_NC_CONFIG=2 torchrun --standalone --nproc_per_node=4 train.py --num-steps 5000 --max-train-seconds 900 --out-dir out/t04-finallrfrac-15-900s --final-lr-frac 0.15", "git_commit": "fdc64f0", "git_dirty": true, "status": "keep", "wall_elapsed_seconds": 961.6, "run_log": "research/run-logs/t04-finallrfrac-15-900s.log", "checkpoint_path": "out/t04-finallrfrac-15-900s/final.pt", "training_seconds": 894.3, "budget_seconds": 1800, "target_steps": 5000, "max_train_seconds": 900, "startup_allowance_est": 55.3, "charged_seconds_est": 894.5, "over_budget": false, "total_seconds": 936.5, "compiled": true, "nki_relu2": false, "num_steps": 1100, "total_tokens_M": 144.2, "world_size": 4, "lnc": 2, "seq_len": 2048, "num_params_M": 55.7, "causality_passed": true, "causality_max_abs": 0.0, "public_val_bpb": 1.084506, "eval_seconds": 7.5, "eval_timeout": 1200, "eval_over_timeout": false}
{"timestamp": "2026-09-09T23:28:56+00:00", "label": "t04-initscale-050-900s", "solution": "T0.4", "description": "INIT_SCALE 0.68 -> 0.50", "launch_command": "NEURON_LOGICAL_NC_CONFIG=2 torchrun --standalone --nproc_per_node=4 train.py --num-steps 5000 --max-train-seconds 900 --out-dir out/t04-initscale-050-900s --init-scale 0.50", "git_commit": "fdc64f0", "git_dirty": true, "status": "keep", "wall_elapsed_seconds": 965.7, "run_log": "research/run-logs/t04-initscale-050-900s.log", "checkpoint_path": "out/t04-initscale-050-900s/final.pt", "training_seconds": 894.9, "budget_seconds": 1800, "target_steps": 5000, "max_train_seconds": 900, "startup_allowance_est": 58.3, "charged_seconds_est": 895.1, "over_budget": false, "total_seconds": 937.3, "compiled": true, "nki_relu2": false, "num_steps": 1099, "total_tokens_M": 144.0, "world_size": 4, "lnc": 2, "seq_len": 2048, "num_params_M": 55.7, "causality_passed": true, "causality_max_abs": 0.0, "public_val_bpb": 1.08138, "eval_seconds": 7.6, "eval_timeout": 1200, "eval_over_timeout": false}
{"timestamp": "2026-09-09T23:44:59+00:00", "label": "t04-initscale-085-900s", "solution": "T0.4", "description": "INIT_SCALE 0.68 -> 0.85", "launch_command": "NEURON_LOGICAL_NC_CONFIG=2 torchrun --standalone --nproc_per_node=4 train.py --num-steps 5000 --max-train-seconds 900 --out-dir out/t04-initscale-085-900s --init-scale 0.85", "git_commit": "fdc64f0", "git_dirty": true, "status": "keep", "wall_elapsed_seconds": 963.1, "run_log": "research/run-logs/t04-initscale-085-900s.log", "checkpoint_path": "out/t04-initscale-085-900s/final.pt", "training_seconds": 894.7, "budget_seconds": 1800, "target_steps": 5000, "max_train_seconds": 900, "startup_allowance_est": 55.9, "charged_seconds_est": 894.8, "over_budget": false, "total_seconds": 937.4, "compiled": true, "nki_relu2": false, "num_steps": 1098, "total_tokens_M": 143.9, "world_size": 4, "lnc": 2, "seq_len": 2048, "num_params_M": 55.7, "causality_passed": true, "causality_max_abs": 0.0, "public_val_bpb": 1.082347, "eval_seconds": 7.7, "eval_timeout": 1200, "eval_over_timeout": false}
{"timestamp": "2026-09-10T02:14:52+00:00", "label": "t04-matrixlr-015-900s", "solution": "T0.4", "description": "MATRIX_LR 0.025 -> 0.015 (0.020 was the best of the first pass, extending downward)", "launch_command": "NEURON_LOGICAL_NC_CONFIG=2 torchrun --standalone --nproc_per_node=4 train.py --num-steps 5000 --max-train-seconds 900 --out-dir out/t04-matrixlr-015-900s --matrix-lr 0.015", "git_commit": "fdc64f0", "git_dirty": true, "status": "keep", "wall_elapsed_seconds": 966.8, "run_log": "research/run-logs/t04-matrixlr-015-900s.log", "checkpoint_path": "out/t04-matrixlr-015-900s/final.pt", "training_seconds": 894.7, "budget_seconds": 1800, "target_steps": 5000, "max_train_seconds": 900, "startup_allowance_est": 59.8, "charged_seconds_est": 894.9, "over_budget": false, "total_seconds": 938.1, "compiled": true, "nki_relu2": false, "num_steps": 1095, "total_tokens_M": 143.5, "world_size": 4, "lnc": 2, "seq_len": 2048, "num_params_M": 55.7, "causality_passed": true, "causality_max_abs": 0.0, "public_val_bpb": 1.085014, "eval_seconds": 7.5, "eval_timeout": 1200, "eval_over_timeout": false}
{"timestamp": "2026-09-09T19:20:11+00:00", "label": "t04-matrixlr-020-900s", "solution": "T0.4", "description": "MATRIX_LR 0.025 -> 0.020", "launch_command": "NEURON_LOGICAL_NC_CONFIG=2 torchrun --standalone --nproc_per_node=4 train.py --num-steps 5000 --max-train-seconds 900 --out-dir out/t04-matrixlr-020-900s --matrix-lr 0.020", "git_commit": "fdc64f0", "git_dirty": true, "status": "keep", "wall_elapsed_seconds": 961.4, "run_log": "research/run-logs/t04-matrixlr-020-900s.log", "checkpoint_path": "out/t04-matrixlr-020-900s/final.pt", "training_seconds": 894.3, "budget_seconds": 1800, "target_steps": 5000, "max_train_seconds": 900, "startup_allowance_est": 54.9, "charged_seconds_est": 894.5, "over_budget": false, "total_seconds": 936.4, "compiled": true, "nki_relu2": false, "num_steps": 1101, "total_tokens_M": 144.3, "world_size": 4, "lnc": 2, "seq_len": 2048, "num_params_M": 55.7, "causality_passed": true, "causality_max_abs": 0.0, "public_val_bpb": 1.081451, "eval_seconds": 7.6, "eval_timeout": 1200, "eval_over_timeout": false}
{"timestamp": "2026-09-10T02:30:57+00:00", "label": "t04-matrixlr-020-900s-v2", "solution": "T0.4", "description": "MATRIX_LR 0.020 paired repeat (only candidate improvement so far, -0.000835 is inside the noise band)", "launch_command": "NEURON_LOGICAL_NC_CONFIG=2 torchrun --standalone --nproc_per_node=4 train.py --num-steps 5000 --max-train-seconds 900 --out-dir out/t04-matrixlr-020-900s-v2 --matrix-lr 0.020", "git_commit": "fdc64f0", "git_dirty": true, "status": "keep", "wall_elapsed_seconds": 964.4, "run_log": "research/run-logs/t04-matrixlr-020-900s-v2.log", "checkpoint_path": "out/t04-matrixlr-020-900s-v2/final.pt", "training_seconds": 894.4, "budget_seconds": 1800, "target_steps": 5000, "max_train_seconds": 900, "startup_allowance_est": 57.7, "charged_seconds_est": 894.6, "over_budget": false, "total_seconds": 937.0, "compiled": true, "nki_relu2": false, "num_steps": 1095, "total_tokens_M": 143.5, "world_size": 4, "lnc": 2, "seq_len": 2048, "num_params_M": 55.7, "causality_passed": true, "causality_max_abs": 0.0, "public_val_bpb": 1.08218, "eval_seconds": 7.6, "eval_timeout": 1200, "eval_over_timeout": false}
{"timestamp": "2026-09-09T20:00:24+00:00", "label": "t04-matrixlr-030-900s", "solution": "T0.4", "description": "MATRIX_LR 0.025 -> 0.030", "launch_command": "NEURON_LOGICAL_NC_CONFIG=2 torchrun --standalone --nproc_per_node=4 train.py --num-steps 5000 --max-train-seconds 900 --out-dir out/t04-matrixlr-030-900s --matrix-lr 0.030", "git_commit": "fdc64f0", "git_dirty": true, "status": "keep", "wall_elapsed_seconds": 963.5, "run_log": "research/run-logs/t04-matrixlr-030-900s.log", "checkpoint_path": "out/t04-matrixlr-030-900s/final.pt", "training_seconds": 894.9, "budget_seconds": 1800, "target_steps": 5000, "max_train_seconds": 900, "startup_allowance_est": 56.3, "charged_seconds_est": 895.1, "over_budget": false, "total_seconds": 937.2, "compiled": true, "nki_relu2": false, "num_steps": 1101, "total_tokens_M": 144.3, "world_size": 4, "lnc": 2, "seq_len": 2048, "num_params_M": 55.7, "causality_passed": true, "causality_max_abs": 0.0, "public_val_bpb": 1.082838, "eval_seconds": 7.7, "eval_timeout": 1200, "eval_over_timeout": false}
{"timestamp": "2026-09-09T20:16:26+00:00", "label": "t04-matrixlr-035-900s", "solution": "T0.4", "description": "MATRIX_LR 0.025 -> 0.035", "launch_command": "NEURON_LOGICAL_NC_CONFIG=2 torchrun --standalone --nproc_per_node=4 train.py --num-steps 5000 --max-train-seconds 900 --out-dir out/t04-matrixlr-035-900s --matrix-lr 0.035", "git_commit": "fdc64f0", "git_dirty": true, "status": "keep", "wall_elapsed_seconds": 962.1, "run_log": "research/run-logs/t04-matrixlr-035-900s.log", "checkpoint_path": "out/t04-matrixlr-035-900s/final.pt", "training_seconds": 894.2, "budget_seconds": 1800, "target_steps": 5000, "max_train_seconds": 900, "startup_allowance_est": 55.7, "charged_seconds_est": 894.4, "over_budget": false, "total_seconds": 936.4, "compiled": true, "nki_relu2": false, "num_steps": 1100, "total_tokens_M": 144.2, "world_size": 4, "lnc": 2, "seq_len": 2048, "num_params_M": 55.7, "causality_passed": true, "causality_max_abs": 0.0, "public_val_bpb": 1.083276, "eval_seconds": 7.6, "eval_timeout": 1200, "eval_over_timeout": false}
{"timestamp": "2026-09-10T01:23:28+00:00", "label": "t04-momcooldown-900s", "solution": "T0.4", "description": "Muon momentum 0.95 -> 0.85 over the last 4.5 pct of the budget (~50 steps at 900s)", "launch_command": "NEURON_LOGICAL_NC_CONFIG=2 torchrun --standalone --nproc_per_node=4 train.py --num-steps 5000 --max-train-seconds 900 --out-dir out/t04-momcooldown-900s --muon-momentum-cooldown-frac 0.045 --muon-momentum-final 0.85", "git_commit": "fdc64f0", "git_dirty": true, "status": "keep", "wall_elapsed_seconds": 963.7, "run_log": "research/run-logs/t04-momcooldown-900s.log", "checkpoint_path": "out/t04-momcooldown-900s/final.pt", "training_seconds": 894.8, "budget_seconds": 1800, "target_steps": 5000, "max_train_seconds": 900, "startup_allowance_est": 56.3, "charged_seconds_est": 895.0, "over_budget": false, "total_seconds": 937.1, "compiled": true, "nki_relu2": false, "num_steps": 1097, "total_tokens_M": 143.8, "world_size": 4, "lnc": 2, "seq_len": 2048, "num_params_M": 55.7, "causality_passed": true, "causality_max_abs": 0.0, "public_val_bpb": 1.081793, "eval_seconds": 7.8, "eval_timeout": 1200, "eval_over_timeout": false}
{"timestamp": "2026-09-10T01:07:24+00:00", "label": "t04-nssteps-4-900s", "solution": "T0.4", "description": "MUON ns_steps 5 -> 4", "launch_command": "NEURON_LOGICAL_NC_CONFIG=2 torchrun --standalone --nproc_per_node=4 train.py --num-steps 5000 --max-train-seconds 900 --out-dir out/t04-nssteps-4-900s --muon-ns-steps 4", "git_commit": "fdc64f0", "git_dirty": true, "status": "keep", "wall_elapsed_seconds": 961.5, "run_log": "research/run-logs/t04-nssteps-4-900s.log", "checkpoint_path": "out/t04-nssteps-4-900s/final.pt", "training_seconds": 894.2, "budget_seconds": 1800, "target_steps": 5000, "max_train_seconds": 900, "startup_allowance_est": 54.8, "charged_seconds_est": 894.4, "over_budget": false, "total_seconds": 937.6, "compiled": true, "nki_relu2": false, "num_steps": 1100, "total_tokens_M": 144.2, "world_size": 4, "lnc": 2, "seq_len": 2048, "num_params_M": 55.7, "causality_passed": true, "causality_max_abs": 0.0, "public_val_bpb": 1.083371, "eval_seconds": 7.6, "eval_timeout": 1200, "eval_over_timeout": false}
{"timestamp": "2026-09-10T00:34:15+00:00", "label": "t04-softcap-075-900s", "solution": "T0.4", "description": "LOGIT_SOFTCAP 15.0 -> 7.5", "launch_command": "NEURON_LOGICAL_NC_CONFIG=2 torchrun --standalone --nproc_per_node=4 train.py --num-steps 5000 --max-train-seconds 900 --out-dir out/t04-softcap-075-900s --logit-softcap 7.5", "git_commit": "fdc64f0", "git_dirty": true, "status": "keep", "wall_elapsed_seconds": 1025.8, "run_log": "research/run-logs/t04-softcap-075-900s.log", "checkpoint_path": "out/t04-softcap-075-900s/final.pt", "training_seconds": 894.6, "budget_seconds": 1800, "target_steps": 5000, "max_train_seconds": 900, "startup_allowance_est": 118.9, "charged_seconds_est": 894.8, "over_budget": false, "total_seconds": 999.7, "compiled": true, "nki_relu2": false, "num_steps": 1096, "total_tokens_M": 143.7, "world_size": 4, "lnc": 2, "seq_len": 2048, "num_params_M": 55.7, "causality_passed": true, "causality_max_abs": 0.0, "public_val_bpb": 1.086722, "eval_seconds": 7.7, "eval_timeout": 1200, "eval_over_timeout": false}
{"timestamp": "2026-09-10T00:51:22+00:00", "label": "t04-softcap-225-900s", "solution": "T0.4", "description": "LOGIT_SOFTCAP 15.0 -> 22.5", "launch_command": "NEURON_LOGICAL_NC_CONFIG=2 torchrun --standalone --nproc_per_node=4 train.py --num-steps 5000 --max-train-seconds 900 --out-dir out/t04-softcap-225-900s --logit-softcap 22.5", "git_commit": "fdc64f0", "git_dirty": true, "status": "keep", "wall_elapsed_seconds": 1027.2, "run_log": "research/run-logs/t04-softcap-225-900s.log", "checkpoint_path": "out/t04-softcap-225-900s/final.pt", "training_seconds": 894.8, "budget_seconds": 1800, "target_steps": 5000, "max_train_seconds": 900, "startup_allowance_est": 119.9, "charged_seconds_est": 895.0, "over_budget": false, "total_seconds": 1001.2, "compiled": true, "nki_relu2": false, "num_steps": 1095, "total_tokens_M": 143.5, "world_size": 4, "lnc": 2, "seq_len": 2048, "num_params_M": 55.7, "causality_passed": true, "causality_max_abs": 0.0, "public_val_bpb": 1.083872, "eval_seconds": 7.7, "eval_timeout": 1200, "eval_over_timeout": false}
{"timestamp": "2026-09-10T04:28:29+00:00", "label": "t04-stack-900s", "solution": "T0.4", "description": "Combined T0.4 stack: MATRIX_LR 0.020, WEIGHT_DECAY 0.20 (decay-to-zero left ON, because 0.20+no-decay-to-zero together came in WORSE than either alone), INIT_SCALE 0.50, attn.c_proj init 0.10*s, Muon momentum cooldown 0.95->0.85 over the last 4.5%. Tests whether the sub-noise single-axis gains add above the 0.002 lock threshold.", "launch_command": "NEURON_LOGICAL_NC_CONFIG=2 torchrun --standalone --nproc_per_node=4 train.py --num-steps 5000 --max-train-seconds 900 --out-dir out/t04-stack-900s --matrix-lr 0.020 --weight-decay 0.20 --init-scale 0.50 --attn-cproj-init 0.10 --muon-momentum-cooldown-frac 0.045 --muon-momentum-final 0.85", "git_commit": "fdc64f0", "git_dirty": true, "status": "keep", "wall_elapsed_seconds": 962.9, "run_log": "research/run-logs/t04-stack-900s.log", "checkpoint_path": "out/t04-stack-900s/final.pt", "training_seconds": 894.9, "budget_seconds": 1800, "target_steps": 5000, "max_train_seconds": 900, "startup_allowance_est": 55.6, "charged_seconds_est": 895.1, "over_budget": false, "total_seconds": 937.1, "compiled": true, "nki_relu2": false, "num_steps": 1097, "total_tokens_M": 143.8, "world_size": 4, "lnc": 2, "seq_len": 2048, "num_params_M": 55.7, "causality_passed": true, "causality_max_abs": 0.0, "public_val_bpb": 1.081226, "eval_seconds": 7.6, "eval_timeout": 1200, "eval_over_timeout": false}
{"timestamp": "2026-09-10T04:44:33+00:00", "label": "t04-stack-900s-v2", "solution": "T0.4", "description": "Combined T0.4 stack, paired repeat", "launch_command": "NEURON_LOGICAL_NC_CONFIG=2 torchrun --standalone --nproc_per_node=4 train.py --num-steps 5000 --max-train-seconds 900 --out-dir out/t04-stack-900s-v2 --matrix-lr 0.020 --weight-decay 0.20 --init-scale 0.50 --attn-cproj-init 0.10 --muon-momentum-cooldown-frac 0.045 --muon-momentum-final 0.85", "git_commit": "fdc64f0", "git_dirty": true, "status": "keep", "wall_elapsed_seconds": 963.5, "run_log": "research/run-logs/t04-stack-900s-v2.log", "checkpoint_path": "out/t04-stack-900s-v2/final.pt", "training_seconds": 894.8, "budget_seconds": 1800, "target_steps": 5000, "max_train_seconds": 900, "startup_allowance_est": 56.3, "charged_seconds_est": 895.0, "over_budget": false, "total_seconds": 937.3, "compiled": true, "nki_relu2": false, "num_steps": 1096, "total_tokens_M": 143.7, "world_size": 4, "lnc": 2, "seq_len": 2048, "num_params_M": 55.7, "causality_passed": true, "causality_max_abs": 0.0, "public_val_bpb": 1.081464, "eval_seconds": 7.7, "eval_timeout": 1200, "eval_over_timeout": false}
{"timestamp": "2026-09-10T07:46:14+00:00", "label": "t04-stack-defaults-fullbudget", "solution": "T0.4", "description": "Defaults-flip verification: the T0.4 stack now hardcoded in train.py, launched with NO flags at the full 1800s budget. Must reproduce t04-stack-fullbudget (2205/1.034005, 2199/1.034101) -- proves the constant edits are equivalent to the flagged runs and doubles as a third stack data point at the decision budget.", "launch_command": "NEURON_LOGICAL_NC_CONFIG=2 torchrun --standalone --nproc_per_node=4 train.py --num-steps 5000 --max-train-seconds 1800 --out-dir out/t04-stack-defaults-fullbudget", "git_commit": "fdc64f0", "git_dirty": true, "status": "keep", "wall_elapsed_seconds": 1924.9, "run_log": "research/run-logs/t04-stack-defaults-fullbudget.log", "checkpoint_path": "out/t04-stack-defaults-fullbudget/final.pt", "training_seconds": 1794.7, "budget_seconds": 1800, "target_steps": 5000, "max_train_seconds": 1800, "startup_allowance_est": 118.0, "charged_seconds_est": 1794.9, "over_budget": false, "total_seconds": 1897.4, "compiled": true, "nki_relu2": false, "num_steps": 2199, "total_tokens_M": 288.2, "world_size": 4, "lnc": 2, "seq_len": 2048, "num_params_M": 55.7, "causality_passed": true, "causality_max_abs": 0.0, "public_val_bpb": 1.034118, "eval_seconds": 7.6, "eval_timeout": 1200, "eval_over_timeout": false}
{"timestamp": "2026-09-10T06:02:52+00:00", "label": "t04-stack-fullbudget", "solution": "T0.4", "description": "Full 1800s budget with the combined T0.4 stack (MATRIX_LR 0.020, WEIGHT_DECAY 0.20, INIT_SCALE 0.50, attn.c_proj init 0.10*s, Muon momentum cooldown 0.95->0.85 over last 4.5%). The single combined confirmation run for T0.4.", "launch_command": "NEURON_LOGICAL_NC_CONFIG=2 torchrun --standalone --nproc_per_node=4 train.py --num-steps 5000 --max-train-seconds 1800 --out-dir out/t04-stack-fullbudget --matrix-lr 0.020 --weight-decay 0.20 --init-scale 0.50 --attn-cproj-init 0.10 --muon-momentum-cooldown-frac 0.045 --muon-momentum-final 0.85", "git_commit": "fdc64f0", "git_dirty": true, "status": "keep", "wall_elapsed_seconds": 1863.0, "run_log": "research/run-logs/t04-stack-fullbudget.log", "checkpoint_path": "out/t04-stack-fullbudget/final.pt", "training_seconds": 1794.3, "budget_seconds": 1800, "target_steps": 5000, "max_train_seconds": 1800, "startup_allowance_est": 56.5, "charged_seconds_est": 1794.4, "over_budget": false, "total_seconds": 1836.4, "compiled": true, "nki_relu2": false, "num_steps": 2205, "total_tokens_M": 289.0, "world_size": 4, "lnc": 2, "seq_len": 2048, "num_params_M": 55.7, "causality_passed": true, "causality_max_abs": 0.0, "public_val_bpb": 1.034005, "eval_seconds": 7.5, "eval_timeout": 1200, "eval_over_timeout": false}
{"timestamp": "2026-09-10T06:35:14+00:00", "label": "t04-stack-fullbudget-v2", "solution": "T0.4", "description": "Paired repeat of the combined T0.4 stack at full 1800s budget (first pair gave -0.001068, which is only just above the single-run noise line, so the decision-budget comparison gets n=2)", "launch_command": "NEURON_LOGICAL_NC_CONFIG=2 torchrun --standalone --nproc_per_node=4 train.py --num-steps 5000 --max-train-seconds 1800 --out-dir out/t04-stack-fullbudget-v2 --matrix-lr 0.020 --weight-decay 0.20 --init-scale 0.50 --attn-cproj-init 0.10 --muon-momentum-cooldown-frac 0.045 --muon-momentum-final 0.85", "git_commit": "fdc64f0", "git_dirty": true, "status": "keep", "wall_elapsed_seconds": 1852.1, "run_log": "research/run-logs/t04-stack-fullbudget-v2.log", "checkpoint_path": "out/t04-stack-fullbudget-v2/final.pt", "training_seconds": 1794.4, "budget_seconds": 1800, "target_steps": 5000, "max_train_seconds": 1800, "startup_allowance_est": 45.3, "charged_seconds_est": 1794.6, "over_budget": false, "total_seconds": 1836.3, "compiled": true, "nki_relu2": false, "num_steps": 2199, "total_tokens_M": 288.2, "world_size": 4, "lnc": 2, "seq_len": 2048, "num_params_M": 55.7, "causality_passed": true, "causality_max_abs": 0.0, "public_val_bpb": 1.034101, "eval_seconds": 7.6, "eval_timeout": 1200, "eval_over_timeout": false}
{"timestamp": "2026-09-10T05:00:43+00:00", "label": "t04-stackbase-900s", "solution": "T0.4", "description": "Same-day same-commit default-config control for the stack pair (the optlevel1 baseline pair predates the --grad-clip flag plumbing)", "launch_command": "NEURON_LOGICAL_NC_CONFIG=2 torchrun --standalone --nproc_per_node=4 train.py --num-steps 5000 --max-train-seconds 900 --out-dir out/t04-stackbase-900s", "git_commit": "fdc64f0", "git_dirty": true, "status": "keep", "wall_elapsed_seconds": 969.7, "run_log": "research/run-logs/t04-stackbase-900s.log", "checkpoint_path": "out/t04-stackbase-900s/final.pt", "training_seconds": 894.6, "budget_seconds": 1800, "target_steps": 5000, "max_train_seconds": 900, "startup_allowance_est": 62.8, "charged_seconds_est": 894.8, "over_budget": false, "total_seconds": 937.4, "compiled": true, "nki_relu2": false, "num_steps": 1102, "total_tokens_M": 144.4, "world_size": 4, "lnc": 2, "seq_len": 2048, "num_params_M": 55.7, "causality_passed": true, "causality_max_abs": 0.0, "public_val_bpb": 1.082271, "eval_seconds": 7.6, "eval_timeout": 1200, "eval_over_timeout": false}
