{"timestamp": "2026-09-16T22:01:06+00:00", "label": "sub1-p4-notri-full", "solution": "sub1", "description": "no trigram tables full 1800s seed42", "launch_command": "NEURON_LOGICAL_NC_CONFIG=2 torchrun --standalone --nproc_per_node=4 train.py --num-steps 1000000 --max-train-seconds 1800 --out-dir out/sub1-p4-notri-full --no-ngram-ve-trigram --seed 42", "git_commit": "dab464a", "git_dirty": true, "status": "keep", "wall_elapsed_seconds": 1865.6, "run_log": "research/run-logs/sub1-p4-notri-full.log", "checkpoint_path": "out/sub1-p4-notri-full/final.pt", "training_seconds": 1784.5, "budget_seconds": 1800, "target_steps": 1000000, "max_train_seconds": 1800, "startup_allowance_est": 66.0, "charged_seconds_est": 1785.1, "over_budget": false, "total_seconds": 1837.3, "compiled": true, "nki_relu2": false, "ngram_ve": "True tables=2 rows=1048576 dim=128 index_gather=True trigram=False opt=rmsprop flat_lr=True bf16=True", "out_bigram": "False bf16=True gate_bias=-2.0 lr=0.0", "oneliners": "relu2_tau=0.0 mlp_sandwich=False head_gate=False hg_norm=True hg_ch=32 hg_mul=2.0 hg_bias=0.0 out_pool=False pool_layers=3 qk_shift=True qk_beta=0.0 qk_freeze=True x0_gate=False block_nudge=False nudge_site=qk qkv_norm_cse=False parallel_block=False par_coalesce=none epoch_shuffle=False epoch_shuffle_seed=1234", "engram": "False site=-1 orders=2,3 heads=1 tables=0 mult=32 mem_dim=128 e_dim=0 key_dim=0 conv_k=4 share=False bf16=True", "batch_ramp": "False grad_accum=(2, 4, 8) bounds=(0.35, 0.75) lr_exp=0.5 ref_grad_accum=4 last_grad_accum=4", "weight_ema": "False decays=(0.995,) start_frac=0.75 seeded=False updates=0", "sched_tricks": "demon_b1=False demon_final=0.55 demon_ref=0.8 demon_start=-1.0 muon_b2=0.9 muon_b2_final=0.0 depth_lr=1.0->1.0 depth_mom=0.0->0.0 depth_mom_ref=0.95", "num_steps": 2336, "total_tokens_M": 306.2, "world_size": 4, "lnc": 2, "seq_len": 2048, "num_params_M": 324.3, "causality_passed": true, "causality_max_abs": 0.0, "public_val_bpb": 1.011402, "eval_seconds": 9.2, "eval_timeout": 1200, "eval_over_timeout": false}
{"timestamp": "2026-09-16T19:53:33+00:00", "label": "sub1-p4-notri-smoke", "solution": "sub1", "description": "no trigram tables smoke 300 steps", "launch_command": "NEURON_LOGICAL_NC_CONFIG=2 torchrun --standalone --nproc_per_node=4 train.py --num-steps 300 --max-train-seconds 3600 --out-dir out/sub1-p4-notri-smoke --no-ngram-ve-trigram --seed 42", "git_commit": "dab464a", "git_dirty": true, "status": "keep", "wall_elapsed_seconds": 631.8, "run_log": "research/run-logs/sub1-p4-notri-smoke.log", "checkpoint_path": "out/sub1-p4-notri-smoke/final.pt", "training_seconds": 226.8, "budget_seconds": 1800, "target_steps": 300, "max_train_seconds": 3600, "startup_allowance_est": 389.2, "charged_seconds_est": 227.4, "over_budget": false, "total_seconds": 604.2, "compiled": true, "nki_relu2": false, "ngram_ve": "True tables=2 rows=1048576 dim=128 index_gather=True trigram=False opt=rmsprop flat_lr=True bf16=True", "out_bigram": "False bf16=True gate_bias=-2.0 lr=0.0", "oneliners": "relu2_tau=0.0 mlp_sandwich=False head_gate=False hg_norm=True hg_ch=32 hg_mul=2.0 hg_bias=0.0 out_pool=False pool_layers=3 qk_shift=True qk_beta=0.0 qk_freeze=True x0_gate=False block_nudge=False nudge_site=qk qkv_norm_cse=False parallel_block=False par_coalesce=none epoch_shuffle=False epoch_shuffle_seed=1234", "engram": "False site=-1 orders=2,3 heads=1 tables=0 mult=32 mem_dim=128 e_dim=0 key_dim=0 conv_k=4 share=False bf16=True", "batch_ramp": "False grad_accum=(2, 4, 8) bounds=(0.35, 0.75) lr_exp=0.5 ref_grad_accum=4 last_grad_accum=4", "weight_ema": "False decays=(0.995,) start_frac=0.75 seeded=False updates=0", "sched_tricks": "demon_b1=False demon_final=0.55 demon_ref=0.8 demon_start=-1.0 muon_b2=0.9 muon_b2_final=0.0 depth_lr=1.0->1.0 depth_mom=0.0->0.0 depth_mom_ref=0.95", "num_steps": 300, "total_tokens_M": 39.3, "world_size": 4, "lnc": 2, "seq_len": 2048, "num_params_M": 324.3, "causality_passed": true, "causality_max_abs": 0.0, "public_val_bpb": 1.228956, "eval_seconds": 9.3, "eval_timeout": 1200, "eval_over_timeout": false}
{"timestamp": "2026-09-16T17:58:48+00:00", "label": "sub1-p4-shuffle-full", "solution": "sub1", "description": "epoch-shuffle data order full 1800s seed42", "launch_command": "NEURON_LOGICAL_NC_CONFIG=2 torchrun --standalone --nproc_per_node=4 train.py --num-steps 1000000 --max-train-seconds 1800 --out-dir out/sub1-p4-shuffle-full --epoch-shuffle --epoch-shuffle-seed 42 --seed 42", "git_commit": "496befd", "git_dirty": true, "status": "keep", "wall_elapsed_seconds": 2181.8, "run_log": "research/run-logs/sub1-p4-shuffle-full.log", "checkpoint_path": "out/sub1-p4-shuffle-full/final.pt", "training_seconds": 1784.3, "budget_seconds": 1800, "target_steps": 1000000, "max_train_seconds": 1800, "startup_allowance_est": 381.2, "charged_seconds_est": 1785.3, "over_budget": false, "total_seconds": 2154.0, "compiled": true, "nki_relu2": false, "ngram_ve": "True tables=4 rows=1048576 dim=128 index_gather=True trigram=True opt=rmsprop flat_lr=True bf16=True", "out_bigram": "False bf16=True gate_bias=-2.0 lr=0.0", "oneliners": "relu2_tau=0.0 mlp_sandwich=False head_gate=False hg_norm=True hg_ch=32 hg_mul=2.0 hg_bias=0.0 out_pool=False pool_layers=3 qk_shift=True qk_beta=0.0 qk_freeze=True x0_gate=False block_nudge=False nudge_site=qk qkv_norm_cse=False parallel_block=False par_coalesce=none epoch_shuffle=True epoch_shuffle_seed=42", "engram": "False site=-1 orders=2,3 heads=1 tables=0 mult=32 mem_dim=128 e_dim=0 key_dim=0 conv_k=4 share=False bf16=True", "batch_ramp": "False grad_accum=(2, 4, 8) bounds=(0.35, 0.75) lr_exp=0.5 ref_grad_accum=4 last_grad_accum=4", "weight_ema": "False decays=(0.995,) start_frac=0.75 seeded=False updates=0", "sched_tricks": "demon_b1=False demon_final=0.55 demon_ref=0.8 demon_start=-1.0 muon_b2=0.9 muon_b2_final=0.0 depth_lr=1.0->1.0 depth_mom=0.0->0.0 depth_mom_ref=0.95", "num_steps": 2126, "total_tokens_M": 278.7, "world_size": 4, "lnc": 2, "seq_len": 2048, "num_params_M": 592.9, "causality_passed": true, "causality_max_abs": 0.0, "public_val_bpb": 1.004625, "eval_seconds": 9.9, "eval_timeout": 1200, "eval_over_timeout": false}
{"timestamp": "2026-09-17T15:26:41+00:00", "label": "sub1-p42-nonautocast-full", "solution": "sub1", "description": "record-config no-autocast seed 42 isolation [trn21] CC=(in-code default optlevel=1)", "launch_command": "NEURON_LOGICAL_NC_CONFIG=2 torchrun --standalone --nproc_per_node=4 train.py --num-steps 5000 --max-train-seconds 1800 --out-dir out/sub1-p42-nonautocast-full --eval-seq-len 1024 --compile-muon --qk-shift --qk-shift-beta 0.0 --qk-shift-freeze --ngram-ve-layers 1,-1 --ngram-ve-table-mult 128 --seed 42", "git_commit": "496befd", "git_dirty": true, "status": "keep", "wall_elapsed_seconds": 2207.8, "run_log": "research/run-logs/sub1-p42-nonautocast-full.log", "checkpoint_path": "out/sub1-p42-nonautocast-full/final.pt", "training_seconds": 1784.9, "budget_seconds": 1800, "target_steps": 5000, "max_train_seconds": 1800, "startup_allowance_est": 389.6, "charged_seconds_est": 1785.9, "over_budget": false, "total_seconds": 2191.4, "compiled": true, "nki_relu2": false, "ngram_ve": "True tables=4 rows=1048576 dim=128 index_gather=True trigram=True opt=rmsprop flat_lr=True bf16=True", "out_bigram": "False bf16=True gate_bias=-2.0 lr=0.0", "oneliners": "relu2_tau=0.0 mlp_sandwich=False head_gate=False hg_norm=True hg_ch=32 hg_mul=2.0 hg_bias=0.0 out_pool=False pool_layers=3 qk_shift=True qk_beta=0.0 qk_freeze=True x0_gate=False block_nudge=False nudge_site=qk qkv_norm_cse=False parallel_block=False par_coalesce=none epoch_shuffle=False epoch_shuffle_seed=1234", "engram": "False site=-1 orders=2,3 heads=1 tables=0 mult=32 mem_dim=128 e_dim=0 key_dim=0 conv_k=4 share=False bf16=True", "batch_ramp": "False grad_accum=(2, 4, 8) bounds=(0.35, 0.75) lr_exp=0.5 ref_grad_accum=4 last_grad_accum=4", "weight_ema": "False decays=(0.995,) start_frac=0.75 seeded=False updates=0", "sched_tricks": "demon_b1=False demon_final=0.55 demon_ref=0.8 demon_start=-1.0 muon_b2=0.9 muon_b2_final=0.0 depth_lr=1.0->1.0 depth_mom=0.0->0.0 depth_mom_ref=0.95", "num_steps": 2104, "total_tokens_M": 275.8, "world_size": 4, "lnc": 2, "seq_len": 2048, "num_params_M": 592.9, "causality_passed": true, "causality_max_abs": 0.0, "public_val_bpb": 1.005781, "eval_seconds": 9.8, "eval_timeout": 1200, "eval_over_timeout": false, "eval_alt_seq_len": 1024, "public_val_bpb_alt": 1.020452, "eval_alt_seconds": 17.3}
{"timestamp": "2026-09-16T15:29:47+00:00", "label": "sub1-p48-bwloss-full", "solution": "sub1", "description": "byte-weighted loss full 1800s seed42", "launch_command": "NEURON_LOGICAL_NC_CONFIG=2 torchrun --standalone --nproc_per_node=4 train.py --num-steps 1000000 --max-train-seconds 1800 --out-dir out/sub1-p48-bwloss-full --byte-loss-weight --seed 42", "git_commit": "dab464a", "git_dirty": true, "status": "keep", "wall_elapsed_seconds": 1863.7, "run_log": "research/run-logs/sub1-p48-bwloss-full.log", "checkpoint_path": "out/sub1-p48-bwloss-full/final.pt", "training_seconds": 1784.4, "budget_seconds": 1800, "target_steps": 1000000, "max_train_seconds": 1800, "startup_allowance_est": 63.1, "charged_seconds_est": 1785.4, "over_budget": false, "total_seconds": 1838.5, "compiled": true, "nki_relu2": false, "ngram_ve": "True tables=4 rows=1048576 dim=128 index_gather=True trigram=True opt=rmsprop flat_lr=True bf16=True", "out_bigram": "False bf16=True gate_bias=-2.0 lr=0.0", "oneliners": "relu2_tau=0.0 mlp_sandwich=False head_gate=False hg_norm=True hg_ch=32 hg_mul=2.0 hg_bias=0.0 out_pool=False pool_layers=3 qk_shift=True qk_beta=0.0 qk_freeze=True x0_gate=False block_nudge=False nudge_site=qk qkv_norm_cse=False parallel_block=False par_coalesce=none epoch_shuffle=False epoch_shuffle_seed=1234", "engram": "False site=-1 orders=2,3 heads=1 tables=0 mult=32 mem_dim=128 e_dim=0 key_dim=0 conv_k=4 share=False bf16=True", "batch_ramp": "False grad_accum=(2, 4, 8) bounds=(0.35, 0.75) lr_exp=0.5 ref_grad_accum=4 last_grad_accum=4", "weight_ema": "False decays=(0.995,) start_frac=0.75 seeded=False updates=0", "sched_tricks": "demon_b1=False demon_final=0.55 demon_ref=0.8 demon_start=-1.0 muon_b2=0.9 muon_b2_final=0.0 depth_lr=1.0->1.0 depth_mom=0.0->0.0 depth_mom_ref=0.95", "num_steps": 2121, "total_tokens_M": 278.0, "world_size": 4, "lnc": 2, "seq_len": 2048, "num_params_M": 592.9, "causality_passed": true, "causality_max_abs": 0.0, "public_val_bpb": 1.052163, "eval_seconds": 9.9, "eval_timeout": 1200, "eval_over_timeout": false}
{"timestamp": "2026-09-16T14:57:46+00:00", "label": "sub1-p48-bwloss-smoke", "solution": "sub1", "description": "byte-weighted loss smoke 300 steps", "launch_command": "NEURON_LOGICAL_NC_CONFIG=2 torchrun --standalone --nproc_per_node=4 train.py --num-steps 300 --max-train-seconds 3600 --out-dir out/sub1-p48-bwloss-smoke --byte-loss-weight --seed 42", "git_commit": "dab464a", "git_dirty": true, "status": "keep", "wall_elapsed_seconds": 661.1, "run_log": "research/run-logs/sub1-p48-bwloss-smoke.log", "checkpoint_path": "out/sub1-p48-bwloss-smoke/final.pt", "training_seconds": 248.8, "budget_seconds": 1800, "target_steps": 300, "max_train_seconds": 3600, "startup_allowance_est": 396.1, "charged_seconds_est": 249.8, "over_budget": false, "total_seconds": 634.8, "compiled": true, "nki_relu2": false, "ngram_ve": "True tables=4 rows=1048576 dim=128 index_gather=True trigram=True opt=rmsprop flat_lr=True bf16=True", "out_bigram": "False bf16=True gate_bias=-2.0 lr=0.0", "oneliners": "relu2_tau=0.0 mlp_sandwich=False head_gate=False hg_norm=True hg_ch=32 hg_mul=2.0 hg_bias=0.0 out_pool=False pool_layers=3 qk_shift=True qk_beta=0.0 qk_freeze=True x0_gate=False block_nudge=False nudge_site=qk qkv_norm_cse=False parallel_block=False par_coalesce=none epoch_shuffle=False epoch_shuffle_seed=1234", "engram": "False site=-1 orders=2,3 heads=1 tables=0 mult=32 mem_dim=128 e_dim=0 key_dim=0 conv_k=4 share=False bf16=True", "batch_ramp": "False grad_accum=(2, 4, 8) bounds=(0.35, 0.75) lr_exp=0.5 ref_grad_accum=4 last_grad_accum=4", "weight_ema": "False decays=(0.995,) start_frac=0.75 seeded=False updates=0", "sched_tricks": "demon_b1=False demon_final=0.55 demon_ref=0.8 demon_start=-1.0 muon_b2=0.9 muon_b2_final=0.0 depth_lr=1.0->1.0 depth_mom=0.0->0.0 depth_mom_ref=0.95", "num_steps": 300, "total_tokens_M": 39.3, "world_size": 4, "lnc": 2, "seq_len": 2048, "num_params_M": 592.9, "causality_passed": true, "causality_max_abs": 0.0, "public_val_bpb": 1.281561, "eval_seconds": 9.9, "eval_timeout": 1200, "eval_over_timeout": false}
{"timestamp": "2026-09-17T15:29:14+00:00", "label": "sub1-record-repro-full", "solution": "sub1", "description": "record-config exact repro default seed [trn22] CC=(in-code default optlevel=1)", "launch_command": "NEURON_LOGICAL_NC_CONFIG=2 torchrun --standalone --nproc_per_node=4 train.py --num-steps 5000 --max-train-seconds 1800 --out-dir out/sub1-record-repro-full --eval-seq-len 1024 --compile-muon --qk-shift --qk-shift-beta 0.0 --qk-shift-freeze --ngram-ve-layers 1,-1 --ngram-ve-table-mult 128", "git_commit": "dab464a", "git_dirty": true, "status": "keep", "wall_elapsed_seconds": 2210.9, "run_log": "research/run-logs/sub1-record-repro-full.log", "checkpoint_path": "out/sub1-record-repro-full/final.pt", "training_seconds": 1784.7, "budget_seconds": 1800, "target_steps": 5000, "max_train_seconds": 1800, "startup_allowance_est": 392.2, "charged_seconds_est": 1785.7, "over_budget": false, "total_seconds": 2185.5, "compiled": true, "nki_relu2": false, "ngram_ve": "True tables=4 rows=1048576 dim=128 index_gather=True trigram=True opt=rmsprop flat_lr=True bf16=True", "out_bigram": "False bf16=True gate_bias=-2.0 lr=0.0", "oneliners": "relu2_tau=0.0 mlp_sandwich=False head_gate=False hg_norm=True hg_ch=32 hg_mul=2.0 hg_bias=0.0 out_pool=False pool_layers=3 qk_shift=True qk_beta=0.0 qk_freeze=True x0_gate=False block_nudge=False nudge_site=qk qkv_norm_cse=False parallel_block=False par_coalesce=none epoch_shuffle=False epoch_shuffle_seed=1234", "engram": "False site=-1 orders=2,3 heads=1 tables=0 mult=32 mem_dim=128 e_dim=0 key_dim=0 conv_k=4 share=False bf16=True", "batch_ramp": "False grad_accum=(2, 4, 8) bounds=(0.35, 0.75) lr_exp=0.5 ref_grad_accum=4 last_grad_accum=4", "weight_ema": "False decays=(0.995,) start_frac=0.75 seeded=False updates=0", "sched_tricks": "demon_b1=False demon_final=0.55 demon_ref=0.8 demon_start=-1.0 muon_b2=0.9 muon_b2_final=0.0 depth_lr=1.0->1.0 depth_mom=0.0->0.0 depth_mom_ref=0.95", "num_steps": 2094, "total_tokens_M": 274.5, "world_size": 4, "lnc": 2, "seq_len": 2048, "num_params_M": 592.9, "causality_passed": true, "causality_max_abs": 0.0, "public_val_bpb": 1.005436, "eval_seconds": 9.9, "eval_timeout": 1200, "eval_over_timeout": false, "eval_alt_seq_len": 1024, "public_val_bpb_alt": 1.020435, "eval_alt_seconds": 17.6}
{"timestamp": "2026-09-09T11:45:10+00:00", "label": "t01-baseline-900s", "solution": "T0.1", "description": "baseline TRAIN_LOCAL_CONV=False (default, matches nkimuon-fullbudget); paired A/B partner for local_conv weight training", "launch_command": "NEURON_LOGICAL_NC_CONFIG=2 torchrun --standalone --nproc_per_node=4 train.py --num-steps 5000 --max-train-seconds 900 --out-dir out/t01-baseline-900s", "git_commit": "fdc64f0", "git_dirty": true, "status": "keep", "wall_elapsed_seconds": 955.8, "run_log": "research/run-logs/t01-baseline-900s.log", "checkpoint_path": "out/t01-baseline-900s/final.pt", "training_seconds": 894.9, "budget_seconds": 1800, "target_steps": 5000, "max_train_seconds": 900, "startup_allowance_est": 48.9, "charged_seconds_est": 895.0, "over_budget": false, "total_seconds": 929.6, "compiled": true, "nki_relu2": false, "num_steps": 1012, "total_tokens_M": 132.6, "world_size": 4, "lnc": 2, "seq_len": 2048, "num_params_M": 55.7, "causality_passed": true, "causality_max_abs": 0.0, "public_val_bpb": 1.090389, "eval_seconds": 7.5, "eval_timeout": 1200, "eval_over_timeout": false}
{"timestamp": "2026-09-09T13:09:46+00:00", "label": "t01-baseline-fullbudget", "solution": "T0.1", "description": "baseline TRAIN_LOCAL_CONV=False, full 1800s confirmation, paired vs t01-kernel2-fullbudget", "launch_command": "NEURON_LOGICAL_NC_CONFIG=2 torchrun --standalone --nproc_per_node=4 train.py --num-steps 5000 --max-train-seconds 1800 --out-dir out/t01-baseline-fullbudget", "git_commit": "fdc64f0", "git_dirty": true, "status": "keep", "wall_elapsed_seconds": 1854.4, "run_log": "research/run-logs/t01-baseline-fullbudget.log", "checkpoint_path": "out/t01-baseline-fullbudget/final.pt", "training_seconds": 1794.5, "budget_seconds": 1800, "target_steps": 5000, "max_train_seconds": 1800, "startup_allowance_est": 47.6, "charged_seconds_est": 1794.7, "over_budget": false, "total_seconds": 1829.5, "compiled": true, "nki_relu2": false, "num_steps": 2037, "total_tokens_M": 267.0, "world_size": 4, "lnc": 2, "seq_len": 2048, "num_params_M": 55.7, "causality_passed": true, "causality_max_abs": 0.0, "public_val_bpb": 1.040879, "eval_seconds": 7.7, "eval_timeout": 1200, "eval_over_timeout": false}
{"timestamp": "2026-09-09T12:20:47+00:00", "label": "t01-kernel2-900s", "solution": "T0.1", "description": "local_conv kernel sweep: LOCAL_CONV_KERNEL=2, --train-local-conv", "launch_command": "NEURON_LOGICAL_NC_CONFIG=2 torchrun --standalone --nproc_per_node=4 train.py --num-steps 5000 --max-train-seconds 900 --out-dir out/t01-kernel2-900s --train-local-conv --local-conv-kernel 2", "git_commit": "fdc64f0", "git_dirty": true, "status": "keep", "wall_elapsed_seconds": 1033.2, "run_log": "research/run-logs/t01-kernel2-900s.log", "checkpoint_path": "out/t01-kernel2-900s/final.pt", "training_seconds": 894.9, "budget_seconds": 1800, "target_steps": 5000, "max_train_seconds": 900, "startup_allowance_est": 124.1, "charged_seconds_est": 895.1, "over_budget": false, "total_seconds": 1009.1, "compiled": true, "nki_relu2": false, "num_steps": 1049, "total_tokens_M": 137.5, "world_size": 4, "lnc": 2, "seq_len": 2048, "num_params_M": 55.7, "causality_passed": true, "causality_max_abs": 0.0, "public_val_bpb": 1.085529, "eval_seconds": 7.5, "eval_timeout": 1200, "eval_over_timeout": false}
{"timestamp": "2026-09-09T13:41:37+00:00", "label": "t01-kernel2-fullbudget", "solution": "T0.1", "description": "winning T0.1 config (--train-local-conv --local-conv-kernel 2), full 1800s confirmation vs t01-baseline-fullbudget", "launch_command": "NEURON_LOGICAL_NC_CONFIG=2 torchrun --standalone --nproc_per_node=4 train.py --num-steps 5000 --max-train-seconds 1800 --out-dir out/t01-kernel2-fullbudget --train-local-conv --local-conv-kernel 2", "git_commit": "fdc64f0", "git_dirty": true, "status": "keep", "wall_elapsed_seconds": 1856.6, "run_log": "research/run-logs/t01-kernel2-fullbudget.log", "checkpoint_path": "out/t01-kernel2-fullbudget/final.pt", "training_seconds": 1795.0, "budget_seconds": 1800, "target_steps": 5000, "max_train_seconds": 1800, "startup_allowance_est": 49.5, "charged_seconds_est": 1795.2, "over_budget": false, "total_seconds": 1829.9, "compiled": true, "nki_relu2": false, "num_steps": 2100, "total_tokens_M": 275.3, "world_size": 4, "lnc": 2, "seq_len": 2048, "num_params_M": 55.7, "causality_passed": true, "causality_max_abs": 0.0, "public_val_bpb": 1.038386, "eval_seconds": 7.6, "eval_timeout": 1200, "eval_over_timeout": false}
{"timestamp": "2026-09-09T12:38:28+00:00", "label": "t01-kernel8-900s", "solution": "T0.1", "description": "local_conv kernel sweep: LOCAL_CONV_KERNEL=8, --train-local-conv", "launch_command": "NEURON_LOGICAL_NC_CONFIG=2 torchrun --standalone --nproc_per_node=4 train.py --num-steps 5000 --max-train-seconds 900 --out-dir out/t01-kernel8-900s --train-local-conv --local-conv-kernel 8", "git_commit": "fdc64f0", "git_dirty": true, "status": "keep", "wall_elapsed_seconds": 1040.4, "run_log": "research/run-logs/t01-kernel8-900s.log", "checkpoint_path": "out/t01-kernel8-900s/final.pt", "training_seconds": 894.4, "budget_seconds": 1800, "target_steps": 5000, "max_train_seconds": 900, "startup_allowance_est": 131.5, "charged_seconds_est": 894.6, "over_budget": false, "total_seconds": 1013.3, "compiled": true, "nki_relu2": false, "num_steps": 999, "total_tokens_M": 130.9, "world_size": 4, "lnc": 2, "seq_len": 2048, "num_params_M": 55.7, "causality_passed": true, "causality_max_abs": 0.0, "public_val_bpb": 1.088411, "eval_seconds": 7.7, "eval_timeout": 1200, "eval_over_timeout": false}
{"timestamp": "2026-09-09T12:01:49+00:00", "label": "t01-trainlocalconv-900s", "solution": "T0.1", "description": "local_conv.weight now trained (own AdamW group, lr=MATRIX_LR, betas=(0.9,0.95), wd=0.0); --train-local-conv", "launch_command": "NEURON_LOGICAL_NC_CONFIG=2 torchrun --standalone --nproc_per_node=4 train.py --num-steps 5000 --max-train-seconds 900 --out-dir out/t01-trainlocalconv-900s --train-local-conv", "git_commit": "fdc64f0", "git_dirty": true, "status": "keep", "wall_elapsed_seconds": 958.7, "run_log": "research/run-logs/t01-trainlocalconv-900s.log", "checkpoint_path": "out/t01-trainlocalconv-900s/final.pt", "training_seconds": 894.1, "budget_seconds": 1800, "target_steps": 5000, "max_train_seconds": 900, "startup_allowance_est": 52.5, "charged_seconds_est": 894.3, "over_budget": false, "total_seconds": 932.7, "compiled": true, "nki_relu2": false, "num_steps": 1009, "total_tokens_M": 132.3, "world_size": 4, "lnc": 2, "seq_len": 2048, "num_params_M": 55.7, "causality_passed": true, "causality_max_abs": 0.0, "public_val_bpb": 1.085591, "eval_seconds": 7.6, "eval_timeout": 1200, "eval_over_timeout": false}
