{"timestamp": "2026-09-06T03:58:08+00:00", "label": "sol11-batch131072-fullbudget", "solution": "11", "description": "DATA-INTEGRITY CORRECTION: head-to-head full 1800s confirmation at genuine TOTAL_BATCH_SIZE=131072, fresh init, real submission shape, kernel toggle OFF -- direct comparison against the existing genuine 262144 full-budget number (362 steps, bpb=1.200143) to decide the real locked value", "launch_command": "NEURON_LOGICAL_NC_CONFIG=1 torchrun --standalone --nproc_per_node=8 train.py --num-steps 5000 --max-train-seconds 1800 --out-dir out/sol11-batch131072-fullbudget", "git_commit": "9e8fc18", "git_dirty": true, "status": "keep", "wall_elapsed_seconds": 1843.4, "run_log": "research/run-logs/sol11-batch131072-fullbudget.log", "checkpoint_path": "out/sol11-batch131072-fullbudget/final.pt", "training_seconds": 1793.1, "budget_seconds": 1800, "target_steps": 5000, "max_train_seconds": 1800, "startup_allowance_est": 32.7, "charged_seconds_est": 1793.2, "over_budget": false, "total_seconds": 1814.2, "compiled": false, "nki_relu2": false, "num_steps": 560, "total_tokens_M": 73.4, "world_size": 8, "lnc": 1, "seq_len": 1024, "num_params_M": 26.4, "causality_passed": true, "causality_max_abs": 0.0, "public_val_bpb": 1.199914, "eval_seconds": 12.7, "eval_timeout": 1200, "eval_over_timeout": false}
{"timestamp": "2026-09-05T22:10:53+00:00", "label": "sol11-batch262144-900s", "solution": "11", "description": "Solution 11 batch sweep at fixed DEPTH=6: TOTAL_BATCH_SIZE=262144 (quadruple), fixed 900s wall-clock -- checking if larger-batch trend continues past 131072", "launch_command": "NEURON_LOGICAL_NC_CONFIG=1 torchrun --standalone --nproc_per_node=8 train.py --num-steps 3000 --max-train-seconds 900 --out-dir out/sol11-batch262144-900s", "git_commit": "40ffcb2", "git_dirty": true, "status": "keep", "wall_elapsed_seconds": 939.6, "run_log": "research/run-logs/sol11-batch262144-900s.log", "checkpoint_path": "out/sol11-batch262144-900s/final.pt", "training_seconds": 895.0, "budget_seconds": 1800, "target_steps": 3000, "max_train_seconds": 900, "startup_allowance_est": 27.8, "charged_seconds_est": 895.1, "over_budget": false, "total_seconds": 916.2, "compiled": false, "nki_relu2": false, "num_steps": 262, "total_tokens_M": 34.3, "world_size": 8, "lnc": 1, "seq_len": 1024, "num_params_M": 26.4, "causality_passed": true, "causality_max_abs": 0.0, "public_val_bpb": 1.288261, "eval_seconds": 12.7, "eval_timeout": 1200, "eval_over_timeout": false}
{"timestamp": "2026-09-06T03:23:59+00:00", "label": "sol11-batch262144-900s-v2", "solution": "11", "description": "CORRECTED re-run: the original sol11-batch262144-900s run actually executed with grad_accum_steps=8 (effective TOTAL_BATCH_SIZE=131072, a duplicate of the 131072 sweep point, not 262144). This is the real missing 900s data point at genuine TOTAL_BATCH_SIZE=262144, kernel toggle OFF (default, matching original sweep methodology).", "launch_command": "NEURON_LOGICAL_NC_CONFIG=1 torchrun --standalone --nproc_per_node=8 train.py --num-steps 3000 --max-train-seconds 900 --out-dir out/sol11-batch262144-900s-v2", "git_commit": "dbbb929", "git_dirty": true, "status": "keep", "wall_elapsed_seconds": 942.1, "run_log": "research/run-logs/sol11-batch262144-900s-v2.log", "checkpoint_path": "out/sol11-batch262144-900s-v2/final.pt", "training_seconds": 892.7, "budget_seconds": 1800, "target_steps": 3000, "max_train_seconds": 900, "startup_allowance_est": 31.9, "charged_seconds_est": 892.8, "over_budget": false, "total_seconds": 920.0, "compiled": false, "nki_relu2": false, "num_steps": 172, "total_tokens_M": 45.1, "world_size": 8, "lnc": 1, "seq_len": 1024, "num_params_M": 26.4, "causality_passed": true, "causality_max_abs": 0.0, "public_val_bpb": 1.310506, "eval_seconds": 13.4, "eval_timeout": 1200, "eval_over_timeout": false}
{"timestamp": "2026-09-05T21:37:41+00:00", "label": "sol11-batch32768-900s", "solution": "11", "description": "Solution 11 batch sweep at fixed DEPTH=6: TOTAL_BATCH_SIZE=32768 (half), fixed 900s wall-clock, real submission shape", "launch_command": "NEURON_LOGICAL_NC_CONFIG=1 torchrun --standalone --nproc_per_node=8 train.py --num-steps 3000 --max-train-seconds 900 --out-dir out/sol11-batch32768-900s", "git_commit": "612f04b", "git_dirty": true, "status": "keep", "wall_elapsed_seconds": 933.3, "run_log": "research/run-logs/sol11-batch32768-900s.log", "checkpoint_path": "out/sol11-batch32768-900s/final.pt", "training_seconds": 890.7, "budget_seconds": 1800, "target_steps": 3000, "max_train_seconds": 900, "startup_allowance_est": 25.6, "charged_seconds_est": 890.8, "over_budget": false, "total_seconds": 907.5, "compiled": false, "nki_relu2": false, "num_steps": 601, "total_tokens_M": 19.7, "world_size": 8, "lnc": 1, "seq_len": 1024, "num_params_M": 26.4, "causality_passed": true, "causality_max_abs": 0.0, "public_val_bpb": 1.322478, "eval_seconds": 12.7, "eval_timeout": 1200, "eval_over_timeout": false}
{"timestamp": "2026-09-05T22:29:42+00:00", "label": "sol11-batch524288-900s", "solution": "11", "description": "Solution 11 batch sweep at fixed DEPTH=6: TOTAL_BATCH_SIZE=524288, fixed 900s wall-clock -- checking for the plateau/turnaround after diminishing gains at 131072/262144", "launch_command": "NEURON_LOGICAL_NC_CONFIG=1 torchrun --standalone --nproc_per_node=8 train.py --num-steps 3000 --max-train-seconds 900 --out-dir out/sol11-batch524288-900s", "git_commit": "886724c", "git_dirty": true, "status": "keep", "wall_elapsed_seconds": 945.1, "run_log": "research/run-logs/sol11-batch524288-900s.log", "checkpoint_path": "out/sol11-batch524288-900s/final.pt", "training_seconds": 883.0, "budget_seconds": 1800, "target_steps": 3000, "max_train_seconds": 900, "startup_allowance_est": 45.4, "charged_seconds_est": 883.2, "over_budget": false, "total_seconds": 921.4, "compiled": false, "nki_relu2": false, "num_steps": 115, "total_tokens_M": 60.3, "world_size": 8, "lnc": 1, "seq_len": 1024, "num_params_M": 26.4, "causality_passed": true, "causality_max_abs": 0.0, "public_val_bpb": 1.403897, "eval_seconds": 12.8, "eval_timeout": 1200, "eval_over_timeout": false}
{"timestamp": "2026-09-05T15:24:59+00:00", "label": "sol11-depth10-900s", "solution": "11", "description": "Solution 11 depth/width sweep: DEPTH=10 (n_embd=640, current locked baseline), fixed 900s wall-clock, real submission shape", "launch_command": "NEURON_LOGICAL_NC_CONFIG=1 torchrun --standalone --nproc_per_node=8 train.py --num-steps 3000 --max-train-seconds 900 --out-dir out/sol11-depth10-900s", "git_commit": "9d49231", "git_dirty": true, "status": "keep", "wall_elapsed_seconds": 953.0, "run_log": "research/run-logs/sol11-depth10-900s.log", "checkpoint_path": "out/sol11-depth10-900s/final.pt", "training_seconds": 893.3, "budget_seconds": 1800, "target_steps": 3000, "max_train_seconds": 900, "startup_allowance_est": 33.6, "charged_seconds_est": 893.7, "over_budget": false, "total_seconds": 924.8, "compiled": false, "nki_relu2": false, "num_steps": 235, "total_tokens_M": 15.4, "world_size": 8, "lnc": 1, "seq_len": 1024, "num_params_M": 85.9, "causality_passed": true, "causality_max_abs": 0.0, "public_val_bpb": 1.368452, "eval_seconds": 21.6, "eval_timeout": 1200, "eval_over_timeout": false}
{"timestamp": "2026-09-05T15:43:04+00:00", "label": "sol11-depth12-900s", "solution": "11", "description": "Solution 11 depth/width sweep: DEPTH=12 (n_embd=768), fixed 900s wall-clock, real submission shape", "launch_command": "NEURON_LOGICAL_NC_CONFIG=1 torchrun --standalone --nproc_per_node=8 train.py --num-steps 3000 --max-train-seconds 900 --out-dir out/sol11-depth12-900s", "git_commit": "8f16ebd", "git_dirty": true, "status": "keep", "wall_elapsed_seconds": 1046.4, "run_log": "research/run-logs/sol11-depth12-900s.log", "checkpoint_path": "out/sol11-depth12-900s/final.pt", "training_seconds": 889.7, "budget_seconds": 1800, "target_steps": 3000, "max_train_seconds": 900, "startup_allowance_est": 114.9, "charged_seconds_est": 890.2, "over_budget": false, "total_seconds": 1020.5, "compiled": false, "nki_relu2": false, "num_steps": 193, "total_tokens_M": 12.6, "world_size": 8, "lnc": 1, "seq_len": 1024, "num_params_M": 135.3, "causality_passed": true, "causality_max_abs": 0.0, "public_val_bpb": 1.365736, "eval_seconds": 27.0, "eval_timeout": 1200, "eval_over_timeout": false}
{"timestamp": "2026-09-05T16:18:42+00:00", "label": "sol11-depth4-900s", "solution": "11", "description": "Solution 11 depth/width sweep: DEPTH=4 (n_embd=256), fixed 900s wall-clock, real submission shape -- trend still improving smaller after depth6 beat 8/10/12", "launch_command": "NEURON_LOGICAL_NC_CONFIG=1 torchrun --standalone --nproc_per_node=8 train.py --num-steps 3000 --max-train-seconds 900 --out-dir out/sol11-depth4-900s", "git_commit": "d4652fa", "git_dirty": true, "status": "keep", "wall_elapsed_seconds": 1009.0, "run_log": "research/run-logs/sol11-depth4-900s.log", "checkpoint_path": "out/sol11-depth4-900s/final.pt", "training_seconds": 888.4, "budget_seconds": 1800, "target_steps": 3000, "max_train_seconds": 900, "startup_allowance_est": 97.0, "charged_seconds_est": 888.5, "over_budget": false, "total_seconds": 984.4, "compiled": false, "nki_relu2": false, "num_steps": 529, "total_tokens_M": 34.7, "world_size": 8, "lnc": 1, "seq_len": 1024, "num_params_M": 11.5, "causality_passed": true, "causality_max_abs": 0.0, "public_val_bpb": 1.330846, "eval_seconds": 9.3, "eval_timeout": 1200, "eval_over_timeout": false}
{"timestamp": "2026-09-05T16:01:09+00:00", "label": "sol11-depth6-900s", "solution": "11", "description": "Solution 11 depth/width sweep: DEPTH=6 (n_embd=384), fixed 900s wall-clock, real submission shape -- checking if smaller keeps winning past depth8", "launch_command": "NEURON_LOGICAL_NC_CONFIG=1 torchrun --standalone --nproc_per_node=8 train.py --num-steps 3000 --max-train-seconds 900 --out-dir out/sol11-depth6-900s", "git_commit": "45e6831", "git_dirty": true, "status": "keep", "wall_elapsed_seconds": 1020.5, "run_log": "research/run-logs/sol11-depth6-900s.log", "checkpoint_path": "out/sol11-depth6-900s/final.pt", "training_seconds": 893.3, "budget_seconds": 1800, "target_steps": 3000, "max_train_seconds": 900, "startup_allowance_est": 100.4, "charged_seconds_est": 893.4, "over_budget": false, "total_seconds": 993.7, "compiled": false, "nki_relu2": false, "num_steps": 399, "total_tokens_M": 26.1, "world_size": 8, "lnc": 1, "seq_len": 1024, "num_params_M": 26.4, "causality_passed": true, "causality_max_abs": 0.0, "public_val_bpb": 1.297186, "eval_seconds": 12.7, "eval_timeout": 1200, "eval_over_timeout": false}
{"timestamp": "2026-09-05T18:04:11+00:00", "label": "sol11-depth6-fullbudget", "solution": "11", "description": "clean full 1800s real-budget confirmation at the newly-locked DEPTH=6 config, fresh init, real submission shape", "launch_command": "NEURON_LOGICAL_NC_CONFIG=1 torchrun --standalone --nproc_per_node=8 train.py --num-steps 5000 --max-train-seconds 1800 --out-dir out/sol11-depth6-fullbudget", "git_commit": "8ceffd6", "git_dirty": true, "status": "keep", "wall_elapsed_seconds": 1831.3, "run_log": "research/run-logs/sol11-depth6-fullbudget.log", "checkpoint_path": "out/sol11-depth6-fullbudget/final.pt", "training_seconds": 1788.8, "budget_seconds": 1800, "target_steps": 5000, "max_train_seconds": 1800, "startup_allowance_est": 25.1, "charged_seconds_est": 1789.0, "over_budget": false, "total_seconds": 1807.1, "compiled": false, "nki_relu2": false, "num_steps": 809, "total_tokens_M": 53.0, "world_size": 8, "lnc": 1, "seq_len": 1024, "num_params_M": 26.4, "causality_passed": true, "causality_max_abs": 0.0, "public_val_bpb": 1.220658, "eval_seconds": 12.7, "eval_timeout": 1200, "eval_over_timeout": false}
{"timestamp": "2026-09-05T17:31:35+00:00", "label": "sol11-depth6-rawbaseline-900s", "solution": "meta-check", "description": "does the Solutions-1-10 toggle stack still help at the new DEPTH=6? raw untuned baseline at depth6, same 900s protocol, compare vs 1.297186 with full stack", "launch_command": "NEURON_LOGICAL_NC_CONFIG=1 torchrun --standalone --nproc_per_node=8 train.py --num-steps 3000 --max-train-seconds 900 --out-dir out/sol11-depth6-rawbaseline-900s", "git_commit": "39bec99", "git_dirty": true, "status": "keep", "wall_elapsed_seconds": 966.2, "run_log": "research/run-logs/sol11-depth6-rawbaseline-900s.log", "checkpoint_path": "out/sol11-depth6-rawbaseline-900s/final.pt", "training_seconds": 894.3, "budget_seconds": 1800, "target_steps": 3000, "max_train_seconds": 900, "startup_allowance_est": 57.1, "charged_seconds_est": 894.4, "over_budget": false, "total_seconds": 937.5, "compiled": false, "nki_relu2": false, "num_steps": 927, "total_tokens_M": 60.8, "world_size": 8, "lnc": 1, "seq_len": 1024, "num_params_M": 16.9, "causality_passed": true, "causality_max_abs": 0.0, "public_val_bpb": 1.32268, "eval_seconds": 11.2, "eval_timeout": 1200, "eval_over_timeout": false}
{"timestamp": "2026-09-05T15:07:49+00:00", "label": "sol11-depth8-900s", "solution": "11", "description": "Solution 11 depth/width sweep: DEPTH=8 (n_embd=512), fixed 900s wall-clock, real submission shape", "launch_command": "NEURON_LOGICAL_NC_CONFIG=1 torchrun --standalone --nproc_per_node=8 train.py --num-steps 3000 --max-train-seconds 900 --out-dir out/sol11-depth8-900s", "git_commit": "9ca5a3c", "git_dirty": true, "status": "keep", "wall_elapsed_seconds": 1026.2, "run_log": "research/run-logs/sol11-depth8-900s.log", "checkpoint_path": "out/sol11-depth8-900s/final.pt", "training_seconds": 892.4, "budget_seconds": 1800, "target_steps": 3000, "max_train_seconds": 900, "startup_allowance_est": 102.0, "charged_seconds_est": 892.6, "over_budget": false, "total_seconds": 1002.1, "compiled": false, "nki_relu2": false, "num_steps": 308, "total_tokens_M": 20.2, "world_size": 8, "lnc": 1, "seq_len": 1024, "num_params_M": 50.3, "causality_passed": true, "causality_max_abs": 0.0, "public_val_bpb": 1.342754, "eval_seconds": 17.3, "eval_timeout": 1200, "eval_over_timeout": false}
{"timestamp": "2026-09-05T23:04:50+00:00", "label": "sol11-final-combined-fullbudget", "solution": "11", "description": "clean full 1800s confirmation at the final combined config: DEPTH=6, TOTAL_BATCH_SIZE=262144, fresh init, real submission shape", "launch_command": "NEURON_LOGICAL_NC_CONFIG=1 torchrun --standalone --nproc_per_node=8 train.py --num-steps 5000 --max-train-seconds 1800 --out-dir out/sol11-final-combined-fullbudget", "git_commit": "26acf3c", "git_dirty": true, "status": "keep", "wall_elapsed_seconds": 1844.9, "run_log": "research/run-logs/sol11-final-combined-fullbudget.log", "checkpoint_path": "out/sol11-final-combined-fullbudget/final.pt", "training_seconds": 1792.8, "budget_seconds": 1800, "target_steps": 5000, "max_train_seconds": 1800, "startup_allowance_est": 34.9, "charged_seconds_est": 1792.9, "over_budget": false, "total_seconds": 1819.8, "compiled": false, "nki_relu2": false, "num_steps": 362, "total_tokens_M": 94.9, "world_size": 8, "lnc": 1, "seq_len": 1024, "num_params_M": 26.4, "causality_passed": true, "causality_max_abs": 0.0, "public_val_bpb": 1.200143, "eval_seconds": 12.8, "eval_timeout": 1200, "eval_over_timeout": false}
{"timestamp": "2026-09-06T08:24:36+00:00", "label": "sol11-final-combo-fullbudget", "solution": "Solution 11", "description": "Final combined confirmation: DEPTH=6, ASPECT_RATIO=96 (n_embd=640), TOTAL_BATCH_SIZE=131072, kernel ON (default), full 1800s budget", "launch_command": "NEURON_LOGICAL_NC_CONFIG=1 torchrun --standalone --nproc_per_node=8 train.py --num-steps 5000 --max-train-seconds 1800 --out-dir out/sol11-final-combo-fullbudget", "git_commit": "707c711", "git_dirty": true, "status": "keep", "wall_elapsed_seconds": 1835.5, "run_log": "research/run-logs/sol11-final-combo-fullbudget.log", "checkpoint_path": "out/sol11-final-combo-fullbudget/final.pt", "training_seconds": 1787.1, "budget_seconds": 1800, "target_steps": 5000, "max_train_seconds": 1800, "startup_allowance_est": 31.8, "charged_seconds_est": 1787.3, "over_budget": false, "total_seconds": 1808.5, "compiled": false, "nki_relu2": false, "num_steps": 500, "total_tokens_M": 65.5, "world_size": 8, "lnc": 1, "seq_len": 1024, "num_params_M": 55.7, "causality_passed": true, "causality_max_abs": 0.0, "public_val_bpb": 1.176151, "eval_seconds": 11.6, "eval_timeout": 1200, "eval_over_timeout": false}
{"timestamp": "2026-09-05T23:25:02+00:00", "label": "sol11-final-rawbaseline-900s", "solution": "meta-check", "description": "does the Solutions-1-10 toggle stack still help at the FINAL combined config (DEPTH=6, TOTAL_BATCH_SIZE=262144)? raw untuned baseline, same 900s protocol, compare vs full-stack 262 steps/bpb1.288261", "launch_command": "NEURON_LOGICAL_NC_CONFIG=1 torchrun --standalone --nproc_per_node=8 train.py --num-steps 3000 --max-train-seconds 900 --out-dir out/sol11-final-rawbaseline-900s", "git_commit": "16c9ca4", "git_dirty": true, "status": "keep", "wall_elapsed_seconds": 942.8, "run_log": "research/run-logs/sol11-final-rawbaseline-900s.log", "checkpoint_path": "out/sol11-final-rawbaseline-900s/final.pt", "training_seconds": 892.5, "budget_seconds": 1800, "target_steps": 3000, "max_train_seconds": 900, "startup_allowance_est": 36.1, "charged_seconds_est": 892.6, "over_budget": false, "total_seconds": 920.3, "compiled": false, "nki_relu2": false, "num_steps": 288, "total_tokens_M": 75.5, "world_size": 8, "lnc": 1, "seq_len": 1024, "num_params_M": 16.9, "causality_passed": true, "causality_max_abs": 0.0, "public_val_bpb": 1.321078, "eval_seconds": 10.8, "eval_timeout": 1200, "eval_over_timeout": false}
{"timestamp": "2026-09-06T06:18:52+00:00", "label": "sol11-width-aspect128", "solution": "Solution 11", "description": "Width-only resweep at fixed DEPTH=6: ASPECT_RATIO=128 -> n_embd=768, n_head=6", "launch_command": "NEURON_LOGICAL_NC_CONFIG=1 torchrun --standalone --nproc_per_node=8 train.py --num-steps 5000 --max-train-seconds 900 --out-dir out/sol11-width-aspect128", "git_commit": "a6dc5dc", "git_dirty": true, "status": "keep", "wall_elapsed_seconds": 979.6, "run_log": "research/run-logs/sol11-width-aspect128.log", "checkpoint_path": "out/sol11-width-aspect128/final.pt", "training_seconds": 888.7, "budget_seconds": 1800, "target_steps": 5000, "max_train_seconds": 900, "startup_allowance_est": 72.7, "charged_seconds_est": 889.0, "over_budget": false, "total_seconds": 953.0, "compiled": false, "nki_relu2": false, "num_steps": 235, "total_tokens_M": 30.8, "world_size": 8, "lnc": 1, "seq_len": 1024, "num_params_M": 73.9, "causality_passed": true, "causality_max_abs": 0.0, "public_val_bpb": 1.273621, "eval_seconds": 12.4, "eval_timeout": 1200, "eval_over_timeout": false}
{"timestamp": "2026-09-06T05:18:41+00:00", "label": "sol11-width-aspect32", "solution": "Solution 11", "description": "Width-only resweep at fixed DEPTH=6: ASPECT_RATIO=32 -> n_embd=256, n_head=2", "launch_command": "NEURON_LOGICAL_NC_CONFIG=1 torchrun --standalone --nproc_per_node=8 train.py --num-steps 5000 --max-train-seconds 900 --out-dir out/sol11-width-aspect32", "git_commit": "828ed8c", "git_dirty": true, "status": "keep", "wall_elapsed_seconds": 968.8, "run_log": "research/run-logs/sol11-width-aspect32.log", "checkpoint_path": "out/sol11-width-aspect32/final.pt", "training_seconds": 887.7, "budget_seconds": 1800, "target_steps": 5000, "max_train_seconds": 900, "startup_allowance_est": 65.5, "charged_seconds_est": 887.8, "over_budget": false, "total_seconds": 944.4, "compiled": false, "nki_relu2": false, "num_steps": 310, "total_tokens_M": 40.6, "world_size": 8, "lnc": 1, "seq_len": 1024, "num_params_M": 15.2, "causality_passed": true, "causality_max_abs": 0.0, "public_val_bpb": 1.309278, "eval_seconds": 9.8, "eval_timeout": 1200, "eval_over_timeout": false}
{"timestamp": "2026-09-06T05:39:54+00:00", "label": "sol11-width-aspect80", "solution": "Solution 11", "description": "Width-only resweep at fixed DEPTH=6: ASPECT_RATIO=80 -> n_embd=512, n_head=4", "launch_command": "NEURON_LOGICAL_NC_CONFIG=1 torchrun --standalone --nproc_per_node=8 train.py --num-steps 5000 --max-train-seconds 900 --out-dir out/sol11-width-aspect80", "git_commit": "71c37ab", "git_dirty": true, "status": "keep", "wall_elapsed_seconds": 973.2, "run_log": "research/run-logs/sol11-width-aspect80.log", "checkpoint_path": "out/sol11-width-aspect80/final.pt", "training_seconds": 890.2, "budget_seconds": 1800, "target_steps": 5000, "max_train_seconds": 900, "startup_allowance_est": 66.6, "charged_seconds_est": 890.4, "over_budget": false, "total_seconds": 949.3, "compiled": false, "nki_relu2": false, "num_steps": 268, "total_tokens_M": 35.1, "world_size": 8, "lnc": 1, "seq_len": 1024, "num_params_M": 39.9, "causality_passed": true, "causality_max_abs": 0.0, "public_val_bpb": 1.270811, "eval_seconds": 11.0, "eval_timeout": 1200, "eval_over_timeout": false}
{"timestamp": "2026-09-06T05:59:54+00:00", "label": "sol11-width-aspect96", "solution": "Solution 11", "description": "Width-only resweep at fixed DEPTH=6: ASPECT_RATIO=96 -> n_embd=640, n_head=5", "launch_command": "NEURON_LOGICAL_NC_CONFIG=1 torchrun --standalone --nproc_per_node=8 train.py --num-steps 5000 --max-train-seconds 900 --out-dir out/sol11-width-aspect96", "git_commit": "5f65fbb", "git_dirty": true, "status": "keep", "wall_elapsed_seconds": 979.8, "run_log": "research/run-logs/sol11-width-aspect96.log", "checkpoint_path": "out/sol11-width-aspect96/final.pt", "training_seconds": 891.8, "budget_seconds": 1800, "target_steps": 5000, "max_train_seconds": 900, "startup_allowance_est": 70.6, "charged_seconds_est": 892.0, "over_budget": false, "total_seconds": 954.0, "compiled": false, "nki_relu2": false, "num_steps": 240, "total_tokens_M": 31.5, "world_size": 8, "lnc": 1, "seq_len": 1024, "num_params_M": 55.7, "causality_passed": true, "causality_max_abs": 0.0, "public_val_bpb": 1.269647, "eval_seconds": 11.6, "eval_timeout": 1200, "eval_over_timeout": false}
