{"timestamp": "2026-09-11T16:53:26+00:00", "label": "t02-base-1800s", "solution": "T0.2", "description": "full-budget control, locked defaults, + bpb@1024 via --eval-seq-len", "launch_command": "NEURON_LOGICAL_NC_CONFIG=2 torchrun --standalone --nproc_per_node=4 train.py --num-steps 5000 --max-train-seconds 1800 --out-dir out/t02-base-1800s --eval-seq-len 1024", "git_commit": "8973cff", "git_dirty": false, "status": "keep", "wall_elapsed_seconds": 1877.4, "run_log": "research/run-logs/t02-base-1800s.log", "checkpoint_path": "out/t02-base-1800s/final.pt", "training_seconds": 1794.8, "budget_seconds": 1800, "target_steps": 5000, "max_train_seconds": 1800, "startup_allowance_est": 57.0, "charged_seconds_est": 1794.9, "over_budget": false, "total_seconds": 1850.5, "compiled": true, "nki_relu2": false, "num_steps": 2187, "total_tokens_M": 286.7, "world_size": 4, "lnc": 2, "seq_len": 2048, "num_params_M": 55.7, "causality_passed": true, "causality_max_abs": 0.0, "public_val_bpb": 1.034328, "eval_seconds": 7.8, "eval_timeout": 1200, "eval_over_timeout": false, "eval_alt_seq_len": 1024, "public_val_bpb_alt": 1.049682, "eval_alt_seconds": 12.7}
{"timestamp": "2026-09-11T13:05:38+00:00", "label": "t02-base-900s", "solution": "T0.2", "description": "same-day 900s control, locked defaults (depth6 n_embd640 hd128 mlp4)", "launch_command": "NEURON_LOGICAL_NC_CONFIG=2 torchrun --standalone --nproc_per_node=4 train.py --num-steps 5000 --max-train-seconds 900 --out-dir out/t02-base-900s", "git_commit": "b434862", "git_dirty": false, "status": "keep", "wall_elapsed_seconds": 1029.0, "run_log": "research/run-logs/t02-base-900s.log", "checkpoint_path": "out/t02-base-900s/final.pt", "training_seconds": 894.5, "budget_seconds": 1800, "target_steps": 5000, "max_train_seconds": 900, "startup_allowance_est": 116.6, "charged_seconds_est": 894.7, "over_budget": false, "total_seconds": 1005.9, "compiled": true, "nki_relu2": false, "num_steps": 1094, "total_tokens_M": 143.4, "world_size": 4, "lnc": 2, "seq_len": 2048, "num_params_M": 55.7, "causality_passed": true, "causality_max_abs": 0.0, "public_val_bpb": 1.081255, "eval_seconds": 9.4, "eval_timeout": 1200, "eval_over_timeout": false}
{"timestamp": "2026-09-11T17:24:55+00:00", "label": "t02-d6-e768-1800s", "solution": "T0.2", "description": "DEPTH=6 n_embd=768 at the DECISION budget: the last open T0.2 arm (900s +0.0094, only prior 1800s comparison was a +0.0007 tie)", "launch_command": "NEURON_LOGICAL_NC_CONFIG=2 torchrun --standalone --nproc_per_node=4 train.py --num-steps 5000 --max-train-seconds 1800 --out-dir out/t02-d6-e768-1800s --n-embd 768 --eval-seq-len 1024", "git_commit": "8973cff", "git_dirty": false, "status": "keep", "wall_elapsed_seconds": 1889.1, "run_log": "research/run-logs/t02-d6-e768-1800s.log", "checkpoint_path": "out/t02-d6-e768-1800s/final.pt", "training_seconds": 1794.8, "budget_seconds": 1800, "target_steps": 5000, "max_train_seconds": 1800, "startup_allowance_est": 57.7, "charged_seconds_est": 1795.0, "over_budget": false, "total_seconds": 1866.0, "compiled": true, "nki_relu2": false, "num_steps": 1771, "total_tokens_M": 232.1, "world_size": 4, "lnc": 2, "seq_len": 2048, "num_params_M": 73.9, "causality_passed": true, "causality_max_abs": 0.0, "public_val_bpb": 1.037112, "eval_seconds": 8.5, "eval_timeout": 1200, "eval_over_timeout": false, "eval_alt_seq_len": 1024, "public_val_bpb_alt": 1.052234, "eval_alt_seconds": 22.8}
{"timestamp": "2026-09-11T13:59:47+00:00", "label": "t02-d6-e768-900s", "solution": "T0.2", "description": "DEPTH=6 forced n_embd=768 (re-check now that throughput moved a lot)", "launch_command": "NEURON_LOGICAL_NC_CONFIG=2 torchrun --standalone --nproc_per_node=4 train.py --num-steps 5000 --max-train-seconds 900 --out-dir out/t02-d6-e768-900s --n-embd 768", "git_commit": "b434862", "git_dirty": false, "status": "keep", "wall_elapsed_seconds": 1100.7, "run_log": "research/run-logs/t02-d6-e768-900s.log", "checkpoint_path": "out/t02-d6-e768-900s/final.pt", "training_seconds": 894.3, "budget_seconds": 1800, "target_steps": 5000, "max_train_seconds": 900, "startup_allowance_est": 183.3, "charged_seconds_est": 894.5, "over_budget": false, "total_seconds": 1073.3, "compiled": true, "nki_relu2": false, "num_steps": 885, "total_tokens_M": 116.0, "world_size": 4, "lnc": 2, "seq_len": 2048, "num_params_M": 73.9, "causality_passed": true, "causality_max_abs": 0.0, "public_val_bpb": 1.090657, "eval_seconds": 8.8, "eval_timeout": 1200, "eval_over_timeout": false}
{"timestamp": "2026-09-11T14:17:33+00:00", "label": "t02-d6-hd64-e640-900s", "solution": "T0.2", "description": "DEPTH=6 HEAD_DIM=64 n_embd=640 -> 10 heads (NKI rope kernel verified at D=64)", "launch_command": "NEURON_LOGICAL_NC_CONFIG=2 torchrun --standalone --nproc_per_node=4 train.py --num-steps 5000 --max-train-seconds 900 --out-dir out/t02-d6-hd64-e640-900s --head-dim 64 --n-embd 640", "git_commit": "b434862", "git_dirty": false, "status": "keep", "wall_elapsed_seconds": 1065.0, "run_log": "research/run-logs/t02-d6-hd64-e640-900s.log", "checkpoint_path": "out/t02-d6-hd64-e640-900s/final.pt", "training_seconds": 894.5, "budget_seconds": 1800, "target_steps": 5000, "max_train_seconds": 900, "startup_allowance_est": 151.6, "charged_seconds_est": 894.7, "over_budget": false, "total_seconds": 1047.3, "compiled": true, "nki_relu2": false, "num_steps": 999, "total_tokens_M": 130.9, "world_size": 4, "lnc": 2, "seq_len": 2048, "num_params_M": 55.7, "causality_passed": true, "causality_max_abs": 0.0, "public_val_bpb": 1.099107, "eval_seconds": 8.2, "eval_timeout": 1200, "eval_over_timeout": false}
{"timestamp": "2026-09-11T13:23:34+00:00", "label": "t02-d7-e640-900s", "solution": "T0.2", "description": "DEPTH=7 forced n_embd=640 (never tested: d7 was only ever at its implied 768)", "launch_command": "NEURON_LOGICAL_NC_CONFIG=2 torchrun --standalone --nproc_per_node=4 train.py --num-steps 5000 --max-train-seconds 900 --out-dir out/t02-d7-e640-900s --depth 7 --n-embd 640", "git_commit": "b434862", "git_dirty": false, "status": "keep", "wall_elapsed_seconds": 1075.4, "run_log": "research/run-logs/t02-d7-e640-900s.log", "checkpoint_path": "out/t02-d7-e640-900s/final.pt", "training_seconds": 894.6, "budget_seconds": 1800, "target_steps": 5000, "max_train_seconds": 900, "startup_allowance_est": 167.4, "charged_seconds_est": 894.9, "over_budget": false, "total_seconds": 1052.6, "compiled": true, "nki_relu2": false, "num_steps": 908, "total_tokens_M": 119.0, "world_size": 4, "lnc": 2, "seq_len": 2048, "num_params_M": 65.9, "causality_passed": true, "causality_max_abs": 0.0, "public_val_bpb": 1.0939, "eval_seconds": 8.6, "eval_timeout": 1200, "eval_over_timeout": false}
{"timestamp": "2026-09-11T13:41:27+00:00", "label": "t02-d8-e640-900s", "solution": "T0.2", "description": "DEPTH=8 forced n_embd=640 (d8 previously only at 768, lost decisively)", "launch_command": "NEURON_LOGICAL_NC_CONFIG=2 torchrun --standalone --nproc_per_node=4 train.py --num-steps 5000 --max-train-seconds 900 --out-dir out/t02-d8-e640-900s --depth 8 --n-embd 640", "git_commit": "b434862", "git_dirty": false, "status": "keep", "wall_elapsed_seconds": 1073.0, "run_log": "research/run-logs/t02-d8-e640-900s.log", "checkpoint_path": "out/t02-d8-e640-900s/final.pt", "training_seconds": 894.8, "budget_seconds": 1800, "target_steps": 5000, "max_train_seconds": 900, "startup_allowance_est": 164.0, "charged_seconds_est": 895.0, "over_budget": false, "total_seconds": 1049.4, "compiled": true, "nki_relu2": false, "num_steps": 839, "total_tokens_M": 110.0, "world_size": 4, "lnc": 2, "seq_len": 2048, "num_params_M": 70.8, "causality_passed": true, "causality_max_abs": 0.0, "public_val_bpb": 1.094958, "eval_seconds": 9.3, "eval_timeout": 1200, "eval_over_timeout": false}
{"timestamp": "2026-09-11T15:10:15+00:00", "label": "t03-mlp3-900s", "solution": "T0.3", "description": "MLP_RATIO=3 (hidden 1920)", "launch_command": "NEURON_LOGICAL_NC_CONFIG=2 torchrun --standalone --nproc_per_node=4 train.py --num-steps 5000 --max-train-seconds 900 --out-dir out/t03-mlp3-900s --mlp-ratio 3", "git_commit": "8973cff", "git_dirty": false, "status": "keep", "wall_elapsed_seconds": 1050.0, "run_log": "research/run-logs/t03-mlp3-900s.log", "checkpoint_path": "out/t03-mlp3-900s/final.pt", "training_seconds": 894.7, "budget_seconds": 1800, "target_steps": 5000, "max_train_seconds": 900, "startup_allowance_est": 140.6, "charged_seconds_est": 894.9, "over_budget": false, "total_seconds": 1025.7, "compiled": true, "nki_relu2": false, "num_steps": 1161, "total_tokens_M": 152.2, "world_size": 4, "lnc": 2, "seq_len": 2048, "num_params_M": 50.8, "causality_passed": true, "causality_max_abs": 0.0, "public_val_bpb": 1.08348, "eval_seconds": 7.6, "eval_timeout": 1200, "eval_over_timeout": false}
{"timestamp": "2026-09-11T15:27:53+00:00", "label": "t03-mlp6-900s", "solution": "T0.3", "description": "MLP_RATIO=6 (hidden 3840)", "launch_command": "NEURON_LOGICAL_NC_CONFIG=2 torchrun --standalone --nproc_per_node=4 train.py --num-steps 5000 --max-train-seconds 900 --out-dir out/t03-mlp6-900s --mlp-ratio 6", "git_commit": "8973cff", "git_dirty": false, "status": "keep", "wall_elapsed_seconds": 1058.4, "run_log": "research/run-logs/t03-mlp6-900s.log", "checkpoint_path": "out/t03-mlp6-900s/final.pt", "training_seconds": 894.5, "budget_seconds": 1800, "target_steps": 5000, "max_train_seconds": 900, "startup_allowance_est": 148.2, "charged_seconds_est": 894.7, "over_budget": false, "total_seconds": 1035.4, "compiled": true, "nki_relu2": false, "num_steps": 981, "total_tokens_M": 128.6, "world_size": 4, "lnc": 2, "seq_len": 2048, "num_params_M": 65.5, "causality_passed": true, "causality_max_abs": 0.0, "public_val_bpb": 1.08291, "eval_seconds": 8.4, "eval_timeout": 1200, "eval_over_timeout": false}
{"timestamp": "2026-09-11T15:45:06+00:00", "label": "t03-scale010-900s", "solution": "T0.3", "description": "SDPA scale=0.10 (default 1/sqrt(128)=0.0884)", "launch_command": "NEURON_LOGICAL_NC_CONFIG=2 torchrun --standalone --nproc_per_node=4 train.py --num-steps 5000 --max-train-seconds 900 --out-dir out/t03-scale010-900s --attn-scale 0.10", "git_commit": "8973cff", "git_dirty": false, "status": "keep", "wall_elapsed_seconds": 1032.3, "run_log": "research/run-logs/t03-scale010-900s.log", "checkpoint_path": "out/t03-scale010-900s/final.pt", "training_seconds": 894.4, "budget_seconds": 1800, "target_steps": 5000, "max_train_seconds": 900, "startup_allowance_est": 118.2, "charged_seconds_est": 894.6, "over_budget": false, "total_seconds": 1007.7, "compiled": true, "nki_relu2": false, "num_steps": 1093, "total_tokens_M": 143.3, "world_size": 4, "lnc": 2, "seq_len": 2048, "num_params_M": 55.7, "causality_passed": true, "causality_max_abs": 0.0, "public_val_bpb": 1.081613, "eval_seconds": 7.8, "eval_timeout": 1200, "eval_over_timeout": false}
{"timestamp": "2026-09-11T16:02:17+00:00", "label": "t03-scale012-900s", "solution": "T0.3", "description": "SDPA scale=0.12", "launch_command": "NEURON_LOGICAL_NC_CONFIG=2 torchrun --standalone --nproc_per_node=4 train.py --num-steps 5000 --max-train-seconds 900 --out-dir out/t03-scale012-900s --attn-scale 0.12", "git_commit": "8973cff", "git_dirty": false, "status": "keep", "wall_elapsed_seconds": 1030.9, "run_log": "research/run-logs/t03-scale012-900s.log", "checkpoint_path": "out/t03-scale012-900s/final.pt", "training_seconds": 894.9, "budget_seconds": 1800, "target_steps": 5000, "max_train_seconds": 900, "startup_allowance_est": 117.3, "charged_seconds_est": 895.1, "over_budget": false, "total_seconds": 1007.0, "compiled": true, "nki_relu2": false, "num_steps": 1094, "total_tokens_M": 143.4, "world_size": 4, "lnc": 2, "seq_len": 2048, "num_params_M": 55.7, "causality_passed": true, "causality_max_abs": 0.0, "public_val_bpb": 1.081488, "eval_seconds": 7.8, "eval_timeout": 1200, "eval_over_timeout": false}
{"timestamp": "2026-09-11T16:19:31+00:00", "label": "t03-scale015-900s", "solution": "T0.3", "description": "SDPA scale=0.15", "launch_command": "NEURON_LOGICAL_NC_CONFIG=2 torchrun --standalone --nproc_per_node=4 train.py --num-steps 5000 --max-train-seconds 900 --out-dir out/t03-scale015-900s --attn-scale 0.15", "git_commit": "8973cff", "git_dirty": false, "status": "keep", "wall_elapsed_seconds": 1034.2, "run_log": "research/run-logs/t03-scale015-900s.log", "checkpoint_path": "out/t03-scale015-900s/final.pt", "training_seconds": 894.5, "budget_seconds": 1800, "target_steps": 5000, "max_train_seconds": 900, "startup_allowance_est": 120.3, "charged_seconds_est": 894.6, "over_budget": false, "total_seconds": 1009.7, "compiled": true, "nki_relu2": false, "num_steps": 1092, "total_tokens_M": 143.1, "world_size": 4, "lnc": 2, "seq_len": 2048, "num_params_M": 55.7, "causality_passed": true, "causality_max_abs": 0.0, "public_val_bpb": 1.08217, "eval_seconds": 7.7, "eval_timeout": 1200, "eval_over_timeout": false}
{"timestamp": "2026-09-10T00:01:05+00:00", "label": "t04-attncproj-010-900s", "solution": "T0.4", "description": "attn.c_proj init uniform(-0.1s,0.1s) instead of zeros (mlp.c_proj still zero)", "launch_command": "NEURON_LOGICAL_NC_CONFIG=2 torchrun --standalone --nproc_per_node=4 train.py --num-steps 5000 --max-train-seconds 900 --out-dir out/t04-attncproj-010-900s --attn-cproj-init 0.10", "git_commit": "fdc64f0", "git_dirty": true, "status": "keep", "wall_elapsed_seconds": 966.0, "run_log": "research/run-logs/t04-attncproj-010-900s.log", "checkpoint_path": "out/t04-attncproj-010-900s/final.pt", "training_seconds": 895.0, "budget_seconds": 1800, "target_steps": 5000, "max_train_seconds": 900, "startup_allowance_est": 58.7, "charged_seconds_est": 895.2, "over_budget": false, "total_seconds": 938.0, "compiled": true, "nki_relu2": false, "num_steps": 1099, "total_tokens_M": 144.0, "world_size": 4, "lnc": 2, "seq_len": 2048, "num_params_M": 55.7, "causality_passed": true, "causality_max_abs": 0.0, "public_val_bpb": 1.081814, "eval_seconds": 7.6, "eval_timeout": 1200, "eval_over_timeout": false}
{"timestamp": "2026-09-10T00:17:09+00:00", "label": "t04-attncproj-025-900s", "solution": "T0.4", "description": "attn.c_proj init uniform(-0.25s,0.25s) instead of zeros", "launch_command": "NEURON_LOGICAL_NC_CONFIG=2 torchrun --standalone --nproc_per_node=4 train.py --num-steps 5000 --max-train-seconds 900 --out-dir out/t04-attncproj-025-900s --attn-cproj-init 0.25", "git_commit": "fdc64f0", "git_dirty": true, "status": "keep", "wall_elapsed_seconds": 964.3, "run_log": "research/run-logs/t04-attncproj-025-900s.log", "checkpoint_path": "out/t04-attncproj-025-900s/final.pt", "training_seconds": 894.7, "budget_seconds": 1800, "target_steps": 5000, "max_train_seconds": 900, "startup_allowance_est": 57.5, "charged_seconds_est": 894.9, "over_budget": false, "total_seconds": 937.5, "compiled": true, "nki_relu2": false, "num_steps": 1101, "total_tokens_M": 144.3, "world_size": 4, "lnc": 2, "seq_len": 2048, "num_params_M": 55.7, "causality_passed": true, "causality_max_abs": 0.0, "public_val_bpb": 1.083091, "eval_seconds": 7.5, "eval_timeout": 1200, "eval_over_timeout": false}
{"timestamp": "2026-09-09T15:59:40+00:00", "label": "t04-base-900s", "solution": "T0.4", "description": "post-T0.1-flip baseline (TRAIN_LOCAL_CONV=True/LOCAL_CONV_KERNEL=2 now hardcoded defaults); must reproduce t01-kernel2-900s 1049/1.085529", "launch_command": "NEURON_LOGICAL_NC_CONFIG=2 torchrun --standalone --nproc_per_node=4 train.py --num-steps 5000 --max-train-seconds 900 --out-dir out/t04-base-900s", "git_commit": "fdc64f0", "git_dirty": true, "status": "keep", "wall_elapsed_seconds": 954.6, "run_log": "research/run-logs/t04-base-900s.log", "checkpoint_path": "out/t04-base-900s/final.pt", "training_seconds": 894.5, "budget_seconds": 1800, "target_steps": 5000, "max_train_seconds": 900, "startup_allowance_est": 48.0, "charged_seconds_est": 894.7, "over_budget": false, "total_seconds": 929.2, "compiled": true, "nki_relu2": false, "num_steps": 1054, "total_tokens_M": 138.1, "world_size": 4, "lnc": 2, "seq_len": 2048, "num_params_M": 55.7, "causality_passed": true, "causality_max_abs": 0.0, "public_val_bpb": 1.085307, "eval_seconds": 7.5, "eval_timeout": 1200, "eval_over_timeout": false}
{"timestamp": "2026-09-10T05:31:49+00:00", "label": "t04-defaults-fullbudget", "solution": "T0.4", "description": "Full 1800s budget at current committed defaults (PACK_FACTOR=4 + NEURON_CC_FLAGS=--optlevel=1 + T0.1 local_conv k=2). Control for the T0.4 stack, and the first full-budget number for the two throughput wins.", "launch_command": "NEURON_LOGICAL_NC_CONFIG=2 torchrun --standalone --nproc_per_node=4 train.py --num-steps 5000 --max-train-seconds 1800 --out-dir out/t04-defaults-fullbudget", "git_commit": "fdc64f0", "git_dirty": true, "status": "keep", "wall_elapsed_seconds": 1853.2, "run_log": "research/run-logs/t04-defaults-fullbudget.log", "checkpoint_path": "out/t04-defaults-fullbudget/final.pt", "training_seconds": 1794.6, "budget_seconds": 1800, "target_steps": 5000, "max_train_seconds": 1800, "startup_allowance_est": 46.4, "charged_seconds_est": 1794.8, "over_budget": false, "total_seconds": 1836.9, "compiled": true, "nki_relu2": false, "num_steps": 2205, "total_tokens_M": 289.0, "world_size": 4, "lnc": 2, "seq_len": 2048, "num_params_M": 55.7, "causality_passed": true, "causality_max_abs": 0.0, "public_val_bpb": 1.035073, "eval_seconds": 7.5, "eval_timeout": 1200, "eval_over_timeout": false}
{"timestamp": "2026-09-10T07:06:16+00:00", "label": "t04-defaults-fullbudget-v2", "solution": "T0.4", "description": "Paired repeat of the current-defaults control at full 1800s budget", "launch_command": "NEURON_LOGICAL_NC_CONFIG=2 torchrun --standalone --nproc_per_node=4 train.py --num-steps 5000 --max-train-seconds 1800 --out-dir out/t04-defaults-fullbudget-v2", "git_commit": "fdc64f0", "git_dirty": true, "status": "keep", "wall_elapsed_seconds": 1862.2, "run_log": "research/run-logs/t04-defaults-fullbudget-v2.log", "checkpoint_path": "out/t04-defaults-fullbudget-v2/final.pt", "training_seconds": 1794.6, "budget_seconds": 1800, "target_steps": 5000, "max_train_seconds": 1800, "startup_allowance_est": 55.3, "charged_seconds_est": 1794.8, "over_budget": false, "total_seconds": 1836.7, "compiled": true, "nki_relu2": false, "num_steps": 2204, "total_tokens_M": 288.9, "world_size": 4, "lnc": 2, "seq_len": 2048, "num_params_M": 55.7, "causality_passed": true, "causality_max_abs": 0.0, "public_val_bpb": 1.035816, "eval_seconds": 7.5, "eval_timeout": 1200, "eval_over_timeout": false}
{"timestamp": "2026-09-09T21:36:41+00:00", "label": "t04-embedlr-018-900s", "solution": "T0.4", "description": "EMBEDDING_LR 0.30 -> 0.18", "launch_command": "NEURON_LOGICAL_NC_CONFIG=2 torchrun --standalone --nproc_per_node=4 train.py --num-steps 5000 --max-train-seconds 900 --out-dir out/t04-embedlr-018-900s --embedding-lr 0.18", "git_commit": "fdc64f0", "git_dirty": true, "status": "keep", "wall_elapsed_seconds": 964.4, "run_log": "research/run-logs/t04-embedlr-018-900s.log", "checkpoint_path": "out/t04-embedlr-018-900s/final.pt", "training_seconds": 894.7, "budget_seconds": 1800, "target_steps": 5000, "max_train_seconds": 900, "startup_allowance_est": 57.2, "charged_seconds_est": 894.9, "over_budget": false, "total_seconds": 937.7, "compiled": true, "nki_relu2": false, "num_steps": 1094, "total_tokens_M": 143.4, "world_size": 4, "lnc": 2, "seq_len": 2048, "num_params_M": 55.7, "causality_passed": true, "causality_max_abs": 0.0, "public_val_bpb": 1.083387, "eval_seconds": 7.6, "eval_timeout": 1200, "eval_over_timeout": false}
{"timestamp": "2026-09-09T21:52:35+00:00", "label": "t04-embedlr-045-900s", "solution": "T0.4", "description": "EMBEDDING_LR 0.30 -> 0.45", "launch_command": "NEURON_LOGICAL_NC_CONFIG=2 torchrun --standalone --nproc_per_node=4 train.py --num-steps 5000 --max-train-seconds 900 --out-dir out/t04-embedlr-045-900s --embedding-lr 0.45", "git_commit": "fdc64f0", "git_dirty": true, "status": "keep", "wall_elapsed_seconds": 954.5, "run_log": "research/run-logs/t04-embedlr-045-900s.log", "checkpoint_path": "out/t04-embedlr-045-900s/final.pt", "training_seconds": 894.9, "budget_seconds": 1800, "target_steps": 5000, "max_train_seconds": 900, "startup_allowance_est": 47.2, "charged_seconds_est": 895.1, "over_budget": false, "total_seconds": 937.3, "compiled": true, "nki_relu2": false, "num_steps": 1094, "total_tokens_M": 143.4, "world_size": 4, "lnc": 2, "seq_len": 2048, "num_params_M": 55.7, "causality_passed": true, "causality_max_abs": 0.0, "public_val_bpb": 1.082229, "eval_seconds": 7.6, "eval_timeout": 1200, "eval_over_timeout": false}
{"timestamp": "2026-09-10T02:46:59+00:00", "label": "t04-finallrfrac-002-900s", "solution": "T0.4", "description": "FINAL_LR_FRAC 0.05 -> 0.02 (0.10 and 0.15 both worse, extending downward)", "launch_command": "NEURON_LOGICAL_NC_CONFIG=2 torchrun --standalone --nproc_per_node=4 train.py --num-steps 5000 --max-train-seconds 900 --out-dir out/t04-finallrfrac-002-900s --final-lr-frac 0.02", "git_commit": "fdc64f0", "git_dirty": true, "status": "keep", "wall_elapsed_seconds": 962.1, "run_log": "research/run-logs/t04-finallrfrac-002-900s.log", "checkpoint_path": "out/t04-finallrfrac-002-900s/final.pt", "training_seconds": 894.8, "budget_seconds": 1800, "target_steps": 5000, "max_train_seconds": 900, "startup_allowance_est": 54.8, "charged_seconds_est": 895.0, "over_budget": false, "total_seconds": 937.5, "compiled": true, "nki_relu2": false, "num_steps": 1098, "total_tokens_M": 143.9, "world_size": 4, "lnc": 2, "seq_len": 2048, "num_params_M": 55.7, "causality_passed": true, "causality_max_abs": 0.0, "public_val_bpb": 1.083099, "eval_seconds": 7.7, "eval_timeout": 1200, "eval_over_timeout": false}
