{"timestamp": "2026-09-07T17:35:28+00:00", "label": "lc-on-300s", "solution": "LocalConv", "description": "matched back-to-back local_conv A/B from ONE binary, 300s, idle box", "launch_command": "NEURON_LOGICAL_NC_CONFIG=2 torchrun --standalone --nproc_per_node=4 train.py --num-steps 5000 --max-train-seconds 300 --out-dir out/lc-on-300s --eval-tokens 65536 --local-conv", "git_commit": "e6fe55a", "git_dirty": true, "status": "keep", "wall_elapsed_seconds": 425.4, "run_log": "research/run-logs/lc-on-300s.log", "checkpoint_path": "out/lc-on-300s/final.pt", "training_seconds": 291.4, "budget_seconds": 1800, "target_steps": 5000, "max_train_seconds": 300, "startup_allowance_est": 129.0, "charged_seconds_est": 291.6, "over_budget": false, "total_seconds": 399.0, "compiled": true, "nki_relu2": false, "num_steps": 131, "total_tokens_M": 17.2, "world_size": 4, "lnc": 2, "seq_len": 2048, "num_params_M": 55.7, "causality_passed": true, "causality_max_abs": 0.0, "public_val_bpb": 1.563173, "eval_seconds": 0.4, "eval_timeout": 1200, "eval_over_timeout": false}
{"timestamp": "2026-09-07T17:54:10+00:00", "label": "lc-on-300s-v2", "solution": "LocalConv", "description": "matched local_conv A/B, both graphs pre-warmed via --compile-only, contention-monitored", "launch_command": "NEURON_LOGICAL_NC_CONFIG=2 torchrun --standalone --nproc_per_node=4 train.py --num-steps 5000 --max-train-seconds 300 --out-dir out/lc-on-300s-v2 --eval-tokens 65536 --local-conv", "git_commit": "e6fe55a", "git_dirty": true, "status": "keep", "wall_elapsed_seconds": 343.7, "run_log": "research/run-logs/lc-on-300s-v2.log", "checkpoint_path": "out/lc-on-300s-v2/final.pt", "training_seconds": 292.8, "budget_seconds": 1800, "target_steps": 5000, "max_train_seconds": 300, "startup_allowance_est": 45.6, "charged_seconds_est": 293.0, "over_budget": false, "total_seconds": 317.8, "compiled": true, "nki_relu2": false, "num_steps": 135, "total_tokens_M": 17.7, "world_size": 4, "lnc": 2, "seq_len": 2048, "num_params_M": 55.7, "causality_passed": true, "causality_max_abs": 0.0, "public_val_bpb": 1.553617, "eval_seconds": 0.5, "eval_timeout": 1200, "eval_over_timeout": false}
{"timestamp": "2026-09-07T16:54:27+00:00", "label": "localconv-off-900s", "solution": "11", "description": "USE_LOCAL_CONV=False: the conv is dead compute (weight zero-init, in no optimizer group), so this is a bit-identical model with the 5.4% profile cost removed", "launch_command": "NEURON_LOGICAL_NC_CONFIG=2 torchrun --standalone --nproc_per_node=4 train.py --num-steps 5000 --max-train-seconds 900 --out-dir out/localconv-off-900s", "git_commit": "e6fe55a", "git_dirty": true, "status": "keep", "wall_elapsed_seconds": 1333.8, "run_log": "research/run-logs/localconv-off-900s.log", "checkpoint_path": "out/localconv-off-900s/final.pt", "training_seconds": 886.1, "budget_seconds": 1800, "target_steps": 5000, "max_train_seconds": 900, "startup_allowance_est": 435.0, "charged_seconds_est": 886.3, "over_budget": false, "total_seconds": 1305.7, "compiled": true, "nki_relu2": false, "num_steps": 105, "total_tokens_M": 13.8, "world_size": 4, "lnc": 2, "seq_len": 2048, "num_params_M": 55.7, "causality_passed": true, "causality_max_abs": 0.0, "public_val_bpb": 1.512256, "eval_seconds": 6.8, "eval_timeout": 1200, "eval_over_timeout": false}
{"timestamp": "2026-09-07T17:15:14+00:00", "label": "localconv-off-900s-v2", "solution": "11", "description": "USE_LOCAL_CONV=False, second run with the NEFF cache now warm (v1 paid 435s of cold compile on a 12-vCPU box and its step time was inflated 3x)", "launch_command": "NEURON_LOGICAL_NC_CONFIG=2 torchrun --standalone --nproc_per_node=4 train.py --num-steps 5000 --max-train-seconds 900 --out-dir out/localconv-off-900s-v2", "git_commit": "e6fe55a", "git_dirty": true, "status": "keep", "wall_elapsed_seconds": 976.4, "run_log": "research/run-logs/localconv-off-900s-v2.log", "checkpoint_path": "out/localconv-off-900s-v2/final.pt", "training_seconds": 888.3, "budget_seconds": 1800, "target_steps": 5000, "max_train_seconds": 900, "startup_allowance_est": 75.5, "charged_seconds_est": 888.5, "over_budget": false, "total_seconds": 952.0, "compiled": true, "nki_relu2": false, "num_steps": 111, "total_tokens_M": 14.5, "world_size": 4, "lnc": 2, "seq_len": 2048, "num_params_M": 55.7, "causality_passed": true, "causality_max_abs": 0.0, "public_val_bpb": 1.616416, "eval_seconds": 6.9, "eval_timeout": 1200, "eval_over_timeout": false}
{"timestamp": "2026-09-07T18:09:31+00:00", "label": "lrmq0-300s", "solution": "LrmQuantum", "description": "LR-multiplier quantisation A/B: continuous cooldown recompiles the optimizer every step (measured dt 0.90s -> 2.2-4.3s); --lrm-quantum 0", "launch_command": "NEURON_LOGICAL_NC_CONFIG=2 torchrun --standalone --nproc_per_node=4 train.py --num-steps 5000 --max-train-seconds 300 --out-dir out/lrmq0-300s --eval-tokens 65536 --lrm-quantum 0", "git_commit": "e6fe55a", "git_dirty": true, "status": "keep", "wall_elapsed_seconds": 419.3, "run_log": "research/run-logs/lrmq0-300s.log", "checkpoint_path": "out/lrmq0-300s/final.pt", "training_seconds": 293.4, "budget_seconds": 1800, "target_steps": 5000, "max_train_seconds": 300, "startup_allowance_est": 120.8, "charged_seconds_est": 293.6, "over_budget": false, "total_seconds": 403.8, "compiled": true, "nki_relu2": false, "num_steps": 132, "total_tokens_M": 17.3, "world_size": 4, "lnc": 2, "seq_len": 2048, "num_params_M": 55.7, "causality_passed": true, "causality_max_abs": 0.0, "public_val_bpb": 1.56145, "eval_seconds": 0.5, "eval_timeout": 1200, "eval_over_timeout": false}
{"timestamp": "2026-09-07T19:07:45+00:00", "label": "lrmq12-900s", "solution": "LrmQuantum", "description": "coarser LR quantisation, --lrm-quantum 12 (Q=25 gave 1004/1.093785, Q=50 gave 936/1.099500 -- fewer compiles beat a finer schedule, so test fewer still)", "launch_command": "NEURON_LOGICAL_NC_CONFIG=2 torchrun --standalone --nproc_per_node=4 train.py --num-steps 5000 --max-train-seconds 900 --out-dir out/lrmq12-900s --lrm-quantum 12", "git_commit": "e6fe55a", "git_dirty": true, "status": "keep", "wall_elapsed_seconds": 1011.0, "run_log": "research/run-logs/lrmq12-900s.log", "checkpoint_path": "out/lrmq12-900s/final.pt", "training_seconds": 894.9, "budget_seconds": 1800, "target_steps": 5000, "max_train_seconds": 900, "startup_allowance_est": 104.4, "charged_seconds_est": 895.1, "over_budget": false, "total_seconds": 996.0, "compiled": true, "nki_relu2": false, "num_steps": 982, "total_tokens_M": 128.7, "world_size": 4, "lnc": 2, "seq_len": 2048, "num_params_M": 55.7, "causality_passed": true, "causality_max_abs": 0.0, "public_val_bpb": 1.095435, "eval_seconds": 7.4, "eval_timeout": 1200, "eval_over_timeout": false}
{"timestamp": "2026-09-07T18:15:14+00:00", "label": "lrmq25-300s", "solution": "LrmQuantum", "description": "LR-multiplier quantisation A/B: continuous cooldown recompiles the optimizer every step (measured dt 0.90s -> 2.2-4.3s); --lrm-quantum 25", "launch_command": "NEURON_LOGICAL_NC_CONFIG=2 torchrun --standalone --nproc_per_node=4 train.py --num-steps 5000 --max-train-seconds 300 --out-dir out/lrmq25-300s --eval-tokens 65536 --lrm-quantum 25", "git_commit": "e6fe55a", "git_dirty": true, "status": "keep", "wall_elapsed_seconds": 343.1, "run_log": "research/run-logs/lrmq25-300s.log", "checkpoint_path": "out/lrmq25-300s/final.pt", "training_seconds": 292.5, "budget_seconds": 1800, "target_steps": 5000, "max_train_seconds": 300, "startup_allowance_est": 45.7, "charged_seconds_est": 292.7, "over_budget": false, "total_seconds": 317.3, "compiled": true, "nki_relu2": false, "num_steps": 277, "total_tokens_M": 36.3, "world_size": 4, "lnc": 2, "seq_len": 2048, "num_params_M": 55.7, "causality_passed": true, "causality_max_abs": 0.0, "public_val_bpb": 1.326234, "eval_seconds": 0.4, "eval_timeout": 1200, "eval_over_timeout": false}
{"timestamp": "2026-09-07T18:31:47+00:00", "label": "lrmq25-900s", "solution": "LrmQuantum", "description": "LR-multiplier quantisation at the real 900s budget, --lrm-quantum 25 (baseline to beat: 427 steps / 1.180633 with the continuous schedule)", "launch_command": "NEURON_LOGICAL_NC_CONFIG=2 torchrun --standalone --nproc_per_node=4 train.py --num-steps 5000 --max-train-seconds 900 --out-dir out/lrmq25-900s --lrm-quantum 25", "git_commit": "e6fe55a", "git_dirty": true, "status": "keep", "wall_elapsed_seconds": 952.7, "run_log": "research/run-logs/lrmq25-900s.log", "checkpoint_path": "out/lrmq25-900s/final.pt", "training_seconds": 896.6, "budget_seconds": 1800, "target_steps": 5000, "max_train_seconds": 900, "startup_allowance_est": 44.1, "charged_seconds_est": 896.8, "over_budget": false, "total_seconds": 928.5, "compiled": true, "nki_relu2": false, "num_steps": 1004, "total_tokens_M": 131.6, "world_size": 4, "lnc": 2, "seq_len": 2048, "num_params_M": 55.7, "causality_passed": true, "causality_max_abs": 0.0, "public_val_bpb": 1.093785, "eval_seconds": 7.5, "eval_timeout": 1200, "eval_over_timeout": false}
{"timestamp": "2026-09-07T18:47:35+00:00", "label": "lrmq50-900s", "solution": "LrmQuantum", "description": "LR-multiplier quantisation at the real 900s budget, --lrm-quantum 50 (baseline to beat: 427 steps / 1.180633 with the continuous schedule)", "launch_command": "NEURON_LOGICAL_NC_CONFIG=2 torchrun --standalone --nproc_per_node=4 train.py --num-steps 5000 --max-train-seconds 900 --out-dir out/lrmq50-900s --lrm-quantum 50", "git_commit": "e6fe55a", "git_dirty": true, "status": "keep", "wall_elapsed_seconds": 948.3, "run_log": "research/run-logs/lrmq50-900s.log", "checkpoint_path": "out/lrmq50-900s/final.pt", "training_seconds": 892.4, "budget_seconds": 1800, "target_steps": 5000, "max_train_seconds": 900, "startup_allowance_est": 43.9, "charged_seconds_est": 892.6, "over_budget": false, "total_seconds": 924.3, "compiled": true, "nki_relu2": false, "num_steps": 936, "total_tokens_M": 122.7, "world_size": 4, "lnc": 2, "seq_len": 2048, "num_params_M": 55.7, "causality_passed": true, "causality_max_abs": 0.0, "public_val_bpb": 1.0995, "eval_seconds": 7.4, "eval_timeout": 1200, "eval_over_timeout": false}
{"timestamp": "2026-09-08T04:17:09+00:00", "label": "m2-g0-e2n128k4-300", "solution": "Mamba2Lever1", "description": "Lever 1 baseline re-measure: paper geometry expand=2 d_state=128 head_dim=128 k=4, eager + NKI SSD kernel, kernel path now announced by ssd_scan", "launch_command": "NEURON_LOGICAL_NC_CONFIG=2 torchrun --standalone --nproc_per_node=4 train.py --num-steps 300 --max-train-seconds 1500 --out-dir out/m2-g0-e2n128k4-300 --mamba2 --mamba2-pattern MMAMMM --nki-ssd --no-compile", "git_commit": "eb81ae5", "git_dirty": true, "status": "keep", "wall_elapsed_seconds": 515.1, "run_log": "research/run-logs/m2-g0-e2n128k4-300.log", "checkpoint_path": "out/m2-g0-e2n128k4-300/final.pt", "training_seconds": 452.7, "budget_seconds": 1800, "target_steps": 300, "max_train_seconds": 1500, "startup_allowance_est": 46.2, "charged_seconds_est": 452.8, "over_budget": false, "total_seconds": 489.2, "compiled": false, "nki_relu2": false, "num_steps": 300, "total_tokens_M": 39.3, "world_size": 4, "lnc": 2, "seq_len": 2048, "num_params_M": 45.0, "causality_passed": true, "causality_max_abs": 0.0, "public_val_bpb": 1.273513, "eval_seconds": 10.6, "eval_timeout": 1200, "eval_over_timeout": false}
{"timestamp": "2026-09-08T05:27:13+00:00", "label": "m2-g0-e2n128k4-900s", "solution": "Mamba2Lever1", "description": "Lever 1 at the real 900s budget: paper Mamba2 geometry with the NKI scan VERIFIABLY active (1.509 s/step; the earlier m2hybrid-nki-* runs silently fell back to the 2.00 s/step eager scan). Best quality-per-step of the family. Baseline to beat: tensorlr-900s 995 steps / 1.094327", "launch_command": "NEURON_LOGICAL_NC_CONFIG=2 torchrun --standalone --nproc_per_node=4 train.py --num-steps 5000 --max-train-seconds 900 --out-dir out/m2-g0-e2n128k4-900s --mamba2 --mamba2-pattern MMAMMM --nki-ssd --no-compile", "git_commit": "eb81ae5", "git_dirty": true, "status": "keep", "wall_elapsed_seconds": 960.2, "run_log": "research/run-logs/m2-g0-e2n128k4-900s.log", "checkpoint_path": "out/m2-g0-e2n128k4-900s/final.pt", "training_seconds": 893.7, "budget_seconds": 1800, "target_steps": 5000, "max_train_seconds": 900, "startup_allowance_est": 50.7, "charged_seconds_est": 893.8, "over_budget": false, "total_seconds": 930.0, "compiled": false, "nki_relu2": false, "num_steps": 588, "total_tokens_M": 77.1, "world_size": 4, "lnc": 2, "seq_len": 2048, "num_params_M": 45.0, "causality_passed": true, "causality_max_abs": 0.0, "public_val_bpb": 1.144603, "eval_seconds": 10.5, "eval_timeout": 1200, "eval_over_timeout": false}
{"timestamp": "2026-09-08T04:25:15+00:00", "label": "m2-g1-e1n128k4-300", "solution": "Mamba2Lever1", "description": "Lever 1: expand=1 (d_inner 1280->640, H 10->5), everything else paper default", "launch_command": "NEURON_LOGICAL_NC_CONFIG=2 torchrun --standalone --nproc_per_node=4 train.py --num-steps 300 --max-train-seconds 1500 --out-dir out/m2-g1-e1n128k4-300 --mamba2 --mamba2-pattern MMAMMM --nki-ssd --no-compile --mamba2-expand 1", "git_commit": "eb81ae5", "git_dirty": true, "status": "keep", "wall_elapsed_seconds": 486.2, "run_log": "research/run-logs/m2-g1-e1n128k4-300.log", "checkpoint_path": "out/m2-g1-e1n128k4-300/final.pt", "training_seconds": 380.0, "budget_seconds": 1800, "target_steps": 300, "max_train_seconds": 1500, "startup_allowance_est": 84.3, "charged_seconds_est": 380.2, "over_budget": false, "total_seconds": 471.4, "compiled": false, "nki_relu2": false, "num_steps": 300, "total_tokens_M": 39.3, "world_size": 4, "lnc": 2, "seq_len": 2048, "num_params_M": 38.8, "causality_passed": true, "causality_max_abs": 0.0, "public_val_bpb": 1.290404, "eval_seconds": 9.3, "eval_timeout": 1200, "eval_over_timeout": false}
{"timestamp": "2026-09-08T04:33:00+00:00", "label": "m2-g2-e1n64k4-300", "solution": "Mamba2Lever1", "description": "Lever 1: expand=1 + d_state=64 (mixer fwd+bwd 0.707x of baseline in the microbenchmark)", "launch_command": "NEURON_LOGICAL_NC_CONFIG=2 torchrun --standalone --nproc_per_node=4 train.py --num-steps 300 --max-train-seconds 1500 --out-dir out/m2-g2-e1n64k4-300 --mamba2 --mamba2-pattern MMAMMM --nki-ssd --no-compile --mamba2-expand 1 --mamba2-d-state 64", "git_commit": "eb81ae5", "git_dirty": true, "status": "keep", "wall_elapsed_seconds": 464.8, "run_log": "research/run-logs/m2-g2-e1n64k4-300.log", "checkpoint_path": "out/m2-g2-e1n64k4-300/final.pt", "training_seconds": 377.2, "budget_seconds": 1800, "target_steps": 300, "max_train_seconds": 1500, "startup_allowance_est": 67.5, "charged_seconds_est": 377.3, "over_budget": false, "total_seconds": 441.5, "compiled": false, "nki_relu2": false, "num_steps": 300, "total_tokens_M": 39.3, "world_size": 4, "lnc": 2, "seq_len": 2048, "num_params_M": 38.4, "causality_passed": true, "causality_max_abs": 0.0, "public_val_bpb": 1.293135, "eval_seconds": 10.3, "eval_timeout": 1200, "eval_over_timeout": false}
{"timestamp": "2026-09-08T04:54:30+00:00", "label": "m2-g3-900s-KILLED-MISCONFIGURED", "solution": "Mamba2Lever1", "description": "KILLED BY OPERATOR, NOT A DATA POINT. The driver script omitted the geometry flags, so this run was launched under the g3 label but with the PAPER geometry (expand=2 d_state=128 conv_kernel=4). Killed ~10 min in and relaunched correctly as m2-g3-e1n64k2-900s. Kept only so the box-time expenditure is on the record; see launch_command, which has no --mamba2-expand/--mamba2-d-state/--mamba2-conv-kernel.", "launch_command": "NEURON_LOGICAL_NC_CONFIG=2 torchrun --standalone --nproc_per_node=4 train.py --num-steps 5000 --max-train-seconds 900 --out-dir out/m2-g3-e1n64k2-900s --mamba2 --mamba2-pattern MMAMMM --nki-ssd --no-compile", "git_commit": "eb81ae5", "git_dirty": true, "status": "crash", "wall_elapsed_seconds": 277.9, "run_log": "research/run-logs/m2-g3-e1n64k2-900s.log"}
{"timestamp": "2026-09-08T04:39:36+00:00", "label": "m2-g3-e1n64k2-300", "solution": "Mamba2Lever1", "description": "Lever 1: cheapest measured config -- expand=1 + d_state=64 + conv_kernel=2 (0.567x mixer fwd+bwd); the k-shift conv1d was the largest single forward component at k=4", "launch_command": "NEURON_LOGICAL_NC_CONFIG=2 torchrun --standalone --nproc_per_node=4 train.py --num-steps 300 --max-train-seconds 1500 --out-dir out/m2-g3-e1n64k2-300 --mamba2 --mamba2-pattern MMAMMM --nki-ssd --no-compile --mamba2-expand 1 --mamba2-d-state 64 --mamba2-conv-kernel 2", "git_commit": "eb81ae5", "git_dirty": true, "status": "keep", "wall_elapsed_seconds": 395.4, "run_log": "research/run-logs/m2-g3-e1n64k2-300.log", "checkpoint_path": "out/m2-g3-e1n64k2-300/final.pt", "training_seconds": 333.1, "budget_seconds": 1800, "target_steps": 300, "max_train_seconds": 1500, "startup_allowance_est": 47.3, "charged_seconds_est": 333.3, "over_budget": false, "total_seconds": 367.2, "compiled": false, "nki_relu2": false, "num_steps": 300, "total_tokens_M": 39.3, "world_size": 4, "lnc": 2, "seq_len": 2048, "num_params_M": 38.4, "causality_passed": true, "causality_max_abs": 0.0, "public_val_bpb": 1.288748, "eval_seconds": 8.7, "eval_timeout": 1200, "eval_over_timeout": false}
{"timestamp": "2026-09-08T05:11:13+00:00", "label": "m2-g3-e1n64k2-900s", "solution": "Mamba2Lever1", "description": "Lever 1 at the real 900s budget: cheapest Mamba2 geometry (expand=1 d_state=64 conv_kernel=2, 1.110 s/step vs the paper geometry's 1.509), eager + NKI SSD kernel. Baseline to beat: tensorlr-900s 995 steps / 1.094327", "launch_command": "NEURON_LOGICAL_NC_CONFIG=2 torchrun --standalone --nproc_per_node=4 train.py --num-steps 5000 --max-train-seconds 900 --out-dir out/m2-g3-e1n64k2-900s --mamba2 --mamba2-pattern MMAMMM --nki-ssd --no-compile --mamba2-expand 1 --mamba2-d-state 64 --mamba2-conv-kernel 2", "git_commit": "eb81ae5", "git_dirty": true, "status": "keep", "wall_elapsed_seconds": 935.2, "run_log": "research/run-logs/m2-g3-e1n64k2-900s.log", "checkpoint_path": "out/m2-g3-e1n64k2-900s/final.pt", "training_seconds": 894.5, "budget_seconds": 1800, "target_steps": 5000, "max_train_seconds": 900, "startup_allowance_est": 27.4, "charged_seconds_est": 894.6, "over_budget": false, "total_seconds": 919.8, "compiled": false, "nki_relu2": false, "num_steps": 795, "total_tokens_M": 104.2, "world_size": 4, "lnc": 2, "seq_len": 2048, "num_params_M": 38.4, "causality_passed": true, "causality_max_abs": 0.0, "public_val_bpb": 1.128185, "eval_seconds": 8.5, "eval_timeout": 1200, "eval_over_timeout": false}
{"timestamp": "2026-09-08T05:46:43+00:00", "label": "m2-pat1-AMAAAA-300", "solution": "Mamba2Pattern", "description": "Pattern sweep at paper geometry: ONE Mamba2 layer of 6 (AMAAAA, layer 1). Nearly free on speed (~+0.028 s/step) and keeps 5 of 6 value-embedding tables. Reference xf-fixed300 = 1.269458 at 0.907 s/step", "launch_command": "NEURON_LOGICAL_NC_CONFIG=2 torchrun --standalone --nproc_per_node=4 train.py --num-steps 300 --max-train-seconds 1500 --out-dir out/m2-pat1-AMAAAA-300 --mamba2 --nki-ssd --no-compile --mamba2-pattern AMAAAA", "git_commit": "eb81ae5", "git_dirty": true, "status": "keep", "wall_elapsed_seconds": 444.4, "run_log": "research/run-logs/m2-pat1-AMAAAA-300.log", "checkpoint_path": "out/m2-pat1-AMAAAA-300/final.pt", "training_seconds": 323.9, "budget_seconds": 1800, "target_steps": 300, "max_train_seconds": 1500, "startup_allowance_est": 104.3, "charged_seconds_est": 324.1, "over_budget": false, "total_seconds": 429.3, "compiled": false, "nki_relu2": false, "num_steps": 300, "total_tokens_M": 39.3, "world_size": 4, "lnc": 2, "seq_len": 2048, "num_params_M": 51.5, "causality_passed": true, "causality_max_abs": 0.0, "public_val_bpb": 1.26705, "eval_seconds": 8.2, "eval_timeout": 1200, "eval_over_timeout": false}
{"timestamp": "2026-09-08T06:11:44+00:00", "label": "m2-pat1-cheap-300", "solution": "Mamba2LowM", "description": "Best candidate: ONE Mamba2 layer of 6 (AMAAAA) at the cheap geometry (expand=1 d_state=64 conv_kernel=2). A cheap mixer prices at only +0.041 s/step over the attention layer it replaces, vs +0.12-0.17 at the paper geometry, while M=1 paper already BEAT pure attention on quality-per-step (1.267050 vs 1.269458). Reference xf-fixed300 = 1.269458 @ 0.907 s/step", "launch_command": "NEURON_LOGICAL_NC_CONFIG=2 torchrun --standalone --nproc_per_node=4 train.py --num-steps 300 --max-train-seconds 1500 --out-dir out/m2-pat1-cheap-300 --mamba2 --nki-ssd --no-compile --mamba2-expand 1 --mamba2-d-state 64 --mamba2-conv-kernel 2 --mamba2-pattern AMAAAA", "git_commit": "eb81ae5", "git_dirty": true, "status": "keep", "wall_elapsed_seconds": 388.6, "run_log": "research/run-logs/m2-pat1-cheap-300.log", "checkpoint_path": "out/m2-pat1-cheap-300/final.pt", "training_seconds": 297.7, "budget_seconds": 1800, "target_steps": 300, "max_train_seconds": 1500, "startup_allowance_est": 75.7, "charged_seconds_est": 297.8, "over_budget": false, "total_seconds": 361.0, "compiled": false, "nki_relu2": false, "num_steps": 300, "total_tokens_M": 39.3, "world_size": 4, "lnc": 2, "seq_len": 2048, "num_params_M": 50.2, "causality_passed": true, "causality_max_abs": 0.0, "public_val_bpb": 1.27058, "eval_seconds": 8.0, "eval_timeout": 1200, "eval_over_timeout": false}
