{"timestamp": "2026-09-13T02:15:49+00:00", "label": "t39-qkshift-1800s", "solution": "T3.9", "description": "T3.9 causal Q/K token shift beta=0.3, full budget", "launch_command": "NEURON_LOGICAL_NC_CONFIG=2 torchrun --standalone --nproc_per_node=4 train.py --num-steps 5000 --max-train-seconds 1800 --out-dir out/t39-qkshift-1800s --eval-seq-len 1024 --qk-shift", "git_commit": "496befd", "git_dirty": true, "status": "keep", "wall_elapsed_seconds": 1886.9, "run_log": "research/run-logs/t39-qkshift-1800s.log", "checkpoint_path": "out/t39-qkshift-1800s/final.pt", "training_seconds": 1794.2, "budget_seconds": 1800, "target_steps": 5000, "max_train_seconds": 1800, "startup_allowance_est": 62.1, "charged_seconds_est": 1794.6, "over_budget": false, "total_seconds": 1860.8, "compiled": true, "nki_relu2": false, "ngram_ve": "True tables=2 rows=524288 dim=128 index_gather=True trigram=True opt=rmsprop flat_lr=True bf16=True", "out_bigram": "False bf16=True gate_bias=-2.0 lr=0.0", "oneliners": "relu2_tau=0.0 mlp_sandwich=False head_gate=False hg_norm=True hg_ch=32 hg_mul=2.0 hg_bias=0.0 out_pool=False pool_layers=3 qk_shift=True qk_beta=0.3", "batch_ramp": "False grad_accum=(2, 4, 8) bounds=(0.35, 0.75) lr_exp=0.5 ref_grad_accum=4 last_grad_accum=4", "weight_ema": "False decays=(0.995,) start_frac=0.75 seeded=False updates=0", "num_steps": 2311, "total_tokens_M": 302.9, "world_size": 4, "lnc": 2, "seq_len": 2048, "num_params_M": 190.1, "causality_passed": true, "causality_max_abs": 0.0, "public_val_bpb": 1.022031, "eval_seconds": 9.2, "eval_timeout": 1200, "eval_over_timeout": false, "eval_alt_seq_len": 1024, "public_val_bpb_alt": 1.037069, "eval_alt_seconds": 15.9}
{"timestamp": "2026-09-12T22:41:20+00:00", "label": "t39-qkshift-900s", "solution": "T4.2/T3.9", "description": "T3.9 causal Q/K token shift beta=0.3 per-dim learned", "launch_command": "NEURON_LOGICAL_NC_CONFIG=2 torchrun --standalone --nproc_per_node=4 train.py --num-steps 5000 --max-train-seconds 900 --out-dir out/t39-qkshift-900s --eval-seq-len 1024 --qk-shift", "git_commit": "496befd", "git_dirty": true, "status": "keep", "wall_elapsed_seconds": 982.6, "run_log": "research/run-logs/t39-qkshift-900s.log", "checkpoint_path": "out/t39-qkshift-900s/final.pt", "training_seconds": 894.8, "budget_seconds": 1800, "target_steps": 5000, "max_train_seconds": 900, "startup_allowance_est": 52.0, "charged_seconds_est": 895.2, "over_budget": false, "total_seconds": 965.6, "compiled": true, "nki_relu2": false, "ngram_ve": "True tables=2 rows=524288 dim=128 index_gather=True trigram=True opt=rmsprop flat_lr=True bf16=True", "out_bigram": "False bf16=True gate_bias=-2.0 lr=0.0", "oneliners": "relu2_tau=0.0 mlp_sandwich=False head_gate=False hg_norm=True hg_ch=32 hg_mul=2.0 hg_bias=0.0 out_pool=False pool_layers=3 qk_shift=True qk_beta=0.3", "batch_ramp": "False grad_accum=(2, 4, 8) bounds=(0.35, 0.75) lr_exp=0.5 ref_grad_accum=4 last_grad_accum=4", "weight_ema": "False decays=(0.995,) start_frac=0.75 seeded=False updates=0", "num_steps": 1154, "total_tokens_M": 151.3, "world_size": 4, "lnc": 2, "seq_len": 2048, "num_params_M": 190.1, "causality_passed": true, "causality_max_abs": 0.0, "public_val_bpb": 1.059431, "eval_seconds": 9.3, "eval_timeout": 1200, "eval_over_timeout": false, "eval_alt_seq_len": 1024, "public_val_bpb_alt": 1.07519, "eval_alt_seconds": 18.5}
{"timestamp": "2026-09-13T03:54:10+00:00", "label": "t39-qkshift-b0-1800s", "solution": "T3.9", "description": "T3.9 qk-shift with beta init 0.0 (identity at init, keeps the graph shape / +8% throughput)", "launch_command": "NEURON_LOGICAL_NC_CONFIG=2 torchrun --standalone --nproc_per_node=4 train.py --num-steps 5000 --max-train-seconds 1800 --out-dir out/t39-qkshift-b0-1800s --eval-seq-len 1024 --qk-shift --qk-shift-beta 0.0", "git_commit": "496befd", "git_dirty": true, "status": "keep", "wall_elapsed_seconds": 1886.3, "run_log": "research/run-logs/t39-qkshift-b0-1800s.log", "checkpoint_path": "out/t39-qkshift-b0-1800s/final.pt", "training_seconds": 1794.4, "budget_seconds": 1800, "target_steps": 5000, "max_train_seconds": 1800, "startup_allowance_est": 61.9, "charged_seconds_est": 1794.8, "over_budget": false, "total_seconds": 1860.0, "compiled": true, "nki_relu2": false, "ngram_ve": "True tables=2 rows=524288 dim=128 index_gather=True trigram=True opt=rmsprop flat_lr=True bf16=True", "out_bigram": "False bf16=True gate_bias=-2.0 lr=0.0", "oneliners": "relu2_tau=0.0 mlp_sandwich=False head_gate=False hg_norm=True hg_ch=32 hg_mul=2.0 hg_bias=0.0 out_pool=False pool_layers=3 qk_shift=True qk_beta=0.0", "batch_ramp": "False grad_accum=(2, 4, 8) bounds=(0.35, 0.75) lr_exp=0.5 ref_grad_accum=4 last_grad_accum=4", "weight_ema": "False decays=(0.995,) start_frac=0.75 seeded=False updates=0", "num_steps": 2330, "total_tokens_M": 305.4, "world_size": 4, "lnc": 2, "seq_len": 2048, "num_params_M": 190.1, "causality_passed": true, "causality_max_abs": 0.0, "public_val_bpb": 1.020738, "eval_seconds": 9.0, "eval_timeout": 1200, "eval_over_timeout": false, "eval_alt_seq_len": 1024, "public_val_bpb_alt": 1.03619, "eval_alt_seconds": 15.6}
{"timestamp": "2026-09-13T00:29:11+00:00", "label": "t39-qkshift2-900s", "solution": "T3.9", "description": "T3.9 qk-shift repeat", "launch_command": "NEURON_LOGICAL_NC_CONFIG=2 torchrun --standalone --nproc_per_node=4 train.py --num-steps 5000 --max-train-seconds 900 --out-dir out/t39-qkshift2-900s --eval-seq-len 1024 --qk-shift", "git_commit": "496befd", "git_dirty": true, "status": "keep", "wall_elapsed_seconds": 988.2, "run_log": "research/run-logs/t39-qkshift2-900s.log", "checkpoint_path": "out/t39-qkshift2-900s/final.pt", "training_seconds": 894.5, "budget_seconds": 1800, "target_steps": 5000, "max_train_seconds": 900, "startup_allowance_est": 62.7, "charged_seconds_est": 894.9, "over_budget": false, "total_seconds": 960.6, "compiled": true, "nki_relu2": false, "ngram_ve": "True tables=2 rows=524288 dim=128 index_gather=True trigram=True opt=rmsprop flat_lr=True bf16=True", "out_bigram": "False bf16=True gate_bias=-2.0 lr=0.0", "oneliners": "relu2_tau=0.0 mlp_sandwich=False head_gate=False hg_norm=True hg_ch=32 hg_mul=2.0 hg_bias=0.0 out_pool=False pool_layers=3 qk_shift=True qk_beta=0.3", "batch_ramp": "False grad_accum=(2, 4, 8) bounds=(0.35, 0.75) lr_exp=0.5 ref_grad_accum=4 last_grad_accum=4", "weight_ema": "False decays=(0.995,) start_frac=0.75 seeded=False updates=0", "num_steps": 1153, "total_tokens_M": 151.1, "world_size": 4, "lnc": 2, "seq_len": 2048, "num_params_M": 190.1, "causality_passed": true, "causality_max_abs": 0.0, "public_val_bpb": 1.059623, "eval_seconds": 9.2, "eval_timeout": 1200, "eval_over_timeout": false, "eval_alt_seq_len": 1024, "public_val_bpb_alt": 1.075339, "eval_alt_seconds": 16.1}
{"timestamp": "2026-09-12T22:08:37+00:00", "label": "t39-relu2t05-900s", "solution": "T4.2/T3.9", "description": "T3.9 shifted ReLU^2 tau=0.5", "launch_command": "NEURON_LOGICAL_NC_CONFIG=2 torchrun --standalone --nproc_per_node=4 train.py --num-steps 5000 --max-train-seconds 900 --out-dir out/t39-relu2t05-900s --eval-seq-len 1024 --relu2-tau 0.5", "git_commit": "496befd", "git_dirty": true, "status": "keep", "wall_elapsed_seconds": 993.1, "run_log": "research/run-logs/t39-relu2t05-900s.log", "checkpoint_path": "out/t39-relu2t05-900s/final.pt", "training_seconds": 895.0, "budget_seconds": 1800, "target_steps": 5000, "max_train_seconds": 900, "startup_allowance_est": 64.0, "charged_seconds_est": 895.4, "over_budget": false, "total_seconds": 967.5, "compiled": true, "nki_relu2": false, "ngram_ve": "True tables=2 rows=524288 dim=128 index_gather=True trigram=True opt=rmsprop flat_lr=True bf16=True", "out_bigram": "False bf16=True gate_bias=-2.0 lr=0.0", "oneliners": "relu2_tau=0.5 mlp_sandwich=False head_gate=False hg_norm=True hg_ch=32 hg_mul=2.0 hg_bias=0.0 out_pool=False pool_layers=3 qk_shift=False qk_beta=0.3", "batch_ramp": "False grad_accum=(2, 4, 8) bounds=(0.35, 0.75) lr_exp=0.5 ref_grad_accum=4 last_grad_accum=4", "weight_ema": "False decays=(0.995,) start_frac=0.75 seeded=False updates=0", "num_steps": 1074, "total_tokens_M": 140.8, "world_size": 4, "lnc": 2, "seq_len": 2048, "num_params_M": 190.1, "causality_passed": true, "causality_max_abs": 0.0, "public_val_bpb": 1.068547, "eval_seconds": 10.1, "eval_timeout": 1200, "eval_over_timeout": false, "eval_alt_seq_len": 1024, "public_val_bpb_alt": 1.083968, "eval_alt_seconds": 16.7}
{"timestamp": "2026-09-13T03:22:44+00:00", "label": "t39-sandwich-1800s", "solution": "T3.9", "description": "T3.9 mlp sandwich norm alone, full budget", "launch_command": "NEURON_LOGICAL_NC_CONFIG=2 torchrun --standalone --nproc_per_node=4 train.py --num-steps 5000 --max-train-seconds 1800 --out-dir out/t39-sandwich-1800s --eval-seq-len 1024 --mlp-sandwich-norm", "git_commit": "496befd", "git_dirty": true, "status": "keep", "wall_elapsed_seconds": 1879.8, "run_log": "research/run-logs/t39-sandwich-1800s.log", "checkpoint_path": "out/t39-sandwich-1800s/final.pt", "training_seconds": 1794.6, "budget_seconds": 1800, "target_steps": 5000, "max_train_seconds": 1800, "startup_allowance_est": 55.1, "charged_seconds_est": 1795.0, "over_budget": false, "total_seconds": 1862.9, "compiled": true, "nki_relu2": false, "ngram_ve": "True tables=2 rows=524288 dim=128 index_gather=True trigram=True opt=rmsprop flat_lr=True bf16=True", "out_bigram": "False bf16=True gate_bias=-2.0 lr=0.0", "oneliners": "relu2_tau=0.0 mlp_sandwich=True head_gate=False hg_norm=True hg_ch=32 hg_mul=2.0 hg_bias=0.0 out_pool=False pool_layers=3 qk_shift=False qk_beta=0.3", "batch_ramp": "False grad_accum=(2, 4, 8) bounds=(0.35, 0.75) lr_exp=0.5 ref_grad_accum=4 last_grad_accum=4", "weight_ema": "False decays=(0.995,) start_frac=0.75 seeded=False updates=0", "num_steps": 2326, "total_tokens_M": 304.9, "world_size": 4, "lnc": 2, "seq_len": 2048, "num_params_M": 190.1, "causality_passed": true, "causality_max_abs": 0.0, "public_val_bpb": 1.025017, "eval_seconds": 8.8, "eval_timeout": 1200, "eval_over_timeout": false, "eval_alt_seq_len": 1024, "public_val_bpb_alt": 1.040276, "eval_alt_seconds": 15.0}
{"timestamp": "2026-09-12T22:24:57+00:00", "label": "t39-sandwich-900s", "solution": "T4.2/T3.9", "description": "T3.9 MLP sandwich norm", "launch_command": "NEURON_LOGICAL_NC_CONFIG=2 torchrun --standalone --nproc_per_node=4 train.py --num-steps 5000 --max-train-seconds 900 --out-dir out/t39-sandwich-900s --eval-seq-len 1024 --mlp-sandwich-norm", "git_commit": "496befd", "git_dirty": true, "status": "keep", "wall_elapsed_seconds": 979.8, "run_log": "research/run-logs/t39-sandwich-900s.log", "checkpoint_path": "out/t39-sandwich-900s/final.pt", "training_seconds": 894.9, "budget_seconds": 1800, "target_steps": 5000, "max_train_seconds": 900, "startup_allowance_est": 55.2, "charged_seconds_est": 895.3, "over_budget": false, "total_seconds": 962.8, "compiled": true, "nki_relu2": false, "ngram_ve": "True tables=2 rows=524288 dim=128 index_gather=True trigram=True opt=rmsprop flat_lr=True bf16=True", "out_bigram": "False bf16=True gate_bias=-2.0 lr=0.0", "oneliners": "relu2_tau=0.0 mlp_sandwich=True head_gate=False hg_norm=True hg_ch=32 hg_mul=2.0 hg_bias=0.0 out_pool=False pool_layers=3 qk_shift=False qk_beta=0.3", "batch_ramp": "False grad_accum=(2, 4, 8) bounds=(0.35, 0.75) lr_exp=0.5 ref_grad_accum=4 last_grad_accum=4", "weight_ema": "False decays=(0.995,) start_frac=0.75 seeded=False updates=0", "num_steps": 1163, "total_tokens_M": 152.4, "world_size": 4, "lnc": 2, "seq_len": 2048, "num_params_M": 190.1, "causality_passed": true, "causality_max_abs": 0.0, "public_val_bpb": 1.062569, "eval_seconds": 8.7, "eval_timeout": 1200, "eval_over_timeout": false, "eval_alt_seq_len": 1024, "public_val_bpb_alt": 1.078144, "eval_alt_seconds": 15.0}
{"timestamp": "2026-09-13T00:45:41+00:00", "label": "t39-sandwich2-900s", "solution": "T3.9", "description": "T3.9 mlp sandwich norm repeat", "launch_command": "NEURON_LOGICAL_NC_CONFIG=2 torchrun --standalone --nproc_per_node=4 train.py --num-steps 5000 --max-train-seconds 900 --out-dir out/t39-sandwich2-900s --eval-seq-len 1024 --mlp-sandwich-norm", "git_commit": "496befd", "git_dirty": true, "status": "keep", "wall_elapsed_seconds": 989.4, "run_log": "research/run-logs/t39-sandwich2-900s.log", "checkpoint_path": "out/t39-sandwich2-900s/final.pt", "training_seconds": 894.8, "budget_seconds": 1800, "target_steps": 5000, "max_train_seconds": 900, "startup_allowance_est": 65.0, "charged_seconds_est": 895.2, "over_budget": false, "total_seconds": 962.8, "compiled": true, "nki_relu2": false, "ngram_ve": "True tables=2 rows=524288 dim=128 index_gather=True trigram=True opt=rmsprop flat_lr=True bf16=True", "out_bigram": "False bf16=True gate_bias=-2.0 lr=0.0", "oneliners": "relu2_tau=0.0 mlp_sandwich=True head_gate=False hg_norm=True hg_ch=32 hg_mul=2.0 hg_bias=0.0 out_pool=False pool_layers=3 qk_shift=False qk_beta=0.3", "batch_ramp": "False grad_accum=(2, 4, 8) bounds=(0.35, 0.75) lr_exp=0.5 ref_grad_accum=4 last_grad_accum=4", "weight_ema": "False decays=(0.995,) start_frac=0.75 seeded=False updates=0", "num_steps": 1161, "total_tokens_M": 152.2, "world_size": 4, "lnc": 2, "seq_len": 2048, "num_params_M": 190.1, "causality_passed": true, "causality_max_abs": 0.0, "public_val_bpb": 1.06248, "eval_seconds": 8.8, "eval_timeout": 1200, "eval_over_timeout": false, "eval_alt_seq_len": 1024, "public_val_bpb_alt": 1.07819, "eval_alt_seconds": 15.0}
{"timestamp": "2026-09-13T02:47:17+00:00", "label": "t39-stack-1800s", "solution": "T3.9", "description": "T3.9 qk-shift + mlp sandwich norm, full budget", "launch_command": "NEURON_LOGICAL_NC_CONFIG=2 torchrun --standalone --nproc_per_node=4 train.py --num-steps 5000 --max-train-seconds 1800 --out-dir out/t39-stack-1800s --eval-seq-len 1024 --qk-shift --mlp-sandwich-norm", "git_commit": "496befd", "git_dirty": true, "status": "keep", "wall_elapsed_seconds": 1888.5, "run_log": "research/run-logs/t39-stack-1800s.log", "checkpoint_path": "out/t39-stack-1800s/final.pt", "training_seconds": 1794.6, "budget_seconds": 1800, "target_steps": 5000, "max_train_seconds": 1800, "startup_allowance_est": 61.9, "charged_seconds_est": 1795.0, "over_budget": false, "total_seconds": 1862.5, "compiled": true, "nki_relu2": false, "ngram_ve": "True tables=2 rows=524288 dim=128 index_gather=True trigram=True opt=rmsprop flat_lr=True bf16=True", "out_bigram": "False bf16=True gate_bias=-2.0 lr=0.0", "oneliners": "relu2_tau=0.0 mlp_sandwich=True head_gate=False hg_norm=True hg_ch=32 hg_mul=2.0 hg_bias=0.0 out_pool=False pool_layers=3 qk_shift=True qk_beta=0.3", "batch_ramp": "False grad_accum=(2, 4, 8) bounds=(0.35, 0.75) lr_exp=0.5 ref_grad_accum=4 last_grad_accum=4", "weight_ema": "False decays=(0.995,) start_frac=0.75 seeded=False updates=0", "num_steps": 2288, "total_tokens_M": 299.9, "world_size": 4, "lnc": 2, "seq_len": 2048, "num_params_M": 190.1, "causality_passed": true, "causality_max_abs": 0.0, "public_val_bpb": 1.021278, "eval_seconds": 9.5, "eval_timeout": 1200, "eval_over_timeout": false, "eval_alt_seq_len": 1024, "public_val_bpb_alt": 1.036844, "eval_alt_seconds": 16.7}
{"timestamp": "2026-09-13T01:04:21+00:00", "label": "t39-stack-900s", "solution": "T3.9", "description": "T3.9 stack: qk-shift + mlp sandwich norm", "launch_command": "NEURON_LOGICAL_NC_CONFIG=2 torchrun --standalone --nproc_per_node=4 train.py --num-steps 5000 --max-train-seconds 900 --out-dir out/t39-stack-900s --eval-seq-len 1024 --qk-shift --mlp-sandwich-norm", "git_commit": "496befd", "git_dirty": true, "status": "keep", "wall_elapsed_seconds": 1119.6, "run_log": "research/run-logs/t39-stack-900s.log", "checkpoint_path": "out/t39-stack-900s/final.pt", "training_seconds": 894.3, "budget_seconds": 1800, "target_steps": 5000, "max_train_seconds": 900, "startup_allowance_est": 194.0, "charged_seconds_est": 894.7, "over_budget": false, "total_seconds": 1095.1, "compiled": true, "nki_relu2": false, "ngram_ve": "True tables=2 rows=524288 dim=128 index_gather=True trigram=True opt=rmsprop flat_lr=True bf16=True", "out_bigram": "False bf16=True gate_bias=-2.0 lr=0.0", "oneliners": "relu2_tau=0.0 mlp_sandwich=True head_gate=False hg_norm=True hg_ch=32 hg_mul=2.0 hg_bias=0.0 out_pool=False pool_layers=3 qk_shift=True qk_beta=0.3", "batch_ramp": "False grad_accum=(2, 4, 8) bounds=(0.35, 0.75) lr_exp=0.5 ref_grad_accum=4 last_grad_accum=4", "weight_ema": "False decays=(0.995,) start_frac=0.75 seeded=False updates=0", "num_steps": 1143, "total_tokens_M": 149.8, "world_size": 4, "lnc": 2, "seq_len": 2048, "num_params_M": 190.1, "causality_passed": true, "causality_max_abs": 0.0, "public_val_bpb": 1.05892, "eval_seconds": 9.3, "eval_timeout": 1200, "eval_over_timeout": false, "eval_alt_seq_len": 1024, "public_val_bpb_alt": 1.074905, "eval_alt_seconds": 16.3}
{"timestamp": "2026-09-12T21:35:28+00:00", "label": "t42-base-900s", "solution": "T4.2/T3.9", "description": "fresh same-day 900s control, locked defaults", "launch_command": "NEURON_LOGICAL_NC_CONFIG=2 torchrun --standalone --nproc_per_node=4 train.py --num-steps 5000 --max-train-seconds 900 --out-dir out/t42-base-900s --eval-seq-len 1024", "git_commit": "496befd", "git_dirty": true, "status": "keep", "wall_elapsed_seconds": 1180.0, "run_log": "research/run-logs/t42-base-900s.log", "checkpoint_path": "out/t42-base-900s/final.pt", "training_seconds": 894.8, "budget_seconds": 1800, "target_steps": 5000, "max_train_seconds": 900, "startup_allowance_est": 255.8, "charged_seconds_est": 895.2, "over_budget": false, "total_seconds": 1156.7, "compiled": true, "nki_relu2": false, "ngram_ve": "True tables=2 rows=524288 dim=128 index_gather=True trigram=True opt=rmsprop flat_lr=True bf16=True", "out_bigram": "False bf16=True gate_bias=-2.0 lr=0.0", "oneliners": "relu2_tau=0.0 mlp_sandwich=False head_gate=False hg_norm=True hg_ch=32 hg_mul=2.0 hg_bias=0.0 out_pool=False pool_layers=3 qk_shift=False qk_beta=0.3", "batch_ramp": "False grad_accum=(2, 4, 8) bounds=(0.35, 0.75) lr_exp=0.5 ref_grad_accum=4 last_grad_accum=4", "weight_ema": "False decays=(0.995,) start_frac=0.75 seeded=False updates=0", "num_steps": 1068, "total_tokens_M": 140.0, "world_size": 4, "lnc": 2, "seq_len": 2048, "num_params_M": 190.1, "causality_passed": true, "causality_max_abs": 0.0, "public_val_bpb": 1.065569, "eval_seconds": 8.6, "eval_timeout": 1200, "eval_over_timeout": false, "eval_alt_seq_len": 1024, "public_val_bpb_alt": 1.081036, "eval_alt_seconds": 14.7}
{"timestamp": "2026-09-12T21:52:04+00:00", "label": "t42-outbi-900s", "solution": "T4.2/T3.9", "description": "T4.2 Aster output bigram logit table, gate_bias=-2, bf16", "launch_command": "NEURON_LOGICAL_NC_CONFIG=2 torchrun --standalone --nproc_per_node=4 train.py --num-steps 5000 --max-train-seconds 900 --out-dir out/t42-outbi-900s --eval-seq-len 1024 --out-bigram", "git_commit": "496befd", "git_dirty": true, "status": "keep", "wall_elapsed_seconds": 996.3, "run_log": "research/run-logs/t42-outbi-900s.log", "checkpoint_path": "out/t42-outbi-900s/final.pt", "training_seconds": 894.1, "budget_seconds": 1800, "target_steps": 5000, "max_train_seconds": 900, "startup_allowance_est": 65.8, "charged_seconds_est": 894.6, "over_budget": false, "total_seconds": 970.9, "compiled": true, "nki_relu2": false, "ngram_ve": "True tables=2 rows=524288 dim=128 index_gather=True trigram=True opt=rmsprop flat_lr=True bf16=True", "out_bigram": "True bf16=True gate_bias=-2.0 lr=0.0", "oneliners": "relu2_tau=0.0 mlp_sandwich=False head_gate=False hg_norm=True hg_ch=32 hg_mul=2.0 hg_bias=0.0 out_pool=False pool_layers=3 qk_shift=False qk_beta=0.3", "batch_ramp": "False grad_accum=(2, 4, 8) bounds=(0.35, 0.75) lr_exp=0.5 ref_grad_accum=4 last_grad_accum=4", "weight_ema": "False decays=(0.995,) start_frac=0.75 seeded=False updates=0", "num_steps": 992, "total_tokens_M": 130.0, "world_size": 4, "lnc": 2, "seq_len": 2048, "num_params_M": 257.2, "causality_passed": true, "causality_max_abs": 0.0, "public_val_bpb": 1.069691, "eval_seconds": 8.9, "eval_timeout": 1200, "eval_over_timeout": false, "eval_alt_seq_len": 1024, "public_val_bpb_alt": 1.085172, "eval_alt_seconds": 18.1}
{"timestamp": "2026-09-07T19:23:54+00:00", "label": "tensorlr-900s", "solution": "LrmQuantum", "description": "root-cause fix instead of quantisation: lr carried in a device tensor (--tensor-lr-scalars) so the exact continuous cooldown compiles once, not once per step", "launch_command": "NEURON_LOGICAL_NC_CONFIG=2 torchrun --standalone --nproc_per_node=4 train.py --num-steps 5000 --max-train-seconds 900 --out-dir out/tensorlr-900s --tensor-lr-scalars --lrm-quantum 0", "git_commit": "e6fe55a", "git_dirty": true, "status": "keep", "wall_elapsed_seconds": 968.9, "run_log": "research/run-logs/tensorlr-900s.log", "checkpoint_path": "out/tensorlr-900s/final.pt", "training_seconds": 894.8, "budget_seconds": 1800, "target_steps": 5000, "max_train_seconds": 900, "startup_allowance_est": 62.2, "charged_seconds_est": 895.0, "over_budget": false, "total_seconds": 942.2, "compiled": true, "nki_relu2": false, "num_steps": 995, "total_tokens_M": 130.4, "world_size": 4, "lnc": 2, "seq_len": 2048, "num_params_M": 55.7, "causality_passed": true, "causality_max_abs": 0.0, "public_val_bpb": 1.094327, "eval_seconds": 7.5, "eval_timeout": 1200, "eval_over_timeout": false}
