{"timestamp": "2026-09-06T10:57:13+00:00", "label": "sol13b-final-shape-ab", "solution": "Solution 13", "description": "Solution 13b A/B at final locked shape: USE_STOCHASTIC_ROUNDING=True", "launch_command": "NEURON_LOGICAL_NC_CONFIG=1 torchrun --standalone --nproc_per_node=8 train.py --num-steps 5000 --max-train-seconds 900 --out-dir out/sol13b-final-shape-ab", "git_commit": "a2fa809", "git_dirty": true, "status": "keep", "wall_elapsed_seconds": 933.6, "run_log": "research/run-logs/sol13b-final-shape-ab.log", "checkpoint_path": "out/sol13b-final-shape-ab/final.pt", "training_seconds": 887.1, "budget_seconds": 1800, "target_steps": 5000, "max_train_seconds": 900, "startup_allowance_est": 30.4, "charged_seconds_est": 887.3, "over_budget": false, "total_seconds": 909.0, "compiled": false, "nki_relu2": false, "num_steps": 248, "total_tokens_M": 32.5, "world_size": 8, "lnc": 1, "seq_len": 1024, "num_params_M": 55.7, "causality_passed": false, "causality_max_abs": 0.021134, "public_val_bpb": 1.270737, "eval_seconds": 11.6, "eval_timeout": 1200, "eval_over_timeout": false}
{"timestamp": "2026-09-06T11:20:14+00:00", "label": "sol13c-final-shape-ab", "solution": "Solution 13", "description": "Solution 13c A/B at final locked shape: USE_FUSED_QKV=True (note: silently disables rope+QK-norm kernel fusion, falls back to eager)", "launch_command": "NEURON_LOGICAL_NC_CONFIG=1 torchrun --standalone --nproc_per_node=8 train.py --num-steps 5000 --max-train-seconds 900 --out-dir out/sol13c-final-shape-ab", "git_commit": "0097830", "git_dirty": true, "status": "keep", "wall_elapsed_seconds": 961.2, "run_log": "research/run-logs/sol13c-final-shape-ab.log", "checkpoint_path": "out/sol13c-final-shape-ab/final.pt", "training_seconds": 891.6, "budget_seconds": 1800, "target_steps": 5000, "max_train_seconds": 900, "startup_allowance_est": 51.4, "charged_seconds_est": 891.8, "over_budget": false, "total_seconds": 936.6, "compiled": false, "nki_relu2": false, "num_steps": 206, "total_tokens_M": 27.0, "world_size": 8, "lnc": 1, "seq_len": 1024, "num_params_M": 55.7, "causality_passed": true, "causality_max_abs": 0.0, "public_val_bpb": 1.312086, "eval_seconds": 13.9, "eval_timeout": 1200, "eval_over_timeout": false}
{"timestamp": "2026-09-05T14:02:39+00:00", "label": "sol13c-fusedqkv-smoke", "solution": "13c", "description": "USE_FUSED_QKV=True smoke test, single device, 15 steps", "launch_command": "NEURON_LOGICAL_NC_CONFIG=1 torchrun --standalone --nproc_per_node=1 train.py --num-steps 15 --max-train-seconds 200 --out-dir out/sol13c-fusedqkv-smoke --eval-tokens 65536", "git_commit": "c2f7299", "git_dirty": true, "status": "keep", "wall_elapsed_seconds": 166.6, "run_log": "research/run-logs/sol13c-fusedqkv-smoke.log", "checkpoint_path": "out/sol13c-fusedqkv-smoke/final.pt", "training_seconds": 73.4, "budget_seconds": 1800, "target_steps": 15, "max_train_seconds": 200, "startup_allowance_est": 82.4, "charged_seconds_est": 73.7, "over_budget": false, "total_seconds": 153.4, "compiled": false, "nki_relu2": false, "num_steps": 15, "total_tokens_M": 1.0, "world_size": 1, "lnc": 1, "seq_len": 1024, "num_params_M": 85.9, "causality_passed": true, "causality_max_abs": 0.0, "public_val_bpb": 2.126904, "eval_seconds": 3.5, "eval_timeout": 1200, "eval_over_timeout": false}
{"timestamp": "2026-09-05T14:05:07+00:00", "label": "sol13d-causalfastpath-smoke", "solution": "13d", "description": "USE_CAUSAL_FASTPATH=True smoke test, single device, 15 steps", "launch_command": "NEURON_LOGICAL_NC_CONFIG=1 torchrun --standalone --nproc_per_node=1 train.py --num-steps 15 --max-train-seconds 200 --out-dir out/sol13d-causalfastpath-smoke --eval-tokens 65536", "git_commit": "67f3681", "git_dirty": true, "status": "keep", "wall_elapsed_seconds": 115.0, "run_log": "research/run-logs/sol13d-causalfastpath-smoke.log", "checkpoint_path": "out/sol13d-causalfastpath-smoke/final.pt", "training_seconds": 58.6, "budget_seconds": 1800, "target_steps": 15, "max_train_seconds": 200, "startup_allowance_est": 46.2, "charged_seconds_est": 58.9, "over_budget": false, "total_seconds": 103.1, "compiled": false, "nki_relu2": false, "num_steps": 15, "total_tokens_M": 1.0, "world_size": 1, "lnc": 1, "seq_len": 1024, "num_params_M": 85.9, "causality_passed": true, "causality_max_abs": 0.0, "public_val_bpb": 2.129617, "eval_seconds": 3.3, "eval_timeout": 1200, "eval_over_timeout": false}
{"timestamp": "2026-09-06T11:39:20+00:00", "label": "sol13d-final-shape-ab", "solution": "Solution 13", "description": "Solution 13d A/B at final locked shape: USE_CAUSAL_FASTPATH=True", "launch_command": "NEURON_LOGICAL_NC_CONFIG=1 torchrun --standalone --nproc_per_node=8 train.py --num-steps 5000 --max-train-seconds 900 --out-dir out/sol13d-final-shape-ab", "git_commit": "df360d9", "git_dirty": true, "status": "keep", "wall_elapsed_seconds": 941.5, "run_log": "research/run-logs/sol13d-final-shape-ab.log", "checkpoint_path": "out/sol13d-final-shape-ab/final.pt", "training_seconds": 892.5, "budget_seconds": 1800, "target_steps": 5000, "max_train_seconds": 900, "startup_allowance_est": 33.2, "charged_seconds_est": 892.7, "over_budget": false, "total_seconds": 913.4, "compiled": false, "nki_relu2": false, "num_steps": 265, "total_tokens_M": 34.7, "world_size": 8, "lnc": 1, "seq_len": 1024, "num_params_M": 55.7, "causality_passed": true, "causality_max_abs": 0.0, "public_val_bpb": 1.252675, "eval_seconds": 11.3, "eval_timeout": 1200, "eval_over_timeout": false}
{"timestamp": "2026-09-04T09:10:55+00:00", "label": "sol2-warmup0", "solution": "2", "description": "WARMUP_STEPS=0 (on top of Solution 1 winner)", "launch_command": "NEURON_LOGICAL_NC_CONFIG=1 torchrun --standalone --nproc_per_node=1 train.py --num-steps 800 --max-train-seconds 1050 --out-dir out/sol2-warmup0", "git_commit": "32dfd61", "git_dirty": true, "status": "keep", "wall_elapsed_seconds": 1044.4, "run_log": "research/run-logs/sol2-warmup0.log", "checkpoint_path": "out/sol2-warmup0/final.pt", "training_seconds": 1028.2, "budget_seconds": 1800, "target_steps": 800, "max_train_seconds": 1050, "over_budget": false, "total_seconds": 1028.3, "compiled": false, "nki_relu2": false, "num_steps": 800, "total_tokens_M": 52.4, "world_size": 1, "lnc": 1, "seq_len": 1024, "num_params_M": 59.6, "causality_passed": true, "causality_max_abs": 0.0, "public_val_bpb": 1.21612, "eval_seconds": 13.9, "eval_timeout": 1200, "eval_over_timeout": false}
{"timestamp": "2026-09-04T09:29:54+00:00", "label": "sol3-wddecay", "solution": "3", "description": "WD_DECAY_TO_ZERO=True (on top of Sol1+2)", "launch_command": "NEURON_LOGICAL_NC_CONFIG=1 torchrun --standalone --nproc_per_node=1 train.py --num-steps 800 --max-train-seconds 1050 --out-dir out/sol3-wddecay", "git_commit": "4d915cd", "git_dirty": true, "status": "keep", "wall_elapsed_seconds": 1042.4, "run_log": "research/run-logs/sol3-wddecay.log", "checkpoint_path": "out/sol3-wddecay/final.pt", "training_seconds": 1026.4, "budget_seconds": 1800, "target_steps": 800, "max_train_seconds": 1050, "over_budget": false, "total_seconds": 1026.5, "compiled": false, "nki_relu2": false, "num_steps": 800, "total_tokens_M": 52.4, "world_size": 1, "lnc": 1, "seq_len": 1024, "num_params_M": 59.6, "causality_passed": true, "causality_max_abs": 0.0, "public_val_bpb": 1.21587, "eval_seconds": 13.9, "eval_timeout": 1200, "eval_over_timeout": false}
{"timestamp": "2026-09-04T09:48:21+00:00", "label": "sol4-muonwarm200", "solution": "4", "description": "MUON_MOMENTUM_WARMUP_STEPS=200 (on top of Sol1-3)", "launch_command": "NEURON_LOGICAL_NC_CONFIG=1 torchrun --standalone --nproc_per_node=1 train.py --num-steps 800 --max-train-seconds 1050 --out-dir out/sol4-muonwarm200", "git_commit": "9a168b0", "git_dirty": true, "status": "keep", "wall_elapsed_seconds": 1042.9, "run_log": "research/run-logs/sol4-muonwarm200.log", "checkpoint_path": "out/sol4-muonwarm200/final.pt", "training_seconds": 1026.8, "budget_seconds": 1800, "target_steps": 800, "max_train_seconds": 1050, "over_budget": false, "total_seconds": 1026.9, "compiled": false, "nki_relu2": false, "num_steps": 800, "total_tokens_M": 52.4, "world_size": 1, "lnc": 1, "seq_len": 1024, "num_params_M": 59.6, "causality_passed": true, "causality_max_abs": 0.0, "public_val_bpb": 1.216712, "eval_seconds": 13.9, "eval_timeout": 1200, "eval_over_timeout": false}
{"timestamp": "2026-09-04T10:25:02+00:00", "label": "sol5-initscale068", "solution": "5", "description": "INIT_SCALE=0.68", "launch_command": "NEURON_LOGICAL_NC_CONFIG=1 torchrun --standalone --nproc_per_node=1 train.py --num-steps 800 --max-train-seconds 1050 --out-dir out/sol5-initscale068", "git_commit": "6feb2ac", "git_dirty": true, "status": "keep", "wall_elapsed_seconds": 1043.5, "run_log": "research/run-logs/sol5-initscale068.log", "checkpoint_path": "out/sol5-initscale068/final.pt", "training_seconds": 1027.4, "budget_seconds": 1800, "target_steps": 800, "max_train_seconds": 1050, "over_budget": false, "total_seconds": 1027.5, "compiled": false, "nki_relu2": false, "num_steps": 800, "total_tokens_M": 52.4, "world_size": 1, "lnc": 1, "seq_len": 1024, "num_params_M": 59.6, "causality_passed": true, "causality_max_abs": 0.0, "public_val_bpb": 1.21094, "eval_seconds": 13.9, "eval_timeout": 1200, "eval_over_timeout": false}
{"timestamp": "2026-09-04T10:06:58+00:00", "label": "sol5-initscale07", "solution": "5", "description": "INIT_SCALE=0.7 (on top of Sol1-3, Sol4 discarded)", "launch_command": "NEURON_LOGICAL_NC_CONFIG=1 torchrun --standalone --nproc_per_node=1 train.py --num-steps 800 --max-train-seconds 1050 --out-dir out/sol5-initscale07", "git_commit": "b6eb459", "git_dirty": true, "status": "keep", "wall_elapsed_seconds": 1042.0, "run_log": "research/run-logs/sol5-initscale07.log", "checkpoint_path": "out/sol5-initscale07/final.pt", "training_seconds": 1025.8, "budget_seconds": 1800, "target_steps": 800, "max_train_seconds": 1050, "over_budget": false, "total_seconds": 1025.9, "compiled": false, "nki_relu2": false, "num_steps": 800, "total_tokens_M": 52.4, "world_size": 1, "lnc": 1, "seq_len": 1024, "num_params_M": 59.6, "causality_passed": true, "causality_max_abs": 0.0, "public_val_bpb": 1.212319, "eval_seconds": 13.8, "eval_timeout": 1200, "eval_over_timeout": false}
{"timestamp": "2026-09-04T10:40:38+00:00", "label": "sol6-pack8", "solution": "6", "description": "PACK_FACTOR=8 (on top of Sol1-3,5), max-train-seconds recalibrated to match faster throughput", "launch_command": "NEURON_LOGICAL_NC_CONFIG=1 torchrun --standalone --nproc_per_node=1 train.py --num-steps 800 --max-train-seconds 715 --out-dir out/sol6-pack8", "git_commit": "e7202dd", "git_dirty": true, "status": "keep", "wall_elapsed_seconds": 686.8, "run_log": "research/run-logs/sol6-pack8.log", "checkpoint_path": "out/sol6-pack8/final.pt", "training_seconds": 670.5, "budget_seconds": 1800, "target_steps": 800, "max_train_seconds": 715, "over_budget": false, "total_seconds": 670.6, "compiled": false, "nki_relu2": false, "num_steps": 800, "total_tokens_M": 52.4, "world_size": 1, "lnc": 1, "seq_len": 1024, "num_params_M": 59.6, "causality_passed": true, "causality_max_abs": 0.0, "public_val_bpb": 1.18868, "eval_seconds": 13.9, "eval_timeout": 1200, "eval_over_timeout": false}
{"timestamp": "2026-09-04T10:27:02+00:00", "label": "sol6-pack8-smoke", "solution": "6", "description": "PACK_FACTOR=8 smoke test", "launch_command": "NEURON_LOGICAL_NC_CONFIG=1 torchrun --standalone --nproc_per_node=1 train.py --num-steps 15 --max-train-seconds 300 --out-dir out/sol6-pack8-smoke --eval-tokens 65536", "git_commit": "0076909", "git_dirty": true, "status": "keep", "wall_elapsed_seconds": 15.5, "run_log": "research/run-logs/sol6-pack8-smoke.log", "checkpoint_path": "out/sol6-pack8-smoke/final.pt", "training_seconds": 13.1, "budget_seconds": 1800, "target_steps": 15, "max_train_seconds": 300, "over_budget": false, "total_seconds": 13.2, "compiled": false, "nki_relu2": false, "num_steps": 15, "total_tokens_M": 1.0, "world_size": 1, "lnc": 1, "seq_len": 1024, "num_params_M": 59.6, "causality_passed": true, "causality_max_abs": 0.0, "public_val_bpb": 2.146375, "eval_seconds": 0.4, "eval_timeout": 1200, "eval_over_timeout": false}
{"timestamp": "2026-09-04T18:28:21+00:00", "label": "sol6b-pack16", "solution": "6", "description": "bin-size sweep: PACK_FACTOR=16 (on top of Sol1-7,9a,10)", "launch_command": "NEURON_LOGICAL_NC_CONFIG=1 torchrun --standalone --nproc_per_node=1 train.py --num-steps 800 --max-train-seconds 800 --out-dir out/sol6b-pack16", "git_commit": "9094c01", "git_dirty": true, "status": "keep", "wall_elapsed_seconds": 804.7, "run_log": "research/run-logs/sol6b-pack16.log", "checkpoint_path": "out/sol6b-pack16/final.pt", "training_seconds": 781.6, "budget_seconds": 1800, "target_steps": 800, "max_train_seconds": 800, "over_budget": false, "total_seconds": 801.9, "compiled": false, "nki_relu2": false, "num_steps": 800, "total_tokens_M": 52.4, "world_size": 1, "lnc": 1, "seq_len": 1024, "num_params_M": 85.9, "causality_passed": true, "causality_max_abs": 0.0, "public_val_bpb": 1.174631, "eval_seconds": 15.3, "eval_timeout": 1200, "eval_over_timeout": false}
{"timestamp": "2026-09-04T18:14:23+00:00", "label": "sol6b-pack16-smoke", "solution": "6", "description": "bin-size sweep: PACK_FACTOR=16 smoke test", "launch_command": "NEURON_LOGICAL_NC_CONFIG=1 torchrun --standalone --nproc_per_node=1 train.py --num-steps 15 --max-train-seconds 300 --out-dir out/sol6b-pack16-smoke --eval-tokens 65536", "git_commit": "eda9a16", "git_dirty": true, "status": "keep", "wall_elapsed_seconds": 18.1, "run_log": "research/run-logs/sol6b-pack16-smoke.log", "checkpoint_path": "out/sol6b-pack16-smoke/final.pt", "training_seconds": 9.4, "budget_seconds": 1800, "target_steps": 15, "max_train_seconds": 300, "over_budget": false, "total_seconds": 14.9, "compiled": false, "nki_relu2": false, "num_steps": 15, "total_tokens_M": 1.0, "world_size": 1, "lnc": 1, "seq_len": 1024, "num_params_M": 85.9, "causality_passed": true, "causality_max_abs": 0.0, "public_val_bpb": 2.158012, "eval_seconds": 0.5, "eval_timeout": 1200, "eval_over_timeout": false}
{"timestamp": "2026-09-04T18:44:15+00:00", "label": "sol6c-pack4", "solution": "6", "description": "bin-size sweep: PACK_FACTOR=4 (on top of Sol1-7,9a,10)", "launch_command": "NEURON_LOGICAL_NC_CONFIG=1 torchrun --standalone --nproc_per_node=1 train.py --num-steps 800 --max-train-seconds 830 --out-dir out/sol6c-pack4", "git_commit": "2c5d0e6", "git_dirty": true, "status": "keep", "wall_elapsed_seconds": 826.8, "run_log": "research/run-logs/sol6c-pack4.log", "checkpoint_path": "out/sol6c-pack4/final.pt", "training_seconds": 803.3, "budget_seconds": 1800, "target_steps": 800, "max_train_seconds": 830, "over_budget": false, "total_seconds": 823.6, "compiled": false, "nki_relu2": false, "num_steps": 800, "total_tokens_M": 52.4, "world_size": 1, "lnc": 1, "seq_len": 1024, "num_params_M": 85.9, "causality_passed": true, "causality_max_abs": 0.0, "public_val_bpb": 1.166012, "eval_seconds": 15.1, "eval_timeout": 1200, "eval_over_timeout": false}
{"timestamp": "2026-09-04T18:30:09+00:00", "label": "sol6c-pack4-smoke", "solution": "6", "description": "bin-size sweep: PACK_FACTOR=4 smoke test", "launch_command": "NEURON_LOGICAL_NC_CONFIG=1 torchrun --standalone --nproc_per_node=1 train.py --num-steps 15 --max-train-seconds 300 --out-dir out/sol6c-pack4-smoke --eval-tokens 65536", "git_commit": "dc8455d", "git_dirty": true, "status": "keep", "wall_elapsed_seconds": 18.7, "run_log": "research/run-logs/sol6c-pack4-smoke.log", "checkpoint_path": "out/sol6c-pack4-smoke/final.pt", "training_seconds": 9.9, "budget_seconds": 1800, "target_steps": 15, "max_train_seconds": 300, "over_budget": false, "total_seconds": 15.5, "compiled": false, "nki_relu2": false, "num_steps": 15, "total_tokens_M": 1.0, "world_size": 1, "lnc": 1, "seq_len": 1024, "num_params_M": 85.9, "causality_passed": true, "causality_max_abs": 0.0, "public_val_bpb": 2.144409, "eval_seconds": 0.5, "eval_timeout": 1200, "eval_over_timeout": false}
{"timestamp": "2026-09-04T19:00:40+00:00", "label": "sol6d-pack2", "solution": "6", "description": "bin-size sweep: PACK_FACTOR=2 (on top of Sol1-7,9a,10)", "launch_command": "NEURON_LOGICAL_NC_CONFIG=1 torchrun --standalone --nproc_per_node=1 train.py --num-steps 800 --max-train-seconds 900 --out-dir out/sol6d-pack2", "git_commit": "72a8062", "git_dirty": true, "status": "keep", "wall_elapsed_seconds": 884.8, "run_log": "research/run-logs/sol6d-pack2.log", "checkpoint_path": "out/sol6d-pack2/final.pt", "training_seconds": 861.2, "budget_seconds": 1800, "target_steps": 800, "max_train_seconds": 900, "over_budget": false, "total_seconds": 881.8, "compiled": false, "nki_relu2": false, "num_steps": 800, "total_tokens_M": 52.4, "world_size": 1, "lnc": 1, "seq_len": 1024, "num_params_M": 85.9, "causality_passed": true, "causality_max_abs": 0.0, "public_val_bpb": 1.165273, "eval_seconds": 15.1, "eval_timeout": 1200, "eval_over_timeout": false}
{"timestamp": "2026-09-04T18:45:37+00:00", "label": "sol6d-pack2-smoke", "solution": "6", "description": "bin-size sweep: PACK_FACTOR=2 smoke test", "launch_command": "NEURON_LOGICAL_NC_CONFIG=1 torchrun --standalone --nproc_per_node=1 train.py --num-steps 15 --max-train-seconds 300 --out-dir out/sol6d-pack2-smoke --eval-tokens 65536", "git_commit": "3549bc7", "git_dirty": true, "status": "keep", "wall_elapsed_seconds": 19.5, "run_log": "research/run-logs/sol6d-pack2-smoke.log", "checkpoint_path": "out/sol6d-pack2-smoke/final.pt", "training_seconds": 10.6, "budget_seconds": 1800, "target_steps": 15, "max_train_seconds": 300, "over_budget": false, "total_seconds": 16.6, "compiled": false, "nki_relu2": false, "num_steps": 15, "total_tokens_M": 1.0, "world_size": 1, "lnc": 1, "seq_len": 1024, "num_params_M": 85.9, "causality_passed": true, "causality_max_abs": 0.0, "public_val_bpb": 2.131734, "eval_seconds": 0.5, "eval_timeout": 1200, "eval_over_timeout": false}
{"timestamp": "2026-09-04T19:21:48+00:00", "label": "sol6e-pack1", "solution": "6", "description": "bin-size sweep: PACK_FACTOR=1 original (on top of Sol1-7,9a,10)", "launch_command": "NEURON_LOGICAL_NC_CONFIG=1 torchrun --standalone --nproc_per_node=1 train.py --num-steps 800 --max-train-seconds 1180 --out-dir out/sol6e-pack1", "git_commit": "5e283bd", "git_dirty": true, "status": "keep", "wall_elapsed_seconds": 1150.6, "run_log": "research/run-logs/sol6e-pack1.log", "checkpoint_path": "out/sol6e-pack1/final.pt", "training_seconds": 1125.3, "budget_seconds": 1800, "target_steps": 800, "max_train_seconds": 1180, "over_budget": false, "total_seconds": 1147.6, "compiled": false, "nki_relu2": false, "num_steps": 800, "total_tokens_M": 52.4, "world_size": 1, "lnc": 1, "seq_len": 1024, "num_params_M": 85.9, "causality_passed": true, "causality_max_abs": 0.0, "public_val_bpb": 1.205512, "eval_seconds": 15.1, "eval_timeout": 1200, "eval_over_timeout": false}
{"timestamp": "2026-09-04T19:02:18+00:00", "label": "sol6e-pack1-smoke", "solution": "6", "description": "bin-size sweep: PACK_FACTOR=1 (original) smoke test", "launch_command": "NEURON_LOGICAL_NC_CONFIG=1 torchrun --standalone --nproc_per_node=1 train.py --num-steps 15 --max-train-seconds 300 --out-dir out/sol6e-pack1-smoke --eval-tokens 65536", "git_commit": "fc6a790", "git_dirty": true, "status": "keep", "wall_elapsed_seconds": 24.6, "run_log": "research/run-logs/sol6e-pack1-smoke.log", "checkpoint_path": "out/sol6e-pack1-smoke/final.pt", "training_seconds": 13.9, "budget_seconds": 1800, "target_steps": 15, "max_train_seconds": 300, "over_budget": false, "total_seconds": 21.6, "compiled": false, "nki_relu2": false, "num_steps": 15, "total_tokens_M": 1.0, "world_size": 1, "lnc": 1, "seq_len": 1024, "num_params_M": 85.9, "causality_passed": true, "causality_max_abs": 0.0, "public_val_bpb": 2.129304, "eval_seconds": 0.5, "eval_timeout": 1200, "eval_over_timeout": false}
{"timestamp": "2026-09-04T10:44:13+00:00", "label": "sol7-ve-off-smoke", "solution": "7", "description": "USE_VE=False smoke test (no-op refactor check)", "launch_command": "NEURON_LOGICAL_NC_CONFIG=1 torchrun --standalone --nproc_per_node=1 train.py --num-steps 15 --max-train-seconds 300 --out-dir out/sol7-ve-off-smoke --eval-tokens 65536", "git_commit": "fc57454", "git_dirty": true, "status": "keep", "wall_elapsed_seconds": 15.5, "run_log": "research/run-logs/sol7-ve-off-smoke.log", "checkpoint_path": "out/sol7-ve-off-smoke/final.pt", "training_seconds": 13.1, "budget_seconds": 1800, "target_steps": 15, "max_train_seconds": 300, "over_budget": false, "total_seconds": 13.2, "compiled": false, "nki_relu2": false, "num_steps": 15, "total_tokens_M": 1.0, "world_size": 1, "lnc": 1, "seq_len": 1024, "num_params_M": 59.6, "causality_passed": true, "causality_max_abs": 0.0, "public_val_bpb": 2.146382, "eval_seconds": 0.4, "eval_timeout": 1200, "eval_over_timeout": false}
{"timestamp": "2026-09-04T10:57:12+00:00", "label": "sol7-ve-on", "solution": "7", "description": "USE_VE=True, alternating layers (on top of Sol1-6)", "launch_command": "NEURON_LOGICAL_NC_CONFIG=1 torchrun --standalone --nproc_per_node=1 train.py --num-steps 800 --max-train-seconds 750 --out-dir out/sol7-ve-on", "git_commit": "9803d8e", "git_dirty": true, "status": "keep", "wall_elapsed_seconds": 695.8, "run_log": "research/run-logs/sol7-ve-on.log", "checkpoint_path": "out/sol7-ve-on/final.pt", "training_seconds": 679.5, "budget_seconds": 1800, "target_steps": 800, "max_train_seconds": 750, "over_budget": false, "total_seconds": 679.6, "compiled": false, "nki_relu2": false, "num_steps": 800, "total_tokens_M": 52.4, "world_size": 1, "lnc": 1, "seq_len": 1024, "num_params_M": 85.9, "causality_passed": true, "causality_max_abs": 0.0, "public_val_bpb": 1.174188, "eval_seconds": 14.1, "eval_timeout": 1200, "eval_over_timeout": false}
