{"timestamp": "2026-09-15T05:03:00+00:00", "label": "st-depthlr-900s", "solution": "R1.2", "description": "plan 11.1 item 3a, per-depth Muon LR only: x1.15 at layer 0 ramping linearly to x0.85 at layer 5, as a per-parameter [K,1,1] operand inside the existing per-shape Muon groups (grouping, batched Newton-Schulz and compiled-graph count all unchanged). Non-block matrices (n-gram up-projections) stay at 1.0.", "launch_command": "NEURON_LOGICAL_NC_CONFIG=2 torchrun --standalone --nproc_per_node=4 train.py --num-steps 5000 --max-train-seconds 900 --out-dir out/st-depthlr-900s --eval-seq-len 1024 --muon-depth-lr-bottom 1.15 --muon-depth-lr-top 0.85", "git_commit": "496befd", "git_dirty": true, "status": "keep", "wall_elapsed_seconds": 973.7, "run_log": "research/run-logs/st-depthlr-900s.log", "checkpoint_path": "out/st-depthlr-900s/final.pt", "training_seconds": 884.4, "budget_seconds": 1800, "target_steps": 5000, "max_train_seconds": 900, "startup_allowance_est": 55.0, "charged_seconds_est": 885.4, "over_budget": false, "total_seconds": 957.0, "compiled": true, "nki_relu2": false, "ngram_ve": "True tables=4 rows=1048576 dim=128 index_gather=True trigram=True opt=rmsprop flat_lr=True bf16=True", "out_bigram": "False bf16=True gate_bias=-2.0 lr=0.0", "oneliners": "relu2_tau=0.0 mlp_sandwich=False head_gate=False hg_norm=True hg_ch=32 hg_mul=2.0 hg_bias=0.0 out_pool=False pool_layers=3 qk_shift=True qk_beta=0.0 qk_freeze=True x0_gate=False block_nudge=False nudge_site=qk qkv_norm_cse=False parallel_block=False par_coalesce=none epoch_shuffle=False epoch_shuffle_seed=1234", "engram": "False site=-1 orders=2,3 heads=1 tables=0 mult=32 mem_dim=128 e_dim=0 key_dim=0 conv_k=4 share=False bf16=True", "batch_ramp": "False grad_accum=(2, 4, 8) bounds=(0.35, 0.75) lr_exp=0.5 ref_grad_accum=4 last_grad_accum=4", "weight_ema": "False decays=(0.995,) start_frac=0.75 seeded=False updates=0", "sched_tricks": "demon_b1=False demon_final=0.55 demon_ref=0.8 demon_start=-1.0 muon_b2=0.9 muon_b2_final=0.0 depth_lr=1.15->0.85 depth_mom=0.0->0.0 depth_mom_ref=0.95", "num_steps": 1054, "total_tokens_M": 138.1, "world_size": 4, "lnc": 2, "seq_len": 2048, "num_params_M": 592.9, "causality_passed": true, "causality_max_abs": 0.0, "public_val_bpb": 1.053433, "eval_seconds": 10.1, "eval_timeout": 1200, "eval_over_timeout": false, "eval_alt_seq_len": 1024, "public_val_bpb_alt": 1.06871, "eval_alt_seconds": 17.9}
{"timestamp": "2026-09-17T16:25:35+00:00", "label": "sub1-bf16-lr065-full", "solution": "sub1", "description": "bf16 O1 LRx0.65 stronger cut seed 42 [trn22] CC=--optlevel=1 --auto-cast matmult --auto-cast-type bf16", "launch_command": "NEURON_LOGICAL_NC_CONFIG=2 torchrun --standalone --nproc_per_node=4 train.py --num-steps 1000000 --max-train-seconds 1800 --out-dir out/sub1-bf16-lr065-full --matrix-lr 0.013 --scalar-lr 0.13 --seed 42", "git_commit": "dab464a", "git_dirty": true, "status": "keep", "wall_elapsed_seconds": 2295.6, "run_log": "research/run-logs/sub1-bf16-lr065-full.log", "checkpoint_path": "out/sub1-bf16-lr065-full/final.pt", "training_seconds": 1784.7, "budget_seconds": 1800, "target_steps": 1000000, "max_train_seconds": 1800, "startup_allowance_est": 451.5, "charged_seconds_est": 1785.7, "over_budget": false, "total_seconds": 2269.6, "compiled": true, "nki_relu2": false, "ngram_ve": "True tables=4 rows=1048576 dim=128 index_gather=True trigram=True opt=rmsprop flat_lr=True bf16=True", "out_bigram": "False bf16=True gate_bias=-2.0 lr=0.0", "oneliners": "relu2_tau=0.0 mlp_sandwich=False head_gate=False hg_norm=True hg_ch=32 hg_mul=2.0 hg_bias=0.0 out_pool=False pool_layers=3 qk_shift=True qk_beta=0.0 qk_freeze=True x0_gate=False block_nudge=False nudge_site=qk qkv_norm_cse=False parallel_block=False par_coalesce=none epoch_shuffle=False epoch_shuffle_seed=1234", "engram": "False site=-1 orders=2,3 heads=1 tables=0 mult=32 mem_dim=128 e_dim=0 key_dim=0 conv_k=4 share=False bf16=True", "batch_ramp": "False grad_accum=(2, 4, 8) bounds=(0.35, 0.75) lr_exp=0.5 ref_grad_accum=4 last_grad_accum=4", "weight_ema": "False decays=(0.995,) start_frac=0.75 seeded=False updates=0", "sched_tricks": "demon_b1=False demon_final=0.55 demon_ref=0.8 demon_start=-1.0 muon_b2=0.9 muon_b2_final=0.0 depth_lr=1.0->1.0 depth_mom=0.0->0.0 depth_mom_ref=0.95", "num_steps": 2688, "total_tokens_M": 352.3, "world_size": 4, "lnc": 2, "seq_len": 2048, "num_params_M": 592.9, "causality_passed": true, "causality_max_abs": 0.0, "public_val_bpb": 1.017985, "eval_seconds": 33.3, "eval_timeout": 1200, "eval_over_timeout": false}
{"timestamp": "2026-09-17T16:15:54+00:00", "label": "sub1-bf16-lr077-full", "solution": "sub1", "description": "bf16 O1 LRx0.77 update-integral match seed 42 [trn21] CC=--optlevel=1 --auto-cast matmult --auto-cast-type bf16", "launch_command": "NEURON_LOGICAL_NC_CONFIG=2 torchrun --standalone --nproc_per_node=4 train.py --num-steps 1000000 --max-train-seconds 1800 --out-dir out/sub1-bf16-lr077-full --matrix-lr 0.0155 --scalar-lr 0.155 --seed 42", "git_commit": "496befd", "git_dirty": true, "status": "keep", "wall_elapsed_seconds": 1864.1, "run_log": "research/run-logs/sub1-bf16-lr077-full.log", "checkpoint_path": "out/sub1-bf16-lr077-full/final.pt", "training_seconds": 1784.4, "budget_seconds": 1800, "target_steps": 1000000, "max_train_seconds": 1800, "startup_allowance_est": 64.6, "charged_seconds_est": 1785.4, "over_budget": false, "total_seconds": 1837.4, "compiled": true, "nki_relu2": false, "ngram_ve": "True tables=4 rows=1048576 dim=128 index_gather=True trigram=True opt=rmsprop flat_lr=True bf16=True", "out_bigram": "False bf16=True gate_bias=-2.0 lr=0.0", "oneliners": "relu2_tau=0.0 mlp_sandwich=False head_gate=False hg_norm=True hg_ch=32 hg_mul=2.0 hg_bias=0.0 out_pool=False pool_layers=3 qk_shift=True qk_beta=0.0 qk_freeze=True x0_gate=False block_nudge=False nudge_site=qk qkv_norm_cse=False parallel_block=False par_coalesce=none epoch_shuffle=False epoch_shuffle_seed=1234", "engram": "False site=-1 orders=2,3 heads=1 tables=0 mult=32 mem_dim=128 e_dim=0 key_dim=0 conv_k=4 share=False bf16=True", "batch_ramp": "False grad_accum=(2, 4, 8) bounds=(0.35, 0.75) lr_exp=0.5 ref_grad_accum=4 last_grad_accum=4", "weight_ema": "False decays=(0.995,) start_frac=0.75 seeded=False updates=0", "sched_tricks": "demon_b1=False demon_final=0.55 demon_ref=0.8 demon_start=-1.0 muon_b2=0.9 muon_b2_final=0.0 depth_lr=1.0->1.0 depth_mom=0.0->0.0 depth_mom_ref=0.95", "num_steps": 2700, "total_tokens_M": 353.9, "world_size": 4, "lnc": 2, "seq_len": 2048, "num_params_M": 592.9, "causality_passed": true, "causality_max_abs": 0.0, "public_val_bpb": 1.015923, "eval_seconds": 9.1, "eval_timeout": 1200, "eval_over_timeout": false}
{"timestamp": "2026-09-18T02:00:01+00:00", "label": "sub1-p1-nkiattn-off-smoke", "solution": "sub1", "description": "eager control NEW FILE flag OFF (presence test + loss baseline) [trn22] CC=(in-code default optlevel=1)", "launch_command": "NEURON_LOGICAL_NC_CONFIG=2 torchrun --standalone --nproc_per_node=4 train.py --num-steps 300 --max-train-seconds 3600 --out-dir out/sub1-p1-nkiattn-off-smoke --eval-seq-len 1024 --compile-muon --qk-shift --qk-shift-beta 0.0 --qk-shift-freeze --ngram-ve-layers 1,-1 --ngram-ve-table-mult 128 --seed 42", "git_commit": "dab464a", "git_dirty": true, "status": "keep", "wall_elapsed_seconds": 702.0, "run_log": "research/run-logs/sub1-p1-nkiattn-off-smoke.log", "checkpoint_path": "out/sub1-p1-nkiattn-off-smoke/final.pt", "training_seconds": 252.9, "budget_seconds": 1800, "target_steps": 300, "max_train_seconds": 3600, "startup_allowance_est": 415.1, "charged_seconds_est": 253.9, "over_budget": false, "total_seconds": 676.1, "compiled": true, "nki_relu2": false, "ngram_ve": "True tables=4 rows=1048576 dim=128 index_gather=True trigram=True opt=rmsprop flat_lr=True bf16=True", "out_bigram": "False bf16=True gate_bias=-2.0 lr=0.0", "oneliners": "relu2_tau=0.0 mlp_sandwich=False head_gate=False hg_norm=True hg_ch=32 hg_mul=2.0 hg_bias=0.0 out_pool=False pool_layers=3 qk_shift=True qk_beta=0.0 qk_freeze=True x0_gate=False block_nudge=False nudge_site=qk qkv_norm_cse=False parallel_block=False par_coalesce=none epoch_shuffle=False epoch_shuffle_seed=1234", "engram": "False site=-1 orders=2,3 heads=1 tables=0 mult=32 mem_dim=128 e_dim=0 key_dim=0 conv_k=4 share=False bf16=True", "batch_ramp": "False grad_accum=(2, 4, 8) bounds=(0.35, 0.75) lr_exp=0.5 ref_grad_accum=4 last_grad_accum=4", "weight_ema": "False decays=(0.995,) start_frac=0.75 seeded=False updates=0", "sched_tricks": "demon_b1=False demon_final=0.55 demon_ref=0.8 demon_start=-1.0 muon_b2=0.9 muon_b2_final=0.0 depth_lr=1.0->1.0 depth_mom=0.0->0.0 depth_mom_ref=0.95", "num_steps": 300, "total_tokens_M": 39.3, "world_size": 4, "lnc": 2, "seq_len": 2048, "num_params_M": 592.9, "causality_passed": true, "causality_max_abs": 0.0, "public_val_bpb": 1.223783, "eval_seconds": 10.0, "eval_timeout": 1200, "eval_over_timeout": false, "eval_alt_seq_len": 1024, "public_val_bpb_alt": 1.239689, "eval_alt_seconds": 17.7}
{"timestamp": "2026-09-18T02:28:47+00:00", "label": "sub1-p1-nkiattn-smoke", "solution": "sub1", "description": "P1 NKI attn smoke take4 (dynamo-disabled wrapper) seed 42 [trn22] CC=(in-code default optlevel=1)", "launch_command": "NEURON_LOGICAL_NC_CONFIG=2 torchrun --standalone --nproc_per_node=4 train.py --num-steps 300 --max-train-seconds 3600 --out-dir out/sub1-p1-nkiattn-smoke --eval-seq-len 1024 --compile-muon --qk-shift --qk-shift-beta 0.0 --qk-shift-freeze --ngram-ve-layers 1,-1 --ngram-ve-table-mult 128 --seed 42 --nki-attn", "git_commit": "dab464a", "git_dirty": true, "status": "keep", "wall_elapsed_seconds": 749.2, "run_log": "research/run-logs/sub1-p1-nkiattn-smoke.log", "checkpoint_path": "out/sub1-p1-nkiattn-smoke/final.pt", "training_seconds": 477.4, "budget_seconds": 1800, "target_steps": 300, "max_train_seconds": 3600, "startup_allowance_est": 212.5, "charged_seconds_est": 487.4, "over_budget": false, "total_seconds": 723.5, "compiled": true, "nki_relu2": false, "ngram_ve": "True tables=4 rows=1048576 dim=128 index_gather=True trigram=True opt=rmsprop flat_lr=True bf16=True", "out_bigram": "False bf16=True gate_bias=-2.0 lr=0.0", "oneliners": "relu2_tau=0.0 mlp_sandwich=False head_gate=False hg_norm=True hg_ch=32 hg_mul=2.0 hg_bias=0.0 out_pool=False pool_layers=3 qk_shift=True qk_beta=0.0 qk_freeze=True x0_gate=False block_nudge=False nudge_site=qk qkv_norm_cse=False parallel_block=False par_coalesce=none epoch_shuffle=False epoch_shuffle_seed=1234", "engram": "False site=-1 orders=2,3 heads=1 tables=0 mult=32 mem_dim=128 e_dim=0 key_dim=0 conv_k=4 share=False bf16=True", "batch_ramp": "False grad_accum=(2, 4, 8) bounds=(0.35, 0.75) lr_exp=0.5 ref_grad_accum=4 last_grad_accum=4", "weight_ema": "False decays=(0.995,) start_frac=0.75 seeded=False updates=0", "sched_tricks": "demon_b1=False demon_final=0.55 demon_ref=0.8 demon_start=-1.0 muon_b2=0.9 muon_b2_final=0.0 depth_lr=1.0->1.0 depth_mom=0.0->0.0 depth_mom_ref=0.95", "num_steps": 300, "total_tokens_M": 39.3, "world_size": 4, "lnc": 2, "seq_len": 2048, "num_params_M": 592.9, "causality_passed": false, "causality_max_abs": 1.726686, "public_val_bpb": 0.001543, "eval_seconds": 13.9, "eval_timeout": 1200, "eval_over_timeout": false, "eval_alt_seq_len": 1024, "public_val_bpb_alt": 0.003078, "eval_alt_seconds": 25.8}
{"timestamp": "2026-09-18T02:57:28+00:00", "label": "sub1-p1-nkiattn-smoke2", "solution": "sub1", "description": "P1 NKI attn smoke take5 (causal-mask fix) seed 42 [trn22] CC=(in-code default optlevel=1)", "launch_command": "NEURON_LOGICAL_NC_CONFIG=2 torchrun --standalone --nproc_per_node=4 train.py --num-steps 300 --max-train-seconds 3600 --out-dir out/sub1-p1-nkiattn-smoke2 --eval-seq-len 1024 --compile-muon --qk-shift --qk-shift-beta 0.0 --qk-shift-freeze --ngram-ve-layers 1,-1 --ngram-ve-table-mult 128 --seed 42 --nki-attn", "git_commit": "dab464a", "git_dirty": true, "status": "keep", "wall_elapsed_seconds": 616.9, "run_log": "research/run-logs/sub1-p1-nkiattn-smoke2.log", "checkpoint_path": "out/sub1-p1-nkiattn-smoke2/final.pt", "training_seconds": 477.3, "budget_seconds": 1800, "target_steps": 300, "max_train_seconds": 3600, "startup_allowance_est": 97.2, "charged_seconds_est": 478.4, "over_budget": false, "total_seconds": 591.7, "compiled": true, "nki_relu2": false, "ngram_ve": "True tables=4 rows=1048576 dim=128 index_gather=True trigram=True opt=rmsprop flat_lr=True bf16=True", "out_bigram": "False bf16=True gate_bias=-2.0 lr=0.0", "oneliners": "relu2_tau=0.0 mlp_sandwich=False head_gate=False hg_norm=True hg_ch=32 hg_mul=2.0 hg_bias=0.0 out_pool=False pool_layers=3 qk_shift=True qk_beta=0.0 qk_freeze=True x0_gate=False block_nudge=False nudge_site=qk qkv_norm_cse=False parallel_block=False par_coalesce=none epoch_shuffle=False epoch_shuffle_seed=1234", "engram": "False site=-1 orders=2,3 heads=1 tables=0 mult=32 mem_dim=128 e_dim=0 key_dim=0 conv_k=4 share=False bf16=True", "batch_ramp": "False grad_accum=(2, 4, 8) bounds=(0.35, 0.75) lr_exp=0.5 ref_grad_accum=4 last_grad_accum=4", "weight_ema": "False decays=(0.995,) start_frac=0.75 seeded=False updates=0", "sched_tricks": "demon_b1=False demon_final=0.55 demon_ref=0.8 demon_start=-1.0 muon_b2=0.9 muon_b2_final=0.0 depth_lr=1.0->1.0 depth_mom=0.0->0.0 depth_mom_ref=0.95", "num_steps": 300, "total_tokens_M": 39.3, "world_size": 4, "lnc": 2, "seq_len": 2048, "num_params_M": 592.9, "causality_passed": true, "causality_max_abs": 2.8e-05, "public_val_bpb": 1.222236, "eval_seconds": 13.8, "eval_timeout": 1200, "eval_over_timeout": false, "eval_alt_seq_len": 1024, "public_val_bpb_alt": 1.23794, "eval_alt_seconds": 21.1}
{"timestamp": "2026-09-16T14:44:15+00:00", "label": "sub1-p2a-mqa1-full", "solution": "sub1", "description": "gqa n_kv_heads=1 MQA full 1800s, paired vs t17-l1-m128 seed42", "launch_command": "NEURON_LOGICAL_NC_CONFIG=2 torchrun --standalone --nproc_per_node=4 train.py --num-steps 1000000 --max-train-seconds 1800 --out-dir out/sub1-p2a-mqa1-full --n-kv-heads 1 --seed 42", "git_commit": "dab464a", "git_dirty": true, "status": "keep", "wall_elapsed_seconds": 1867.0, "run_log": "research/run-logs/sub1-p2a-mqa1-full.log", "checkpoint_path": "out/sub1-p2a-mqa1-full/final.pt", "training_seconds": 1784.7, "budget_seconds": 1800, "target_steps": 1000000, "max_train_seconds": 1800, "startup_allowance_est": 65.8, "charged_seconds_est": 1785.7, "over_budget": false, "total_seconds": 1840.8, "compiled": true, "nki_relu2": false, "ngram_ve": "True tables=4 rows=1048576 dim=128 index_gather=True trigram=True opt=rmsprop flat_lr=True bf16=True", "out_bigram": "False bf16=True gate_bias=-2.0 lr=0.0", "oneliners": "relu2_tau=0.0 mlp_sandwich=False head_gate=False hg_norm=True hg_ch=32 hg_mul=2.0 hg_bias=0.0 out_pool=False pool_layers=3 qk_shift=True qk_beta=0.0 qk_freeze=True x0_gate=False block_nudge=False nudge_site=qk qkv_norm_cse=False parallel_block=False par_coalesce=none epoch_shuffle=False epoch_shuffle_seed=1234", "engram": "False site=-1 orders=2,3 heads=1 tables=0 mult=32 mem_dim=128 e_dim=0 key_dim=0 conv_k=4 share=False bf16=True", "batch_ramp": "False grad_accum=(2, 4, 8) bounds=(0.35, 0.75) lr_exp=0.5 ref_grad_accum=4 last_grad_accum=4", "weight_ema": "False decays=(0.995,) start_frac=0.75 seeded=False updates=0", "sched_tricks": "demon_b1=False demon_final=0.55 demon_ref=0.8 demon_start=-1.0 muon_b2=0.9 muon_b2_final=0.0 depth_lr=1.0->1.0 depth_mom=0.0->0.0 depth_mom_ref=0.95", "num_steps": 2114, "total_tokens_M": 277.1, "world_size": 4, "lnc": 2, "seq_len": 2048, "num_params_M": 589.0, "causality_passed": true, "causality_max_abs": 0.0, "public_val_bpb": 1.018895, "eval_seconds": 10.2, "eval_timeout": 1200, "eval_over_timeout": false}
{"timestamp": "2026-09-16T14:08:56+00:00", "label": "sub1-p2a-mqa1-smoke", "solution": "sub1", "description": "gqa n_kv_heads=1 MQA smoke 300 steps", "launch_command": "NEURON_LOGICAL_NC_CONFIG=2 torchrun --standalone --nproc_per_node=4 train.py --num-steps 300 --max-train-seconds 3600 --out-dir out/sub1-p2a-mqa1-smoke --n-kv-heads 1", "git_commit": "dab464a", "git_dirty": true, "status": "keep", "wall_elapsed_seconds": 673.5, "run_log": "research/run-logs/sub1-p2a-mqa1-smoke.log", "checkpoint_path": "out/sub1-p2a-mqa1-smoke/final.pt", "training_seconds": 249.5, "budget_seconds": 1800, "target_steps": 300, "max_train_seconds": 3600, "startup_allowance_est": 405.1, "charged_seconds_est": 250.5, "over_budget": false, "total_seconds": 648.8, "compiled": true, "nki_relu2": false, "ngram_ve": "True tables=4 rows=1048576 dim=128 index_gather=True trigram=True opt=rmsprop flat_lr=True bf16=True", "out_bigram": "False bf16=True gate_bias=-2.0 lr=0.0", "oneliners": "relu2_tau=0.0 mlp_sandwich=False head_gate=False hg_norm=True hg_ch=32 hg_mul=2.0 hg_bias=0.0 out_pool=False pool_layers=3 qk_shift=True qk_beta=0.0 qk_freeze=True x0_gate=False block_nudge=False nudge_site=qk qkv_norm_cse=False parallel_block=False par_coalesce=none epoch_shuffle=False epoch_shuffle_seed=1234", "engram": "False site=-1 orders=2,3 heads=1 tables=0 mult=32 mem_dim=128 e_dim=0 key_dim=0 conv_k=4 share=False bf16=True", "batch_ramp": "False grad_accum=(2, 4, 8) bounds=(0.35, 0.75) lr_exp=0.5 ref_grad_accum=4 last_grad_accum=4", "weight_ema": "False decays=(0.995,) start_frac=0.75 seeded=False updates=0", "sched_tricks": "demon_b1=False demon_final=0.55 demon_ref=0.8 demon_start=-1.0 muon_b2=0.9 muon_b2_final=0.0 depth_lr=1.0->1.0 depth_mom=0.0->0.0 depth_mom_ref=0.95", "num_steps": 300, "total_tokens_M": 39.3, "world_size": 4, "lnc": 2, "seq_len": 2048, "num_params_M": 589.0, "causality_passed": true, "causality_max_abs": 0.0, "public_val_bpb": 1.234037, "eval_seconds": 10.3, "eval_timeout": 1200, "eval_over_timeout": false}
{"timestamp": "2026-09-17T07:26:47+00:00", "label": "sub1-p2b-autocast-all256-smoke", "solution": "sub1", "description": "fp8 auto-cast ALL mode dynamic-256 300 steps, mode discriminator", "launch_command": "NEURON_LOGICAL_NC_CONFIG=2 torchrun --standalone --nproc_per_node=4 train.py --num-steps 300 --max-train-seconds 3600 --out-dir out/sub1-p2b-autocast-all256-smoke --loss-scale 256 --loss-scale-dynamic --seed 42", "git_commit": "dab464a", "git_dirty": true, "status": "crash", "wall_elapsed_seconds": 410.1, "run_log": "research/run-logs/sub1-p2b-autocast-all256-smoke.log"}
{"timestamp": "2026-09-17T08:00:01+00:00", "label": "sub1-p2b-autocast-bf16-full", "solution": "sub1", "description": "FULL 1800s bf16 auto-cast matmult, record config, seed 42", "launch_command": "NEURON_LOGICAL_NC_CONFIG=2 torchrun --standalone --nproc_per_node=4 train.py --num-steps 1000000 --max-train-seconds 1800 --out-dir out/sub1-p2b-autocast-bf16-full --seed 42", "git_commit": "496befd", "git_dirty": true, "status": "keep", "wall_elapsed_seconds": 2624.6, "run_log": "research/run-logs/sub1-p2b-autocast-bf16-full.log", "checkpoint_path": "out/sub1-p2b-autocast-bf16-full/final.pt", "training_seconds": 1784.9, "budget_seconds": 1800, "target_steps": 1000000, "max_train_seconds": 1800, "startup_allowance_est": 779.3, "charged_seconds_est": 1785.9, "over_budget": false, "total_seconds": 2604.6, "compiled": true, "nki_relu2": false, "ngram_ve": "True tables=4 rows=1048576 dim=128 index_gather=True trigram=True opt=rmsprop flat_lr=True bf16=True", "out_bigram": "False bf16=True gate_bias=-2.0 lr=0.0", "oneliners": "relu2_tau=0.0 mlp_sandwich=False head_gate=False hg_norm=True hg_ch=32 hg_mul=2.0 hg_bias=0.0 out_pool=False pool_layers=3 qk_shift=True qk_beta=0.0 qk_freeze=True x0_gate=False block_nudge=False nudge_site=qk qkv_norm_cse=False parallel_block=False par_coalesce=none epoch_shuffle=False epoch_shuffle_seed=1234", "engram": "False site=-1 orders=2,3 heads=1 tables=0 mult=32 mem_dim=128 e_dim=0 key_dim=0 conv_k=4 share=False bf16=True", "batch_ramp": "False grad_accum=(2, 4, 8) bounds=(0.35, 0.75) lr_exp=0.5 ref_grad_accum=4 last_grad_accum=4", "weight_ema": "False decays=(0.995,) start_frac=0.75 seeded=False updates=0", "sched_tricks": "demon_b1=False demon_final=0.55 demon_ref=0.8 demon_start=-1.0 muon_b2=0.9 muon_b2_final=0.0 depth_lr=1.0->1.0 depth_mom=0.0->0.0 depth_mom_ref=0.95", "num_steps": 1449, "total_tokens_M": 189.9, "world_size": 4, "lnc": 2, "seq_len": 2048, "num_params_M": 592.9, "causality_passed": true, "causality_max_abs": 0.0, "public_val_bpb": 1.0302, "eval_seconds": 32.9, "eval_timeout": 1200, "eval_over_timeout": false}
