{"timestamp": "2026-09-15T10:57:22+00:00", "label": "ngmbeta2-arm-095-900s", "solution": "T3.1", "description": "--ngram-ve-beta2 0.95 (mirrors EMBED_ADAMW_BETA2's winning value; pure hyperparameter change, no new tensors, no throughput effect expected)", "launch_command": "NEURON_LOGICAL_NC_CONFIG=2 torchrun --standalone --nproc_per_node=4 train.py --num-steps 5000 --max-train-seconds 900 --out-dir out/ngmbeta2-arm-095-900s --eval-seq-len 1024 --ngram-ve-beta2 0.95", "git_commit": "496befd", "git_dirty": true, "status": "keep", "wall_elapsed_seconds": 979.1, "run_log": "research/run-logs/ngmbeta2-arm-095-900s.log", "checkpoint_path": "out/ngmbeta2-arm-095-900s/final.pt", "training_seconds": 884.5, "budget_seconds": 1800, "target_steps": 5000, "max_train_seconds": 900, "startup_allowance_est": 61.8, "charged_seconds_est": 885.5, "over_budget": false, "total_seconds": 955.3, "compiled": true, "nki_relu2": false, "ngram_ve": "True tables=4 rows=1048576 dim=128 index_gather=True trigram=True opt=rmsprop flat_lr=True bf16=True", "out_bigram": "False bf16=True gate_bias=-2.0 lr=0.0", "oneliners": "relu2_tau=0.0 mlp_sandwich=False head_gate=False hg_norm=True hg_ch=32 hg_mul=2.0 hg_bias=0.0 out_pool=False pool_layers=3 qk_shift=True qk_beta=0.0 qk_freeze=True x0_gate=False block_nudge=False nudge_site=qk qkv_norm_cse=False parallel_block=False par_coalesce=none epoch_shuffle=False epoch_shuffle_seed=1234", "engram": "False site=-1 orders=2,3 heads=1 tables=0 mult=32 mem_dim=128 e_dim=0 key_dim=0 conv_k=4 share=False bf16=True", "batch_ramp": "False grad_accum=(2, 4, 8) bounds=(0.35, 0.75) lr_exp=0.5 ref_grad_accum=4 last_grad_accum=4", "weight_ema": "False decays=(0.995,) start_frac=0.75 seeded=False updates=0", "sched_tricks": "demon_b1=False demon_final=0.55 demon_ref=0.8 demon_start=-1.0 muon_b2=0.9 muon_b2_final=0.0 depth_lr=1.0->1.0 depth_mom=0.0->0.0 depth_mom_ref=0.95", "num_steps": 1062, "total_tokens_M": 139.2, "world_size": 4, "lnc": 2, "seq_len": 2048, "num_params_M": 592.9, "causality_passed": true, "causality_max_abs": 0.0, "public_val_bpb": 1.053878, "eval_seconds": 9.8, "eval_timeout": 1200, "eval_over_timeout": false, "eval_alt_seq_len": 1024, "public_val_bpb_alt": 1.069204, "eval_alt_seconds": 17.2}
{"timestamp": "2026-09-15T12:03:28+00:00", "label": "ngmbeta2-arm-095-900s-r2", "solution": "T3.1", "description": "--ngram-ve-beta2 0.95, same-day repeat of the first-pass arm that measured +0.00169 bpb worse than control", "launch_command": "NEURON_LOGICAL_NC_CONFIG=2 torchrun --standalone --nproc_per_node=4 train.py --num-steps 5000 --max-train-seconds 900 --out-dir out/ngmbeta2-arm-095-900s-r2 --eval-seq-len 1024 --ngram-ve-beta2 0.95", "git_commit": "496befd", "git_dirty": true, "status": "keep", "wall_elapsed_seconds": 979.4, "run_log": "research/run-logs/ngmbeta2-arm-095-900s-r2.log", "checkpoint_path": "out/ngmbeta2-arm-095-900s-r2/final.pt", "training_seconds": 884.2, "budget_seconds": 1800, "target_steps": 5000, "max_train_seconds": 900, "startup_allowance_est": 62.3, "charged_seconds_est": 885.2, "over_budget": false, "total_seconds": 954.7, "compiled": true, "nki_relu2": false, "ngram_ve": "True tables=4 rows=1048576 dim=128 index_gather=True trigram=True opt=rmsprop flat_lr=True bf16=True", "out_bigram": "False bf16=True gate_bias=-2.0 lr=0.0", "oneliners": "relu2_tau=0.0 mlp_sandwich=False head_gate=False hg_norm=True hg_ch=32 hg_mul=2.0 hg_bias=0.0 out_pool=False pool_layers=3 qk_shift=True qk_beta=0.0 qk_freeze=True x0_gate=False block_nudge=False nudge_site=qk qkv_norm_cse=False parallel_block=False par_coalesce=none epoch_shuffle=False epoch_shuffle_seed=1234", "engram": "False site=-1 orders=2,3 heads=1 tables=0 mult=32 mem_dim=128 e_dim=0 key_dim=0 conv_k=4 share=False bf16=True", "batch_ramp": "False grad_accum=(2, 4, 8) bounds=(0.35, 0.75) lr_exp=0.5 ref_grad_accum=4 last_grad_accum=4", "weight_ema": "False decays=(0.995,) start_frac=0.75 seeded=False updates=0", "sched_tricks": "demon_b1=False demon_final=0.55 demon_ref=0.8 demon_start=-1.0 muon_b2=0.9 muon_b2_final=0.0 depth_lr=1.0->1.0 depth_mom=0.0->0.0 depth_mom_ref=0.95", "num_steps": 1063, "total_tokens_M": 139.3, "world_size": 4, "lnc": 2, "seq_len": 2048, "num_params_M": 592.9, "causality_passed": true, "causality_max_abs": 0.0, "public_val_bpb": 1.054497, "eval_seconds": 9.8, "eval_timeout": 1200, "eval_over_timeout": false, "eval_alt_seq_len": 1024, "public_val_bpb_alt": 1.069868, "eval_alt_seconds": 17.2}
{"timestamp": "2026-09-15T11:13:43+00:00", "label": "ngmbeta2-arm-099-900s", "solution": "T3.1", "description": "--ngram-ve-beta2 0.99 (midpoint between 0.95 and the locked 0.999; pure hyperparameter change, no new tensors, no throughput effect expected)", "launch_command": "NEURON_LOGICAL_NC_CONFIG=2 torchrun --standalone --nproc_per_node=4 train.py --num-steps 5000 --max-train-seconds 900 --out-dir out/ngmbeta2-arm-099-900s --eval-seq-len 1024 --ngram-ve-beta2 0.99", "git_commit": "496befd", "git_dirty": true, "status": "keep", "wall_elapsed_seconds": 981.3, "run_log": "research/run-logs/ngmbeta2-arm-099-900s.log", "checkpoint_path": "out/ngmbeta2-arm-099-900s/final.pt", "training_seconds": 885.0, "budget_seconds": 1800, "target_steps": 5000, "max_train_seconds": 900, "startup_allowance_est": 63.5, "charged_seconds_est": 886.0, "over_budget": false, "total_seconds": 955.4, "compiled": true, "nki_relu2": false, "ngram_ve": "True tables=4 rows=1048576 dim=128 index_gather=True trigram=True opt=rmsprop flat_lr=True bf16=True", "out_bigram": "False bf16=True gate_bias=-2.0 lr=0.0", "oneliners": "relu2_tau=0.0 mlp_sandwich=False head_gate=False hg_norm=True hg_ch=32 hg_mul=2.0 hg_bias=0.0 out_pool=False pool_layers=3 qk_shift=True qk_beta=0.0 qk_freeze=True x0_gate=False block_nudge=False nudge_site=qk qkv_norm_cse=False parallel_block=False par_coalesce=none epoch_shuffle=False epoch_shuffle_seed=1234", "engram": "False site=-1 orders=2,3 heads=1 tables=0 mult=32 mem_dim=128 e_dim=0 key_dim=0 conv_k=4 share=False bf16=True", "batch_ramp": "False grad_accum=(2, 4, 8) bounds=(0.35, 0.75) lr_exp=0.5 ref_grad_accum=4 last_grad_accum=4", "weight_ema": "False decays=(0.995,) start_frac=0.75 seeded=False updates=0", "sched_tricks": "demon_b1=False demon_final=0.55 demon_ref=0.8 demon_start=-1.0 muon_b2=0.9 muon_b2_final=0.0 depth_lr=1.0->1.0 depth_mom=0.0->0.0 depth_mom_ref=0.95", "num_steps": 1064, "total_tokens_M": 139.5, "world_size": 4, "lnc": 2, "seq_len": 2048, "num_params_M": 592.9, "causality_passed": true, "causality_max_abs": 0.0, "public_val_bpb": 1.052365, "eval_seconds": 9.7, "eval_timeout": 1200, "eval_over_timeout": false, "eval_alt_seq_len": 1024, "public_val_bpb_alt": 1.067687, "eval_alt_seconds": 17.2}
{"timestamp": "2026-09-15T10:41:02+00:00", "label": "ngmbeta2-ctrl-900s-r1", "solution": "T3.1", "description": "fresh same-commit 900s control for the --ngram-ve-beta2 isolation A/B, flag at locked default (beta2=0.999, layers 1,-1, mult 128)", "launch_command": "NEURON_LOGICAL_NC_CONFIG=2 torchrun --standalone --nproc_per_node=4 train.py --num-steps 5000 --max-train-seconds 900 --out-dir out/ngmbeta2-ctrl-900s-r1 --eval-seq-len 1024", "git_commit": "496befd", "git_dirty": true, "status": "keep", "wall_elapsed_seconds": 973.4, "run_log": "research/run-logs/ngmbeta2-ctrl-900s-r1.log", "checkpoint_path": "out/ngmbeta2-ctrl-900s-r1/final.pt", "training_seconds": 884.2, "budget_seconds": 1800, "target_steps": 5000, "max_train_seconds": 900, "startup_allowance_est": 56.0, "charged_seconds_est": 885.2, "over_budget": false, "total_seconds": 955.0, "compiled": true, "nki_relu2": false, "ngram_ve": "True tables=4 rows=1048576 dim=128 index_gather=True trigram=True opt=rmsprop flat_lr=True bf16=True", "out_bigram": "False bf16=True gate_bias=-2.0 lr=0.0", "oneliners": "relu2_tau=0.0 mlp_sandwich=False head_gate=False hg_norm=True hg_ch=32 hg_mul=2.0 hg_bias=0.0 out_pool=False pool_layers=3 qk_shift=True qk_beta=0.0 qk_freeze=True x0_gate=False block_nudge=False nudge_site=qk qkv_norm_cse=False parallel_block=False par_coalesce=none epoch_shuffle=False epoch_shuffle_seed=1234", "engram": "False site=-1 orders=2,3 heads=1 tables=0 mult=32 mem_dim=128 e_dim=0 key_dim=0 conv_k=4 share=False bf16=True", "batch_ramp": "False grad_accum=(2, 4, 8) bounds=(0.35, 0.75) lr_exp=0.5 ref_grad_accum=4 last_grad_accum=4", "weight_ema": "False decays=(0.995,) start_frac=0.75 seeded=False updates=0", "sched_tricks": "demon_b1=False demon_final=0.55 demon_ref=0.8 demon_start=-1.0 muon_b2=0.9 muon_b2_final=0.0 depth_lr=1.0->1.0 depth_mom=0.0->0.0 depth_mom_ref=0.95", "num_steps": 1063, "total_tokens_M": 139.3, "world_size": 4, "lnc": 2, "seq_len": 2048, "num_params_M": 592.9, "causality_passed": true, "causality_max_abs": 0.0, "public_val_bpb": 1.052188, "eval_seconds": 9.8, "eval_timeout": 1200, "eval_over_timeout": false, "eval_alt_seq_len": 1024, "public_val_bpb_alt": 1.067441, "eval_alt_seconds": 17.3}
{"timestamp": "2026-09-15T11:29:56+00:00", "label": "ngmbeta2-ctrl-900s-r2", "solution": "T3.1", "description": "closing same-commit 900s control: measures this block's own drift/noise band", "launch_command": "NEURON_LOGICAL_NC_CONFIG=2 torchrun --standalone --nproc_per_node=4 train.py --num-steps 5000 --max-train-seconds 900 --out-dir out/ngmbeta2-ctrl-900s-r2 --eval-seq-len 1024", "git_commit": "496befd", "git_dirty": true, "status": "keep", "wall_elapsed_seconds": 972.8, "run_log": "research/run-logs/ngmbeta2-ctrl-900s-r2.log", "checkpoint_path": "out/ngmbeta2-ctrl-900s-r2/final.pt", "training_seconds": 884.6, "budget_seconds": 1800, "target_steps": 5000, "max_train_seconds": 900, "startup_allowance_est": 55.2, "charged_seconds_est": 885.6, "over_budget": false, "total_seconds": 955.3, "compiled": true, "nki_relu2": false, "ngram_ve": "True tables=4 rows=1048576 dim=128 index_gather=True trigram=True opt=rmsprop flat_lr=True bf16=True", "out_bigram": "False bf16=True gate_bias=-2.0 lr=0.0", "oneliners": "relu2_tau=0.0 mlp_sandwich=False head_gate=False hg_norm=True hg_ch=32 hg_mul=2.0 hg_bias=0.0 out_pool=False pool_layers=3 qk_shift=True qk_beta=0.0 qk_freeze=True x0_gate=False block_nudge=False nudge_site=qk qkv_norm_cse=False parallel_block=False par_coalesce=none epoch_shuffle=False epoch_shuffle_seed=1234", "engram": "False site=-1 orders=2,3 heads=1 tables=0 mult=32 mem_dim=128 e_dim=0 key_dim=0 conv_k=4 share=False bf16=True", "batch_ramp": "False grad_accum=(2, 4, 8) bounds=(0.35, 0.75) lr_exp=0.5 ref_grad_accum=4 last_grad_accum=4", "weight_ema": "False decays=(0.995,) start_frac=0.75 seeded=False updates=0", "sched_tricks": "demon_b1=False demon_final=0.55 demon_ref=0.8 demon_start=-1.0 muon_b2=0.9 muon_b2_final=0.0 depth_lr=1.0->1.0 depth_mom=0.0->0.0 depth_mom_ref=0.95", "num_steps": 1063, "total_tokens_M": 139.3, "world_size": 4, "lnc": 2, "seq_len": 2048, "num_params_M": 592.9, "causality_passed": true, "causality_max_abs": 0.0, "public_val_bpb": 1.052331, "eval_seconds": 9.8, "eval_timeout": 1200, "eval_over_timeout": false, "eval_alt_seq_len": 1024, "public_val_bpb_alt": 1.067621, "eval_alt_seconds": 17.1}
{"timestamp": "2026-09-15T11:47:09+00:00", "label": "ngmbeta2-ctrl-900s-r3", "solution": "T3.1", "description": "fresh same-commit 900s control, same-day repeat pair for the --ngram-ve-beta2 0.95 result", "launch_command": "NEURON_LOGICAL_NC_CONFIG=2 torchrun --standalone --nproc_per_node=4 train.py --num-steps 5000 --max-train-seconds 900 --out-dir out/ngmbeta2-ctrl-900s-r3 --eval-seq-len 1024", "git_commit": "496befd", "git_dirty": true, "status": "keep", "wall_elapsed_seconds": 981.1, "run_log": "research/run-logs/ngmbeta2-ctrl-900s-r3.log", "checkpoint_path": "out/ngmbeta2-ctrl-900s-r3/final.pt", "training_seconds": 884.2, "budget_seconds": 1800, "target_steps": 5000, "max_train_seconds": 900, "startup_allowance_est": 63.7, "charged_seconds_est": 885.2, "over_budget": false, "total_seconds": 954.8, "compiled": true, "nki_relu2": false, "ngram_ve": "True tables=4 rows=1048576 dim=128 index_gather=True trigram=True opt=rmsprop flat_lr=True bf16=True", "out_bigram": "False bf16=True gate_bias=-2.0 lr=0.0", "oneliners": "relu2_tau=0.0 mlp_sandwich=False head_gate=False hg_norm=True hg_ch=32 hg_mul=2.0 hg_bias=0.0 out_pool=False pool_layers=3 qk_shift=True qk_beta=0.0 qk_freeze=True x0_gate=False block_nudge=False nudge_site=qk qkv_norm_cse=False parallel_block=False par_coalesce=none epoch_shuffle=False epoch_shuffle_seed=1234", "engram": "False site=-1 orders=2,3 heads=1 tables=0 mult=32 mem_dim=128 e_dim=0 key_dim=0 conv_k=4 share=False bf16=True", "batch_ramp": "False grad_accum=(2, 4, 8) bounds=(0.35, 0.75) lr_exp=0.5 ref_grad_accum=4 last_grad_accum=4", "weight_ema": "False decays=(0.995,) start_frac=0.75 seeded=False updates=0", "sched_tricks": "demon_b1=False demon_final=0.55 demon_ref=0.8 demon_start=-1.0 muon_b2=0.9 muon_b2_final=0.0 depth_lr=1.0->1.0 depth_mom=0.0->0.0 depth_mom_ref=0.95", "num_steps": 1062, "total_tokens_M": 139.2, "world_size": 4, "lnc": 2, "seq_len": 2048, "num_params_M": 592.9, "causality_passed": true, "causality_max_abs": 0.0, "public_val_bpb": 1.052088, "eval_seconds": 9.9, "eval_timeout": 1200, "eval_over_timeout": false, "eval_alt_seq_len": 1024, "public_val_bpb_alt": 1.067336, "eval_alt_seconds": 17.3}
{"timestamp": "2026-09-15T11:22:15+00:00", "label": "ngmlr-arm-015-900s", "solution": "T3.1", "description": "--ngram-ve-lr 0.15 (half the locked implicit 0.30; pure hyperparameter change, no new tensors, no throughput effect expected)", "launch_command": "NEURON_LOGICAL_NC_CONFIG=2 torchrun --standalone --nproc_per_node=4 train.py --num-steps 5000 --max-train-seconds 900 --out-dir out/ngmlr-arm-015-900s --eval-seq-len 1024 --ngram-ve-lr 0.15", "git_commit": "95038a2", "git_dirty": true, "status": "keep", "wall_elapsed_seconds": 973.0, "run_log": "research/run-logs/ngmlr-arm-015-900s.log", "checkpoint_path": "out/ngmlr-arm-015-900s/final.pt", "training_seconds": 884.3, "budget_seconds": 1800, "target_steps": 5000, "max_train_seconds": 900, "startup_allowance_est": 54.9, "charged_seconds_est": 885.3, "over_budget": false, "total_seconds": 956.5, "compiled": true, "nki_relu2": false, "ngram_ve": "True tables=4 rows=1048576 dim=128 index_gather=True trigram=True opt=rmsprop flat_lr=True bf16=True", "out_bigram": "False bf16=True gate_bias=-2.0 lr=0.0", "oneliners": "relu2_tau=0.0 mlp_sandwich=False head_gate=False hg_norm=True hg_ch=32 hg_mul=2.0 hg_bias=0.0 out_pool=False pool_layers=3 qk_shift=True qk_beta=0.0 qk_freeze=True x0_gate=False block_nudge=False nudge_site=qk qkv_norm_cse=False parallel_block=False par_coalesce=none epoch_shuffle=False epoch_shuffle_seed=1234", "engram": "False site=-1 orders=2,3 heads=1 tables=0 mult=32 mem_dim=128 e_dim=0 key_dim=0 conv_k=4 share=False bf16=True", "batch_ramp": "False grad_accum=(2, 4, 8) bounds=(0.35, 0.75) lr_exp=0.5 ref_grad_accum=4 last_grad_accum=4", "weight_ema": "False decays=(0.995,) start_frac=0.75 seeded=False updates=0", "sched_tricks": "demon_b1=False demon_final=0.55 demon_ref=0.8 demon_start=-1.0 muon_b2=0.9 muon_b2_final=0.0 depth_lr=1.0->1.0 depth_mom=0.0->0.0 depth_mom_ref=0.95", "num_steps": 1055, "total_tokens_M": 138.3, "world_size": 4, "lnc": 2, "seq_len": 2048, "num_params_M": 592.9, "causality_passed": true, "causality_max_abs": 0.0, "public_val_bpb": 1.052302, "eval_seconds": 9.9, "eval_timeout": 1200, "eval_over_timeout": false, "eval_alt_seq_len": 1024, "public_val_bpb_alt": 1.067673, "eval_alt_seconds": 17.7}
{"timestamp": "2026-09-15T11:38:35+00:00", "label": "ngmlr-arm-060-900s", "solution": "T3.1", "description": "--ngram-ve-lr 0.60 (double the locked implicit 0.30; pure hyperparameter change, no new tensors, no throughput effect expected)", "launch_command": "NEURON_LOGICAL_NC_CONFIG=2 torchrun --standalone --nproc_per_node=4 train.py --num-steps 5000 --max-train-seconds 900 --out-dir out/ngmlr-arm-060-900s --eval-seq-len 1024 --ngram-ve-lr 0.60", "git_commit": "95038a2", "git_dirty": true, "status": "keep", "wall_elapsed_seconds": 980.4, "run_log": "research/run-logs/ngmlr-arm-060-900s.log", "checkpoint_path": "out/ngmlr-arm-060-900s/final.pt", "training_seconds": 884.6, "budget_seconds": 1800, "target_steps": 5000, "max_train_seconds": 900, "startup_allowance_est": 62.1, "charged_seconds_est": 885.6, "over_budget": false, "total_seconds": 956.4, "compiled": true, "nki_relu2": false, "ngram_ve": "True tables=4 rows=1048576 dim=128 index_gather=True trigram=True opt=rmsprop flat_lr=True bf16=True", "out_bigram": "False bf16=True gate_bias=-2.0 lr=0.0", "oneliners": "relu2_tau=0.0 mlp_sandwich=False head_gate=False hg_norm=True hg_ch=32 hg_mul=2.0 hg_bias=0.0 out_pool=False pool_layers=3 qk_shift=True qk_beta=0.0 qk_freeze=True x0_gate=False block_nudge=False nudge_site=qk qkv_norm_cse=False parallel_block=False par_coalesce=none epoch_shuffle=False epoch_shuffle_seed=1234", "engram": "False site=-1 orders=2,3 heads=1 tables=0 mult=32 mem_dim=128 e_dim=0 key_dim=0 conv_k=4 share=False bf16=True", "batch_ramp": "False grad_accum=(2, 4, 8) bounds=(0.35, 0.75) lr_exp=0.5 ref_grad_accum=4 last_grad_accum=4", "weight_ema": "False decays=(0.995,) start_frac=0.75 seeded=False updates=0", "sched_tricks": "demon_b1=False demon_final=0.55 demon_ref=0.8 demon_start=-1.0 muon_b2=0.9 muon_b2_final=0.0 depth_lr=1.0->1.0 depth_mom=0.0->0.0 depth_mom_ref=0.95", "num_steps": 1056, "total_tokens_M": 138.4, "world_size": 4, "lnc": 2, "seq_len": 2048, "num_params_M": 592.9, "causality_passed": true, "causality_max_abs": 0.0, "public_val_bpb": 1.053012, "eval_seconds": 9.9, "eval_timeout": 1200, "eval_over_timeout": false, "eval_alt_seq_len": 1024, "public_val_bpb_alt": 1.068339, "eval_alt_seconds": 17.7}
{"timestamp": "2026-09-15T11:06:02+00:00", "label": "ngmlr-ctrl-900s-r1", "solution": "T3.1", "description": "fresh same-commit 900s control for the --ngram-ve-lr isolation A/B, flag at locked default (lr sentinel 0.0 -> EMBEDDING_LR=0.30, layers 1,-1, mult 128, beta2 0.999)", "launch_command": "NEURON_LOGICAL_NC_CONFIG=2 torchrun --standalone --nproc_per_node=4 train.py --num-steps 5000 --max-train-seconds 900 --out-dir out/ngmlr-ctrl-900s-r1 --eval-seq-len 1024", "git_commit": "95038a2", "git_dirty": true, "status": "keep", "wall_elapsed_seconds": 982.9, "run_log": "research/run-logs/ngmlr-ctrl-900s-r1.log", "checkpoint_path": "out/ngmlr-ctrl-900s-r1/final.pt", "training_seconds": 884.5, "budget_seconds": 1800, "target_steps": 5000, "max_train_seconds": 900, "startup_allowance_est": 64.6, "charged_seconds_est": 885.5, "over_budget": false, "total_seconds": 956.5, "compiled": true, "nki_relu2": false, "ngram_ve": "True tables=4 rows=1048576 dim=128 index_gather=True trigram=True opt=rmsprop flat_lr=True bf16=True", "out_bigram": "False bf16=True gate_bias=-2.0 lr=0.0", "oneliners": "relu2_tau=0.0 mlp_sandwich=False head_gate=False hg_norm=True hg_ch=32 hg_mul=2.0 hg_bias=0.0 out_pool=False pool_layers=3 qk_shift=True qk_beta=0.0 qk_freeze=True x0_gate=False block_nudge=False nudge_site=qk qkv_norm_cse=False parallel_block=False par_coalesce=none epoch_shuffle=False epoch_shuffle_seed=1234", "engram": "False site=-1 orders=2,3 heads=1 tables=0 mult=32 mem_dim=128 e_dim=0 key_dim=0 conv_k=4 share=False bf16=True", "batch_ramp": "False grad_accum=(2, 4, 8) bounds=(0.35, 0.75) lr_exp=0.5 ref_grad_accum=4 last_grad_accum=4", "weight_ema": "False decays=(0.995,) start_frac=0.75 seeded=False updates=0", "sched_tricks": "demon_b1=False demon_final=0.55 demon_ref=0.8 demon_start=-1.0 muon_b2=0.9 muon_b2_final=0.0 depth_lr=1.0->1.0 depth_mom=0.0->0.0 depth_mom_ref=0.95", "num_steps": 1056, "total_tokens_M": 138.4, "world_size": 4, "lnc": 2, "seq_len": 2048, "num_params_M": 592.9, "causality_passed": true, "causality_max_abs": 0.0, "public_val_bpb": 1.052631, "eval_seconds": 10.0, "eval_timeout": 1200, "eval_over_timeout": false, "eval_alt_seq_len": 1024, "public_val_bpb_alt": 1.067923, "eval_alt_seconds": 17.7}
