{"timestamp": "2026-09-11T14:35:42+00:00", "label": "t07-seq2048-alt1024-900s", "solution": "T0.7", "description": "control (SEQ_LEN=2048) + second in-process eval at 1024 -> paired bpb@1024", "launch_command": "NEURON_LOGICAL_NC_CONFIG=2 torchrun --standalone --nproc_per_node=4 train.py --num-steps 5000 --max-train-seconds 900 --out-dir out/t07-seq2048-alt1024-900s --eval-seq-len 1024", "git_commit": "8973cff", "git_dirty": false, "status": "keep", "wall_elapsed_seconds": 975.1, "run_log": "research/run-logs/t07-seq2048-alt1024-900s.log", "checkpoint_path": "out/t07-seq2048-alt1024-900s/final.pt", "training_seconds": 894.8, "budget_seconds": 1800, "target_steps": 5000, "max_train_seconds": 900, "startup_allowance_est": 53.8, "charged_seconds_est": 895.0, "over_budget": false, "total_seconds": 951.4, "compiled": true, "nki_relu2": false, "num_steps": 1094, "total_tokens_M": 143.4, "world_size": 4, "lnc": 2, "seq_len": 2048, "num_params_M": 55.7, "causality_passed": true, "causality_max_abs": 0.0, "public_val_bpb": 1.081201, "eval_seconds": 7.8, "eval_timeout": 1200, "eval_over_timeout": false, "eval_alt_seq_len": 1024, "public_val_bpb_alt": 1.097033, "eval_alt_seconds": 13.8}
{"timestamp": "2026-09-09T19:04:10+00:00", "label": "t14-adam-every2-900s", "solution": "T1.4", "description": "AdamW groups update every 2nd step (grads accumulate, all_reduce deferred); Muon every step", "launch_command": "NEURON_LOGICAL_NC_CONFIG=2 torchrun --standalone --nproc_per_node=4 train.py --num-steps 5000 --max-train-seconds 900 --out-dir out/t14-adam-every2-900s --adam-every-n 2", "git_commit": "fdc64f0", "git_dirty": true, "status": "keep", "wall_elapsed_seconds": 962.1, "run_log": "research/run-logs/t14-adam-every2-900s.log", "checkpoint_path": "out/t14-adam-every2-900s/final.pt", "training_seconds": 894.9, "budget_seconds": 1800, "target_steps": 5000, "max_train_seconds": 900, "startup_allowance_est": 54.8, "charged_seconds_est": 895.1, "over_budget": false, "total_seconds": 937.4, "compiled": true, "nki_relu2": false, "num_steps": 1110, "total_tokens_M": 145.5, "world_size": 4, "lnc": 2, "seq_len": 2048, "num_params_M": 55.7, "causality_passed": true, "causality_max_abs": 0.0, "public_val_bpb": 1.083173, "eval_seconds": 7.5, "eval_timeout": 1200, "eval_over_timeout": false}
{"timestamp": "2026-09-10T03:03:05+00:00", "label": "t14-adam-every2-lrcomp-900s", "solution": "T1.4", "description": "--adam-every-n 2 with --adam-every-n-lr-comp (AdamW lr x2 to compensate the half-as-far effect)", "launch_command": "NEURON_LOGICAL_NC_CONFIG=2 torchrun --standalone --nproc_per_node=4 train.py --num-steps 5000 --max-train-seconds 900 --out-dir out/t14-adam-every2-lrcomp-900s --adam-every-n 2 --adam-every-n-lr-comp", "git_commit": "fdc64f0", "git_dirty": true, "status": "keep", "wall_elapsed_seconds": 966.1, "run_log": "research/run-logs/t14-adam-every2-lrcomp-900s.log", "checkpoint_path": "out/t14-adam-every2-lrcomp-900s/final.pt", "training_seconds": 894.6, "budget_seconds": 1800, "target_steps": 5000, "max_train_seconds": 900, "startup_allowance_est": 59.2, "charged_seconds_est": 894.8, "over_budget": false, "total_seconds": 937.6, "compiled": true, "nki_relu2": false, "num_steps": 1105, "total_tokens_M": 144.8, "world_size": 4, "lnc": 2, "seq_len": 2048, "num_params_M": 55.7, "causality_passed": true, "causality_max_abs": 0.0, "public_val_bpb": 1.110379, "eval_seconds": 7.6, "eval_timeout": 1200, "eval_over_timeout": false}
{"timestamp": "2026-09-09T16:42:10+00:00", "label": "t15-packfactor4-900s", "solution": "T1.5", "description": "PACK_FACTOR=4 (grad_accum 4) re-test under current code; historical 776 steps was at commit 9dc9873", "launch_command": "NEURON_LOGICAL_NC_CONFIG=2 torchrun --standalone --nproc_per_node=4 train.py --num-steps 5000 --max-train-seconds 900 --out-dir out/t15-packfactor4-900s --pack-factor 4", "git_commit": "fdc64f0", "git_dirty": true, "status": "keep", "wall_elapsed_seconds": 1026.3, "run_log": "research/run-logs/t15-packfactor4-900s.log", "checkpoint_path": "out/t15-packfactor4-900s/final.pt", "training_seconds": 894.6, "budget_seconds": 1800, "target_steps": 5000, "max_train_seconds": 900, "startup_allowance_est": 119.4, "charged_seconds_est": 894.8, "over_budget": false, "total_seconds": 998.6, "compiled": true, "nki_relu2": false, "num_steps": 1077, "total_tokens_M": 141.2, "world_size": 4, "lnc": 2, "seq_len": 2048, "num_params_M": 55.7, "causality_passed": true, "causality_max_abs": 0.0, "public_val_bpb": 1.08361, "eval_seconds": 7.5, "eval_timeout": 1200, "eval_over_timeout": false}
{"timestamp": "2026-09-09T16:59:57+00:00", "label": "t15-packfactor4-900s-v2", "solution": "T1.5", "description": "PACK_FACTOR=4 paired repeat (delta was -0.001697, inside the needs-a-repeat band)", "launch_command": "NEURON_LOGICAL_NC_CONFIG=2 torchrun --standalone --nproc_per_node=4 train.py --num-steps 5000 --max-train-seconds 900 --out-dir out/t15-packfactor4-900s-v2 --pack-factor 4", "git_commit": "fdc64f0", "git_dirty": true, "status": "keep", "wall_elapsed_seconds": 960.7, "run_log": "research/run-logs/t15-packfactor4-900s-v2.log", "checkpoint_path": "out/t15-packfactor4-900s-v2/final.pt", "training_seconds": 894.6, "budget_seconds": 1800, "target_steps": 5000, "max_train_seconds": 900, "startup_allowance_est": 54.1, "charged_seconds_est": 894.8, "over_budget": false, "total_seconds": 936.5, "compiled": true, "nki_relu2": false, "num_steps": 1080, "total_tokens_M": 141.6, "world_size": 4, "lnc": 2, "seq_len": 2048, "num_params_M": 55.7, "causality_passed": true, "causality_max_abs": 0.0, "public_val_bpb": 1.083759, "eval_seconds": 7.5, "eval_timeout": 1200, "eval_over_timeout": false}
{"timestamp": "2026-09-14T08:28:17+00:00", "label": "t17-ctrl-2150", "solution": "T1.7", "description": "T1.7 compiled Muon step + frozen qk-shift, budget shortened to land at ~2150 steps (step-matched control)", "launch_command": "NEURON_LOGICAL_NC_CONFIG=2 torchrun --standalone --nproc_per_node=4 train.py --num-steps 5000 --max-train-seconds 1589 --out-dir out/t17-ctrl-2150 --eval-seq-len 1024 --compile-muon --qk-shift --qk-shift-beta 0.0 --qk-shift-freeze", "git_commit": "496befd", "git_dirty": true, "status": "keep", "wall_elapsed_seconds": 1677.0, "run_log": "research/run-logs/t17-ctrl-2150.log", "checkpoint_path": "out/t17-ctrl-2150/final.pt", "training_seconds": 1583.6, "budget_seconds": 1800, "target_steps": 5000, "max_train_seconds": 1589, "startup_allowance_est": 63.1, "charged_seconds_est": 1584.0, "over_budget": false, "total_seconds": 1651.8, "compiled": true, "nki_relu2": false, "ngram_ve": "True tables=2 rows=524288 dim=128 index_gather=True trigram=True opt=rmsprop flat_lr=True bf16=True", "out_bigram": "False bf16=True gate_bias=-2.0 lr=0.0", "oneliners": "relu2_tau=0.0 mlp_sandwich=False head_gate=False hg_norm=True hg_ch=32 hg_mul=2.0 hg_bias=0.0 out_pool=False pool_layers=3 qk_shift=True qk_beta=0.0 qk_freeze=True x0_gate=False block_nudge=False nudge_site=qk qkv_norm_cse=False parallel_block=False par_coalesce=none epoch_shuffle=False epoch_shuffle_seed=1234", "engram": "False site=-1 orders=2,3 heads=1 tables=0 mult=32 mem_dim=128 e_dim=0 key_dim=0 conv_k=4 share=False bf16=True", "batch_ramp": "False grad_accum=(2, 4, 8) bounds=(0.35, 0.75) lr_exp=0.5 ref_grad_accum=4 last_grad_accum=4", "weight_ema": "False decays=(0.995,) start_frac=0.75 seeded=False updates=0", "num_steps": 2141, "total_tokens_M": 280.6, "world_size": 4, "lnc": 2, "seq_len": 2048, "num_params_M": 190.1, "causality_passed": true, "causality_max_abs": 0.0, "public_val_bpb": 1.019126, "eval_seconds": 9.1, "eval_timeout": 1200, "eval_over_timeout": false, "eval_alt_seq_len": 1024, "public_val_bpb_alt": 1.033758, "eval_alt_seconds": 15.7}
{"timestamp": "2026-09-14T09:58:17+00:00", "label": "t17-dim256-2150", "solution": "T1.7", "description": "T1.7 + frozen qk-shift budget spent on n-gram VE dim 256 only, 324.5M params, ~2150 steps", "launch_command": "NEURON_LOGICAL_NC_CONFIG=2 torchrun --standalone --nproc_per_node=4 train.py --num-steps 5000 --max-train-seconds 1650 --out-dir out/t17-dim256-2150 --eval-seq-len 1024 --compile-muon --qk-shift --qk-shift-beta 0.0 --qk-shift-freeze --ngram-ve-dim 256", "git_commit": "496befd", "git_dirty": true, "status": "keep", "wall_elapsed_seconds": 1738.2, "run_log": "research/run-logs/t17-dim256-2150.log", "checkpoint_path": "out/t17-dim256-2150/final.pt", "training_seconds": 1644.9, "budget_seconds": 1800, "target_steps": 5000, "max_train_seconds": 1650, "startup_allowance_est": 62.2, "charged_seconds_est": 1645.5, "over_budget": false, "total_seconds": 1712.6, "compiled": true, "nki_relu2": false, "ngram_ve": "True tables=2 rows=524288 dim=256 index_gather=True trigram=True opt=rmsprop flat_lr=True bf16=True", "out_bigram": "False bf16=True gate_bias=-2.0 lr=0.0", "oneliners": "relu2_tau=0.0 mlp_sandwich=False head_gate=False hg_norm=True hg_ch=32 hg_mul=2.0 hg_bias=0.0 out_pool=False pool_layers=3 qk_shift=True qk_beta=0.0 qk_freeze=True x0_gate=False block_nudge=False nudge_site=qk qkv_norm_cse=False parallel_block=False par_coalesce=none epoch_shuffle=False epoch_shuffle_seed=1234", "engram": "False site=-1 orders=2,3 heads=1 tables=0 mult=32 mem_dim=128 e_dim=0 key_dim=0 conv_k=4 share=False bf16=True", "batch_ramp": "False grad_accum=(2, 4, 8) bounds=(0.35, 0.75) lr_exp=0.5 ref_grad_accum=4 last_grad_accum=4", "weight_ema": "False decays=(0.995,) start_frac=0.75 seeded=False updates=0", "num_steps": 2152, "total_tokens_M": 282.1, "world_size": 4, "lnc": 2, "seq_len": 2048, "num_params_M": 324.5, "causality_passed": true, "causality_max_abs": 0.0, "public_val_bpb": 1.016105, "eval_seconds": 9.2, "eval_timeout": 1200, "eval_over_timeout": false, "eval_alt_seq_len": 1024, "public_val_bpb_alt": 1.030827, "eval_alt_seconds": 15.9}
{"timestamp": "2026-09-14T08:59:40+00:00", "label": "t17-dim256-m128-2150", "solution": "T1.7", "description": "T1.7 + frozen qk-shift budget spent entirely on n-gram VE WIDTH: dim 256 x mult 128, 592.9M params, ~2150 steps", "launch_command": "NEURON_LOGICAL_NC_CONFIG=2 torchrun --standalone --nproc_per_node=4 train.py --num-steps 5000 --max-train-seconds 1795 --out-dir out/t17-dim256-m128-2150 --eval-seq-len 1024 --compile-muon --qk-shift --qk-shift-beta 0.0 --qk-shift-freeze --ngram-ve-dim 256 --ngram-ve-table-mult 128", "git_commit": "496befd", "git_dirty": true, "status": "keep", "wall_elapsed_seconds": 1882.9, "run_log": "research/run-logs/t17-dim256-m128-2150.log", "checkpoint_path": "out/t17-dim256-m128-2150/final.pt", "training_seconds": 1789.5, "budget_seconds": 1800, "target_steps": 5000, "max_train_seconds": 1795, "startup_allowance_est": 61.7, "charged_seconds_est": 1790.5, "over_budget": false, "total_seconds": 1858.2, "compiled": true, "nki_relu2": false, "ngram_ve": "True tables=2 rows=1048576 dim=256 index_gather=True trigram=True opt=rmsprop flat_lr=True bf16=True", "out_bigram": "False bf16=True gate_bias=-2.0 lr=0.0", "oneliners": "relu2_tau=0.0 mlp_sandwich=False head_gate=False hg_norm=True hg_ch=32 hg_mul=2.0 hg_bias=0.0 out_pool=False pool_layers=3 qk_shift=True qk_beta=0.0 qk_freeze=True x0_gate=False block_nudge=False nudge_site=qk qkv_norm_cse=False parallel_block=False par_coalesce=none epoch_shuffle=False epoch_shuffle_seed=1234", "engram": "False site=-1 orders=2,3 heads=1 tables=0 mult=32 mem_dim=128 e_dim=0 key_dim=0 conv_k=4 share=False bf16=True", "batch_ramp": "False grad_accum=(2, 4, 8) bounds=(0.35, 0.75) lr_exp=0.5 ref_grad_accum=4 last_grad_accum=4", "weight_ema": "False decays=(0.995,) start_frac=0.75 seeded=False updates=0", "num_steps": 2155, "total_tokens_M": 282.5, "world_size": 4, "lnc": 2, "seq_len": 2048, "num_params_M": 592.9, "causality_passed": true, "causality_max_abs": 0.0, "public_val_bpb": 1.013656, "eval_seconds": 9.2, "eval_timeout": 1200, "eval_over_timeout": false, "eval_alt_seq_len": 1024, "public_val_bpb_alt": 1.028309, "eval_alt_seconds": 16.0}
{"timestamp": "2026-09-14T09:29:19+00:00", "label": "t17-l1-2150", "solution": "T1.7", "description": "T1.7 + frozen qk-shift budget spent on re-enabling n-gram VE on layer 1 (NGRAM_VE_LAYERS=1,-1), 324.5M params, ~2150 steps", "launch_command": "NEURON_LOGICAL_NC_CONFIG=2 torchrun --standalone --nproc_per_node=4 train.py --num-steps 5000 --max-train-seconds 1687 --out-dir out/t17-l1-2150 --eval-seq-len 1024 --compile-muon --qk-shift --qk-shift-beta 0.0 --qk-shift-freeze --ngram-ve-layers 1,-1", "git_commit": "496befd", "git_dirty": true, "status": "keep", "wall_elapsed_seconds": 1779.2, "run_log": "research/run-logs/t17-l1-2150.log", "checkpoint_path": "out/t17-l1-2150/final.pt", "training_seconds": 1681.5, "budget_seconds": 1800, "target_steps": 5000, "max_train_seconds": 1687, "startup_allowance_est": 63.3, "charged_seconds_est": 1682.2, "over_budget": false, "total_seconds": 1753.2, "compiled": true, "nki_relu2": false, "ngram_ve": "True tables=4 rows=524288 dim=128 index_gather=True trigram=True opt=rmsprop flat_lr=True bf16=True", "out_bigram": "False bf16=True gate_bias=-2.0 lr=0.0", "oneliners": "relu2_tau=0.0 mlp_sandwich=False head_gate=False hg_norm=True hg_ch=32 hg_mul=2.0 hg_bias=0.0 out_pool=False pool_layers=3 qk_shift=True qk_beta=0.0 qk_freeze=True x0_gate=False block_nudge=False nudge_site=qk qkv_norm_cse=False parallel_block=False par_coalesce=none epoch_shuffle=False epoch_shuffle_seed=1234", "engram": "False site=-1 orders=2,3 heads=1 tables=0 mult=32 mem_dim=128 e_dim=0 key_dim=0 conv_k=4 share=False bf16=True", "batch_ramp": "False grad_accum=(2, 4, 8) bounds=(0.35, 0.75) lr_exp=0.5 ref_grad_accum=4 last_grad_accum=4", "weight_ema": "False decays=(0.995,) start_frac=0.75 seeded=False updates=0", "num_steps": 2139, "total_tokens_M": 280.4, "world_size": 4, "lnc": 2, "seq_len": 2048, "num_params_M": 324.5, "causality_passed": true, "causality_max_abs": 0.0, "public_val_bpb": 1.007376, "eval_seconds": 10.1, "eval_timeout": 1200, "eval_over_timeout": false, "eval_alt_seq_len": 1024, "public_val_bpb_alt": 1.022212, "eval_alt_seconds": 18.0}
{"timestamp": "2026-09-14T11:25:28+00:00", "label": "t17-l1-2185", "solution": "T1.7", "description": "n-gram VE on layers 1,-1 + T1.7 compiled Muon + frozen qk-shift, budget spent to land at ~2185 steps (just under the data wall)", "launch_command": "NEURON_LOGICAL_NC_CONFIG=2 torchrun --standalone --nproc_per_node=4 train.py --num-steps 5000 --max-train-seconds 1723 --out-dir out/t17-l1-2185 --eval-seq-len 1024 --compile-muon --qk-shift --qk-shift-beta 0.0 --qk-shift-freeze --ngram-ve-layers 1,-1", "git_commit": "496befd", "git_dirty": true, "status": "keep", "wall_elapsed_seconds": 1814.6, "run_log": "research/run-logs/t17-l1-2185.log", "checkpoint_path": "out/t17-l1-2185/final.pt", "training_seconds": 1717.8, "budget_seconds": 1800, "target_steps": 5000, "max_train_seconds": 1723, "startup_allowance_est": 63.5, "charged_seconds_est": 1718.4, "over_budget": false, "total_seconds": 1788.8, "compiled": true, "nki_relu2": false, "ngram_ve": "True tables=4 rows=524288 dim=128 index_gather=True trigram=True opt=rmsprop flat_lr=True bf16=True", "out_bigram": "False bf16=True gate_bias=-2.0 lr=0.0", "oneliners": "relu2_tau=0.0 mlp_sandwich=False head_gate=False hg_norm=True hg_ch=32 hg_mul=2.0 hg_bias=0.0 out_pool=False pool_layers=3 qk_shift=True qk_beta=0.0 qk_freeze=True x0_gate=False block_nudge=False nudge_site=qk qkv_norm_cse=False parallel_block=False par_coalesce=none epoch_shuffle=False epoch_shuffle_seed=1234", "engram": "False site=-1 orders=2,3 heads=1 tables=0 mult=32 mem_dim=128 e_dim=0 key_dim=0 conv_k=4 share=False bf16=True", "batch_ramp": "False grad_accum=(2, 4, 8) bounds=(0.35, 0.75) lr_exp=0.5 ref_grad_accum=4 last_grad_accum=4", "weight_ema": "False decays=(0.995,) start_frac=0.75 seeded=False updates=0", "num_steps": 2187, "total_tokens_M": 286.7, "world_size": 4, "lnc": 2, "seq_len": 2048, "num_params_M": 324.5, "causality_passed": true, "causality_max_abs": 0.0, "public_val_bpb": 1.005973, "eval_seconds": 9.9, "eval_timeout": 1200, "eval_over_timeout": false, "eval_alt_seq_len": 1024, "public_val_bpb_alt": 1.020922, "eval_alt_seconds": 17.4}
{"timestamp": "2026-09-14T11:57:00+00:00", "label": "t17-l1-m128", "solution": "T1.7", "description": "n-gram VE on layers 1,-1 with table mult 128 (592.9M) + T1.7 + frozen qk-shift, full 1800s budget lands at ~2153 steps", "launch_command": "NEURON_LOGICAL_NC_CONFIG=2 torchrun --standalone --nproc_per_node=4 train.py --num-steps 5000 --max-train-seconds 1800 --out-dir out/t17-l1-m128 --eval-seq-len 1024 --compile-muon --qk-shift --qk-shift-beta 0.0 --qk-shift-freeze --ngram-ve-layers 1,-1 --ngram-ve-table-mult 128", "git_commit": "496befd", "git_dirty": true, "status": "keep", "wall_elapsed_seconds": 1892.4, "run_log": "research/run-logs/t17-l1-m128.log", "checkpoint_path": "out/t17-l1-m128/final.pt", "training_seconds": 1794.3, "budget_seconds": 1800, "target_steps": 5000, "max_train_seconds": 1800, "startup_allowance_est": 64.3, "charged_seconds_est": 1795.3, "over_budget": false, "total_seconds": 1865.8, "compiled": true, "nki_relu2": false, "ngram_ve": "True tables=4 rows=1048576 dim=128 index_gather=True trigram=True opt=rmsprop flat_lr=True bf16=True", "out_bigram": "False bf16=True gate_bias=-2.0 lr=0.0", "oneliners": "relu2_tau=0.0 mlp_sandwich=False head_gate=False hg_norm=True hg_ch=32 hg_mul=2.0 hg_bias=0.0 out_pool=False pool_layers=3 qk_shift=True qk_beta=0.0 qk_freeze=True x0_gate=False block_nudge=False nudge_site=qk qkv_norm_cse=False parallel_block=False par_coalesce=none epoch_shuffle=False epoch_shuffle_seed=1234", "engram": "False site=-1 orders=2,3 heads=1 tables=0 mult=32 mem_dim=128 e_dim=0 key_dim=0 conv_k=4 share=False bf16=True", "batch_ramp": "False grad_accum=(2, 4, 8) bounds=(0.35, 0.75) lr_exp=0.5 ref_grad_accum=4 last_grad_accum=4", "weight_ema": "False decays=(0.995,) start_frac=0.75 seeded=False updates=0", "num_steps": 2135, "total_tokens_M": 279.8, "world_size": 4, "lnc": 2, "seq_len": 2048, "num_params_M": 592.9, "causality_passed": true, "causality_max_abs": 0.0, "public_val_bpb": 1.004363, "eval_seconds": 10.0, "eval_timeout": 1200, "eval_over_timeout": false, "eval_alt_seq_len": 1024, "public_val_bpb_alt": 1.019229, "eval_alt_seconds": 17.4}
{"timestamp": "2026-09-11T22:50:32+00:00", "label": "t21-base-1800s", "solution": "2.1", "description": "T2.1 control: BATCH_RAMP=False, locked baseline at 1800s", "launch_command": "NEURON_LOGICAL_NC_CONFIG=2 torchrun --standalone --nproc_per_node=4 train.py --num-steps 5000 --max-train-seconds 1800 --out-dir out/t21-base-1800s --eval-seq-len 1024", "git_commit": "496befd", "git_dirty": true, "status": "keep", "wall_elapsed_seconds": 1873.9, "run_log": "research/run-logs/t21-base-1800s.log", "checkpoint_path": "out/t21-base-1800s/final.pt", "training_seconds": 1794.5, "budget_seconds": 1800, "target_steps": 5000, "max_train_seconds": 1800, "startup_allowance_est": 54.3, "charged_seconds_est": 1794.7, "over_budget": false, "total_seconds": 1849.7, "compiled": true, "nki_relu2": false, "ngram_ve": "False tables=0 rows=65536 dim=640 index_gather=True trigram=True opt=rmsprop flat_lr=True bf16=True", "batch_ramp": "False grad_accum=(2, 4, 8) bounds=(0.35, 0.75) lr_exp=0.5 ref_grad_accum=4 last_grad_accum=4", "num_steps": 2192, "total_tokens_M": 287.3, "world_size": 4, "lnc": 2, "seq_len": 2048, "num_params_M": 55.7, "causality_passed": true, "causality_max_abs": 0.0, "public_val_bpb": 1.034536, "eval_seconds": 7.7, "eval_timeout": 1200, "eval_over_timeout": false, "eval_alt_seq_len": 1024, "public_val_bpb_alt": 1.049742, "eval_alt_seconds": 12.4}
{"timestamp": "2026-09-11T23:21:46+00:00", "label": "t21-ramp-1800s", "solution": "2.1", "description": "T2.1 treatment: BATCH_RAMP=True gas=(2,4,8) bounds=(0.35,0.75) lr_exp=0.5 at 1800s", "launch_command": "NEURON_LOGICAL_NC_CONFIG=2 torchrun --standalone --nproc_per_node=4 train.py --num-steps 5000 --max-train-seconds 1800 --out-dir out/t21-ramp-1800s --batch-ramp --eval-seq-len 1024", "git_commit": "496befd", "git_dirty": true, "status": "keep", "wall_elapsed_seconds": 1874.4, "run_log": "research/run-logs/t21-ramp-1800s.log", "batch_ramp": "True grad_accum=(2, 4, 8) bounds=(0.35, 0.75) lr_exp=0.5 ref_grad_accum=4 last_grad_accum=8", "checkpoint_path": "out/t21-ramp-1800s/final.pt", "training_seconds": 1794.0, "budget_seconds": 1800, "target_steps": 5000, "max_train_seconds": 1800, "startup_allowance_est": 55.1, "charged_seconds_est": 1794.2, "over_budget": false, "total_seconds": 1847.2, "compiled": true, "nki_relu2": false, "ngram_ve": "False tables=0 rows=65536 dim=640 index_gather=True trigram=True opt=rmsprop flat_lr=True bf16=True", "num_steps": 2620, "total_tokens_M": 286.9, "world_size": 4, "lnc": 2, "seq_len": 2048, "num_params_M": 55.7, "causality_passed": true, "causality_max_abs": 0.0, "public_val_bpb": 1.036367, "eval_seconds": 7.7, "eval_timeout": 1200, "eval_over_timeout": false, "eval_alt_seq_len": 1024, "public_val_bpb_alt": 1.051112, "eval_alt_seconds": 12.5}
