{"timestamp": "2026-09-08T00:38:01+00:00", "label": "mudd-compileonly", "solution": "MUDD", "description": "MUDD compile-only timing isolate at the REAL 4-way locked shape (nproc_per_node=4, lnc=2), to check whether MUDD's per-layer-varying-shape compile fits the 900s startup allowance before spending a full A/B run", "launch_command": "NEURON_LOGICAL_NC_CONFIG=2 torchrun --standalone --nproc_per_node=4 train.py --mudd --no-dcmha --compile-only --out-dir out/mudd-compileonly", "git_commit": "8f3c4e8", "git_dirty": true, "status": "keep", "wall_elapsed_seconds": 494.0, "run_log": "research/run-logs/mudd-compileonly.log", "note": "494s total (00:38:01->00:46:15), comfortably under the 900s TRAIN_STARTUP_ALLOWANCE_CAP_SECONDS -- the 4-way parallel compile is much cheaper than the single-device (nproc=1, lnc=1) mudd-smoke run's compile phase, so MUDD's compile cost is viable within budget at the real submission config."}
{"timestamp": "2026-09-08T01:51:45+00:00", "label": "mudd-dcmha-rebuild-verify", "solution": "MUDD+DCMHA", "description": "Post-rebuild real-hardware re-verification (single device, eager, both toggles together) after discovering the working tree had stale reverted Mamba2/NKI-custom-ops code underneath the MUDD/DCMHA changes and rebuilding cleanly on top of HEAD -- confirms the clean rebuild is behaviorally identical (num_params matches the pre-rebuild run exactly, causality still exact)", "launch_command": "NEURON_LOGICAL_NC_CONFIG=1 torchrun --standalone --nproc_per_node=1 train.py --num-steps 8 --max-train-seconds 240 --out-dir out/rebuild-verify --mudd --dcmha --no-compile --eval-tokens 32768", "git_commit": "ff44404", "git_dirty": true, "status": "keep", "wall_elapsed_seconds": 823.4, "run_log": "research/run-logs/mudd-dcmha-rebuild-verify.log", "checkpoint_path": "out/rebuild-verify/final.pt", "training_seconds": 118.6, "budget_seconds": 1800, "target_steps": 8, "max_train_seconds": 240, "startup_allowance_est": 694.1, "charged_seconds_est": 118.9, "over_budget": false, "total_seconds": 823.4, "compiled": false, "num_steps": 6, "world_size": 1, "lnc": 1, "seq_len": 2048, "num_params_M": 56.2, "causality_passed": true, "causality_max_abs": 0.0, "public_val_bpb": 3.459203}
{"timestamp": "2026-09-07T22:43:08+00:00", "label": "mudd-smoke", "solution": "MUDD", "description": "MUDDFormer (arXiv:2502.12170) real-hardware causality/crash smoke test, single device, compiled: 15-step target", "launch_command": "NEURON_LOGICAL_NC_CONFIG=1 torchrun --standalone --nproc_per_node=1 train.py --num-steps 15 --max-train-seconds 600 --out-dir out/mudd-smoke --mudd --no-dcmha --eval-tokens 65536", "git_commit": "8f3c4e8", "git_dirty": true, "status": "keep", "wall_elapsed_seconds": 1510.1, "run_log": "research/run-logs/mudd-smoke.log", "checkpoint_path": "out/mudd-smoke/final.pt", "training_seconds": 614.3, "budget_seconds": 1800, "target_steps": 15, "max_train_seconds": 600, "startup_allowance_est": 900.0, "charged_seconds_est": 614.5, "over_budget": false, "total_seconds": 1510.1, "compiled": true, "num_steps": 5, "world_size": 1, "lnc": 1, "seq_len": 2048, "num_params_M": 55.8, "causality_passed": true, "causality_max_abs": 0.0, "public_val_bpb": 3.063555, "note": "compile-dominated smoke test (per-layer-varying-shape MuddCompose adds real compile time); see mudd-compileonly for the real-shape compile-time isolate and mudd-900s-v2 for the real A/B"}
{"timestamp": "2026-09-15T09:21:27+00:00", "label": "ngd256-arm-900", "solution": "T3.1", "description": "locked defaults + --ngram-ve-dim 256 on top of layers 1,-1 + mult 128, ~900s, step-matched to ~869 steps", "launch_command": "NEURON_LOGICAL_NC_CONFIG=2 torchrun --standalone --nproc_per_node=4 train.py --num-steps 5000 --max-train-seconds 900 --out-dir out/ngd256-arm-900 --eval-seq-len 1024 --ngram-ve-dim 256", "git_commit": "496befd", "git_dirty": true, "status": "keep", "wall_elapsed_seconds": 1005.7, "run_log": "research/run-logs/ngd256-arm-900.log", "checkpoint_path": "out/ngd256-arm-900/final.pt", "training_seconds": 884.9, "budget_seconds": 1800, "target_steps": 5000, "max_train_seconds": 900, "startup_allowance_est": 86.7, "charged_seconds_est": 886.7, "over_budget": false, "total_seconds": 977.6, "compiled": true, "nki_relu2": false, "ngram_ve": "True tables=4 rows=1048576 dim=256 index_gather=True trigram=True opt=rmsprop flat_lr=True bf16=True", "out_bigram": "False bf16=True gate_bias=-2.0 lr=0.0", "oneliners": "relu2_tau=0.0 mlp_sandwich=False head_gate=False hg_norm=True hg_ch=32 hg_mul=2.0 hg_bias=0.0 out_pool=False pool_layers=3 qk_shift=True qk_beta=0.0 qk_freeze=True x0_gate=False block_nudge=False nudge_site=qk qkv_norm_cse=False parallel_block=False par_coalesce=none epoch_shuffle=False epoch_shuffle_seed=1234", "engram": "False site=-1 orders=2,3 heads=1 tables=0 mult=32 mem_dim=128 e_dim=0 key_dim=0 conv_k=4 share=False bf16=True", "batch_ramp": "False grad_accum=(2, 4, 8) bounds=(0.35, 0.75) lr_exp=0.5 ref_grad_accum=4 last_grad_accum=4", "weight_ema": "False decays=(0.995,) start_frac=0.75 seeded=False updates=0", "sched_tricks": "demon_b1=False demon_final=0.55 demon_ref=0.8 demon_start=-1.0 muon_b2=0.9 muon_b2_final=0.0 depth_lr=1.0->1.0 depth_mom=0.0->0.0 depth_mom_ref=0.95", "num_steps": 860, "total_tokens_M": 112.7, "world_size": 4, "lnc": 2, "seq_len": 2048, "num_params_M": 1130.1, "causality_passed": true, "causality_max_abs": 0.0, "public_val_bpb": 1.066135, "eval_seconds": 9.8, "eval_timeout": 1200, "eval_over_timeout": false, "eval_alt_seq_len": 1024, "public_val_bpb_alt": 1.081523, "eval_alt_seconds": 17.2}
{"timestamp": "2026-09-15T09:04:41+00:00", "label": "ngd256-ctrl-900", "solution": "T3.1", "description": "current locked defaults (layers 1,-1 / mult 128 / dim 128), step-matched to 869 steps for the dim-256 spot-check", "launch_command": "NEURON_LOGICAL_NC_CONFIG=2 torchrun --standalone --nproc_per_node=4 train.py --num-steps 5000 --max-train-seconds 724 --out-dir out/ngd256-ctrl-900 --eval-seq-len 1024", "git_commit": "496befd", "git_dirty": true, "status": "keep", "wall_elapsed_seconds": 797.4, "run_log": "research/run-logs/ngd256-ctrl-900.log", "checkpoint_path": "out/ngd256-ctrl-900/final.pt", "training_seconds": 708.7, "budget_seconds": 1800, "target_steps": 5000, "max_train_seconds": 724, "startup_allowance_est": 55.8, "charged_seconds_est": 709.7, "over_budget": false, "total_seconds": 779.6, "compiled": true, "nki_relu2": false, "ngram_ve": "True tables=4 rows=1048576 dim=128 index_gather=True trigram=True opt=rmsprop flat_lr=True bf16=True", "out_bigram": "False bf16=True gate_bias=-2.0 lr=0.0", "oneliners": "relu2_tau=0.0 mlp_sandwich=False head_gate=False hg_norm=True hg_ch=32 hg_mul=2.0 hg_bias=0.0 out_pool=False pool_layers=3 qk_shift=True qk_beta=0.0 qk_freeze=True x0_gate=False block_nudge=False nudge_site=qk qkv_norm_cse=False parallel_block=False par_coalesce=none epoch_shuffle=False epoch_shuffle_seed=1234", "engram": "False site=-1 orders=2,3 heads=1 tables=0 mult=32 mem_dim=128 e_dim=0 key_dim=0 conv_k=4 share=False bf16=True", "batch_ramp": "False grad_accum=(2, 4, 8) bounds=(0.35, 0.75) lr_exp=0.5 ref_grad_accum=4 last_grad_accum=4", "weight_ema": "False decays=(0.995,) start_frac=0.75 seeded=False updates=0", "sched_tricks": "demon_b1=False demon_final=0.55 demon_ref=0.8 demon_start=-1.0 muon_b2=0.9 muon_b2_final=0.0 depth_lr=1.0->1.0 depth_mom=0.0->0.0 depth_mom_ref=0.95", "num_steps": 853, "total_tokens_M": 111.8, "world_size": 4, "lnc": 2, "seq_len": 2048, "num_params_M": 592.9, "causality_passed": true, "causality_max_abs": 0.0, "public_val_bpb": 1.069576, "eval_seconds": 9.8, "eval_timeout": 1200, "eval_over_timeout": false, "eval_alt_seq_len": 1024, "public_val_bpb_alt": 1.084904, "eval_alt_seconds": 17.2}
{"timestamp": "2026-09-15T09:27:00+00:00", "label": "ngm256-arm-900s", "solution": "R1.2", "description": "table-mult 256 ON (dim unchanged at 128): isolates table WIDTH alone at the two-injection-site config. --max-train-seconds pre-scaled from the 120-step calibration (0.8438s/step ctrl, 1.0371s/step arm) to land at ~1066 steps, matching the control's natural 900s step count.", "launch_command": "NEURON_LOGICAL_NC_CONFIG=2 torchrun --standalone --nproc_per_node=4 train.py --num-steps 5000 --max-train-seconds 1106 --out-dir out/ngm256-arm-900s --eval-seq-len 1024 --ngram-ve-table-mult 256", "git_commit": "95038a2", "git_dirty": true, "status": "keep", "wall_elapsed_seconds": 1215.2, "run_log": "research/run-logs/ngm256-arm-900s.log", "checkpoint_path": "out/ngm256-arm-900s/final.pt", "training_seconds": 1091.0, "budget_seconds": 1800, "target_steps": 5000, "max_train_seconds": 1106, "startup_allowance_est": 88.8, "charged_seconds_est": 1092.8, "over_budget": false, "total_seconds": 1186.3, "compiled": true, "nki_relu2": false, "ngram_ve": "True tables=4 rows=2097152 dim=128 index_gather=True trigram=True opt=rmsprop flat_lr=True bf16=True", "out_bigram": "False bf16=True gate_bias=-2.0 lr=0.0", "oneliners": "relu2_tau=0.0 mlp_sandwich=False head_gate=False hg_norm=True hg_ch=32 hg_mul=2.0 hg_bias=0.0 out_pool=False pool_layers=3 qk_shift=True qk_beta=0.0 qk_freeze=True x0_gate=False block_nudge=False nudge_site=qk qkv_norm_cse=False parallel_block=False par_coalesce=none epoch_shuffle=False epoch_shuffle_seed=1234", "engram": "False site=-1 orders=2,3 heads=1 tables=0 mult=32 mem_dim=128 e_dim=0 key_dim=0 conv_k=4 share=False bf16=True", "batch_ramp": "False grad_accum=(2, 4, 8) bounds=(0.35, 0.75) lr_exp=0.5 ref_grad_accum=4 last_grad_accum=4", "weight_ema": "False decays=(0.995,) start_frac=0.75 seeded=False updates=0", "num_steps": 1053, "total_tokens_M": 138.0, "world_size": 4, "lnc": 2, "seq_len": 2048, "num_params_M": 1129.8, "causality_passed": true, "causality_max_abs": 0.0, "public_val_bpb": 1.050478, "eval_seconds": 10.1, "eval_timeout": 1200, "eval_over_timeout": false, "eval_alt_seq_len": 1024, "public_val_bpb_alt": 1.065729, "eval_alt_seconds": 18.0}
{"timestamp": "2026-09-15T10:22:04+00:00", "label": "ngm256-arm-900s-r2", "solution": "R1.2", "description": "same-day repeat block: --ngram-ve-table-mult 256 ON (dim unchanged), same 1106s pre-scaled max-train-seconds as the first pair, confirming the -0.0022 bpb step-normalised delta before trusting it", "launch_command": "NEURON_LOGICAL_NC_CONFIG=2 torchrun --standalone --nproc_per_node=4 train.py --num-steps 5000 --max-train-seconds 1106 --out-dir out/ngm256-arm-900s-r2 --eval-seq-len 1024 --ngram-ve-table-mult 256", "git_commit": "95038a2", "git_dirty": true, "status": "keep", "wall_elapsed_seconds": 1210.1, "run_log": "research/run-logs/ngm256-arm-900s-r2.log", "checkpoint_path": "out/ngm256-arm-900s-r2/final.pt", "training_seconds": 1090.9, "budget_seconds": 1800, "target_steps": 5000, "max_train_seconds": 1106, "startup_allowance_est": 83.9, "charged_seconds_est": 1092.7, "over_budget": false, "total_seconds": 1184.4, "compiled": true, "nki_relu2": false, "ngram_ve": "True tables=4 rows=2097152 dim=128 index_gather=True trigram=True opt=rmsprop flat_lr=True bf16=True", "out_bigram": "False bf16=True gate_bias=-2.0 lr=0.0", "oneliners": "relu2_tau=0.0 mlp_sandwich=False head_gate=False hg_norm=True hg_ch=32 hg_mul=2.0 hg_bias=0.0 out_pool=False pool_layers=3 qk_shift=True qk_beta=0.0 qk_freeze=True x0_gate=False block_nudge=False nudge_site=qk qkv_norm_cse=False parallel_block=False par_coalesce=none epoch_shuffle=False epoch_shuffle_seed=1234", "engram": "False site=-1 orders=2,3 heads=1 tables=0 mult=32 mem_dim=128 e_dim=0 key_dim=0 conv_k=4 share=False bf16=True", "batch_ramp": "False grad_accum=(2, 4, 8) bounds=(0.35, 0.75) lr_exp=0.5 ref_grad_accum=4 last_grad_accum=4", "weight_ema": "False decays=(0.995,) start_frac=0.75 seeded=False updates=0", "num_steps": 1053, "total_tokens_M": 138.0, "world_size": 4, "lnc": 2, "seq_len": 2048, "num_params_M": 1129.8, "causality_passed": true, "causality_max_abs": 0.0, "public_val_bpb": 1.050501, "eval_seconds": 10.0, "eval_timeout": 1200, "eval_over_timeout": false, "eval_alt_seq_len": 1024, "public_val_bpb_alt": 1.06569, "eval_alt_seconds": 17.9}
{"timestamp": "2026-09-15T09:06:45+00:00", "label": "ngm256-ctrl-900s-r1", "solution": "R1.2", "description": "fresh same-commit 900s control for the --ngram-ve-table-mult 256 isolation A/B, flag at locked default (mult=128, dim=128, layers 1,-1)", "launch_command": "NEURON_LOGICAL_NC_CONFIG=2 torchrun --standalone --nproc_per_node=4 train.py --num-steps 5000 --max-train-seconds 900 --out-dir out/ngm256-ctrl-900s-r1 --eval-seq-len 1024", "git_commit": "95038a2", "git_dirty": true, "status": "keep", "wall_elapsed_seconds": 985.8, "run_log": "research/run-logs/ngm256-ctrl-900s-r1.log", "checkpoint_path": "out/ngm256-ctrl-900s-r1/final.pt", "training_seconds": 884.8, "budget_seconds": 1800, "target_steps": 5000, "max_train_seconds": 900, "startup_allowance_est": 65.4, "charged_seconds_est": 885.8, "over_budget": false, "total_seconds": 958.6, "compiled": true, "nki_relu2": false, "ngram_ve": "True tables=4 rows=1048576 dim=128 index_gather=True trigram=True opt=rmsprop flat_lr=True bf16=True", "out_bigram": "False bf16=True gate_bias=-2.0 lr=0.0", "oneliners": "relu2_tau=0.0 mlp_sandwich=False head_gate=False hg_norm=True hg_ch=32 hg_mul=2.0 hg_bias=0.0 out_pool=False pool_layers=3 qk_shift=True qk_beta=0.0 qk_freeze=True x0_gate=False block_nudge=False nudge_site=qk qkv_norm_cse=False parallel_block=False par_coalesce=none epoch_shuffle=False epoch_shuffle_seed=1234", "engram": "False site=-1 orders=2,3 heads=1 tables=0 mult=32 mem_dim=128 e_dim=0 key_dim=0 conv_k=4 share=False bf16=True", "batch_ramp": "False grad_accum=(2, 4, 8) bounds=(0.35, 0.75) lr_exp=0.5 ref_grad_accum=4 last_grad_accum=4", "weight_ema": "False decays=(0.995,) start_frac=0.75 seeded=False updates=0", "num_steps": 1048, "total_tokens_M": 137.4, "world_size": 4, "lnc": 2, "seq_len": 2048, "num_params_M": 592.9, "causality_passed": true, "causality_max_abs": 0.0, "public_val_bpb": 1.053042, "eval_seconds": 10.3, "eval_timeout": 1200, "eval_over_timeout": false, "eval_alt_seq_len": 1024, "public_val_bpb_alt": 1.068291, "eval_alt_seconds": 18.7}
{"timestamp": "2026-09-15T09:43:28+00:00", "label": "ngm256-ctrl-900s-r2", "solution": "R1.2", "description": "closing same-commit 900s control: measures this block's own drift/noise band", "launch_command": "NEURON_LOGICAL_NC_CONFIG=2 torchrun --standalone --nproc_per_node=4 train.py --num-steps 5000 --max-train-seconds 900 --out-dir out/ngm256-ctrl-900s-r2 --eval-seq-len 1024", "git_commit": "95038a2", "git_dirty": true, "status": "keep", "wall_elapsed_seconds": 987.6, "run_log": "research/run-logs/ngm256-ctrl-900s-r2.log", "checkpoint_path": "out/ngm256-ctrl-900s-r2/final.pt", "training_seconds": 884.3, "budget_seconds": 1800, "target_steps": 5000, "max_train_seconds": 900, "startup_allowance_est": 68.4, "charged_seconds_est": 885.3, "over_budget": false, "total_seconds": 957.4, "compiled": true, "nki_relu2": false, "ngram_ve": "True tables=4 rows=1048576 dim=128 index_gather=True trigram=True opt=rmsprop flat_lr=True bf16=True", "out_bigram": "False bf16=True gate_bias=-2.0 lr=0.0", "oneliners": "relu2_tau=0.0 mlp_sandwich=False head_gate=False hg_norm=True hg_ch=32 hg_mul=2.0 hg_bias=0.0 out_pool=False pool_layers=3 qk_shift=True qk_beta=0.0 qk_freeze=True x0_gate=False block_nudge=False nudge_site=qk qkv_norm_cse=False parallel_block=False par_coalesce=none epoch_shuffle=False epoch_shuffle_seed=1234", "engram": "False site=-1 orders=2,3 heads=1 tables=0 mult=32 mem_dim=128 e_dim=0 key_dim=0 conv_k=4 share=False bf16=True", "batch_ramp": "False grad_accum=(2, 4, 8) bounds=(0.35, 0.75) lr_exp=0.5 ref_grad_accum=4 last_grad_accum=4", "weight_ema": "False decays=(0.995,) start_frac=0.75 seeded=False updates=0", "num_steps": 1052, "total_tokens_M": 137.9, "world_size": 4, "lnc": 2, "seq_len": 2048, "num_params_M": 592.9, "causality_passed": true, "causality_max_abs": 0.0, "public_val_bpb": 1.05275, "eval_seconds": 10.1, "eval_timeout": 1200, "eval_over_timeout": false, "eval_alt_seq_len": 1024, "public_val_bpb_alt": 1.068017, "eval_alt_seconds": 18.1}
{"timestamp": "2026-09-15T10:01:54+00:00", "label": "ngm256-ctrl-900s-r3", "solution": "R1.2", "description": "same-day repeat block: fresh same-commit 900s control, flag at locked default (mult=128)", "launch_command": "NEURON_LOGICAL_NC_CONFIG=2 torchrun --standalone --nproc_per_node=4 train.py --num-steps 5000 --max-train-seconds 900 --out-dir out/ngm256-ctrl-900s-r3 --eval-seq-len 1024", "git_commit": "95038a2", "git_dirty": true, "status": "keep", "wall_elapsed_seconds": 984.2, "run_log": "research/run-logs/ngm256-ctrl-900s-r3.log", "checkpoint_path": "out/ngm256-ctrl-900s-r3/final.pt", "training_seconds": 884.5, "budget_seconds": 1800, "target_steps": 5000, "max_train_seconds": 900, "startup_allowance_est": 65.4, "charged_seconds_est": 885.5, "over_budget": false, "total_seconds": 957.9, "compiled": true, "nki_relu2": false, "ngram_ve": "True tables=4 rows=1048576 dim=128 index_gather=True trigram=True opt=rmsprop flat_lr=True bf16=True", "out_bigram": "False bf16=True gate_bias=-2.0 lr=0.0", "oneliners": "relu2_tau=0.0 mlp_sandwich=False head_gate=False hg_norm=True hg_ch=32 hg_mul=2.0 hg_bias=0.0 out_pool=False pool_layers=3 qk_shift=True qk_beta=0.0 qk_freeze=True x0_gate=False block_nudge=False nudge_site=qk qkv_norm_cse=False parallel_block=False par_coalesce=none epoch_shuffle=False epoch_shuffle_seed=1234", "engram": "False site=-1 orders=2,3 heads=1 tables=0 mult=32 mem_dim=128 e_dim=0 key_dim=0 conv_k=4 share=False bf16=True", "batch_ramp": "False grad_accum=(2, 4, 8) bounds=(0.35, 0.75) lr_exp=0.5 ref_grad_accum=4 last_grad_accum=4", "weight_ema": "False decays=(0.995,) start_frac=0.75 seeded=False updates=0", "num_steps": 1053, "total_tokens_M": 138.0, "world_size": 4, "lnc": 2, "seq_len": 2048, "num_params_M": 592.9, "causality_passed": true, "causality_max_abs": 0.0, "public_val_bpb": 1.052425, "eval_seconds": 10.1, "eval_timeout": 1200, "eval_over_timeout": false, "eval_alt_seq_len": 1024, "public_val_bpb_alt": 1.067721, "eval_alt_seconds": 18.0}
{"timestamp": "2026-09-15T10:38:27+00:00", "label": "ngm256-ctrl-900s-r4", "solution": "R1.2", "description": "same-day repeat block: closing fresh same-commit 900s control", "launch_command": "NEURON_LOGICAL_NC_CONFIG=2 torchrun --standalone --nproc_per_node=4 train.py --num-steps 5000 --max-train-seconds 900 --out-dir out/ngm256-ctrl-900s-r4 --eval-seq-len 1024", "git_commit": "95038a2", "git_dirty": true, "status": "keep", "wall_elapsed_seconds": 983.0, "run_log": "research/run-logs/ngm256-ctrl-900s-r4.log", "checkpoint_path": "out/ngm256-ctrl-900s-r4/final.pt", "training_seconds": 884.5, "budget_seconds": 1800, "target_steps": 5000, "max_train_seconds": 900, "startup_allowance_est": 64.5, "charged_seconds_est": 885.5, "over_budget": false, "total_seconds": 957.3, "compiled": true, "nki_relu2": false, "ngram_ve": "True tables=4 rows=1048576 dim=128 index_gather=True trigram=True opt=rmsprop flat_lr=True bf16=True", "out_bigram": "False bf16=True gate_bias=-2.0 lr=0.0", "oneliners": "relu2_tau=0.0 mlp_sandwich=False head_gate=False hg_norm=True hg_ch=32 hg_mul=2.0 hg_bias=0.0 out_pool=False pool_layers=3 qk_shift=True qk_beta=0.0 qk_freeze=True x0_gate=False block_nudge=False nudge_site=qk qkv_norm_cse=False parallel_block=False par_coalesce=none epoch_shuffle=False epoch_shuffle_seed=1234", "engram": "False site=-1 orders=2,3 heads=1 tables=0 mult=32 mem_dim=128 e_dim=0 key_dim=0 conv_k=4 share=False bf16=True", "batch_ramp": "False grad_accum=(2, 4, 8) bounds=(0.35, 0.75) lr_exp=0.5 ref_grad_accum=4 last_grad_accum=4", "weight_ema": "False decays=(0.995,) start_frac=0.75 seeded=False updates=0", "num_steps": 1054, "total_tokens_M": 138.1, "world_size": 4, "lnc": 2, "seq_len": 2048, "num_params_M": 592.9, "causality_passed": true, "causality_max_abs": 0.0, "public_val_bpb": 1.052783, "eval_seconds": 10.0, "eval_timeout": 1200, "eval_over_timeout": false, "eval_alt_seq_len": 1024, "public_val_bpb_alt": 1.067995, "eval_alt_seconds": 17.7}
