{"timestamp": "2026-09-04T10:44:55+00:00", "label": "sol7-ve-on-smoke", "solution": "7", "description": "USE_VE=True smoke test", "launch_command": "NEURON_LOGICAL_NC_CONFIG=1 torchrun --standalone --nproc_per_node=1 train.py --num-steps 15 --max-train-seconds 300 --out-dir out/sol7-ve-on-smoke --eval-tokens 65536", "git_commit": "736c997", "git_dirty": true, "status": "keep", "wall_elapsed_seconds": 16.0, "run_log": "research/run-logs/sol7-ve-on-smoke.log", "checkpoint_path": "out/sol7-ve-on-smoke/final.pt", "training_seconds": 13.4, "budget_seconds": 1800, "target_steps": 15, "max_train_seconds": 300, "over_budget": false, "total_seconds": 13.6, "compiled": false, "nki_relu2": false, "num_steps": 15, "total_tokens_M": 1.0, "world_size": 1, "lnc": 1, "seq_len": 1024, "num_params_M": 85.9, "causality_passed": true, "causality_max_abs": 0.0, "public_val_bpb": 2.152977, "eval_seconds": 0.4, "eval_timeout": 1200, "eval_over_timeout": false}
{"timestamp": "2026-09-04T11:00:06+00:00", "label": "sol8-mask-off-smoke", "solution": "8", "description": "window mask refactor no-op check (WINDOW_PATTERN=L)", "launch_command": "NEURON_LOGICAL_NC_CONFIG=1 torchrun --standalone --nproc_per_node=1 train.py --num-steps 15 --max-train-seconds 300 --out-dir out/sol8-mask-off-smoke --eval-tokens 65536", "git_commit": "3a8329a", "git_dirty": true, "status": "crash", "wall_elapsed_seconds": 3.6, "run_log": "research/run-logs/sol8-mask-off-smoke.log"}
{"timestamp": "2026-09-04T11:01:28+00:00", "label": "sol8-mask-off-smoke2", "solution": "8", "description": "window mask refactor no-op check, mask dtype fixed", "launch_command": "NEURON_LOGICAL_NC_CONFIG=1 torchrun --standalone --nproc_per_node=1 train.py --num-steps 15 --max-train-seconds 300 --out-dir out/sol8-mask-off-smoke2 --eval-tokens 65536", "git_commit": "5ba9c14", "git_dirty": true, "status": "keep", "wall_elapsed_seconds": 17.5, "run_log": "research/run-logs/sol8-mask-off-smoke2.log", "checkpoint_path": "out/sol8-mask-off-smoke2/final.pt", "training_seconds": 14.7, "budget_seconds": 1800, "target_steps": 15, "max_train_seconds": 300, "over_budget": false, "total_seconds": 14.8, "compiled": false, "nki_relu2": false, "num_steps": 15, "total_tokens_M": 1.0, "world_size": 1, "lnc": 1, "seq_len": 1024, "num_params_M": 85.9, "causality_passed": true, "causality_max_abs": 0.0, "public_val_bpb": 2.153047, "eval_seconds": 0.4, "eval_timeout": 1200, "eval_over_timeout": false}
{"timestamp": "2026-09-04T11:15:49+00:00", "label": "sol8-window-on", "solution": "8", "description": "WINDOW_PATTERN=SSSSL SHORT_WINDOW_FRAC=0.125 ROPE_BASE=200000 (on top of Sol1-7)", "launch_command": "NEURON_LOGICAL_NC_CONFIG=1 torchrun --standalone --nproc_per_node=1 train.py --num-steps 800 --max-train-seconds 800 --out-dir out/sol8-window-on", "git_commit": "e4cddcd", "git_dirty": true, "status": "keep", "wall_elapsed_seconds": 765.7, "run_log": "research/run-logs/sol8-window-on.log", "checkpoint_path": "out/sol8-window-on/final.pt", "training_seconds": 749.1, "budget_seconds": 1800, "target_steps": 800, "max_train_seconds": 800, "over_budget": false, "total_seconds": 749.3, "compiled": false, "nki_relu2": false, "num_steps": 800, "total_tokens_M": 52.4, "world_size": 1, "lnc": 1, "seq_len": 1024, "num_params_M": 85.9, "causality_passed": true, "causality_max_abs": 0.0, "public_val_bpb": 1.175473, "eval_seconds": 14.5, "eval_timeout": 1200, "eval_over_timeout": false}
{"timestamp": "2026-09-04T11:02:30+00:00", "label": "sol8-window-on-smoke", "solution": "8", "description": "WINDOW_PATTERN=SSSSL SHORT_WINDOW_FRAC=0.125 ROPE_BASE=200000 smoke test", "launch_command": "NEURON_LOGICAL_NC_CONFIG=1 torchrun --standalone --nproc_per_node=1 train.py --num-steps 15 --max-train-seconds 300 --out-dir out/sol8-window-on-smoke --eval-tokens 65536", "git_commit": "bdcc10e", "git_dirty": true, "status": "keep", "wall_elapsed_seconds": 17.7, "run_log": "research/run-logs/sol8-window-on-smoke.log", "checkpoint_path": "out/sol8-window-on-smoke/final.pt", "training_seconds": 14.7, "budget_seconds": 1800, "target_steps": 15, "max_train_seconds": 300, "over_budget": false, "total_seconds": 14.8, "compiled": false, "nki_relu2": false, "num_steps": 15, "total_tokens_M": 1.0, "world_size": 1, "lnc": 1, "seq_len": 1024, "num_params_M": 85.9, "causality_passed": true, "causality_max_abs": 0.0, "public_val_bpb": 2.147972, "eval_seconds": 0.4, "eval_timeout": 1200, "eval_over_timeout": false}
{"timestamp": "2026-09-04T11:31:58+00:00", "label": "sol9a-conv", "solution": "9", "description": "USE_LOCAL_CONV=True, kernel=4 (on top of Sol1-7)", "launch_command": "NEURON_LOGICAL_NC_CONFIG=1 torchrun --standalone --nproc_per_node=1 train.py --num-steps 800 --max-train-seconds 780 --out-dir out/sol9a-conv", "git_commit": "ce6a47e", "git_dirty": true, "status": "keep", "wall_elapsed_seconds": 796.9, "run_log": "research/run-logs/sol9a-conv.log", "checkpoint_path": "out/sol9a-conv/final.pt", "training_seconds": 779.2, "budget_seconds": 1800, "target_steps": 800, "max_train_seconds": 780, "over_budget": false, "total_seconds": 779.4, "compiled": false, "nki_relu2": false, "num_steps": 800, "total_tokens_M": 52.4, "world_size": 1, "lnc": 1, "seq_len": 1024, "num_params_M": 85.9, "causality_passed": true, "causality_max_abs": 0.0, "public_val_bpb": 1.171962, "eval_seconds": 15.1, "eval_timeout": 1200, "eval_over_timeout": false}
{"timestamp": "2026-09-04T11:18:13+00:00", "label": "sol9a-conv-smoke", "solution": "9", "description": "USE_LOCAL_CONV=True smoke test", "launch_command": "NEURON_LOGICAL_NC_CONFIG=1 torchrun --standalone --nproc_per_node=1 train.py --num-steps 15 --max-train-seconds 300 --out-dir out/sol9a-conv-smoke --eval-tokens 65536", "git_commit": "ea79363", "git_dirty": true, "status": "keep", "wall_elapsed_seconds": 18.0, "run_log": "research/run-logs/sol9a-conv-smoke.log", "checkpoint_path": "out/sol9a-conv-smoke/final.pt", "training_seconds": 15.2, "budget_seconds": 1800, "target_steps": 15, "max_train_seconds": 300, "over_budget": false, "total_seconds": 15.3, "compiled": false, "nki_relu2": false, "num_steps": 15, "total_tokens_M": 1.0, "world_size": 1, "lnc": 1, "seq_len": 1024, "num_params_M": 85.9, "causality_passed": true, "causality_max_abs": 0.0, "public_val_bpb": 2.152975, "eval_seconds": 0.5, "eval_timeout": 1200, "eval_over_timeout": false}
{"timestamp": "2026-09-04T11:50:06+00:00", "label": "sol9b-gatedmlp", "solution": "9", "description": "USE_GATED_MLP=True (on top of Sol1-7,9a)", "launch_command": "NEURON_LOGICAL_NC_CONFIG=1 torchrun --standalone --nproc_per_node=1 train.py --num-steps 800 --max-train-seconds 970 --out-dir out/sol9b-gatedmlp", "git_commit": "ba1dde9", "git_dirty": true, "status": "keep", "wall_elapsed_seconds": 949.9, "run_log": "research/run-logs/sol9b-gatedmlp.log", "checkpoint_path": "out/sol9b-gatedmlp/final.pt", "training_seconds": 930.4, "budget_seconds": 1800, "target_steps": 800, "max_train_seconds": 970, "over_budget": false, "total_seconds": 930.6, "compiled": false, "nki_relu2": false, "num_steps": 800, "total_tokens_M": 52.4, "world_size": 1, "lnc": 1, "seq_len": 1024, "num_params_M": 102.3, "causality_passed": true, "causality_max_abs": 0.0, "public_val_bpb": 1.175858, "eval_seconds": 17.4, "eval_timeout": 1200, "eval_over_timeout": false}
{"timestamp": "2026-09-04T11:33:44+00:00", "label": "sol9b-gatedmlp-smoke", "solution": "9", "description": "USE_GATED_MLP=True smoke test", "launch_command": "NEURON_LOGICAL_NC_CONFIG=1 torchrun --standalone --nproc_per_node=1 train.py --num-steps 15 --max-train-seconds 300 --out-dir out/sol9b-gatedmlp-smoke --eval-tokens 65536", "git_commit": "d1b9488", "git_dirty": true, "status": "keep", "wall_elapsed_seconds": 20.4, "run_log": "research/run-logs/sol9b-gatedmlp-smoke.log", "checkpoint_path": "out/sol9b-gatedmlp-smoke/final.pt", "training_seconds": 18.0, "budget_seconds": 1800, "target_steps": 15, "max_train_seconds": 300, "over_budget": false, "total_seconds": 18.1, "compiled": false, "nki_relu2": false, "num_steps": 15, "total_tokens_M": 1.0, "world_size": 1, "lnc": 1, "seq_len": 1024, "num_params_M": 102.3, "causality_passed": true, "causality_max_abs": 0.0, "public_val_bpb": 2.194833, "eval_seconds": 0.5, "eval_timeout": 1200, "eval_over_timeout": false}
{"timestamp": "2026-09-15T04:46:47+00:00", "label": "st-b2flat95-900s", "solution": "R1.2", "description": "plan 11.1 item 2 DISCRIMINATOR: flat Muon beta2 0.95, no ramp. Separates 'the ramp is the mechanism' from '0.90 was simply mistuned'.", "launch_command": "NEURON_LOGICAL_NC_CONFIG=2 torchrun --standalone --nproc_per_node=4 train.py --num-steps 5000 --max-train-seconds 900 --out-dir out/st-b2flat95-900s --eval-seq-len 1024 --muon-beta2 0.95", "git_commit": "496befd", "git_dirty": true, "status": "keep", "wall_elapsed_seconds": 1009.5, "run_log": "research/run-logs/st-b2flat95-900s.log", "checkpoint_path": "out/st-b2flat95-900s/final.pt", "training_seconds": 884.5, "budget_seconds": 1800, "target_steps": 5000, "max_train_seconds": 900, "startup_allowance_est": 91.0, "charged_seconds_est": 885.5, "over_budget": false, "total_seconds": 980.9, "compiled": true, "nki_relu2": false, "ngram_ve": "True tables=4 rows=1048576 dim=128 index_gather=True trigram=True opt=rmsprop flat_lr=True bf16=True", "out_bigram": "False bf16=True gate_bias=-2.0 lr=0.0", "oneliners": "relu2_tau=0.0 mlp_sandwich=False head_gate=False hg_norm=True hg_ch=32 hg_mul=2.0 hg_bias=0.0 out_pool=False pool_layers=3 qk_shift=True qk_beta=0.0 qk_freeze=True x0_gate=False block_nudge=False nudge_site=qk qkv_norm_cse=False parallel_block=False par_coalesce=none epoch_shuffle=False epoch_shuffle_seed=1234", "engram": "False site=-1 orders=2,3 heads=1 tables=0 mult=32 mem_dim=128 e_dim=0 key_dim=0 conv_k=4 share=False bf16=True", "batch_ramp": "False grad_accum=(2, 4, 8) bounds=(0.35, 0.75) lr_exp=0.5 ref_grad_accum=4 last_grad_accum=4", "weight_ema": "False decays=(0.995,) start_frac=0.75 seeded=False updates=0", "sched_tricks": "demon_b1=False demon_final=0.55 demon_ref=0.8 demon_start=-1.0 muon_b2=0.95 muon_b2_final=0.0 depth_lr=1.0->1.0 depth_mom=0.0->0.0 depth_mom_ref=0.95", "num_steps": 1054, "total_tokens_M": 138.1, "world_size": 4, "lnc": 2, "seq_len": 2048, "num_params_M": 592.9, "causality_passed": true, "causality_max_abs": 0.0, "public_val_bpb": 1.052798, "eval_seconds": 10.0, "eval_timeout": 1200, "eval_over_timeout": false, "eval_alt_seq_len": 1024, "public_val_bpb_alt": 1.06807, "eval_alt_seconds": 17.8}
{"timestamp": "2026-09-15T04:13:34+00:00", "label": "st-b2ramp95-900s", "solution": "R1.2", "description": "plan 11.1 item 2, NorMuon beta2 ramp: Muon second-moment beta2 0.90 -> 0.95 linearly over elapsed/max_train_seconds. 1-beta2 reaches the compiled Muon body as a device tensor (fifth slot of the existing single staged copy), not a Python float.", "launch_command": "NEURON_LOGICAL_NC_CONFIG=2 torchrun --standalone --nproc_per_node=4 train.py --num-steps 5000 --max-train-seconds 900 --out-dir out/st-b2ramp95-900s --eval-seq-len 1024 --muon-beta2-final 0.95", "git_commit": "496befd", "git_dirty": true, "status": "keep", "wall_elapsed_seconds": 974.9, "run_log": "research/run-logs/st-b2ramp95-900s.log", "checkpoint_path": "out/st-b2ramp95-900s/final.pt", "training_seconds": 884.6, "budget_seconds": 1800, "target_steps": 5000, "max_train_seconds": 900, "startup_allowance_est": 55.7, "charged_seconds_est": 885.6, "over_budget": false, "total_seconds": 957.3, "compiled": true, "nki_relu2": false, "ngram_ve": "True tables=4 rows=1048576 dim=128 index_gather=True trigram=True opt=rmsprop flat_lr=True bf16=True", "out_bigram": "False bf16=True gate_bias=-2.0 lr=0.0", "oneliners": "relu2_tau=0.0 mlp_sandwich=False head_gate=False hg_norm=True hg_ch=32 hg_mul=2.0 hg_bias=0.0 out_pool=False pool_layers=3 qk_shift=True qk_beta=0.0 qk_freeze=True x0_gate=False block_nudge=False nudge_site=qk qkv_norm_cse=False parallel_block=False par_coalesce=none epoch_shuffle=False epoch_shuffle_seed=1234", "engram": "False site=-1 orders=2,3 heads=1 tables=0 mult=32 mem_dim=128 e_dim=0 key_dim=0 conv_k=4 share=False bf16=True", "batch_ramp": "False grad_accum=(2, 4, 8) bounds=(0.35, 0.75) lr_exp=0.5 ref_grad_accum=4 last_grad_accum=4", "weight_ema": "False decays=(0.995,) start_frac=0.75 seeded=False updates=0", "sched_tricks": "demon_b1=False demon_final=0.55 demon_ref=0.8 demon_start=-1.0 muon_b2=0.9 muon_b2_final=0.95 depth_lr=1.0->1.0 depth_mom=0.0->0.0 depth_mom_ref=0.95", "num_steps": 1054, "total_tokens_M": 138.1, "world_size": 4, "lnc": 2, "seq_len": 2048, "num_params_M": 592.9, "causality_passed": true, "causality_max_abs": 0.0, "public_val_bpb": 1.052737, "eval_seconds": 10.1, "eval_timeout": 1200, "eval_over_timeout": false, "eval_alt_seq_len": 1024, "public_val_bpb_alt": 1.067969, "eval_alt_seconds": 18.2}
{"timestamp": "2026-09-15T04:29:57+00:00", "label": "st-b2ramp97-900s", "solution": "R1.2", "description": "plan 11.1 item 2 at Recursive's upper endpoint: Muon beta2 0.90 -> 0.97 over the run", "launch_command": "NEURON_LOGICAL_NC_CONFIG=2 torchrun --standalone --nproc_per_node=4 train.py --num-steps 5000 --max-train-seconds 900 --out-dir out/st-b2ramp97-900s --eval-seq-len 1024 --muon-beta2-final 0.97", "git_commit": "496befd", "git_dirty": true, "status": "keep", "wall_elapsed_seconds": 983.2, "run_log": "research/run-logs/st-b2ramp97-900s.log", "checkpoint_path": "out/st-b2ramp97-900s/final.pt", "training_seconds": 884.7, "budget_seconds": 1800, "target_steps": 5000, "max_train_seconds": 900, "startup_allowance_est": 64.2, "charged_seconds_est": 885.7, "over_budget": false, "total_seconds": 957.2, "compiled": true, "nki_relu2": false, "ngram_ve": "True tables=4 rows=1048576 dim=128 index_gather=True trigram=True opt=rmsprop flat_lr=True bf16=True", "out_bigram": "False bf16=True gate_bias=-2.0 lr=0.0", "oneliners": "relu2_tau=0.0 mlp_sandwich=False head_gate=False hg_norm=True hg_ch=32 hg_mul=2.0 hg_bias=0.0 out_pool=False pool_layers=3 qk_shift=True qk_beta=0.0 qk_freeze=True x0_gate=False block_nudge=False nudge_site=qk qkv_norm_cse=False parallel_block=False par_coalesce=none epoch_shuffle=False epoch_shuffle_seed=1234", "engram": "False site=-1 orders=2,3 heads=1 tables=0 mult=32 mem_dim=128 e_dim=0 key_dim=0 conv_k=4 share=False bf16=True", "batch_ramp": "False grad_accum=(2, 4, 8) bounds=(0.35, 0.75) lr_exp=0.5 ref_grad_accum=4 last_grad_accum=4", "weight_ema": "False decays=(0.995,) start_frac=0.75 seeded=False updates=0", "sched_tricks": "demon_b1=False demon_final=0.55 demon_ref=0.8 demon_start=-1.0 muon_b2=0.9 muon_b2_final=0.97 depth_lr=1.0->1.0 depth_mom=0.0->0.0 depth_mom_ref=0.95", "num_steps": 1055, "total_tokens_M": 138.3, "world_size": 4, "lnc": 2, "seq_len": 2048, "num_params_M": 592.9, "causality_passed": true, "causality_max_abs": 0.0, "public_val_bpb": 1.052614, "eval_seconds": 10.0, "eval_timeout": 1200, "eval_over_timeout": false, "eval_alt_seq_len": 1024, "public_val_bpb_alt": 1.06788, "eval_alt_seconds": 17.8}
{"timestamp": "2026-09-15T03:24:27+00:00", "label": "st-ctrl-900s-r1", "solution": "R1.2", "description": "fresh same-commit 900s control for the plan-11.1 schedule-tricks block (Demon beta1 / NorMuon beta2 ramp / per-depth Muon LR+momentum)", "launch_command": "NEURON_LOGICAL_NC_CONFIG=2 torchrun --standalone --nproc_per_node=4 train.py --num-steps 5000 --max-train-seconds 900 --out-dir out/st-ctrl-900s-r1 --eval-seq-len 1024", "git_commit": "496befd", "git_dirty": true, "status": "keep", "wall_elapsed_seconds": 985.7, "run_log": "research/run-logs/st-ctrl-900s-r1.log", "checkpoint_path": "out/st-ctrl-900s-r1/final.pt", "training_seconds": 884.9, "budget_seconds": 1800, "target_steps": 5000, "max_train_seconds": 900, "startup_allowance_est": 66.2, "charged_seconds_est": 885.9, "over_budget": false, "total_seconds": 957.4, "compiled": true, "nki_relu2": false, "ngram_ve": "True tables=4 rows=1048576 dim=128 index_gather=True trigram=True opt=rmsprop flat_lr=True bf16=True", "out_bigram": "False bf16=True gate_bias=-2.0 lr=0.0", "oneliners": "relu2_tau=0.0 mlp_sandwich=False head_gate=False hg_norm=True hg_ch=32 hg_mul=2.0 hg_bias=0.0 out_pool=False pool_layers=3 qk_shift=True qk_beta=0.0 qk_freeze=True x0_gate=False block_nudge=False nudge_site=qk qkv_norm_cse=False parallel_block=False par_coalesce=none epoch_shuffle=False epoch_shuffle_seed=1234", "engram": "False site=-1 orders=2,3 heads=1 tables=0 mult=32 mem_dim=128 e_dim=0 key_dim=0 conv_k=4 share=False bf16=True", "batch_ramp": "False grad_accum=(2, 4, 8) bounds=(0.35, 0.75) lr_exp=0.5 ref_grad_accum=4 last_grad_accum=4", "weight_ema": "False decays=(0.995,) start_frac=0.75 seeded=False updates=0", "sched_tricks": "demon_b1=False demon_final=0.55 demon_ref=0.8 demon_start=-1.0 muon_b2=0.9 muon_b2_final=0.0 depth_lr=1.0->1.0 depth_mom=0.0->0.0 depth_mom_ref=0.95", "num_steps": 1055, "total_tokens_M": 138.3, "world_size": 4, "lnc": 2, "seq_len": 2048, "num_params_M": 592.9, "causality_passed": true, "causality_max_abs": 0.0, "public_val_bpb": 1.052603, "eval_seconds": 10.0, "eval_timeout": 1200, "eval_over_timeout": false, "eval_alt_seq_len": 1024, "public_val_bpb_alt": 1.067923, "eval_alt_seconds": 18.0}
{"timestamp": "2026-09-15T03:40:55+00:00", "label": "st-demon-900s", "solution": "R1.2", "description": "plan 11.1 item 1, Adam Demon: anneal every AdamW group's beta1 down across the LR warmdown as a multiplicative shrink on its own initial beta1, calibrated so the 0.8 embedding family lands on 0.55 (Recursive's numbers). Starts at progress 1-WARMDOWN_RATIO=0.25. RMSProp n-gram group unaffected (no first moment).", "launch_command": "NEURON_LOGICAL_NC_CONFIG=2 torchrun --standalone --nproc_per_node=4 train.py --num-steps 5000 --max-train-seconds 900 --out-dir out/st-demon-900s --eval-seq-len 1024 --demon-beta1", "git_commit": "496befd", "git_dirty": true, "status": "keep", "wall_elapsed_seconds": 987.6, "run_log": "research/run-logs/st-demon-900s.log", "checkpoint_path": "out/st-demon-900s/final.pt", "training_seconds": 884.3, "budget_seconds": 1800, "target_steps": 5000, "max_train_seconds": 900, "startup_allowance_est": 69.0, "charged_seconds_est": 885.2, "over_budget": false, "total_seconds": 957.1, "compiled": true, "nki_relu2": false, "ngram_ve": "True tables=4 rows=1048576 dim=128 index_gather=True trigram=True opt=rmsprop flat_lr=True bf16=True", "out_bigram": "False bf16=True gate_bias=-2.0 lr=0.0", "oneliners": "relu2_tau=0.0 mlp_sandwich=False head_gate=False hg_norm=True hg_ch=32 hg_mul=2.0 hg_bias=0.0 out_pool=False pool_layers=3 qk_shift=True qk_beta=0.0 qk_freeze=True x0_gate=False block_nudge=False nudge_site=qk qkv_norm_cse=False parallel_block=False par_coalesce=none epoch_shuffle=False epoch_shuffle_seed=1234", "engram": "False site=-1 orders=2,3 heads=1 tables=0 mult=32 mem_dim=128 e_dim=0 key_dim=0 conv_k=4 share=False bf16=True", "batch_ramp": "False grad_accum=(2, 4, 8) bounds=(0.35, 0.75) lr_exp=0.5 ref_grad_accum=4 last_grad_accum=4", "weight_ema": "False decays=(0.995,) start_frac=0.75 seeded=False updates=0", "sched_tricks": "demon_b1=True demon_final=0.55 demon_ref=0.8 demon_start=-1.0 muon_b2=0.9 muon_b2_final=0.0 depth_lr=1.0->1.0 depth_mom=0.0->0.0 depth_mom_ref=0.95", "num_steps": 1053, "total_tokens_M": 138.0, "world_size": 4, "lnc": 2, "seq_len": 2048, "num_params_M": 592.9, "causality_passed": true, "causality_max_abs": 0.0, "public_val_bpb": 1.052797, "eval_seconds": 10.1, "eval_timeout": 1200, "eval_over_timeout": false, "eval_alt_seq_len": 1024, "public_val_bpb_alt": 1.068046, "eval_alt_seconds": 18.0}
{"timestamp": "2026-09-15T03:57:19+00:00", "label": "st-demonfull-900s", "solution": "R1.2", "description": "plan 11.1 item 1 with the anneal spread over the WHOLE run instead of the warmdown window: same 0.8 -> 0.55 endpoints, start_frac 0.0", "launch_command": "NEURON_LOGICAL_NC_CONFIG=2 torchrun --standalone --nproc_per_node=4 train.py --num-steps 5000 --max-train-seconds 900 --out-dir out/st-demonfull-900s --eval-seq-len 1024 --demon-beta1 --demon-beta1-start-frac 0.0", "git_commit": "496befd", "git_dirty": true, "status": "keep", "wall_elapsed_seconds": 983.9, "run_log": "research/run-logs/st-demonfull-900s.log", "checkpoint_path": "out/st-demonfull-900s/final.pt", "training_seconds": 884.8, "budget_seconds": 1800, "target_steps": 5000, "max_train_seconds": 900, "startup_allowance_est": 65.1, "charged_seconds_est": 885.8, "over_budget": false, "total_seconds": 957.3, "compiled": true, "nki_relu2": false, "ngram_ve": "True tables=4 rows=1048576 dim=128 index_gather=True trigram=True opt=rmsprop flat_lr=True bf16=True", "out_bigram": "False bf16=True gate_bias=-2.0 lr=0.0", "oneliners": "relu2_tau=0.0 mlp_sandwich=False head_gate=False hg_norm=True hg_ch=32 hg_mul=2.0 hg_bias=0.0 out_pool=False pool_layers=3 qk_shift=True qk_beta=0.0 qk_freeze=True x0_gate=False block_nudge=False nudge_site=qk qkv_norm_cse=False parallel_block=False par_coalesce=none epoch_shuffle=False epoch_shuffle_seed=1234", "engram": "False site=-1 orders=2,3 heads=1 tables=0 mult=32 mem_dim=128 e_dim=0 key_dim=0 conv_k=4 share=False bf16=True", "batch_ramp": "False grad_accum=(2, 4, 8) bounds=(0.35, 0.75) lr_exp=0.5 ref_grad_accum=4 last_grad_accum=4", "weight_ema": "False decays=(0.995,) start_frac=0.75 seeded=False updates=0", "sched_tricks": "demon_b1=True demon_final=0.55 demon_ref=0.8 demon_start=0.0 muon_b2=0.9 muon_b2_final=0.0 depth_lr=1.0->1.0 depth_mom=0.0->0.0 depth_mom_ref=0.95", "num_steps": 1055, "total_tokens_M": 138.3, "world_size": 4, "lnc": 2, "seq_len": 2048, "num_params_M": 592.9, "causality_passed": true, "causality_max_abs": 0.0, "public_val_bpb": 1.052858, "eval_seconds": 10.0, "eval_timeout": 1200, "eval_over_timeout": false, "eval_alt_seq_len": 1024, "public_val_bpb_alt": 1.068168, "eval_alt_seconds": 17.8}
