{"timestamp": "2026-09-13T09:03:13+00:00", "label": "parall-1630s", "solution": "R1.3", "description": "parallel attn+MLP block with the fully coalesced input projection (one Linear(640,4480) for q,k,v,c_fc, contiguous copies on q/k so the rope+QK-norm NKI kernel still fires). Budget SHORTENED to 1630s so its +10.5% throughput lands it on ~2150 steps, i.e. below the ~2195-step data wall and step-matched to qkfreeze-base-1800s (2155/1.018303) and qkfreeze-frozen-1648s (2149/1.018967).", "launch_command": "NEURON_LOGICAL_NC_CONFIG=2 torchrun --standalone --nproc_per_node=4 train.py --num-steps 5000 --max-train-seconds 1630 --out-dir out/parall-1630s --eval-seq-len 1024 --parallel-block --parallel-block-coalesce all", "git_commit": "496befd", "git_dirty": true, "status": "keep", "wall_elapsed_seconds": 1705.3, "run_log": "research/run-logs/parall-1630s.log", "checkpoint_path": "out/parall-1630s/final.pt", "training_seconds": 1624.9, "budget_seconds": 1800, "target_steps": 5000, "max_train_seconds": 1630, "startup_allowance_est": 52.4, "charged_seconds_est": 1625.3, "over_budget": false, "total_seconds": 1688.6, "compiled": true, "nki_relu2": false, "ngram_ve": "True tables=2 rows=524288 dim=128 index_gather=True trigram=True opt=rmsprop flat_lr=True bf16=True", "out_bigram": "False bf16=True gate_bias=-2.0 lr=0.0", "oneliners": "relu2_tau=0.0 mlp_sandwich=False head_gate=False hg_norm=True hg_ch=32 hg_mul=2.0 hg_bias=0.0 out_pool=False pool_layers=3 qk_shift=False qk_beta=0.3 qk_freeze=False x0_gate=False block_nudge=False nudge_site=qk qkv_norm_cse=False parallel_block=True par_coalesce=all epoch_shuffle=False epoch_shuffle_seed=1234", "batch_ramp": "False grad_accum=(2, 4, 8) bounds=(0.35, 0.75) lr_exp=0.5 ref_grad_accum=4 last_grad_accum=4", "weight_ema": "False decays=(0.995,) start_frac=0.75 seeded=False updates=0", "num_steps": 2127, "total_tokens_M": 278.8, "world_size": 4, "lnc": 2, "seq_len": 2048, "num_params_M": 190.1, "causality_passed": true, "causality_max_abs": 0.0, "public_val_bpb": 1.0332, "eval_seconds": 8.5, "eval_timeout": 1200, "eval_over_timeout": false, "eval_alt_seq_len": 1024, "public_val_bpb_alt": 1.048447, "eval_alt_seconds": 14.1}
{"timestamp": "2026-09-13T09:31:38+00:00", "label": "parvfc-1630s", "solution": "R1.3", "description": "same, coalesce mode vfc (Linear(640,3200) for c_v+c_fc only, c_q/c_k untouched, no contiguous copies at all). Same 1630s step-matched budget.", "launch_command": "NEURON_LOGICAL_NC_CONFIG=2 torchrun --standalone --nproc_per_node=4 train.py --num-steps 5000 --max-train-seconds 1630 --out-dir out/parvfc-1630s --eval-seq-len 1024 --parallel-block --parallel-block-coalesce vfc", "git_commit": "496befd", "git_dirty": true, "status": "keep", "wall_elapsed_seconds": 1705.0, "run_log": "research/run-logs/parvfc-1630s.log", "checkpoint_path": "out/parvfc-1630s/final.pt", "training_seconds": 1624.3, "budget_seconds": 1800, "target_steps": 5000, "max_train_seconds": 1630, "startup_allowance_est": 52.8, "charged_seconds_est": 1624.7, "over_budget": false, "total_seconds": 1687.9, "compiled": true, "nki_relu2": false, "ngram_ve": "True tables=2 rows=524288 dim=128 index_gather=True trigram=True opt=rmsprop flat_lr=True bf16=True", "out_bigram": "False bf16=True gate_bias=-2.0 lr=0.0", "oneliners": "relu2_tau=0.0 mlp_sandwich=False head_gate=False hg_norm=True hg_ch=32 hg_mul=2.0 hg_bias=0.0 out_pool=False pool_layers=3 qk_shift=False qk_beta=0.3 qk_freeze=False x0_gate=False block_nudge=False nudge_site=qk qkv_norm_cse=False parallel_block=True par_coalesce=vfc epoch_shuffle=False epoch_shuffle_seed=1234", "batch_ramp": "False grad_accum=(2, 4, 8) bounds=(0.35, 0.75) lr_exp=0.5 ref_grad_accum=4 last_grad_accum=4", "weight_ema": "False decays=(0.995,) start_frac=0.75 seeded=False updates=0", "num_steps": 2143, "total_tokens_M": 280.9, "world_size": 4, "lnc": 2, "seq_len": 2048, "num_params_M": 190.1, "causality_passed": true, "causality_max_abs": 0.0, "public_val_bpb": 1.032908, "eval_seconds": 8.4, "eval_timeout": 1200, "eval_over_timeout": false, "eval_alt_seq_len": 1024, "public_val_bpb_alt": 1.048085, "eval_alt_seconds": 14.1}
{"timestamp": "2026-09-04T18:12:53+00:00", "label": "pr6-sanity-warmstart", "solution": "98", "description": "sanity check: PR6-merged train.py, warm-start from final-confirmation", "launch_command": "NEURON_LOGICAL_NC_CONFIG=1 torchrun --standalone --nproc_per_node=1 train.py --num-steps 20 --max-train-seconds 60 --out-dir out/pr6-sanity-warmstart --init-from out/final-confirmation/final.pt", "git_commit": "838ac53", "git_dirty": true, "status": "keep", "wall_elapsed_seconds": 36.5, "run_log": "research/run-logs/pr6-sanity-warmstart.log", "checkpoint_path": "out/pr6-sanity-warmstart/final.pt", "training_seconds": 14.0, "budget_seconds": 1800, "target_steps": 20, "max_train_seconds": 60, "over_budget": false, "total_seconds": 33.6, "compiled": false, "nki_relu2": false, "num_steps": 20, "total_tokens_M": 1.3, "world_size": 1, "lnc": 1, "seq_len": 1024, "num_params_M": 85.9, "causality_passed": true, "causality_max_abs": 0.0, "public_val_bpb": 1.157526, "eval_seconds": 14.6, "eval_timeout": 1200, "eval_over_timeout": false}
{"timestamp": "2026-09-13T05:00:59+00:00", "label": "qkfreeze-base-1800s", "solution": "T1.x", "description": "fresh same-commit 1800s control for the frozen qk-shift probe", "launch_command": "NEURON_LOGICAL_NC_CONFIG=2 torchrun --standalone --nproc_per_node=4 train.py --num-steps 5000 --max-train-seconds 1800 --out-dir out/qkfreeze-base-1800s --eval-seq-len 1024", "git_commit": "496befd", "git_dirty": true, "status": "keep", "wall_elapsed_seconds": 2073.0, "run_log": "research/run-logs/qkfreeze-base-1800s.log", "checkpoint_path": "out/qkfreeze-base-1800s/final.pt", "training_seconds": 1794.5, "budget_seconds": 1800, "target_steps": 5000, "max_train_seconds": 1800, "startup_allowance_est": 250.2, "charged_seconds_est": 1794.9, "over_budget": false, "total_seconds": 2047.2, "compiled": true, "nki_relu2": false, "ngram_ve": "True tables=2 rows=524288 dim=128 index_gather=True trigram=True opt=rmsprop flat_lr=True bf16=True", "out_bigram": "False bf16=True gate_bias=-2.0 lr=0.0", "oneliners": "relu2_tau=0.0 mlp_sandwich=False head_gate=False hg_norm=True hg_ch=32 hg_mul=2.0 hg_bias=0.0 out_pool=False pool_layers=3 qk_shift=False qk_beta=0.3 qk_freeze=False x0_gate=False", "batch_ramp": "False grad_accum=(2, 4, 8) bounds=(0.35, 0.75) lr_exp=0.5 ref_grad_accum=4 last_grad_accum=4", "weight_ema": "False decays=(0.995,) start_frac=0.75 seeded=False updates=0", "num_steps": 2155, "total_tokens_M": 282.5, "world_size": 4, "lnc": 2, "seq_len": 2048, "num_params_M": 190.1, "causality_passed": true, "causality_max_abs": 0.0, "public_val_bpb": 1.018303, "eval_seconds": 8.4, "eval_timeout": 1200, "eval_over_timeout": false, "eval_alt_seq_len": 1024, "public_val_bpb_alt": 1.033265, "eval_alt_seconds": 14.2}
{"timestamp": "2026-09-13T06:16:50+00:00", "label": "qkfreeze-frozen-1648s", "solution": "T1.x", "description": "frozen qk-shift beta=0 at a SHORTENED 1648s budget, chosen so it lands on the 1800s control step count (2155): same steps, same tokens, same schedule shape, no epoch-2 crossing. Separates the identity holding end-to-end from the extra steps replaying the corpus.", "launch_command": "NEURON_LOGICAL_NC_CONFIG=2 torchrun --standalone --nproc_per_node=4 train.py --num-steps 5000 --max-train-seconds 1648 --out-dir out/qkfreeze-frozen-1648s --eval-seq-len 1024 --qk-shift --qk-shift-beta 0.0 --qk-shift-freeze", "git_commit": "496befd", "git_dirty": true, "status": "keep", "wall_elapsed_seconds": 1732.9, "run_log": "research/run-logs/qkfreeze-frozen-1648s.log", "checkpoint_path": "out/qkfreeze-frozen-1648s/final.pt", "training_seconds": 1642.6, "budget_seconds": 1800, "target_steps": 5000, "max_train_seconds": 1648, "startup_allowance_est": 60.0, "charged_seconds_est": 1643.0, "over_budget": false, "total_seconds": 1707.5, "compiled": true, "nki_relu2": false, "ngram_ve": "True tables=2 rows=524288 dim=128 index_gather=True trigram=True opt=rmsprop flat_lr=True bf16=True", "out_bigram": "False bf16=True gate_bias=-2.0 lr=0.0", "oneliners": "relu2_tau=0.0 mlp_sandwich=False head_gate=False hg_norm=True hg_ch=32 hg_mul=2.0 hg_bias=0.0 out_pool=False pool_layers=3 qk_shift=True qk_beta=0.0 qk_freeze=True x0_gate=False", "batch_ramp": "False grad_accum=(2, 4, 8) bounds=(0.35, 0.75) lr_exp=0.5 ref_grad_accum=4 last_grad_accum=4", "weight_ema": "False decays=(0.995,) start_frac=0.75 seeded=False updates=0", "num_steps": 2150, "total_tokens_M": 281.8, "world_size": 4, "lnc": 2, "seq_len": 2048, "num_params_M": 190.1, "causality_passed": true, "causality_max_abs": 0.0, "public_val_bpb": 1.018967, "eval_seconds": 9.1, "eval_timeout": 1200, "eval_over_timeout": false, "eval_alt_seq_len": 1024, "public_val_bpb_alt": 1.033777, "eval_alt_seconds": 15.8}
{"timestamp": "2026-09-13T05:34:28+00:00", "label": "qkfreeze-frozen-1800s", "solution": "T1.x", "description": "frozen qk_shift_beta==0 (requires_grad=False, in no optimizer group): a mathematical no-op whose elementwise ops stay in the compiled block body", "launch_command": "NEURON_LOGICAL_NC_CONFIG=2 torchrun --standalone --nproc_per_node=4 train.py --num-steps 5000 --max-train-seconds 1800 --out-dir out/qkfreeze-frozen-1800s --eval-seq-len 1024 --qk-shift --qk-shift-beta 0.0 --qk-shift-freeze", "git_commit": "496befd", "git_dirty": true, "status": "keep", "wall_elapsed_seconds": 2008.4, "run_log": "research/run-logs/qkfreeze-frozen-1800s.log", "checkpoint_path": "out/qkfreeze-frozen-1800s/final.pt", "training_seconds": 1794.9, "budget_seconds": 1800, "target_steps": 5000, "max_train_seconds": 1800, "startup_allowance_est": 183.0, "charged_seconds_est": 1795.3, "over_budget": false, "total_seconds": 1981.9, "compiled": true, "nki_relu2": false, "ngram_ve": "True tables=2 rows=524288 dim=128 index_gather=True trigram=True opt=rmsprop flat_lr=True bf16=True", "out_bigram": "False bf16=True gate_bias=-2.0 lr=0.0", "oneliners": "relu2_tau=0.0 mlp_sandwich=False head_gate=False hg_norm=True hg_ch=32 hg_mul=2.0 hg_bias=0.0 out_pool=False pool_layers=3 qk_shift=True qk_beta=0.0 qk_freeze=True x0_gate=False", "batch_ramp": "False grad_accum=(2, 4, 8) bounds=(0.35, 0.75) lr_exp=0.5 ref_grad_accum=4 last_grad_accum=4", "weight_ema": "False decays=(0.995,) start_frac=0.75 seeded=False updates=0", "num_steps": 2354, "total_tokens_M": 308.5, "world_size": 4, "lnc": 2, "seq_len": 2048, "num_params_M": 190.1, "causality_passed": true, "causality_max_abs": 0.0, "public_val_bpb": 1.021278, "eval_seconds": 9.1, "eval_timeout": 1200, "eval_over_timeout": false, "eval_alt_seq_len": 1024, "public_val_bpb_alt": 1.036399, "eval_alt_seconds": 15.8}
{"timestamp": "2026-09-08T16:39:39+00:00", "label": "rwkv-fixed995", "solution": "R1", "description": "STEELMAN: pure RWKV at the 900s baselines own step count (995) -- would RWKV win if a kernel made the mixer free?", "launch_command": "NEURON_LOGICAL_NC_CONFIG=2 torchrun --standalone --nproc_per_node=4 train.py --num-steps 995 --max-train-seconds 2400 --out-dir out/rwkv-fixed995 --rwkv --rwkv-chunk 256 --no-compile --tensor-lr-scalars --lrm-quantum 0", "git_commit": "124dfb7", "git_dirty": true, "status": "keep", "wall_elapsed_seconds": 1914.2, "run_log": "research/run-logs/rwkv-fixed995.log", "checkpoint_path": "out/rwkv-fixed995/final.pt", "training_seconds": 1858.6, "budget_seconds": 1800, "target_steps": 995, "max_train_seconds": 2400, "startup_allowance_est": 36.1, "charged_seconds_est": 1858.8, "over_budget": true, "total_seconds": 1887.0, "compiled": false, "nki_relu2": false, "num_steps": 995, "total_tokens_M": 130.4, "world_size": 4, "lnc": 2, "seq_len": 2048, "num_params_M": 55.8, "causality_passed": true, "causality_max_abs": 0.0, "public_val_bpb": 1.144032, "eval_seconds": 15.4, "eval_timeout": 1200, "eval_over_timeout": false}
{"timestamp": "2026-09-08T15:49:33+00:00", "label": "rwkv-pure-900s", "solution": "R1", "description": "pure RWKV-x051a all 6 layers, eager, chunk 256, param-matched 55.75M", "launch_command": "NEURON_LOGICAL_NC_CONFIG=2 torchrun --standalone --nproc_per_node=4 train.py --num-steps 5000 --max-train-seconds 900 --out-dir out/rwkv-pure-900s --rwkv --rwkv-chunk 256 --no-compile --tensor-lr-scalars --lrm-quantum 0", "git_commit": "124dfb7", "git_dirty": true, "status": "keep", "wall_elapsed_seconds": 947.7, "run_log": "research/run-logs/rwkv-pure-900s.log", "checkpoint_path": "out/rwkv-pure-900s/final.pt", "training_seconds": 894.4, "budget_seconds": 1800, "target_steps": 5000, "max_train_seconds": 900, "startup_allowance_est": 33.8, "charged_seconds_est": 894.6, "over_budget": false, "total_seconds": 923.0, "compiled": false, "nki_relu2": false, "num_steps": 480, "total_tokens_M": 62.9, "world_size": 4, "lnc": 2, "seq_len": 2048, "num_params_M": 55.8, "causality_passed": true, "causality_max_abs": 0.0, "public_val_bpb": 1.226041, "eval_seconds": 15.5, "eval_timeout": 1200, "eval_over_timeout": false}
{"timestamp": "2026-09-15T15:14:47+00:00", "label": "seedscreen-s1-300", "solution": "seedscreen-prelim", "description": "Preliminary/exploratory CHEAP short-budget seed screen (companion to the 2026-09-15 3-seed full-1800s variance check, seeds 42/43/44 -> max-min 0.006136 / sample std ~0.0032). Fixed 300 steps, locked default config otherwise, seed=1 only. NOT a full-budget bpb, no seed adopted.", "launch_command": "NEURON_LOGICAL_NC_CONFIG=2 torchrun --standalone --nproc_per_node=4 train.py --num-steps 300 --max-train-seconds 3600 --out-dir out/seedscreen-s1-300 --seed 1", "git_commit": "496befd", "git_dirty": true, "status": "keep", "wall_elapsed_seconds": 325.3, "run_log": "research/run-logs/seedscreen-s1-300.log", "checkpoint_path": "out/seedscreen-s1-300/final.pt", "training_seconds": 246.7, "budget_seconds": 1800, "target_steps": 300, "max_train_seconds": 3600, "startup_allowance_est": 62.9, "charged_seconds_est": 247.6, "over_budget": false, "total_seconds": 300.2, "compiled": true, "nki_relu2": false, "ngram_ve": "True tables=4 rows=1048576 dim=128 index_gather=True trigram=True opt=rmsprop flat_lr=True bf16=True", "out_bigram": "False bf16=True gate_bias=-2.0 lr=0.0", "oneliners": "relu2_tau=0.0 mlp_sandwich=False head_gate=False hg_norm=True hg_ch=32 hg_mul=2.0 hg_bias=0.0 out_pool=False pool_layers=3 qk_shift=True qk_beta=0.0 qk_freeze=True x0_gate=False block_nudge=False nudge_site=qk qkv_norm_cse=False parallel_block=False par_coalesce=none epoch_shuffle=False epoch_shuffle_seed=1234", "engram": "False site=-1 orders=2,3 heads=1 tables=0 mult=32 mem_dim=128 e_dim=0 key_dim=0 conv_k=4 share=False bf16=True", "batch_ramp": "False grad_accum=(2, 4, 8) bounds=(0.35, 0.75) lr_exp=0.5 ref_grad_accum=4 last_grad_accum=4", "weight_ema": "False decays=(0.995,) start_frac=0.75 seeded=False updates=0", "sched_tricks": "demon_b1=False demon_final=0.55 demon_ref=0.8 demon_start=-1.0 muon_b2=0.9 muon_b2_final=0.0 depth_lr=1.0->1.0 depth_mom=0.0->0.0 depth_mom_ref=0.95", "num_steps": 300, "total_tokens_M": 39.3, "world_size": 4, "lnc": 2, "seq_len": 2048, "num_params_M": 592.9, "causality_passed": true, "causality_max_abs": 0.0, "public_val_bpb": 1.225206, "eval_seconds": 9.7, "eval_timeout": 1200, "eval_over_timeout": false}
{"timestamp": "2026-09-15T15:52:39+00:00", "label": "seedscreen-s100-300", "solution": "seedscreen-prelim", "description": "Preliminary/exploratory CHEAP short-budget seed screen (companion to the 2026-09-15 3-seed full-1800s variance check, seeds 42/43/44 -> max-min 0.006136 / sample std ~0.0032). Fixed 300 steps, locked default config otherwise, seed=100 only. NOT a full-budget bpb, no seed adopted.", "launch_command": "NEURON_LOGICAL_NC_CONFIG=2 torchrun --standalone --nproc_per_node=4 train.py --num-steps 300 --max-train-seconds 3600 --out-dir out/seedscreen-s100-300 --seed 100", "git_commit": "496befd", "git_dirty": true, "status": "keep", "wall_elapsed_seconds": 325.5, "run_log": "research/run-logs/seedscreen-s100-300.log", "checkpoint_path": "out/seedscreen-s100-300/final.pt", "training_seconds": 246.8, "budget_seconds": 1800, "target_steps": 300, "max_train_seconds": 3600, "startup_allowance_est": 63.0, "charged_seconds_est": 247.8, "over_budget": false, "total_seconds": 300.3, "compiled": true, "nki_relu2": false, "ngram_ve": "True tables=4 rows=1048576 dim=128 index_gather=True trigram=True opt=rmsprop flat_lr=True bf16=True", "out_bigram": "False bf16=True gate_bias=-2.0 lr=0.0", "oneliners": "relu2_tau=0.0 mlp_sandwich=False head_gate=False hg_norm=True hg_ch=32 hg_mul=2.0 hg_bias=0.0 out_pool=False pool_layers=3 qk_shift=True qk_beta=0.0 qk_freeze=True x0_gate=False block_nudge=False nudge_site=qk qkv_norm_cse=False parallel_block=False par_coalesce=none epoch_shuffle=False epoch_shuffle_seed=1234", "engram": "False site=-1 orders=2,3 heads=1 tables=0 mult=32 mem_dim=128 e_dim=0 key_dim=0 conv_k=4 share=False bf16=True", "batch_ramp": "False grad_accum=(2, 4, 8) bounds=(0.35, 0.75) lr_exp=0.5 ref_grad_accum=4 last_grad_accum=4", "weight_ema": "False decays=(0.995,) start_frac=0.75 seeded=False updates=0", "sched_tricks": "demon_b1=False demon_final=0.55 demon_ref=0.8 demon_start=-1.0 muon_b2=0.9 muon_b2_final=0.0 depth_lr=1.0->1.0 depth_mom=0.0->0.0 depth_mom_ref=0.95", "num_steps": 300, "total_tokens_M": 39.3, "world_size": 4, "lnc": 2, "seq_len": 2048, "num_params_M": 592.9, "causality_passed": true, "causality_max_abs": 0.0, "public_val_bpb": 1.226983, "eval_seconds": 9.8, "eval_timeout": 1200, "eval_over_timeout": false}
{"timestamp": "2026-09-15T15:41:54+00:00", "label": "seedscreen-s13-300", "solution": "seedscreen-prelim", "description": "Preliminary/exploratory CHEAP short-budget seed screen (companion to the 2026-09-15 3-seed full-1800s variance check, seeds 42/43/44 -> max-min 0.006136 / sample std ~0.0032). Fixed 300 steps, locked default config otherwise, seed=13 only. NOT a full-budget bpb, no seed adopted.", "launch_command": "NEURON_LOGICAL_NC_CONFIG=2 torchrun --standalone --nproc_per_node=4 train.py --num-steps 300 --max-train-seconds 3600 --out-dir out/seedscreen-s13-300 --seed 13", "git_commit": "496befd", "git_dirty": true, "status": "keep", "wall_elapsed_seconds": 327.8, "run_log": "research/run-logs/seedscreen-s13-300.log", "checkpoint_path": "out/seedscreen-s13-300/final.pt", "training_seconds": 246.9, "budget_seconds": 1800, "target_steps": 300, "max_train_seconds": 3600, "startup_allowance_est": 65.2, "charged_seconds_est": 247.9, "over_budget": false, "total_seconds": 300.5, "compiled": true, "nki_relu2": false, "ngram_ve": "True tables=4 rows=1048576 dim=128 index_gather=True trigram=True opt=rmsprop flat_lr=True bf16=True", "out_bigram": "False bf16=True gate_bias=-2.0 lr=0.0", "oneliners": "relu2_tau=0.0 mlp_sandwich=False head_gate=False hg_norm=True hg_ch=32 hg_mul=2.0 hg_bias=0.0 out_pool=False pool_layers=3 qk_shift=True qk_beta=0.0 qk_freeze=True x0_gate=False block_nudge=False nudge_site=qk qkv_norm_cse=False parallel_block=False par_coalesce=none epoch_shuffle=False epoch_shuffle_seed=1234", "engram": "False site=-1 orders=2,3 heads=1 tables=0 mult=32 mem_dim=128 e_dim=0 key_dim=0 conv_k=4 share=False bf16=True", "batch_ramp": "False grad_accum=(2, 4, 8) bounds=(0.35, 0.75) lr_exp=0.5 ref_grad_accum=4 last_grad_accum=4", "weight_ema": "False decays=(0.995,) start_frac=0.75 seeded=False updates=0", "sched_tricks": "demon_b1=False demon_final=0.55 demon_ref=0.8 demon_start=-1.0 muon_b2=0.9 muon_b2_final=0.0 depth_lr=1.0->1.0 depth_mom=0.0->0.0 depth_mom_ref=0.95", "num_steps": 300, "total_tokens_M": 39.3, "world_size": 4, "lnc": 2, "seq_len": 2048, "num_params_M": 592.9, "causality_passed": true, "causality_max_abs": 0.0, "public_val_bpb": 1.228437, "eval_seconds": 9.7, "eval_timeout": 1200, "eval_over_timeout": false}
