{"timestamp": "2026-09-08T06:36:19+00:00", "label": "m2-pat1-cheap-900s", "solution": "Mamba2LowM", "description": "Best configuration the whole Mamba2 search produced, at the real 900s budget: ONE Mamba2 layer of 6 (AMAAAA) at the cheap geometry (expand=1 d_state=64 conv_kernel=2), eager + NKI kernel. 300-step control: 0.992 s/step / 1.270580 / 50.2M. Predicted 901 steps / 1.1032 against the verified baseline lrmq25-900s 1004 / 1.093785", "launch_command": "NEURON_LOGICAL_NC_CONFIG=2 torchrun --standalone --nproc_per_node=4 train.py --num-steps 5000 --max-train-seconds 900 --out-dir out/m2-pat1-cheap-900s --mamba2 --nki-ssd --no-compile --mamba2-expand 1 --mamba2-d-state 64 --mamba2-conv-kernel 2 --mamba2-pattern AMAAAA", "git_commit": "eb81ae5", "git_dirty": true, "status": "keep", "wall_elapsed_seconds": 943.7, "run_log": "research/run-logs/m2-pat1-cheap-900s.log", "checkpoint_path": "out/m2-pat1-cheap-900s/final.pt", "training_seconds": 894.5, "budget_seconds": 1800, "target_steps": 5000, "max_train_seconds": 900, "startup_allowance_est": 36.4, "charged_seconds_est": 894.6, "over_budget": false, "total_seconds": 918.7, "compiled": false, "nki_relu2": false, "num_steps": 887, "total_tokens_M": 116.3, "world_size": 4, "lnc": 2, "seq_len": 2048, "num_params_M": 50.2, "causality_passed": true, "causality_max_abs": 0.0, "public_val_bpb": 1.106694, "eval_seconds": 7.8, "eval_timeout": 1200, "eval_over_timeout": false}
{"timestamp": "2026-09-08T05:54:23+00:00", "label": "m2-pat2-AAMAAM-300", "solution": "Mamba2Pattern", "description": "Pattern sweep at paper geometry: TWO Mamba2 layers of 6 (AAMAAM)", "launch_command": "NEURON_LOGICAL_NC_CONFIG=2 torchrun --standalone --nproc_per_node=4 train.py --num-steps 300 --max-train-seconds 1500 --out-dir out/m2-pat2-AAMAAM-300 --mamba2 --nki-ssd --no-compile --mamba2-pattern AAMAAM", "git_commit": "eb81ae5", "git_dirty": true, "status": "keep", "wall_elapsed_seconds": 460.6, "run_log": "research/run-logs/m2-pat2-AAMAAM-300.log", "checkpoint_path": "out/m2-pat2-AAMAAM-300/final.pt", "training_seconds": 360.3, "budget_seconds": 1800, "target_steps": 300, "max_train_seconds": 1500, "startup_allowance_est": 85.7, "charged_seconds_est": 360.5, "over_budget": false, "total_seconds": 435.3, "compiled": false, "nki_relu2": false, "num_steps": 300, "total_tokens_M": 39.3, "world_size": 4, "lnc": 2, "seq_len": 2048, "num_params_M": 52.5, "causality_passed": true, "causality_max_abs": 0.0, "public_val_bpb": 1.268748, "eval_seconds": 8.8, "eval_timeout": 1200, "eval_over_timeout": false}
{"timestamp": "2026-09-08T06:18:21+00:00", "label": "m2-pat2-cheap-300", "solution": "Mamba2LowM", "description": "Same at TWO Mamba2 layers of 6 (AAMAAM), to see whether the second mixer still pays once mixers are cheap (at the paper geometry it did not: 1.268748 @1.201)", "launch_command": "NEURON_LOGICAL_NC_CONFIG=2 torchrun --standalone --nproc_per_node=4 train.py --num-steps 300 --max-train-seconds 1500 --out-dir out/m2-pat2-cheap-300 --mamba2 --nki-ssd --no-compile --mamba2-expand 1 --mamba2-d-state 64 --mamba2-conv-kernel 2 --mamba2-pattern AAMAAM", "git_commit": "eb81ae5", "git_dirty": true, "status": "keep", "wall_elapsed_seconds": 397.1, "run_log": "research/run-logs/m2-pat2-cheap-300.log", "checkpoint_path": "out/m2-pat2-cheap-300/final.pt", "training_seconds": 313.0, "budget_seconds": 1800, "target_steps": 300, "max_train_seconds": 1500, "startup_allowance_est": 71.1, "charged_seconds_est": 313.2, "over_budget": false, "total_seconds": 368.3, "compiled": false, "nki_relu2": false, "num_steps": 300, "total_tokens_M": 39.3, "world_size": 4, "lnc": 2, "seq_len": 2048, "num_params_M": 49.8, "causality_passed": true, "causality_max_abs": 0.0, "public_val_bpb": 1.273451, "eval_seconds": 8.1, "eval_timeout": 1200, "eval_over_timeout": false}
{"timestamp": "2026-09-08T06:02:20+00:00", "label": "m2-pat3-AMAMAM-300", "solution": "Mamba2Pattern", "description": "Pattern sweep at paper geometry: THREE Mamba2 layers of 6 (AMAMAM), the midpoint that fixes the sign of the quality-vs-mixer-count trend together with M=1,2 and the existing M=5 (MMAMMM, 1.273513)", "launch_command": "NEURON_LOGICAL_NC_CONFIG=2 torchrun --standalone --nproc_per_node=4 train.py --num-steps 300 --max-train-seconds 1500 --out-dir out/m2-pat3-AMAMAM-300 --mamba2 --nki-ssd --no-compile --mamba2-pattern AMAMAM", "git_commit": "eb81ae5", "git_dirty": true, "status": "keep", "wall_elapsed_seconds": 476.6, "run_log": "research/run-logs/m2-pat3-AMAMAM-300.log", "checkpoint_path": "out/m2-pat3-AMAMAM-300/final.pt", "training_seconds": 375.1, "budget_seconds": 1800, "target_steps": 300, "max_train_seconds": 1500, "startup_allowance_est": 86.8, "charged_seconds_est": 375.2, "over_budget": false, "total_seconds": 450.6, "compiled": false, "nki_relu2": false, "num_steps": 300, "total_tokens_M": 39.3, "world_size": 4, "lnc": 2, "seq_len": 2048, "num_params_M": 43.0, "causality_passed": true, "causality_max_abs": 0.0, "public_val_bpb": 1.282111, "eval_seconds": 9.1, "eval_timeout": 1200, "eval_over_timeout": false}
{"timestamp": "2026-09-07T23:54:47+00:00", "label": "m2hybrid-nki-fixed300", "solution": "mamba2", "description": "Mamba2 hybrid MMAMMM (5 Mamba2 + 1 attention) with the from-scratch NKI SSD kernel, eager (compile measured SLOWER on this path: 2.17 vs 1.96 s/step); fixed 300 steps to isolate quality-per-step from kernel speed", "launch_command": "NEURON_LOGICAL_NC_CONFIG=2 torchrun --standalone --nproc_per_node=4 train.py --num-steps 300 --max-train-seconds 1500 --out-dir out/m2hybrid-nki-fixed300 --mamba2 --mamba2-pattern MMAMMM --nki-ssd --no-compile --tensor-lr-scalars --lrm-quantum 0", "git_commit": "eb81ae5", "git_dirty": true, "status": "keep", "wall_elapsed_seconds": 639.1, "run_log": "research/run-logs/m2hybrid-nki-fixed300.log", "checkpoint_path": "out/m2hybrid-nki-fixed300/final.pt", "training_seconds": 585.1, "budget_seconds": 1800, "target_steps": 300, "max_train_seconds": 1500, "startup_allowance_est": 35.6, "charged_seconds_est": 585.3, "over_budget": false, "total_seconds": 614.5, "compiled": false, "nki_relu2": false, "num_steps": 300, "total_tokens_M": 39.3, "world_size": 4, "lnc": 2, "seq_len": 2048, "num_params_M": 45.0, "causality_passed": true, "causality_max_abs": 0.0, "public_val_bpb": 1.270639, "eval_seconds": 14.1, "eval_timeout": 1200, "eval_over_timeout": false}
{"timestamp": "2026-09-08T00:35:45+00:00", "label": "m2hybrid-nki-fullbudget", "solution": "mamba2", "description": "Mamba2 hybrid MMAMMM (5 Mamba2 mixers + 1 attention) with the from-scratch NKI SSD kernel, eager; full 1800s budget, head-to-head with tensorlr-fullbudget (1995 steps / 1.043489)", "launch_command": "NEURON_LOGICAL_NC_CONFIG=2 torchrun --standalone --nproc_per_node=4 train.py --num-steps 5000 --max-train-seconds 1800 --out-dir out/m2hybrid-nki-fullbudget --mamba2 --mamba2-pattern MMAMMM --nki-ssd --no-compile --tensor-lr-scalars --lrm-quantum 0", "git_commit": "eb81ae5", "git_dirty": true, "status": "keep", "wall_elapsed_seconds": 1847.5, "run_log": "research/run-logs/m2hybrid-nki-fullbudget.log", "checkpoint_path": "out/m2hybrid-nki-fullbudget/final.pt", "training_seconds": 1793.0, "budget_seconds": 1800, "target_steps": 5000, "max_train_seconds": 1800, "startup_allowance_est": 36.1, "charged_seconds_est": 1793.2, "over_budget": false, "total_seconds": 1822.7, "compiled": false, "nki_relu2": false, "num_steps": 908, "total_tokens_M": 119.0, "world_size": 4, "lnc": 2, "seq_len": 2048, "num_params_M": 45.0, "causality_passed": true, "causality_max_abs": 0.0, "public_val_bpb": 1.109065, "eval_seconds": 14.2, "eval_timeout": 1200, "eval_over_timeout": false}
{"timestamp": "2026-09-08T02:40:00+00:00", "label": "m2hybrid-restore-smoke", "solution": "mamba2", "description": "Re-verification of the RESTORED Mamba2 train.py integration after the splice was lost from the working tree (kernels/reference/harness had survived as committed files, only the train.py wiring was gone). Rebuilt Mamba2Mixer + Block/GPT wiring + --mamba2/--mamba2-pattern/--nki-ssd flags from the surviving artifacts and re-ran the ORIGINAL m2hybrid-nki-fixed300 launch config at 15 steps for a directly comparable loss trajectory. num_params and flops_per_token reproduce the original run EXACTLY (44,976,802 / 3.327753e+08), causality still exact, and losses track the original log to ~1e-2 (9.0106/8.7740/8.5291/8.1253/7.7729/6.5456 at steps 0-4,10 vs 9.0110/8.7846/8.5318/8.1182/7.7649/6.5429) -- residual difference is RNG draw-order in the mixer init plus bf16 nondeterminism, not a behavior change. bpb is not comparable at 15 steps. Also re-validated the transplanted NKI kernels in their new home directly on device: fwd max_rel 1.2e-06 vs the eager scan, bwd worst 4.9e-05 across 3 shapes incl. the competition shape, dispatcher confirmed taking the NKI path bit-exactly and falling back when the toggle is off.", "launch_command": "NEURON_LOGICAL_NC_CONFIG=2 torchrun --standalone --nproc_per_node=4 train.py --num-steps 15 --max-train-seconds 300 --out-dir out/m2hybrid-restore-smoke --mamba2 --mamba2-pattern MMAMMM --nki-ssd --no-compile --tensor-lr-scalars --lrm-quantum 0", "git_commit": "7518d91", "git_dirty": true, "status": "keep", "wall_elapsed_seconds": 71.9, "run_log": "research/run-logs/m2hybrid-restore-smoke.log", "checkpoint_path": "out/m2hybrid-restore-smoke/final.pt", "training_seconds": 15.3, "budget_seconds": 1800, "target_steps": 15, "max_train_seconds": 300, "startup_allowance_est": 64.4, "charged_seconds_est": 15.4, "over_budget": false, "total_seconds": 71.9, "compiled": false, "nki_relu2": false, "num_steps": 15, "total_tokens_M": 2.0, "world_size": 4, "lnc": 2, "seq_len": 2048, "num_params_M": 45.0, "causality_passed": true, "causality_max_abs": 0.0, "public_val_bpb": 1.98254, "eval_seconds": 10.6}
{"timestamp": "2026-09-15T08:07:59+00:00", "label": "mlrfp32-arm-900s", "solution": "R1.2", "description": "muon-lr-fp32 ON: keep the lr*g product in fp32 (g upcast, lr untouched, cast down to w's dtype only at the final subtract) instead of letting 0-dim type promotion cast lr to bf16 first. Zero-cost precision fix, no new tensors/ops, no expected throughput impact.", "launch_command": "NEURON_LOGICAL_NC_CONFIG=2 torchrun --standalone --nproc_per_node=4 train.py --num-steps 5000 --max-train-seconds 900 --out-dir out/mlrfp32-arm-900s --eval-seq-len 1024 --muon-lr-fp32", "git_commit": "95038a2", "git_dirty": true, "status": "keep", "wall_elapsed_seconds": 1008.8, "run_log": "research/run-logs/mlrfp32-arm-900s.log", "checkpoint_path": "out/mlrfp32-arm-900s/final.pt", "training_seconds": 884.5, "budget_seconds": 1800, "target_steps": 5000, "max_train_seconds": 900, "startup_allowance_est": 89.2, "charged_seconds_est": 885.6, "over_budget": false, "total_seconds": 981.6, "compiled": true, "nki_relu2": false, "ngram_ve": "True tables=4 rows=1048576 dim=128 index_gather=True trigram=True opt=rmsprop flat_lr=True bf16=True", "out_bigram": "False bf16=True gate_bias=-2.0 lr=0.0", "oneliners": "relu2_tau=0.0 mlp_sandwich=False head_gate=False hg_norm=True hg_ch=32 hg_mul=2.0 hg_bias=0.0 out_pool=False pool_layers=3 qk_shift=True qk_beta=0.0 qk_freeze=True x0_gate=False block_nudge=False nudge_site=qk qkv_norm_cse=False parallel_block=False par_coalesce=none epoch_shuffle=False epoch_shuffle_seed=1234", "engram": "False site=-1 orders=2,3 heads=1 tables=0 mult=32 mem_dim=128 e_dim=0 key_dim=0 conv_k=4 share=False bf16=True", "batch_ramp": "False grad_accum=(2, 4, 8) bounds=(0.35, 0.75) lr_exp=0.5 ref_grad_accum=4 last_grad_accum=4", "weight_ema": "False decays=(0.995,) start_frac=0.75 seeded=False updates=0", "num_steps": 1051, "total_tokens_M": 137.8, "world_size": 4, "lnc": 2, "seq_len": 2048, "num_params_M": 592.9, "causality_passed": true, "causality_max_abs": 0.0, "public_val_bpb": 1.052845, "eval_seconds": 10.2, "eval_timeout": 1200, "eval_over_timeout": false, "eval_alt_seq_len": 1024, "public_val_bpb_alt": 1.068078, "eval_alt_seconds": 18.3}
{"timestamp": "2026-09-15T07:49:51+00:00", "label": "mlrfp32-ctrl-900s-r1", "solution": "R1.2", "description": "fresh same-commit 900s control for the --muon-lr-fp32 A/B, flag OFF (locked default: 0-dim fp32 lr gets cast to bf16 before the multiply against the bf16 Newton-Schulz iterate)", "launch_command": "NEURON_LOGICAL_NC_CONFIG=2 torchrun --standalone --nproc_per_node=4 train.py --num-steps 5000 --max-train-seconds 900 --out-dir out/mlrfp32-ctrl-900s-r1 --eval-seq-len 1024", "git_commit": "n/a (box2 had no .git at run time -- see the 2026-09-15 muon-lr-fp32 section of trn2-experiment-results.md)", "git_dirty": null, "status": "keep", "wall_elapsed_seconds": null, "run_log": "research/run-logs/mlrfp32-ctrl-900s-r1.log", "checkpoint_path": "out/mlrfp32-ctrl-900s-r1/final.pt", "training_seconds": 884.7, "budget_seconds": 1800, "target_steps": 5000, "max_train_seconds": 900, "startup_allowance_est": 84.8, "charged_seconds_est": 885.7, "over_budget": false, "total_seconds": 979.7, "compiled": true, "nki_relu2": false, "nki_muon": false, "compile_muon": true, "muon_lr_fp32": false, "ngram_ve": "True tables=4 rows=1048576 dim=128 index_gather=True trigram=True opt=rmsprop flat_lr=True bf16=True", "out_bigram": "False bf16=True gate_bias=-2.0 lr=0.0", "oneliners": "relu2_tau=0.0 mlp_sandwich=False head_gate=False hg_norm=True hg_ch=32 hg_mul=2.0 hg_bias=0.0 out_pool=False pool_layers=3 qk_shift=True qk_beta=0.0 qk_freeze=True x0_gate=False block_nudge=False nudge_site=qk qkv_norm_cse=False parallel_block=False par_coalesce=none epoch_shuffle=False epoch_shuffle_seed=1234", "engram": "False site=-1 orders=2,3 heads=1 tables=0 mult=32 mem_dim=128 e_dim=0 key_dim=0 conv_k=4 share=False bf16=True", "batch_ramp": "False grad_accum=(2, 4, 8) bounds=(0.35, 0.75) lr_exp=0.5 ref_grad_accum=4 last_grad_accum=4", "weight_ema": "False decays=(0.995,) start_frac=0.75 seeded=False updates=0", "sched_tricks": "demon_b1=False demon_final=0.55 demon_ref=0.8 demon_start=-1.0 muon_b2=0.9 muon_b2_final=0.0 depth_lr=1.0->1.0 depth_mom=0.0->0.0 depth_mom_ref=0.95", "num_steps": 1058, "total_tokens_M": 138.7, "world_size": 4, "lnc": 2, "seq_len": 2048, "num_params_M": 592.9, "causality_passed": true, "causality_max_abs": 0.0, "public_val_bpb": 1.052438, "eval_seconds": 10.1, "eval_timeout": 1200, "eval_over_timeout": false, "eval_alt_seq_len": 1024, "public_val_bpb_alt": 1.067705, "eval_alt_seconds": 17.9}
{"timestamp": "2026-09-15T08:24:22+00:00", "label": "mlrfp32-ctrl-900s-r2", "solution": "R1.2", "description": "closing same-commit 900s control: measures this block's own drift/noise band", "launch_command": "NEURON_LOGICAL_NC_CONFIG=2 torchrun --standalone --nproc_per_node=4 train.py --num-steps 5000 --max-train-seconds 900 --out-dir out/mlrfp32-ctrl-900s-r2 --eval-seq-len 1024", "git_commit": "95038a2", "git_dirty": true, "status": "keep", "wall_elapsed_seconds": 982.8, "run_log": "research/run-logs/mlrfp32-ctrl-900s-r2.log", "checkpoint_path": "out/mlrfp32-ctrl-900s-r2/final.pt", "training_seconds": 884.7, "budget_seconds": 1800, "target_steps": 5000, "max_train_seconds": 900, "startup_allowance_est": 63.6, "charged_seconds_est": 885.7, "over_budget": false, "total_seconds": 957.8, "compiled": true, "nki_relu2": false, "ngram_ve": "True tables=4 rows=1048576 dim=128 index_gather=True trigram=True opt=rmsprop flat_lr=True bf16=True", "out_bigram": "False bf16=True gate_bias=-2.0 lr=0.0", "oneliners": "relu2_tau=0.0 mlp_sandwich=False head_gate=False hg_norm=True hg_ch=32 hg_mul=2.0 hg_bias=0.0 out_pool=False pool_layers=3 qk_shift=True qk_beta=0.0 qk_freeze=True x0_gate=False block_nudge=False nudge_site=qk qkv_norm_cse=False parallel_block=False par_coalesce=none epoch_shuffle=False epoch_shuffle_seed=1234", "engram": "False site=-1 orders=2,3 heads=1 tables=0 mult=32 mem_dim=128 e_dim=0 key_dim=0 conv_k=4 share=False bf16=True", "batch_ramp": "False grad_accum=(2, 4, 8) bounds=(0.35, 0.75) lr_exp=0.5 ref_grad_accum=4 last_grad_accum=4", "weight_ema": "False decays=(0.995,) start_frac=0.75 seeded=False updates=0", "num_steps": 1053, "total_tokens_M": 138.0, "world_size": 4, "lnc": 2, "seq_len": 2048, "num_params_M": 592.9, "causality_passed": true, "causality_max_abs": 0.0, "public_val_bpb": 1.052748, "eval_seconds": 10.0, "eval_timeout": 1200, "eval_over_timeout": false, "eval_alt_seq_len": 1024, "public_val_bpb_alt": 1.067972, "eval_alt_seconds": 17.9}
{"timestamp": "2026-09-08T07:46:47+00:00", "label": "momwarm100-900s", "solution": "Tier0", "description": "MUON_MOMENTUM_WARMUP_STEPS 300->100 resweep under the new ~2000-step regime", "launch_command": "NEURON_LOGICAL_NC_CONFIG=2 torchrun --standalone --nproc_per_node=4 train.py --num-steps 5000 --max-train-seconds 900 --out-dir out/momwarm100-900s", "git_commit": "4f3e090", "git_dirty": true, "status": "keep", "wall_elapsed_seconds": 950.8, "run_log": "research/run-logs/momwarm100-900s.log", "checkpoint_path": "out/momwarm100-900s/final.pt", "training_seconds": 894.5, "budget_seconds": 1800, "target_steps": 5000, "max_train_seconds": 900, "startup_allowance_est": 44.5, "charged_seconds_est": 894.7, "over_budget": false, "total_seconds": 927.1, "compiled": true, "nki_relu2": false, "num_steps": 976, "total_tokens_M": 127.9, "world_size": 4, "lnc": 2, "seq_len": 2048, "num_params_M": 55.7, "causality_passed": true, "causality_max_abs": 0.0, "public_val_bpb": 1.098676, "eval_seconds": 7.6, "eval_timeout": 1200, "eval_over_timeout": false}
{"timestamp": "2026-09-08T07:29:58+00:00", "label": "momwarm700-900s", "solution": "Tier0", "description": "MUON_MOMENTUM_WARMUP_STEPS 300->700 resweep under the new ~2000-step regime", "launch_command": "NEURON_LOGICAL_NC_CONFIG=2 torchrun --standalone --nproc_per_node=4 train.py --num-steps 5000 --max-train-seconds 900 --out-dir out/momwarm700-900s", "git_commit": "6646980", "git_dirty": true, "status": "keep", "wall_elapsed_seconds": 1022.8, "run_log": "research/run-logs/momwarm700-900s.log", "checkpoint_path": "out/momwarm700-900s/final.pt", "training_seconds": 894.9, "budget_seconds": 1800, "target_steps": 5000, "max_train_seconds": 900, "startup_allowance_est": 115.9, "charged_seconds_est": 895.1, "over_budget": false, "total_seconds": 999.0, "compiled": true, "nki_relu2": false, "num_steps": 979, "total_tokens_M": 128.3, "world_size": 4, "lnc": 2, "seq_len": 2048, "num_params_M": 55.7, "causality_passed": true, "causality_max_abs": 0.0, "public_val_bpb": 1.097288, "eval_seconds": 7.6, "eval_timeout": 1200, "eval_over_timeout": false}
{"timestamp": "2026-09-08T00:47:00+00:00", "label": "mudd-900s-nan", "solution": "MUDD", "description": "MUDD real A/B attempt #1 at the locked shape, 900s budget -- diverged to NaN around step ~270-280 (loss climbed 4.7->6+ then oscillated before NaN, while the same optimizer/schedule trains the baseline stably past 900+ steps)", "launch_command": "NEURON_LOGICAL_NC_CONFIG=2 torchrun --standalone --nproc_per_node=4 train.py --num-steps 5000 --max-train-seconds 900 --out-dir out/mudd-900s --mudd --no-dcmha --tensor-lr-scalars --lrm-quantum 0", "git_commit": "8f3c4e8", "git_dirty": true, "status": "crash", "wall_elapsed_seconds": 1500.0, "run_log": "research/run-logs/mudd-900s-nan.log", "note": "Root cause: MuddCompose.w1/w2/bias (real weight matrices, not true scalars) were in the SCALAR_LR=0.20 AdamW group (8x more aggressive than MATRIX_LR=0.025) -- an implementation/hyperparameter bug, not a fundamental flaw in the MUDD mechanism. Fixed by giving them their own AdamW group at MATRIX_LR; see mudd-900s-v2 for the retest."}
{"timestamp": "2026-09-08T01:05:00+00:00", "label": "mudd-900s-v2", "solution": "MUDD", "description": "MUDD real A/B at the locked shape, 900s budget, after fixing the optimizer-group LR bug (MuddCompose params moved from SCALAR_LR=0.20 to their own MATRIX_LR=0.025 AdamW group) -- trains stably, real result vs baseline tensorlr-900s (995 steps/1.094327)", "launch_command": "NEURON_LOGICAL_NC_CONFIG=2 torchrun --standalone --nproc_per_node=4 train.py --num-steps 5000 --max-train-seconds 900 --out-dir out/mudd-900s-v2 --mudd --no-dcmha --tensor-lr-scalars --lrm-quantum 0", "git_commit": "8f3c4e8", "git_dirty": true, "status": "keep", "wall_elapsed_seconds": 1727.8, "run_log": "research/run-logs/mudd-900s-v2.log", "checkpoint_path": "out/mudd-900s-v2/final.pt", "training_seconds": 894.3, "budget_seconds": 1800, "target_steps": 5000, "max_train_seconds": 900, "startup_allowance_est": 818.7, "charged_seconds_est": 894.5, "over_budget": false, "total_seconds": 1727.8, "compiled": true, "num_steps": 646, "total_tokens_M": 84.7, "world_size": 4, "lnc": 2, "seq_len": 2048, "num_params_M": 55.8, "causality_passed": true, "causality_max_abs": 0.0, "public_val_bpb": 1.146435, "eval_seconds": 8.7, "eval_timeout": 1200, "eval_over_timeout": false, "verdict": "REAL NEGATIVE, both dimensions worse than baseline: 646 steps/1.146435 vs 995 steps/1.094327. dt~1.40s/step vs baseline's ~0.90s/step (O(L) dense-connection compute overhead), and worse quality even accounting for fewer steps. Consistent with the paper's own depth-scaling framing: MUDD's demonstrated benefit is at LM depths >=24 layers (up to 42); this repo's locked DEPTH=6 is well below anything the paper tests. Not kept, default OFF."}
