{"timestamp": "2026-09-06T07:28:10+00:00", "label": "sol11-width640-batch131072", "solution": "Solution 11", "description": "Batch resweep at new locked width n_embd=640: TOTAL_BATCH_SIZE=131072, kernel ON (default)", "launch_command": "NEURON_LOGICAL_NC_CONFIG=1 torchrun --standalone --nproc_per_node=8 train.py --num-steps 5000 --max-train-seconds 900 --out-dir out/sol11-width640-batch131072", "git_commit": "5e2f3b3", "git_dirty": true, "status": "keep", "wall_elapsed_seconds": 939.0, "run_log": "research/run-logs/sol11-width640-batch131072.log", "checkpoint_path": "out/sol11-width640-batch131072/final.pt", "training_seconds": 893.0, "budget_seconds": 1800, "target_steps": 5000, "max_train_seconds": 900, "startup_allowance_est": 30.0, "charged_seconds_est": 893.2, "over_budget": false, "total_seconds": 914.7, "compiled": false, "nki_relu2": false, "num_steps": 240, "total_tokens_M": 31.5, "world_size": 8, "lnc": 1, "seq_len": 1024, "num_params_M": 55.7, "causality_passed": true, "causality_max_abs": 0.0, "public_val_bpb": 1.269318, "eval_seconds": 11.6, "eval_timeout": 1200, "eval_over_timeout": false}
{"timestamp": "2026-09-06T07:49:27+00:00", "label": "sol11-width640-batch262144", "solution": "Solution 11", "description": "Batch resweep at new locked width n_embd=640: TOTAL_BATCH_SIZE=262144, kernel ON (default)", "launch_command": "NEURON_LOGICAL_NC_CONFIG=1 torchrun --standalone --nproc_per_node=8 train.py --num-steps 5000 --max-train-seconds 900 --out-dir out/sol11-width640-batch262144", "git_commit": "6fbbfc0", "git_dirty": true, "status": "keep", "wall_elapsed_seconds": 938.3, "run_log": "research/run-logs/sol11-width640-batch262144.log", "checkpoint_path": "out/sol11-width640-batch262144/final.pt", "training_seconds": 884.9, "budget_seconds": 1800, "target_steps": 5000, "max_train_seconds": 900, "startup_allowance_est": 37.5, "charged_seconds_est": 885.1, "over_budget": false, "total_seconds": 912.6, "compiled": false, "nki_relu2": false, "num_steps": 160, "total_tokens_M": 41.9, "world_size": 8, "lnc": 1, "seq_len": 1024, "num_params_M": 55.7, "causality_passed": true, "causality_max_abs": 0.0, "public_val_bpb": 1.307378, "eval_seconds": 11.7, "eval_timeout": 1200, "eval_over_timeout": false}
{"timestamp": "2026-09-06T07:09:00+00:00", "label": "sol11-width640-batch65536", "solution": "Solution 11", "description": "Batch resweep at new locked width n_embd=640: TOTAL_BATCH_SIZE=65536, kernel ON (default)", "launch_command": "NEURON_LOGICAL_NC_CONFIG=1 torchrun --standalone --nproc_per_node=8 train.py --num-steps 5000 --max-train-seconds 900 --out-dir out/sol11-width640-batch65536", "git_commit": "ff7c139", "git_dirty": true, "status": "keep", "wall_elapsed_seconds": 932.9, "run_log": "research/run-logs/sol11-width640-batch65536.log", "checkpoint_path": "out/sol11-width640-batch65536/final.pt", "training_seconds": 889.0, "budget_seconds": 1800, "target_steps": 5000, "max_train_seconds": 900, "startup_allowance_est": 27.9, "charged_seconds_est": 889.2, "over_budget": false, "total_seconds": 907.4, "compiled": false, "nki_relu2": false, "num_steps": 375, "total_tokens_M": 24.6, "world_size": 8, "lnc": 1, "seq_len": 1024, "num_params_M": 55.7, "causality_passed": true, "causality_max_abs": 0.0, "public_val_bpb": 1.279503, "eval_seconds": 11.6, "eval_timeout": 1200, "eval_over_timeout": false}
{"timestamp": "2026-09-06T06:52:23+00:00", "label": "sol11-width640-kernel-smoke", "solution": "Solution 11/12", "description": "Smoke test: kernel default ON at new locked width n_embd=640 (ASPECT_RATIO=96) -- crash/causality check before batch resweep", "launch_command": "NEURON_LOGICAL_NC_CONFIG=1 torchrun --standalone --nproc_per_node=1 train.py --num-steps 15 --max-train-seconds 200 --out-dir out/sol11-width640-kernel-smoke --eval-tokens 65536", "git_commit": "a5c1d38", "git_dirty": true, "status": "keep", "wall_elapsed_seconds": 121.0, "run_log": "research/run-logs/sol11-width640-kernel-smoke.log", "checkpoint_path": "out/sol11-width640-kernel-smoke/final.pt", "training_seconds": 71.9, "budget_seconds": 1800, "target_steps": 15, "max_train_seconds": 200, "startup_allowance_est": 43.3, "charged_seconds_est": 72.1, "over_budget": false, "total_seconds": 110.2, "compiled": false, "nki_relu2": false, "num_steps": 15, "total_tokens_M": 2.0, "world_size": 1, "lnc": 1, "seq_len": 1024, "num_params_M": 55.7, "causality_passed": true, "causality_max_abs": 0.0, "public_val_bpb": 2.094077, "eval_seconds": 2.2, "eval_timeout": 1200, "eval_over_timeout": false}
{"timestamp": "2026-09-06T04:11:54+00:00", "label": "sol12-default-on-check", "solution": "12", "description": "verify --nki-rope-norm now defaults ON with no flag passed, at final locked config", "launch_command": "NEURON_LOGICAL_NC_CONFIG=1 torchrun --standalone --nproc_per_node=1 train.py --num-steps 15 --max-train-seconds 200 --out-dir out/sol12-default-on-check --eval-tokens 65536", "git_commit": "4622122", "git_dirty": true, "status": "keep", "wall_elapsed_seconds": 88.5, "run_log": "research/run-logs/sol12-default-on-check.log", "checkpoint_path": "out/sol12-default-on-check/final.pt", "training_seconds": 48.8, "budget_seconds": 1800, "target_steps": 15, "max_train_seconds": 200, "startup_allowance_est": 34.5, "charged_seconds_est": 48.9, "over_budget": false, "total_seconds": 76.5, "compiled": false, "nki_relu2": false, "num_steps": 15, "total_tokens_M": 2.0, "world_size": 1, "lnc": 1, "seq_len": 1024, "num_params_M": 26.4, "causality_passed": true, "causality_max_abs": 0.0, "public_val_bpb": 2.061198, "eval_seconds": 1.7, "eval_timeout": 1200, "eval_over_timeout": false}
{"timestamp": "2026-09-06T04:13:37+00:00", "label": "sol12-explicit-off-check", "solution": "12", "description": "verify --no-nki-rope-norm correctly disables it", "launch_command": "NEURON_LOGICAL_NC_CONFIG=1 torchrun --standalone --nproc_per_node=1 train.py --num-steps 15 --max-train-seconds 200 --out-dir out/sol12-explicit-off-check --eval-tokens 65536 --no-nki-rope-norm", "git_commit": "90dec3f", "git_dirty": true, "status": "keep", "wall_elapsed_seconds": 103.5, "run_log": "research/run-logs/sol12-explicit-off-check.log", "checkpoint_path": "out/sol12-explicit-off-check/final.pt", "training_seconds": 59.5, "budget_seconds": 1800, "target_steps": 15, "max_train_seconds": 200, "startup_allowance_est": 38.4, "charged_seconds_est": 59.6, "over_budget": false, "total_seconds": 92.0, "compiled": false, "nki_relu2": false, "num_steps": 15, "total_tokens_M": 2.0, "world_size": 1, "lnc": 1, "seq_len": 1024, "num_params_M": 26.4, "causality_passed": true, "causality_max_abs": 0.0, "public_val_bpb": 2.061073, "eval_seconds": 2.2, "eval_timeout": 1200, "eval_over_timeout": false}
{"timestamp": "2026-09-06T04:52:41+00:00", "label": "sol12-kernel-on-fullbudget", "solution": "Solution 12", "description": "Final headline confirmation: DEPTH=6, TOTAL_BATCH_SIZE=131072, rope+QK-norm NKI kernel ON (default), full 1800s budget, world_size=8", "launch_command": "NEURON_LOGICAL_NC_CONFIG=1 torchrun --standalone --nproc_per_node=8 train.py --num-steps 5000 --max-train-seconds 1800 --out-dir out/sol12-kernel-on-fullbudget", "git_commit": "10a0ef8", "git_dirty": true, "status": "keep", "wall_elapsed_seconds": 1836.8, "run_log": "research/run-logs/sol12-kernel-on-fullbudget.log", "checkpoint_path": "out/sol12-kernel-on-fullbudget/final.pt", "training_seconds": 1790.5, "budget_seconds": 1800, "target_steps": 5000, "max_train_seconds": 1800, "startup_allowance_est": 31.0, "charged_seconds_est": 1790.6, "over_budget": false, "total_seconds": 1808.9, "compiled": false, "nki_relu2": false, "num_steps": 581, "total_tokens_M": 76.2, "world_size": 8, "lnc": 1, "seq_len": 1024, "num_params_M": 26.4, "causality_passed": true, "causality_max_abs": 0.0, "public_val_bpb": 1.197595, "eval_seconds": 10.4, "eval_timeout": 1200, "eval_over_timeout": false}
{"timestamp": "2026-09-06T03:03:33+00:00", "label": "sol12-ropenorm-8way-smoke", "solution": "12", "description": "8-way smoke test of fused rope+QK-norm NKI kernel (--nki-rope-norm), 20 steps, real submission shape", "launch_command": "NEURON_LOGICAL_NC_CONFIG=1 torchrun --standalone --nproc_per_node=8 train.py --num-steps 20 --max-train-seconds 300 --out-dir out/sol12-ropenorm-8way-smoke --nki-rope-norm", "git_commit": "50f9fb0", "git_dirty": true, "status": "keep", "wall_elapsed_seconds": 82.9, "run_log": "research/run-logs/sol12-ropenorm-8way-smoke.log", "checkpoint_path": "out/sol12-ropenorm-8way-smoke/final.pt", "training_seconds": 31.8, "budget_seconds": 1800, "target_steps": 20, "max_train_seconds": 300, "startup_allowance_est": 37.0, "charged_seconds_est": 31.9, "over_budget": false, "total_seconds": 55.0, "compiled": false, "nki_relu2": false, "num_steps": 20, "total_tokens_M": 5.2, "world_size": 8, "lnc": 1, "seq_len": 1024, "num_params_M": 26.4, "causality_passed": true, "causality_max_abs": 0.0, "public_val_bpb": 1.965484, "eval_seconds": 10.4, "eval_timeout": 1200, "eval_over_timeout": false}
{"timestamp": "2026-09-06T04:06:48+00:00", "label": "sol12-ropenorm-off-131072", "solution": "12", "description": "rope+QK-norm kernel A/B, toggle OFF, at final locked TOTAL_BATCH_SIZE=131072, 8-way, fixed steps", "launch_command": "NEURON_LOGICAL_NC_CONFIG=1 torchrun --standalone --nproc_per_node=8 train.py --num-steps 30 --max-train-seconds 300 --out-dir out/sol12-ropenorm-off-131072", "git_commit": "913ee2b", "git_dirty": true, "status": "keep", "wall_elapsed_seconds": 78.1, "run_log": "research/run-logs/sol12-ropenorm-off-131072.log", "checkpoint_path": "out/sol12-ropenorm-off-131072/final.pt", "training_seconds": 33.2, "budget_seconds": 1800, "target_steps": 30, "max_train_seconds": 300, "startup_allowance_est": 28.7, "charged_seconds_est": 33.3, "over_budget": false, "total_seconds": 54.1, "compiled": false, "nki_relu2": false, "num_steps": 30, "total_tokens_M": 3.9, "world_size": 8, "lnc": 1, "seq_len": 1024, "num_params_M": 26.4, "causality_passed": true, "causality_max_abs": 0.0, "public_val_bpb": 1.950521, "eval_seconds": 12.6, "eval_timeout": 1200, "eval_over_timeout": false}
{"timestamp": "2026-09-06T04:08:13+00:00", "label": "sol12-ropenorm-on-131072", "solution": "12", "description": "rope+QK-norm kernel A/B, toggle ON, at final locked TOTAL_BATCH_SIZE=131072, 8-way, fixed steps", "launch_command": "NEURON_LOGICAL_NC_CONFIG=1 torchrun --standalone --nproc_per_node=8 train.py --num-steps 30 --max-train-seconds 300 --out-dir out/sol12-ropenorm-on-131072 --nki-rope-norm", "git_commit": "59a5cac", "git_dirty": true, "status": "keep", "wall_elapsed_seconds": 70.0, "run_log": "research/run-logs/sol12-ropenorm-on-131072.log", "checkpoint_path": "out/sol12-ropenorm-on-131072/final.pt", "training_seconds": 28.5, "budget_seconds": 1800, "target_steps": 30, "max_train_seconds": 300, "startup_allowance_est": 27.4, "charged_seconds_est": 28.6, "over_budget": false, "total_seconds": 46.6, "compiled": false, "nki_relu2": false, "num_steps": 30, "total_tokens_M": 3.9, "world_size": 8, "lnc": 1, "seq_len": 1024, "num_params_M": 26.4, "causality_passed": true, "causality_max_abs": 0.0, "public_val_bpb": 1.950327, "eval_seconds": 10.2, "eval_timeout": 1200, "eval_over_timeout": false}
{"timestamp": "2026-09-06T11:59:28+00:00", "label": "sol13-combo1and4-final-shape", "solution": "Solution 13", "description": "Solution 13 combo: USE_TRN2_COMPILER_FLAGS=True + USE_CAUSAL_FASTPATH=True", "launch_command": "NEURON_LOGICAL_NC_CONFIG=1 torchrun --standalone --nproc_per_node=8 train.py --num-steps 5000 --max-train-seconds 900 --out-dir out/sol13-combo1and4-final-shape", "git_commit": "f776585", "git_dirty": true, "status": "keep", "wall_elapsed_seconds": 946.3, "run_log": "research/run-logs/sol13-combo1and4-final-shape.log", "checkpoint_path": "out/sol13-combo1and4-final-shape/final.pt", "training_seconds": 890.3, "budget_seconds": 1800, "target_steps": 5000, "max_train_seconds": 900, "startup_allowance_est": 37.2, "charged_seconds_est": 890.5, "over_budget": false, "total_seconds": 919.7, "compiled": false, "nki_relu2": false, "num_steps": 262, "total_tokens_M": 34.3, "world_size": 8, "lnc": 1, "seq_len": 1024, "num_params_M": 55.7, "causality_passed": true, "causality_max_abs": 0.0, "public_val_bpb": 1.254491, "eval_seconds": 11.1, "eval_timeout": 1200, "eval_over_timeout": false}
{"timestamp": "2026-09-06T12:22:37+00:00", "label": "sol13-lnc2-final-shape", "solution": "Solution 11/13", "description": "LNC=2 A/B at final locked shape (never tried in the final combo before)", "launch_command": "NEURON_LOGICAL_NC_CONFIG=2 torchrun --standalone --nproc_per_node=4 train.py --num-steps 5000 --max-train-seconds 900 --out-dir out/sol13-lnc2-final-shape", "git_commit": "32acb83", "git_dirty": true, "status": "keep", "wall_elapsed_seconds": 1050.1, "run_log": "research/run-logs/sol13-lnc2-final-shape.log", "checkpoint_path": "out/sol13-lnc2-final-shape/final.pt", "training_seconds": 891.4, "budget_seconds": 1800, "target_steps": 5000, "max_train_seconds": 900, "startup_allowance_est": 119.7, "charged_seconds_est": 891.6, "over_budget": false, "total_seconds": 1023.7, "compiled": false, "nki_relu2": false, "num_steps": 330, "total_tokens_M": 43.3, "world_size": 4, "lnc": 2, "seq_len": 1024, "num_params_M": 55.7, "causality_passed": true, "causality_max_abs": 0.0, "public_val_bpb": 1.234514, "eval_seconds": 30.1, "eval_timeout": 1200, "eval_over_timeout": false}
{"timestamp": "2026-09-06T14:42:31+00:00", "label": "sol13-lnc2-fullbudget", "solution": "Solution 11/13", "description": "Full-1800s confirmation of current best combo: DEPTH=6, n_embd=640, TOTAL_BATCH_SIZE=131072, kernel ON, USE_CAUSAL_FASTPATH=True, LNC=2", "launch_command": "NEURON_LOGICAL_NC_CONFIG=2 torchrun --standalone --nproc_per_node=4 train.py --num-steps 5000 --max-train-seconds 1800 --out-dir out/sol13-lnc2-fullbudget", "git_commit": "9fe7323", "git_dirty": true, "status": "keep", "wall_elapsed_seconds": 1840.5, "run_log": "research/run-logs/sol13-lnc2-fullbudget.log", "checkpoint_path": "out/sol13-lnc2-fullbudget/final.pt", "training_seconds": 1794.5, "budget_seconds": 1800, "target_steps": 5000, "max_train_seconds": 1800, "startup_allowance_est": 29.0, "charged_seconds_est": 1794.7, "over_budget": false, "total_seconds": 1814.9, "compiled": false, "nki_relu2": false, "num_steps": 639, "total_tokens_M": 83.8, "world_size": 4, "lnc": 2, "seq_len": 1024, "num_params_M": 55.7, "causality_passed": true, "causality_max_abs": 0.0, "public_val_bpb": 1.15361, "eval_seconds": 11.6, "eval_timeout": 1200, "eval_over_timeout": false}
{"timestamp": "2026-09-05T14:32:46+00:00", "label": "sol13a-asyncexec-decomp", "solution": "13a-decomp", "description": "isolate NEURON_RT_ASYNC_EXEC_MAX_INFLIGHT_REQUESTS=3 alone, single device, 15 steps, seed=42", "launch_command": "NEURON_LOGICAL_NC_CONFIG=1 torchrun --standalone --nproc_per_node=1 train.py --num-steps 15 --max-train-seconds 200 --out-dir out/sol13a-asyncexec-decomp --eval-tokens 65536", "git_commit": "54e8b74", "git_dirty": true, "status": "keep", "wall_elapsed_seconds": 111.3, "run_log": "research/run-logs/sol13a-asyncexec-decomp.log", "checkpoint_path": "out/sol13a-asyncexec-decomp/final.pt", "training_seconds": 63.2, "budget_seconds": 1800, "target_steps": 15, "max_train_seconds": 200, "startup_allowance_est": 41.0, "charged_seconds_est": 63.5, "over_budget": false, "total_seconds": 99.4, "compiled": false, "nki_relu2": false, "num_steps": 15, "total_tokens_M": 1.0, "world_size": 1, "lnc": 1, "seq_len": 1024, "num_params_M": 85.9, "causality_passed": true, "causality_max_abs": 0.0, "public_val_bpb": 2.129444, "eval_seconds": 3.3, "eval_timeout": 1200, "eval_over_timeout": false}
{"timestamp": "2026-09-05T14:30:24+00:00", "label": "sol13a-ccflagsonly-decomp", "solution": "13a-decomp", "description": "isolate NEURON_CC_FLAGS alone (model-type/distribution-strategy/lnc), single device, 15 steps, seed=42", "launch_command": "NEURON_LOGICAL_NC_CONFIG=1 torchrun --standalone --nproc_per_node=1 train.py --num-steps 15 --max-train-seconds 200 --out-dir out/sol13a-ccflagsonly-decomp --eval-tokens 65536", "git_commit": "35cb15b", "git_dirty": true, "status": "keep", "wall_elapsed_seconds": 107.4, "run_log": "research/run-logs/sol13a-ccflagsonly-decomp.log", "checkpoint_path": "out/sol13a-ccflagsonly-decomp/final.pt", "training_seconds": 61.6, "budget_seconds": 1800, "target_steps": 15, "max_train_seconds": 200, "startup_allowance_est": 38.6, "charged_seconds_est": 61.9, "over_budget": false, "total_seconds": 96.8, "compiled": false, "nki_relu2": false, "num_steps": 15, "total_tokens_M": 1.0, "world_size": 1, "lnc": 1, "seq_len": 1024, "num_params_M": 85.9, "causality_passed": true, "causality_max_abs": 0.0, "public_val_bpb": 2.129466, "eval_seconds": 3.5, "eval_timeout": 1200, "eval_over_timeout": false}
{"timestamp": "2026-09-05T14:18:49+00:00", "label": "sol13a-compilerflags-smoke", "solution": "13a", "description": "USE_TRN2_COMPILER_FLAGS=True smoke test (fixed quoting), single device, 15 steps", "launch_command": "NEURON_LOGICAL_NC_CONFIG=1 torchrun --standalone --nproc_per_node=1 train.py --num-steps 15 --max-train-seconds 200 --out-dir out/sol13a-compilerflags-smoke --eval-tokens 65536", "git_commit": "611008e", "git_dirty": true, "status": "crash", "wall_elapsed_seconds": 11.1, "run_log": "research/run-logs/sol13a-compilerflags-smoke.log"}
{"timestamp": "2026-09-05T14:24:38+00:00", "label": "sol13a-compilerflags-smoke-v2", "solution": "13a", "description": "USE_TRN2_COMPILER_FLAGS=True smoke test (dropped invalid --fast-relayout flag), single device, 15 steps", "launch_command": "NEURON_LOGICAL_NC_CONFIG=1 torchrun --standalone --nproc_per_node=1 train.py --num-steps 15 --max-train-seconds 200 --out-dir out/sol13a-compilerflags-smoke-v2 --eval-tokens 65536", "git_commit": "5dc655a", "git_dirty": true, "status": "keep", "wall_elapsed_seconds": 258.9, "run_log": "research/run-logs/sol13a-compilerflags-smoke-v2.log", "checkpoint_path": "out/sol13a-compilerflags-smoke-v2/final.pt", "training_seconds": 61.5, "budget_seconds": 1800, "target_steps": 15, "max_train_seconds": 200, "startup_allowance_est": 157.9, "charged_seconds_est": 61.9, "over_budget": false, "total_seconds": 245.6, "compiled": false, "nki_relu2": false, "num_steps": 15, "total_tokens_M": 1.0, "world_size": 1, "lnc": 1, "seq_len": 1024, "num_params_M": 85.9, "causality_passed": true, "causality_max_abs": 0.0, "public_val_bpb": 2.682047, "eval_seconds": 20.8, "eval_timeout": 1200, "eval_over_timeout": false}
{"timestamp": "2026-09-06T10:38:26+00:00", "label": "sol13a-final-shape-ab", "solution": "Solution 13", "description": "Solution 13a A/B at final locked shape: USE_TRN2_COMPILER_FLAGS=True, real speed/quality test (only ever correctness-smoke-tested before)", "launch_command": "NEURON_LOGICAL_NC_CONFIG=1 torchrun --standalone --nproc_per_node=8 train.py --num-steps 5000 --max-train-seconds 900 --out-dir out/sol13a-final-shape-ab", "git_commit": "22e366c", "git_dirty": true, "status": "keep", "wall_elapsed_seconds": 991.5, "run_log": "research/run-logs/sol13a-final-shape-ab.log", "checkpoint_path": "out/sol13a-final-shape-ab/final.pt", "training_seconds": 886.3, "budget_seconds": 1800, "target_steps": 5000, "max_train_seconds": 900, "startup_allowance_est": 82.3, "charged_seconds_est": 886.5, "over_budget": false, "total_seconds": 963.8, "compiled": false, "nki_relu2": false, "num_steps": 246, "total_tokens_M": 32.2, "world_size": 8, "lnc": 1, "seq_len": 1024, "num_params_M": 55.7, "causality_passed": true, "causality_max_abs": 0.0, "public_val_bpb": 1.264601, "eval_seconds": 17.1, "eval_timeout": 1200, "eval_over_timeout": false}
{"timestamp": "2026-09-05T14:35:08+00:00", "label": "sol13a-fullcombo-repro", "solution": "13a-decomp", "description": "full combination retest: check if the 2.68 anomaly reproduces or was a one-off", "launch_command": "NEURON_LOGICAL_NC_CONFIG=1 torchrun --standalone --nproc_per_node=1 train.py --num-steps 15 --max-train-seconds 200 --out-dir out/sol13a-fullcombo-repro --eval-tokens 65536", "git_commit": "4367c99", "git_dirty": true, "status": "keep", "wall_elapsed_seconds": 106.5, "run_log": "research/run-logs/sol13a-fullcombo-repro.log", "checkpoint_path": "out/sol13a-fullcombo-repro/final.pt", "training_seconds": 60.9, "budget_seconds": 1800, "target_steps": 15, "max_train_seconds": 200, "startup_allowance_est": 38.3, "charged_seconds_est": 61.3, "over_budget": false, "total_seconds": 96.1, "compiled": false, "nki_relu2": false, "num_steps": 15, "total_tokens_M": 1.0, "world_size": 1, "lnc": 1, "seq_len": 1024, "num_params_M": 85.9, "causality_passed": true, "causality_max_abs": 0.0, "public_val_bpb": 2.129486, "eval_seconds": 3.5, "eval_timeout": 1200, "eval_over_timeout": false}
{"timestamp": "2026-09-05T14:28:05+00:00", "label": "sol13a-softmaxonly-decomp", "solution": "13a-decomp", "description": "isolate NEURON_FUSE_SOFTMAX=1 alone (no NEURON_CC_FLAGS/async-exec), single device, 15 steps, seed=42 matches every other 15-step smoke", "launch_command": "NEURON_LOGICAL_NC_CONFIG=1 torchrun --standalone --nproc_per_node=1 train.py --num-steps 15 --max-train-seconds 200 --out-dir out/sol13a-softmaxonly-decomp --eval-tokens 65536", "git_commit": "9c2950c", "git_dirty": true, "status": "keep", "wall_elapsed_seconds": 109.7, "run_log": "research/run-logs/sol13a-softmaxonly-decomp.log", "checkpoint_path": "out/sol13a-softmaxonly-decomp/final.pt", "training_seconds": 62.9, "budget_seconds": 1800, "target_steps": 15, "max_train_seconds": 200, "startup_allowance_est": 39.8, "charged_seconds_est": 63.2, "over_budget": false, "total_seconds": 98.8, "compiled": false, "nki_relu2": false, "num_steps": 15, "total_tokens_M": 1.0, "world_size": 1, "lnc": 1, "seq_len": 1024, "num_params_M": 85.9, "causality_passed": true, "causality_max_abs": 0.0, "public_val_bpb": 2.129419, "eval_seconds": 3.5, "eval_timeout": 1200, "eval_over_timeout": false}
