{"timestamp": "2026-09-15T15:20:17+00:00", "label": "seedscreen-s2-300", "solution": "seedscreen-prelim", "description": "Preliminary/exploratory CHEAP short-budget seed screen (companion to the 2026-09-15 3-seed full-1800s variance check, seeds 42/43/44 -> max-min 0.006136 / sample std ~0.0032). Fixed 300 steps, locked default config otherwise, seed=2 only. NOT a full-budget bpb, no seed adopted.", "launch_command": "NEURON_LOGICAL_NC_CONFIG=2 torchrun --standalone --nproc_per_node=4 train.py --num-steps 300 --max-train-seconds 3600 --out-dir out/seedscreen-s2-300 --seed 2", "git_commit": "496befd", "git_dirty": true, "status": "keep", "wall_elapsed_seconds": 330.4, "run_log": "research/run-logs/seedscreen-s2-300.log", "checkpoint_path": "out/seedscreen-s2-300/final.pt", "training_seconds": 246.9, "budget_seconds": 1800, "target_steps": 300, "max_train_seconds": 3600, "startup_allowance_est": 67.7, "charged_seconds_est": 247.9, "over_budget": false, "total_seconds": 300.3, "compiled": true, "nki_relu2": false, "ngram_ve": "True tables=4 rows=1048576 dim=128 index_gather=True trigram=True opt=rmsprop flat_lr=True bf16=True", "out_bigram": "False bf16=True gate_bias=-2.0 lr=0.0", "oneliners": "relu2_tau=0.0 mlp_sandwich=False head_gate=False hg_norm=True hg_ch=32 hg_mul=2.0 hg_bias=0.0 out_pool=False pool_layers=3 qk_shift=True qk_beta=0.0 qk_freeze=True x0_gate=False block_nudge=False nudge_site=qk qkv_norm_cse=False parallel_block=False par_coalesce=none epoch_shuffle=False epoch_shuffle_seed=1234", "engram": "False site=-1 orders=2,3 heads=1 tables=0 mult=32 mem_dim=128 e_dim=0 key_dim=0 conv_k=4 share=False bf16=True", "batch_ramp": "False grad_accum=(2, 4, 8) bounds=(0.35, 0.75) lr_exp=0.5 ref_grad_accum=4 last_grad_accum=4", "weight_ema": "False decays=(0.995,) start_frac=0.75 seeded=False updates=0", "sched_tricks": "demon_b1=False demon_final=0.55 demon_ref=0.8 demon_start=-1.0 muon_b2=0.9 muon_b2_final=0.0 depth_lr=1.0->1.0 depth_mom=0.0->0.0 depth_mom_ref=0.95", "num_steps": 300, "total_tokens_M": 39.3, "world_size": 4, "lnc": 2, "seq_len": 2048, "num_params_M": 592.9, "causality_passed": true, "causality_max_abs": 0.0, "public_val_bpb": 1.223903, "eval_seconds": 9.8, "eval_timeout": 1200, "eval_over_timeout": false}
{"timestamp": "2026-09-15T15:47:13+00:00", "label": "seedscreen-s21-300", "solution": "seedscreen-prelim", "description": "Preliminary/exploratory CHEAP short-budget seed screen (companion to the 2026-09-15 3-seed full-1800s variance check, seeds 42/43/44 -> max-min 0.006136 / sample std ~0.0032). Fixed 300 steps, locked default config otherwise, seed=21 only. NOT a full-budget bpb, no seed adopted.", "launch_command": "NEURON_LOGICAL_NC_CONFIG=2 torchrun --standalone --nproc_per_node=4 train.py --num-steps 300 --max-train-seconds 3600 --out-dir out/seedscreen-s21-300 --seed 21", "git_commit": "496befd", "git_dirty": true, "status": "keep", "wall_elapsed_seconds": 319.2, "run_log": "research/run-logs/seedscreen-s21-300.log", "checkpoint_path": "out/seedscreen-s21-300/final.pt", "training_seconds": 247.7, "budget_seconds": 1800, "target_steps": 300, "max_train_seconds": 3600, "startup_allowance_est": 55.8, "charged_seconds_est": 248.7, "over_budget": false, "total_seconds": 301.2, "compiled": true, "nki_relu2": false, "ngram_ve": "True tables=4 rows=1048576 dim=128 index_gather=True trigram=True opt=rmsprop flat_lr=True bf16=True", "out_bigram": "False bf16=True gate_bias=-2.0 lr=0.0", "oneliners": "relu2_tau=0.0 mlp_sandwich=False head_gate=False hg_norm=True hg_ch=32 hg_mul=2.0 hg_bias=0.0 out_pool=False pool_layers=3 qk_shift=True qk_beta=0.0 qk_freeze=True x0_gate=False block_nudge=False nudge_site=qk qkv_norm_cse=False parallel_block=False par_coalesce=none epoch_shuffle=False epoch_shuffle_seed=1234", "engram": "False site=-1 orders=2,3 heads=1 tables=0 mult=32 mem_dim=128 e_dim=0 key_dim=0 conv_k=4 share=False bf16=True", "batch_ramp": "False grad_accum=(2, 4, 8) bounds=(0.35, 0.75) lr_exp=0.5 ref_grad_accum=4 last_grad_accum=4", "weight_ema": "False decays=(0.995,) start_frac=0.75 seeded=False updates=0", "sched_tricks": "demon_b1=False demon_final=0.55 demon_ref=0.8 demon_start=-1.0 muon_b2=0.9 muon_b2_final=0.0 depth_lr=1.0->1.0 depth_mom=0.0->0.0 depth_mom_ref=0.95", "num_steps": 300, "total_tokens_M": 39.3, "world_size": 4, "lnc": 2, "seq_len": 2048, "num_params_M": 592.9, "causality_passed": true, "causality_max_abs": 0.0, "public_val_bpb": 1.226908, "eval_seconds": 9.8, "eval_timeout": 1200, "eval_over_timeout": false}
{"timestamp": "2026-09-15T15:25:43+00:00", "label": "seedscreen-s3-300", "solution": "seedscreen-prelim", "description": "Preliminary/exploratory CHEAP short-budget seed screen (companion to the 2026-09-15 3-seed full-1800s variance check, seeds 42/43/44 -> max-min 0.006136 / sample std ~0.0032). Fixed 300 steps, locked default config otherwise, seed=3 only. NOT a full-budget bpb, no seed adopted.", "launch_command": "NEURON_LOGICAL_NC_CONFIG=2 torchrun --standalone --nproc_per_node=4 train.py --num-steps 300 --max-train-seconds 3600 --out-dir out/seedscreen-s3-300 --seed 3", "git_commit": "496befd", "git_dirty": true, "status": "keep", "wall_elapsed_seconds": 325.3, "run_log": "research/run-logs/seedscreen-s3-300.log", "checkpoint_path": "out/seedscreen-s3-300/final.pt", "training_seconds": 246.9, "budget_seconds": 1800, "target_steps": 300, "max_train_seconds": 3600, "startup_allowance_est": 63.0, "charged_seconds_est": 247.9, "over_budget": false, "total_seconds": 300.5, "compiled": true, "nki_relu2": false, "ngram_ve": "True tables=4 rows=1048576 dim=128 index_gather=True trigram=True opt=rmsprop flat_lr=True bf16=True", "out_bigram": "False bf16=True gate_bias=-2.0 lr=0.0", "oneliners": "relu2_tau=0.0 mlp_sandwich=False head_gate=False hg_norm=True hg_ch=32 hg_mul=2.0 hg_bias=0.0 out_pool=False pool_layers=3 qk_shift=True qk_beta=0.0 qk_freeze=True x0_gate=False block_nudge=False nudge_site=qk qkv_norm_cse=False parallel_block=False par_coalesce=none epoch_shuffle=False epoch_shuffle_seed=1234", "engram": "False site=-1 orders=2,3 heads=1 tables=0 mult=32 mem_dim=128 e_dim=0 key_dim=0 conv_k=4 share=False bf16=True", "batch_ramp": "False grad_accum=(2, 4, 8) bounds=(0.35, 0.75) lr_exp=0.5 ref_grad_accum=4 last_grad_accum=4", "weight_ema": "False decays=(0.995,) start_frac=0.75 seeded=False updates=0", "sched_tricks": "demon_b1=False demon_final=0.55 demon_ref=0.8 demon_start=-1.0 muon_b2=0.9 muon_b2_final=0.0 depth_lr=1.0->1.0 depth_mom=0.0->0.0 depth_mom_ref=0.95", "num_steps": 300, "total_tokens_M": 39.3, "world_size": 4, "lnc": 2, "seq_len": 2048, "num_params_M": 592.9, "causality_passed": true, "causality_max_abs": 0.0, "public_val_bpb": 1.226761, "eval_seconds": 9.7, "eval_timeout": 1200, "eval_over_timeout": false}
{"timestamp": "2026-09-15T15:31:00+00:00", "label": "seedscreen-s5-300", "solution": "seedscreen-prelim", "description": "Preliminary/exploratory CHEAP short-budget seed screen (companion to the 2026-09-15 3-seed full-1800s variance check, seeds 42/43/44 -> max-min 0.006136 / sample std ~0.0032). Fixed 300 steps, locked default config otherwise, seed=5 only. NOT a full-budget bpb, no seed adopted.", "launch_command": "NEURON_LOGICAL_NC_CONFIG=2 torchrun --standalone --nproc_per_node=4 train.py --num-steps 300 --max-train-seconds 3600 --out-dir out/seedscreen-s5-300 --seed 5", "git_commit": "496befd", "git_dirty": true, "status": "keep", "wall_elapsed_seconds": 317.6, "run_log": "research/run-logs/seedscreen-s5-300.log", "checkpoint_path": "out/seedscreen-s5-300/final.pt", "training_seconds": 246.7, "budget_seconds": 1800, "target_steps": 300, "max_train_seconds": 3600, "startup_allowance_est": 55.4, "charged_seconds_est": 247.7, "over_budget": false, "total_seconds": 300.1, "compiled": true, "nki_relu2": false, "ngram_ve": "True tables=4 rows=1048576 dim=128 index_gather=True trigram=True opt=rmsprop flat_lr=True bf16=True", "out_bigram": "False bf16=True gate_bias=-2.0 lr=0.0", "oneliners": "relu2_tau=0.0 mlp_sandwich=False head_gate=False hg_norm=True hg_ch=32 hg_mul=2.0 hg_bias=0.0 out_pool=False pool_layers=3 qk_shift=True qk_beta=0.0 qk_freeze=True x0_gate=False block_nudge=False nudge_site=qk qkv_norm_cse=False parallel_block=False par_coalesce=none epoch_shuffle=False epoch_shuffle_seed=1234", "engram": "False site=-1 orders=2,3 heads=1 tables=0 mult=32 mem_dim=128 e_dim=0 key_dim=0 conv_k=4 share=False bf16=True", "batch_ramp": "False grad_accum=(2, 4, 8) bounds=(0.35, 0.75) lr_exp=0.5 ref_grad_accum=4 last_grad_accum=4", "weight_ema": "False decays=(0.995,) start_frac=0.75 seeded=False updates=0", "sched_tricks": "demon_b1=False demon_final=0.55 demon_ref=0.8 demon_start=-1.0 muon_b2=0.9 muon_b2_final=0.0 depth_lr=1.0->1.0 depth_mom=0.0->0.0 depth_mom_ref=0.95", "num_steps": 300, "total_tokens_M": 39.3, "world_size": 4, "lnc": 2, "seq_len": 2048, "num_params_M": 592.9, "causality_passed": true, "causality_max_abs": 0.0, "public_val_bpb": 1.221123, "eval_seconds": 9.7, "eval_timeout": 1200, "eval_over_timeout": false}
{"timestamp": "2026-09-15T15:36:26+00:00", "label": "seedscreen-s8-300", "solution": "seedscreen-prelim", "description": "Preliminary/exploratory CHEAP short-budget seed screen (companion to the 2026-09-15 3-seed full-1800s variance check, seeds 42/43/44 -> max-min 0.006136 / sample std ~0.0032). Fixed 300 steps, locked default config otherwise, seed=8 only. NOT a full-budget bpb, no seed adopted.", "launch_command": "NEURON_LOGICAL_NC_CONFIG=2 torchrun --standalone --nproc_per_node=4 train.py --num-steps 300 --max-train-seconds 3600 --out-dir out/seedscreen-s8-300 --seed 8", "git_commit": "496befd", "git_dirty": true, "status": "keep", "wall_elapsed_seconds": 325.9, "run_log": "research/run-logs/seedscreen-s8-300.log", "checkpoint_path": "out/seedscreen-s8-300/final.pt", "training_seconds": 246.8, "budget_seconds": 1800, "target_steps": 300, "max_train_seconds": 3600, "startup_allowance_est": 63.6, "charged_seconds_est": 247.8, "over_budget": false, "total_seconds": 300.3, "compiled": true, "nki_relu2": false, "ngram_ve": "True tables=4 rows=1048576 dim=128 index_gather=True trigram=True opt=rmsprop flat_lr=True bf16=True", "out_bigram": "False bf16=True gate_bias=-2.0 lr=0.0", "oneliners": "relu2_tau=0.0 mlp_sandwich=False head_gate=False hg_norm=True hg_ch=32 hg_mul=2.0 hg_bias=0.0 out_pool=False pool_layers=3 qk_shift=True qk_beta=0.0 qk_freeze=True x0_gate=False block_nudge=False nudge_site=qk qkv_norm_cse=False parallel_block=False par_coalesce=none epoch_shuffle=False epoch_shuffle_seed=1234", "engram": "False site=-1 orders=2,3 heads=1 tables=0 mult=32 mem_dim=128 e_dim=0 key_dim=0 conv_k=4 share=False bf16=True", "batch_ramp": "False grad_accum=(2, 4, 8) bounds=(0.35, 0.75) lr_exp=0.5 ref_grad_accum=4 last_grad_accum=4", "weight_ema": "False decays=(0.995,) start_frac=0.75 seeded=False updates=0", "sched_tricks": "demon_b1=False demon_final=0.55 demon_ref=0.8 demon_start=-1.0 muon_b2=0.9 muon_b2_final=0.0 depth_lr=1.0->1.0 depth_mom=0.0->0.0 depth_mom_ref=0.95", "num_steps": 300, "total_tokens_M": 39.3, "world_size": 4, "lnc": 2, "seq_len": 2048, "num_params_M": 592.9, "causality_passed": true, "causality_max_abs": 0.0, "public_val_bpb": 1.225259, "eval_seconds": 9.8, "eval_timeout": 1200, "eval_over_timeout": false}
{"timestamp": "2026-09-09T04:21:29+00:00", "label": "seqlen4096-ropebase100k-900s", "solution": "Scavenger", "description": "SEQ_LEN=4096 fresh baseline under current regime (default ROPE_BASE=100000), before testing scaled-up ROPE_BASE", "launch_command": "NEURON_LOGICAL_NC_CONFIG=2 torchrun --standalone --nproc_per_node=4 train.py --num-steps 5000 --max-train-seconds 900 --out-dir out/seqlen4096-ropebase100k-900s", "git_commit": "9dc9873", "git_dirty": true, "status": "keep", "wall_elapsed_seconds": 1066.4, "run_log": "research/run-logs/seqlen4096-ropebase100k-900s.log", "checkpoint_path": "out/seqlen4096-ropebase100k-900s/final.pt", "training_seconds": 894.8, "budget_seconds": 1800, "target_steps": 5000, "max_train_seconds": 900, "startup_allowance_est": 133.4, "charged_seconds_est": 895.0, "over_budget": false, "total_seconds": 1040.8, "compiled": true, "nki_relu2": false, "num_steps": 849, "total_tokens_M": 111.3, "world_size": 4, "lnc": 2, "seq_len": 4096, "num_params_M": 55.7, "causality_passed": true, "causality_max_abs": 0.0, "public_val_bpb": 1.101243, "eval_seconds": 20.2, "eval_timeout": 1200, "eval_over_timeout": false}
{"timestamp": "2026-09-09T04:39:46+00:00", "label": "seqlen4096-ropebase500k-900s", "solution": "Scavenger", "description": "SEQ_LEN=4096, ROPE_BASE 100000->500000, testing the RoPE-extrapolation hypothesis for the known quality drop-off", "launch_command": "NEURON_LOGICAL_NC_CONFIG=2 torchrun --standalone --nproc_per_node=4 train.py --num-steps 5000 --max-train-seconds 900 --out-dir out/seqlen4096-ropebase500k-900s", "git_commit": "9dc9873", "git_dirty": true, "status": "keep", "wall_elapsed_seconds": 959.7, "run_log": "research/run-logs/seqlen4096-ropebase500k-900s.log", "checkpoint_path": "out/seqlen4096-ropebase500k-900s/final.pt", "training_seconds": 894.0, "budget_seconds": 1800, "target_steps": 5000, "max_train_seconds": 900, "startup_allowance_est": 54.9, "charged_seconds_est": 894.2, "over_budget": false, "total_seconds": 943.1, "compiled": true, "nki_relu2": false, "num_steps": 848, "total_tokens_M": 111.1, "world_size": 4, "lnc": 2, "seq_len": 4096, "num_params_M": 55.7, "causality_passed": true, "causality_max_abs": 0.0, "public_val_bpb": 1.101979, "eval_seconds": 5.8, "eval_timeout": 1200, "eval_over_timeout": false}
{"timestamp": "2026-09-04T07:34:09+00:00", "label": "smoke0", "solution": "0", "description": "smoke test: unmodified baseline on RTX6000Pro", "launch_command": "NEURON_LOGICAL_NC_CONFIG=1 torchrun --standalone --nproc_per_node=1 train.py --num-steps 20 --max-train-seconds 600 --out-dir out/smoke0 --eval-tokens 65536", "git_commit": "16e321b", "git_dirty": true, "status": "keep", "wall_elapsed_seconds": 29.6, "run_log": "research/run-logs/smoke0.log", "checkpoint_path": "out/smoke0/final.pt", "training_seconds": 27.0, "budget_seconds": 1800, "target_steps": 20, "max_train_seconds": 600, "over_budget": false, "total_seconds": 27.1, "compiled": false, "nki_relu2": false, "num_steps": 20, "total_tokens_M": 1.3, "world_size": 1, "lnc": 1, "seq_len": 1024, "num_params_M": 59.6, "causality_passed": true, "causality_max_abs": 0.0, "public_val_bpb": 2.144986, "eval_seconds": 0.4, "eval_timeout": 1200, "eval_over_timeout": false}
{"timestamp": "2026-09-06T16:24:38+00:00", "label": "sol-bucketb-requeue-on", "solution": "Bucket B", "description": "Remainder-requeue packer A/B at final locked shape (LNC=2, USE_CAUSAL_FASTPATH=True): USE_REQUEUE_PACKER=True", "launch_command": "NEURON_LOGICAL_NC_CONFIG=2 torchrun --standalone --nproc_per_node=4 train.py --num-steps 5000 --max-train-seconds 900 --out-dir out/sol-bucketb-requeue-on", "git_commit": "9e43812", "git_dirty": true, "status": "keep", "wall_elapsed_seconds": 934.7, "run_log": "research/run-logs/sol-bucketb-requeue-on.log", "checkpoint_path": "out/sol-bucketb-requeue-on/final.pt", "training_seconds": 891.3, "budget_seconds": 1800, "target_steps": 5000, "max_train_seconds": 900, "startup_allowance_est": 27.6, "charged_seconds_est": 891.5, "over_budget": false, "total_seconds": 911.6, "compiled": false, "nki_relu2": false, "num_steps": 332, "total_tokens_M": 43.5, "world_size": 4, "lnc": 2, "seq_len": 1024, "num_params_M": 55.7, "causality_passed": true, "causality_max_abs": 0.0, "public_val_bpb": 1.235799, "eval_seconds": 11.5, "eval_timeout": 1200, "eval_over_timeout": false}
{"timestamp": "2026-09-06T22:55:31+00:00", "label": "sol-c-dropignore-900s", "solution": "Bucket C", "description": "Bucket C: fresh 900s baseline at final locked shape with dead ignore_index removed", "launch_command": "NEURON_LOGICAL_NC_CONFIG=2 torchrun --standalone --nproc_per_node=4 train.py --num-steps 5000 --max-train-seconds 900 --out-dir out/sol-c-dropignore-900s", "git_commit": "f6beb65", "git_dirty": true, "status": "keep", "wall_elapsed_seconds": 937.1, "run_log": "research/run-logs/sol-c-dropignore-900s.log", "checkpoint_path": "out/sol-c-dropignore-900s/final.pt", "training_seconds": 894.7, "budget_seconds": 1800, "target_steps": 5000, "max_train_seconds": 900, "startup_allowance_est": 30.1, "charged_seconds_est": 894.9, "over_budget": false, "total_seconds": 910.4, "compiled": false, "nki_relu2": false, "num_steps": 366, "total_tokens_M": 48.0, "world_size": 4, "lnc": 2, "seq_len": 2048, "num_params_M": 55.7, "causality_passed": true, "causality_max_abs": 0.0, "public_val_bpb": 1.206231, "eval_seconds": 7.4, "eval_timeout": 1200, "eval_over_timeout": false}
{"timestamp": "2026-09-06T22:39:27+00:00", "label": "sol-c-dropignore-smoke", "solution": "Bucket C", "description": "Bucket C step 1: remove dead ignore_index=-1 from training CE call -- correctness smoke test", "launch_command": "NEURON_LOGICAL_NC_CONFIG=1 torchrun --standalone --nproc_per_node=1 train.py --num-steps 15 --max-train-seconds 200 --out-dir out/sol-c-dropignore-smoke --eval-tokens 65536", "git_commit": "5580b85", "git_dirty": true, "status": "keep", "wall_elapsed_seconds": 98.2, "run_log": "research/run-logs/sol-c-dropignore-smoke.log", "checkpoint_path": "out/sol-c-dropignore-smoke/final.pt", "training_seconds": 54.0, "budget_seconds": 1800, "target_steps": 15, "max_train_seconds": 200, "startup_allowance_est": 39.0, "charged_seconds_est": 54.2, "over_budget": false, "total_seconds": 87.6, "compiled": false, "nki_relu2": false, "num_steps": 15, "total_tokens_M": 2.0, "world_size": 1, "lnc": 1, "seq_len": 2048, "num_params_M": 55.7, "causality_passed": true, "causality_max_abs": 0.0, "public_val_bpb": 2.075312, "eval_seconds": 1.4, "eval_timeout": 1200, "eval_over_timeout": false}
{"timestamp": "2026-09-06T23:14:03+00:00", "label": "sol-c-relu2-900s", "solution": "Bucket C", "description": "Bucket C: measure the already-existing --nki-relu2 kernel at final locked shape (never measured this competition)", "launch_command": "NEURON_LOGICAL_NC_CONFIG=2 torchrun --standalone --nproc_per_node=4 train.py --num-steps 5000 --max-train-seconds 900 --out-dir out/sol-c-relu2-900s --nki-relu2", "git_commit": "5bcd796", "git_dirty": true, "status": "keep", "wall_elapsed_seconds": 939.0, "run_log": "research/run-logs/sol-c-relu2-900s.log", "checkpoint_path": "out/sol-c-relu2-900s/final.pt", "training_seconds": 892.1, "budget_seconds": 1800, "target_steps": 5000, "max_train_seconds": 900, "startup_allowance_est": 33.6, "charged_seconds_est": 892.3, "over_budget": false, "total_seconds": 911.6, "compiled": false, "nki_relu2": true, "num_steps": 381, "total_tokens_M": 49.9, "world_size": 4, "lnc": 2, "seq_len": 2048, "num_params_M": 55.7, "causality_passed": true, "causality_max_abs": 0.0, "public_val_bpb": 1.200379, "eval_seconds": 7.3, "eval_timeout": 1200, "eval_over_timeout": false}
{"timestamp": "2026-09-07T00:19:14+00:00", "label": "sol-c-softcapce-900s", "solution": "Bucket C", "description": "Bucket C: fused softcap+cross-entropy NKI kernel real speed/quality A/B at final locked shape", "launch_command": "NEURON_LOGICAL_NC_CONFIG=2 torchrun --standalone --nproc_per_node=4 train.py --num-steps 5000 --max-train-seconds 900 --out-dir out/sol-c-softcapce-900s --nki-softcap-ce", "git_commit": "573e8fe", "git_dirty": true, "status": "keep", "wall_elapsed_seconds": 937.0, "run_log": "research/run-logs/sol-c-softcapce-900s.log", "checkpoint_path": "out/sol-c-softcapce-900s/final.pt", "training_seconds": 890.0, "budget_seconds": 1800, "target_steps": 5000, "max_train_seconds": 900, "startup_allowance_est": 34.9, "charged_seconds_est": 890.3, "over_budget": false, "total_seconds": 908.3, "compiled": false, "nki_relu2": false, "num_steps": 384, "total_tokens_M": 50.3, "world_size": 4, "lnc": 2, "seq_len": 2048, "num_params_M": 55.7, "causality_passed": true, "causality_max_abs": 0.0, "public_val_bpb": 1.198478, "eval_seconds": 7.5, "eval_timeout": 1200, "eval_over_timeout": false}
{"timestamp": "2026-09-07T00:26:57+00:00", "label": "sol-c-softcapce-default-on-check", "solution": "Bucket C", "description": "verify default-on with no flag passed", "launch_command": "NEURON_LOGICAL_NC_CONFIG=1 torchrun --standalone --nproc_per_node=1 train.py --num-steps 15 --max-train-seconds 200 --out-dir out/sol-c-softcapce-default-on-check --eval-tokens 65536", "git_commit": "d35eeed", "git_dirty": true, "status": "keep", "wall_elapsed_seconds": 90.4, "run_log": "research/run-logs/sol-c-softcapce-default-on-check.log", "checkpoint_path": "out/sol-c-softcapce-default-on-check/final.pt", "training_seconds": 49.7, "budget_seconds": 1800, "target_steps": 15, "max_train_seconds": 200, "startup_allowance_est": 35.3, "charged_seconds_est": 49.8, "over_budget": false, "total_seconds": 79.1, "compiled": false, "nki_relu2": false, "num_steps": 15, "total_tokens_M": 2.0, "world_size": 1, "lnc": 1, "seq_len": 2048, "num_params_M": 55.7, "causality_passed": true, "causality_max_abs": 0.0, "public_val_bpb": 2.091416, "eval_seconds": 1.4, "eval_timeout": 1200, "eval_over_timeout": false}
