{"timestamp": "2026-09-12T08:09:13+00:00", "label": "t31l-l5tri-900s", "solution": "3.1", "description": "T3.1: bigram AND trigram tables both on the LAST layer (NGRAM_VE_LAYERS=-1), 32x8192=262144 rows, dim 128. Also free (r_step=0.980).", "launch_command": "NEURON_LOGICAL_NC_CONFIG=2 torchrun --standalone --nproc_per_node=4 train.py --num-steps 5000 --max-train-seconds 900 --out-dir out/t31l-l5tri-900s --ngram-ve --ngram-ve-trigram --ngram-ve-layers=-1 --ngram-ve-table-mult 32 --ngram-ve-dim 128 --eval-seq-len 1024", "git_commit": "496befd", "git_dirty": true, "status": "keep", "wall_elapsed_seconds": 1192.3, "run_log": "research/run-logs/t31l-l5tri-900s.log", "checkpoint_path": "out/t31l-l5tri-900s/final.pt", "training_seconds": 894.4, "budget_seconds": 1800, "target_steps": 5000, "max_train_seconds": 900, "startup_allowance_est": 264.9, "charged_seconds_est": 894.7, "over_budget": false, "total_seconds": 1165.6, "compiled": true, "nki_relu2": false, "ngram_ve": "True tables=2 rows=262144 dim=128 index_gather=True trigram=True opt=rmsprop flat_lr=True bf16=True", "batch_ramp": "False grad_accum=(2, 4, 8) bounds=(0.35, 0.75) lr_exp=0.5 ref_grad_accum=4 last_grad_accum=4", "weight_ema": "False decays=(0.995,) start_frac=0.75 seeded=False updates=0", "num_steps": 1084, "total_tokens_M": 142.1, "world_size": 4, "lnc": 2, "seq_len": 2048, "num_params_M": 123.0, "causality_passed": true, "causality_max_abs": 0.0, "public_val_bpb": 1.066917, "eval_seconds": 8.6, "eval_timeout": 1200, "eval_over_timeout": false, "eval_alt_seq_len": 1024, "public_val_bpb_alt": 1.082459, "eval_alt_seconds": 18.3}
{"timestamp": "2026-09-13T13:11:22+00:00", "label": "t32-control-900s", "solution": "3.2", "description": "T3.2 paired control: locked default, no new flags", "launch_command": "NEURON_LOGICAL_NC_CONFIG=2 torchrun --standalone --nproc_per_node=4 train.py --num-steps 5000 --max-train-seconds 900 --out-dir out/t32-control-900s --eval-seq-len 1024", "git_commit": "496befd", "git_dirty": true, "status": "keep", "wall_elapsed_seconds": 983.3, "run_log": "research/run-logs/t32-control-900s.log", "checkpoint_path": "out/t32-control-900s/final.pt", "training_seconds": 894.2, "budget_seconds": 1800, "target_steps": 5000, "max_train_seconds": 900, "startup_allowance_est": 61.0, "charged_seconds_est": 894.5, "over_budget": false, "total_seconds": 960.5, "compiled": true, "nki_relu2": false, "ngram_ve": "True tables=2 rows=524288 dim=128 index_gather=True trigram=True opt=rmsprop flat_lr=True bf16=True", "out_bigram": "False bf16=True gate_bias=-2.0 lr=0.0", "oneliners": "relu2_tau=0.0 mlp_sandwich=False head_gate=False hg_norm=True hg_ch=32 hg_mul=2.0 hg_bias=0.0 out_pool=False pool_layers=3 qk_shift=False qk_beta=0.3 qk_freeze=False x0_gate=False block_nudge=False nudge_site=qk qkv_norm_cse=False parallel_block=False par_coalesce=none epoch_shuffle=False epoch_shuffle_seed=1234", "engram": "False site=-1 orders=2,3 heads=1 tables=0 mult=32 mem_dim=128 e_dim=0 key_dim=0 conv_k=4 share=False bf16=True", "batch_ramp": "False grad_accum=(2, 4, 8) bounds=(0.35, 0.75) lr_exp=0.5 ref_grad_accum=4 last_grad_accum=4", "weight_ema": "False decays=(0.995,) start_frac=0.75 seeded=False updates=0", "num_steps": 1076, "total_tokens_M": 141.0, "world_size": 4, "lnc": 2, "seq_len": 2048, "num_params_M": 190.1, "causality_passed": true, "causality_max_abs": 0.0, "public_val_bpb": 1.065199, "eval_seconds": 8.5, "eval_timeout": 1200, "eval_over_timeout": false, "eval_alt_seq_len": 1024, "public_val_bpb_alt": 1.08072, "eval_alt_seconds": 14.2}
{"timestamp": "2026-09-13T14:23:24+00:00", "label": "t32-control-900s-rep", "solution": "3.2", "description": "T3.2 paired repeat of the locked-default control", "launch_command": "NEURON_LOGICAL_NC_CONFIG=2 torchrun --standalone --nproc_per_node=4 train.py --num-steps 5000 --max-train-seconds 900 --out-dir out/t32-control-900s-rep --eval-seq-len 1024", "git_commit": "496befd", "git_dirty": true, "status": "keep", "wall_elapsed_seconds": 986.3, "run_log": "research/run-logs/t32-control-900s-rep.log", "checkpoint_path": "out/t32-control-900s-rep/final.pt", "training_seconds": 894.3, "budget_seconds": 1800, "target_steps": 5000, "max_train_seconds": 900, "startup_allowance_est": 63.8, "charged_seconds_est": 894.6, "over_budget": false, "total_seconds": 960.6, "compiled": true, "nki_relu2": false, "ngram_ve": "True tables=2 rows=524288 dim=128 index_gather=True trigram=True opt=rmsprop flat_lr=True bf16=True", "out_bigram": "False bf16=True gate_bias=-2.0 lr=0.0", "oneliners": "relu2_tau=0.0 mlp_sandwich=False head_gate=False hg_norm=True hg_ch=32 hg_mul=2.0 hg_bias=0.0 out_pool=False pool_layers=3 qk_shift=False qk_beta=0.3 qk_freeze=False x0_gate=False block_nudge=False nudge_site=qk qkv_norm_cse=False parallel_block=False par_coalesce=none epoch_shuffle=False epoch_shuffle_seed=1234", "engram": "False site=-1 orders=2,3 heads=1 tables=0 mult=32 mem_dim=128 e_dim=0 key_dim=0 conv_k=4 share=False bf16=True", "batch_ramp": "False grad_accum=(2, 4, 8) bounds=(0.35, 0.75) lr_exp=0.5 ref_grad_accum=4 last_grad_accum=4", "weight_ema": "False decays=(0.995,) start_frac=0.75 seeded=False updates=0", "num_steps": 1076, "total_tokens_M": 141.0, "world_size": 4, "lnc": 2, "seq_len": 2048, "num_params_M": 190.1, "causality_passed": true, "causality_max_abs": 0.0, "public_val_bpb": 1.065036, "eval_seconds": 8.3, "eval_timeout": 1200, "eval_over_timeout": false, "eval_alt_seq_len": 1024, "public_val_bpb_alt": 1.080532, "eval_alt_seconds": 14.2}
{"timestamp": "2026-09-13T13:27:52+00:00", "label": "t32-engram-frozen-900s", "solution": "3.2", "description": "T3.2 Engram-lite own tables at last layer + frozen qk-shift (capacity for throughput)", "launch_command": "NEURON_LOGICAL_NC_CONFIG=2 torchrun --standalone --nproc_per_node=4 train.py --num-steps 5000 --max-train-seconds 900 --out-dir out/t32-engram-frozen-900s --eval-seq-len 1024 --engram --qk-shift --qk-shift-beta 0.0 --qk-shift-freeze", "git_commit": "496befd", "git_dirty": true, "status": "keep", "wall_elapsed_seconds": 990.6, "run_log": "research/run-logs/t32-engram-frozen-900s.log", "checkpoint_path": "out/t32-engram-frozen-900s/final.pt", "training_seconds": 894.9, "budget_seconds": 1800, "target_steps": 5000, "max_train_seconds": 900, "startup_allowance_est": 62.8, "charged_seconds_est": 895.4, "over_budget": false, "total_seconds": 964.8, "compiled": true, "nki_relu2": false, "ngram_ve": "True tables=2 rows=524288 dim=128 index_gather=True trigram=True opt=rmsprop flat_lr=True bf16=True", "out_bigram": "False bf16=True gate_bias=-2.0 lr=0.0", "oneliners": "relu2_tau=0.0 mlp_sandwich=False head_gate=False hg_norm=True hg_ch=32 hg_mul=2.0 hg_bias=0.0 out_pool=False pool_layers=3 qk_shift=True qk_beta=0.0 qk_freeze=True x0_gate=False block_nudge=False nudge_site=qk qkv_norm_cse=False parallel_block=False par_coalesce=none epoch_shuffle=False epoch_shuffle_seed=1234", "engram": "True site=5 orders=2,3 heads=1 tables=2 mult=32 mem_dim=128 e_dim=256 key_dim=640 conv_k=4 share=False bf16=True", "batch_ramp": "False grad_accum=(2, 4, 8) bounds=(0.35, 0.75) lr_exp=0.5 ref_grad_accum=4 last_grad_accum=4", "weight_ema": "False decays=(0.995,) start_frac=0.75 seeded=False updates=0", "num_steps": 1100, "total_tokens_M": 144.2, "world_size": 4, "lnc": 2, "seq_len": 2048, "num_params_M": 257.5, "causality_passed": true, "causality_max_abs": 0.0, "public_val_bpb": 1.065958, "eval_seconds": 9.9, "eval_timeout": 1200, "eval_over_timeout": false, "eval_alt_seq_len": 1024, "public_val_bpb_alt": 1.08117, "eval_alt_seconds": 17.6}
{"timestamp": "2026-09-13T13:47:44+00:00", "label": "t32-engram-frozen-900s-rep", "solution": "3.2", "description": "T3.2 paired repeat of engram+frozen (noise-floor check on a <0.003 delta)", "launch_command": "NEURON_LOGICAL_NC_CONFIG=2 torchrun --standalone --nproc_per_node=4 train.py --num-steps 5000 --max-train-seconds 900 --out-dir out/t32-engram-frozen-900s-rep --eval-seq-len 1024 --engram --qk-shift --qk-shift-beta 0.0 --qk-shift-freeze", "git_commit": "496befd", "git_dirty": true, "status": "keep", "wall_elapsed_seconds": 990.7, "run_log": "research/run-logs/t32-engram-frozen-900s-rep.log", "checkpoint_path": "out/t32-engram-frozen-900s-rep/final.pt", "training_seconds": 894.6, "budget_seconds": 1800, "target_steps": 5000, "max_train_seconds": 900, "startup_allowance_est": 63.4, "charged_seconds_est": 895.1, "over_budget": false, "total_seconds": 964.7, "compiled": true, "nki_relu2": false, "ngram_ve": "True tables=2 rows=524288 dim=128 index_gather=True trigram=True opt=rmsprop flat_lr=True bf16=True", "out_bigram": "False bf16=True gate_bias=-2.0 lr=0.0", "oneliners": "relu2_tau=0.0 mlp_sandwich=False head_gate=False hg_norm=True hg_ch=32 hg_mul=2.0 hg_bias=0.0 out_pool=False pool_layers=3 qk_shift=True qk_beta=0.0 qk_freeze=True x0_gate=False block_nudge=False nudge_site=qk qkv_norm_cse=False parallel_block=False par_coalesce=none epoch_shuffle=False epoch_shuffle_seed=1234", "engram": "True site=5 orders=2,3 heads=1 tables=2 mult=32 mem_dim=128 e_dim=256 key_dim=640 conv_k=4 share=False bf16=True", "batch_ramp": "False grad_accum=(2, 4, 8) bounds=(0.35, 0.75) lr_exp=0.5 ref_grad_accum=4 last_grad_accum=4", "weight_ema": "False decays=(0.995,) start_frac=0.75 seeded=False updates=0", "num_steps": 1100, "total_tokens_M": 144.2, "world_size": 4, "lnc": 2, "seq_len": 2048, "num_params_M": 257.5, "causality_passed": true, "causality_max_abs": 0.0, "public_val_bpb": 1.065935, "eval_seconds": 9.9, "eval_timeout": 1200, "eval_over_timeout": false, "eval_alt_seq_len": 1024, "public_val_bpb_alt": 1.081146, "eval_alt_seconds": 17.6}
{"timestamp": "2026-09-13T14:06:58+00:00", "label": "t32-engram-small-frozen-900s", "solution": "3.2", "description": "T3.2 small Engram (mult 8, mem_dim 64 = 8.4M vs 67.4M) + frozen qk-shift: is the per-step penalty a capacity-warmup effect?", "launch_command": "NEURON_LOGICAL_NC_CONFIG=2 torchrun --standalone --nproc_per_node=4 train.py --num-steps 5000 --max-train-seconds 900 --out-dir out/t32-engram-small-frozen-900s --eval-seq-len 1024 --engram --engram-table-mult 8 --engram-mem-dim 64 --qk-shift --qk-shift-beta 0.0 --qk-shift-freeze", "git_commit": "496befd", "git_dirty": true, "status": "keep", "wall_elapsed_seconds": 1153.7, "run_log": "research/run-logs/t32-engram-small-frozen-900s.log", "checkpoint_path": "out/t32-engram-small-frozen-900s/final.pt", "training_seconds": 895.0, "budget_seconds": 1800, "target_steps": 5000, "max_train_seconds": 900, "startup_allowance_est": 219.3, "charged_seconds_est": 895.4, "over_budget": false, "total_seconds": 1124.5, "compiled": true, "nki_relu2": false, "ngram_ve": "True tables=2 rows=524288 dim=128 index_gather=True trigram=True opt=rmsprop flat_lr=True bf16=True", "out_bigram": "False bf16=True gate_bias=-2.0 lr=0.0", "oneliners": "relu2_tau=0.0 mlp_sandwich=False head_gate=False hg_norm=True hg_ch=32 hg_mul=2.0 hg_bias=0.0 out_pool=False pool_layers=3 qk_shift=True qk_beta=0.0 qk_freeze=True x0_gate=False block_nudge=False nudge_site=qk qkv_norm_cse=False parallel_block=False par_coalesce=none epoch_shuffle=False epoch_shuffle_seed=1234", "engram": "True site=5 orders=2,3 heads=1 tables=2 mult=8 mem_dim=64 e_dim=128 key_dim=640 conv_k=4 share=False bf16=True", "batch_ramp": "False grad_accum=(2, 4, 8) bounds=(0.35, 0.75) lr_exp=0.5 ref_grad_accum=4 last_grad_accum=4", "weight_ema": "False decays=(0.995,) start_frac=0.75 seeded=False updates=0", "num_steps": 1129, "total_tokens_M": 148.0, "world_size": 4, "lnc": 2, "seq_len": 2048, "num_params_M": 198.7, "causality_passed": true, "causality_max_abs": 0.0, "public_val_bpb": 1.063967, "eval_seconds": 10.9, "eval_timeout": 1200, "eval_over_timeout": false, "eval_alt_seq_len": 1024, "public_val_bpb_alt": 1.078978, "eval_alt_seconds": 20.5}
{"timestamp": "2026-09-13T14:48:29+00:00", "label": "t32-engram-small-mid-frozen-900s", "solution": "3.2", "description": "T3.2 site test: same small Engram at MID-STACK (layer 2 of 6, the paper's site) + frozen qk-shift. Isolates SITE from everything else.", "launch_command": "NEURON_LOGICAL_NC_CONFIG=2 torchrun --standalone --nproc_per_node=4 train.py --num-steps 5000 --max-train-seconds 900 --out-dir out/t32-engram-small-mid-frozen-900s --eval-seq-len 1024 --engram --engram-table-mult 8 --engram-mem-dim 64 --engram-site 2 --qk-shift --qk-shift-beta 0.0 --qk-shift-freeze", "git_commit": "496befd", "git_dirty": true, "status": "keep", "wall_elapsed_seconds": 1292.3, "run_log": "research/run-logs/t32-engram-small-mid-frozen-900s.log", "checkpoint_path": "out/t32-engram-small-mid-frozen-900s/final.pt", "training_seconds": 894.8, "budget_seconds": 1800, "target_steps": 5000, "max_train_seconds": 900, "startup_allowance_est": 363.7, "charged_seconds_est": 895.2, "over_budget": false, "total_seconds": 1266.7, "compiled": true, "nki_relu2": false, "ngram_ve": "True tables=2 rows=524288 dim=128 index_gather=True trigram=True opt=rmsprop flat_lr=True bf16=True", "out_bigram": "False bf16=True gate_bias=-2.0 lr=0.0", "oneliners": "relu2_tau=0.0 mlp_sandwich=False head_gate=False hg_norm=True hg_ch=32 hg_mul=2.0 hg_bias=0.0 out_pool=False pool_layers=3 qk_shift=True qk_beta=0.0 qk_freeze=True x0_gate=False block_nudge=False nudge_site=qk qkv_norm_cse=False parallel_block=False par_coalesce=none epoch_shuffle=False epoch_shuffle_seed=1234", "engram": "True site=2 orders=2,3 heads=1 tables=2 mult=8 mem_dim=64 e_dim=128 key_dim=640 conv_k=4 share=False bf16=True", "batch_ramp": "False grad_accum=(2, 4, 8) bounds=(0.35, 0.75) lr_exp=0.5 ref_grad_accum=4 last_grad_accum=4", "weight_ema": "False decays=(0.995,) start_frac=0.75 seeded=False updates=0", "num_steps": 1128, "total_tokens_M": 147.8, "world_size": 4, "lnc": 2, "seq_len": 2048, "num_params_M": 198.7, "causality_passed": true, "causality_max_abs": 0.0, "public_val_bpb": 1.062342, "eval_seconds": 10.1, "eval_timeout": 1200, "eval_over_timeout": false, "eval_alt_seq_len": 1024, "public_val_bpb_alt": 1.077479, "eval_alt_seconds": 18.0}
{"timestamp": "2026-09-13T01:44:22+00:00", "label": "t39-base-1800s", "solution": "T3.9", "description": "fresh same-day 1800s control, locked defaults", "launch_command": "NEURON_LOGICAL_NC_CONFIG=2 torchrun --standalone --nproc_per_node=4 train.py --num-steps 5000 --max-train-seconds 1800 --out-dir out/t39-base-1800s --eval-seq-len 1024", "git_commit": "496befd", "git_dirty": true, "status": "keep", "wall_elapsed_seconds": 1887.7, "run_log": "research/run-logs/t39-base-1800s.log", "checkpoint_path": "out/t39-base-1800s/final.pt", "training_seconds": 1794.6, "budget_seconds": 1800, "target_steps": 5000, "max_train_seconds": 1800, "startup_allowance_est": 63.7, "charged_seconds_est": 1795.0, "over_budget": false, "total_seconds": 1862.4, "compiled": true, "nki_relu2": false, "ngram_ve": "True tables=2 rows=524288 dim=128 index_gather=True trigram=True opt=rmsprop flat_lr=True bf16=True", "out_bigram": "False bf16=True gate_bias=-2.0 lr=0.0", "oneliners": "relu2_tau=0.0 mlp_sandwich=False head_gate=False hg_norm=True hg_ch=32 hg_mul=2.0 hg_bias=0.0 out_pool=False pool_layers=3 qk_shift=False qk_beta=0.3", "batch_ramp": "False grad_accum=(2, 4, 8) bounds=(0.35, 0.75) lr_exp=0.5 ref_grad_accum=4 last_grad_accum=4", "weight_ema": "False decays=(0.995,) start_frac=0.75 seeded=False updates=0", "num_steps": 2142, "total_tokens_M": 280.8, "world_size": 4, "lnc": 2, "seq_len": 2048, "num_params_M": 190.1, "causality_passed": true, "causality_max_abs": 0.0, "public_val_bpb": 1.019153, "eval_seconds": 8.6, "eval_timeout": 1200, "eval_over_timeout": false, "eval_alt_seq_len": 1024, "public_val_bpb_alt": 1.034176, "eval_alt_seconds": 14.6}
{"timestamp": "2026-09-13T00:12:43+00:00", "label": "t39-base2-900s", "solution": "T3.9", "description": "second same-day 900s control, locked defaults (paired repeat)", "launch_command": "NEURON_LOGICAL_NC_CONFIG=2 torchrun --standalone --nproc_per_node=4 train.py --num-steps 5000 --max-train-seconds 900 --out-dir out/t39-base2-900s --eval-seq-len 1024", "git_commit": "496befd", "git_dirty": true, "status": "keep", "wall_elapsed_seconds": 987.8, "run_log": "research/run-logs/t39-base2-900s.log", "checkpoint_path": "out/t39-base2-900s/final.pt", "training_seconds": 894.6, "budget_seconds": 1800, "target_steps": 5000, "max_train_seconds": 900, "startup_allowance_est": 64.0, "charged_seconds_est": 895.0, "over_budget": false, "total_seconds": 962.8, "compiled": true, "nki_relu2": false, "ngram_ve": "True tables=2 rows=524288 dim=128 index_gather=True trigram=True opt=rmsprop flat_lr=True bf16=True", "out_bigram": "False bf16=True gate_bias=-2.0 lr=0.0", "oneliners": "relu2_tau=0.0 mlp_sandwich=False head_gate=False hg_norm=True hg_ch=32 hg_mul=2.0 hg_bias=0.0 out_pool=False pool_layers=3 qk_shift=False qk_beta=0.3", "batch_ramp": "False grad_accum=(2, 4, 8) bounds=(0.35, 0.75) lr_exp=0.5 ref_grad_accum=4 last_grad_accum=4", "weight_ema": "False decays=(0.995,) start_frac=0.75 seeded=False updates=0", "num_steps": 1067, "total_tokens_M": 139.9, "world_size": 4, "lnc": 2, "seq_len": 2048, "num_params_M": 190.1, "causality_passed": true, "causality_max_abs": 0.0, "public_val_bpb": 1.065718, "eval_seconds": 8.6, "eval_timeout": 1200, "eval_over_timeout": false, "eval_alt_seq_len": 1024, "public_val_bpb_alt": 1.081093, "eval_alt_seconds": 14.7}
{"timestamp": "2026-09-12T23:14:30+00:00", "label": "t39-hgate-900s", "solution": "T4.2/T3.9", "description": "T3.6/T3.9 per-head out norm+gate, resid slice 96:128", "launch_command": "NEURON_LOGICAL_NC_CONFIG=2 torchrun --standalone --nproc_per_node=4 train.py --num-steps 5000 --max-train-seconds 900 --out-dir out/t39-hgate-900s --eval-seq-len 1024 --head-gate", "git_commit": "496befd", "git_dirty": true, "status": "keep", "wall_elapsed_seconds": 998.0, "run_log": "research/run-logs/t39-hgate-900s.log", "checkpoint_path": "out/t39-hgate-900s/final.pt", "training_seconds": 894.0, "budget_seconds": 1800, "target_steps": 5000, "max_train_seconds": 900, "startup_allowance_est": 64.7, "charged_seconds_est": 894.4, "over_budget": false, "total_seconds": 973.1, "compiled": true, "nki_relu2": false, "ngram_ve": "True tables=2 rows=524288 dim=128 index_gather=True trigram=True opt=rmsprop flat_lr=True bf16=True", "out_bigram": "False bf16=True gate_bias=-2.0 lr=0.0", "oneliners": "relu2_tau=0.0 mlp_sandwich=False head_gate=True hg_norm=True hg_ch=32 hg_mul=2.0 hg_bias=0.0 out_pool=False pool_layers=3 qk_shift=False qk_beta=0.3", "batch_ramp": "False grad_accum=(2, 4, 8) bounds=(0.35, 0.75) lr_exp=0.5 ref_grad_accum=4 last_grad_accum=4", "weight_ema": "False decays=(0.995,) start_frac=0.75 seeded=False updates=0", "num_steps": 856, "total_tokens_M": 112.2, "world_size": 4, "lnc": 2, "seq_len": 2048, "num_params_M": 190.1, "causality_passed": true, "causality_max_abs": 0.0, "public_val_bpb": 1.079168, "eval_seconds": 9.7, "eval_timeout": 1200, "eval_over_timeout": false, "eval_alt_seq_len": 1024, "public_val_bpb_alt": 1.094849, "eval_alt_seconds": 20.0}
{"timestamp": "2026-09-12T22:57:52+00:00", "label": "t39-outpool-900s", "solution": "T4.2/T3.9", "description": "T3.9 zero-init last-3-layer output pooling", "launch_command": "NEURON_LOGICAL_NC_CONFIG=2 torchrun --standalone --nproc_per_node=4 train.py --num-steps 5000 --max-train-seconds 900 --out-dir out/t39-outpool-900s --eval-seq-len 1024 --out-pool", "git_commit": "496befd", "git_dirty": true, "status": "keep", "wall_elapsed_seconds": 992.3, "run_log": "research/run-logs/t39-outpool-900s.log", "checkpoint_path": "out/t39-outpool-900s/final.pt", "training_seconds": 894.5, "budget_seconds": 1800, "target_steps": 5000, "max_train_seconds": 900, "startup_allowance_est": 64.0, "charged_seconds_est": 894.9, "over_budget": false, "total_seconds": 968.5, "compiled": true, "nki_relu2": false, "ngram_ve": "True tables=2 rows=524288 dim=128 index_gather=True trigram=True opt=rmsprop flat_lr=True bf16=True", "out_bigram": "False bf16=True gate_bias=-2.0 lr=0.0", "oneliners": "relu2_tau=0.0 mlp_sandwich=False head_gate=False hg_norm=True hg_ch=32 hg_mul=2.0 hg_bias=0.0 out_pool=True pool_layers=3 qk_shift=False qk_beta=0.3", "batch_ramp": "False grad_accum=(2, 4, 8) bounds=(0.35, 0.75) lr_exp=0.5 ref_grad_accum=4 last_grad_accum=4", "weight_ema": "False decays=(0.995,) start_frac=0.75 seeded=False updates=0", "num_steps": 1053, "total_tokens_M": 138.0, "world_size": 4, "lnc": 2, "seq_len": 2048, "num_params_M": 190.1, "causality_passed": true, "causality_max_abs": 0.0, "public_val_bpb": 1.066954, "eval_seconds": 8.9, "eval_timeout": 1200, "eval_over_timeout": false, "eval_alt_seq_len": 1024, "public_val_bpb_alt": 1.082385, "eval_alt_seconds": 16.1}
