{"timestamp": "2026-09-09T22:08:40+00:00", "label": "t04-unembedlr-0035-900s", "solution": "T0.4", "description": "UNEMBEDDING_LR 0.006 -> 0.0035", "launch_command": "NEURON_LOGICAL_NC_CONFIG=2 torchrun --standalone --nproc_per_node=4 train.py --num-steps 5000 --max-train-seconds 900 --out-dir out/t04-unembedlr-0035-900s --unembedding-lr 0.0035", "git_commit": "fdc64f0", "git_dirty": true, "status": "keep", "wall_elapsed_seconds": 964.5, "run_log": "research/run-logs/t04-unembedlr-0035-900s.log", "checkpoint_path": "out/t04-unembedlr-0035-900s/final.pt", "training_seconds": 894.5, "budget_seconds": 1800, "target_steps": 5000, "max_train_seconds": 900, "startup_allowance_est": 57.4, "charged_seconds_est": 894.7, "over_budget": false, "total_seconds": 937.6, "compiled": true, "nki_relu2": false, "num_steps": 1096, "total_tokens_M": 143.7, "world_size": 4, "lnc": 2, "seq_len": 2048, "num_params_M": 55.7, "causality_passed": true, "causality_max_abs": 0.0, "public_val_bpb": 1.084028, "eval_seconds": 7.8, "eval_timeout": 1200, "eval_over_timeout": false}
{"timestamp": "2026-09-09T22:24:42+00:00", "label": "t04-unembedlr-0100-900s", "solution": "T0.4", "description": "UNEMBEDDING_LR 0.006 -> 0.010", "launch_command": "NEURON_LOGICAL_NC_CONFIG=2 torchrun --standalone --nproc_per_node=4 train.py --num-steps 5000 --max-train-seconds 900 --out-dir out/t04-unembedlr-0100-900s --unembedding-lr 0.010", "git_commit": "fdc64f0", "git_dirty": true, "status": "keep", "wall_elapsed_seconds": 961.9, "run_log": "research/run-logs/t04-unembedlr-0100-900s.log", "checkpoint_path": "out/t04-unembedlr-0100-900s/final.pt", "training_seconds": 894.5, "budget_seconds": 1800, "target_steps": 5000, "max_train_seconds": 900, "startup_allowance_est": 54.9, "charged_seconds_est": 894.7, "over_budget": false, "total_seconds": 937.7, "compiled": true, "nki_relu2": false, "num_steps": 1095, "total_tokens_M": 143.5, "world_size": 4, "lnc": 2, "seq_len": 2048, "num_params_M": 55.7, "causality_passed": true, "causality_max_abs": 0.0, "public_val_bpb": 1.083672, "eval_seconds": 7.7, "eval_timeout": 1200, "eval_over_timeout": false}
{"timestamp": "2026-09-09T21:04:33+00:00", "label": "t04-warmdown-60-900s", "solution": "T0.4", "description": "WARMDOWN_RATIO 0.75 -> 0.60", "launch_command": "NEURON_LOGICAL_NC_CONFIG=2 torchrun --standalone --nproc_per_node=4 train.py --num-steps 5000 --max-train-seconds 900 --out-dir out/t04-warmdown-60-900s --warmdown-ratio 0.60", "git_commit": "fdc64f0", "git_dirty": true, "status": "keep", "wall_elapsed_seconds": 964.5, "run_log": "research/run-logs/t04-warmdown-60-900s.log", "checkpoint_path": "out/t04-warmdown-60-900s/final.pt", "training_seconds": 894.5, "budget_seconds": 1800, "target_steps": 5000, "max_train_seconds": 900, "startup_allowance_est": 57.6, "charged_seconds_est": 894.7, "over_budget": false, "total_seconds": 936.6, "compiled": true, "nki_relu2": false, "num_steps": 1101, "total_tokens_M": 144.3, "world_size": 4, "lnc": 2, "seq_len": 2048, "num_params_M": 55.7, "causality_passed": true, "causality_max_abs": 0.0, "public_val_bpb": 1.082468, "eval_seconds": 7.7, "eval_timeout": 1200, "eval_over_timeout": false}
{"timestamp": "2026-09-09T21:20:36+00:00", "label": "t04-warmdown-90-900s", "solution": "T0.4", "description": "WARMDOWN_RATIO 0.75 -> 0.90", "launch_command": "NEURON_LOGICAL_NC_CONFIG=2 torchrun --standalone --nproc_per_node=4 train.py --num-steps 5000 --max-train-seconds 900 --out-dir out/t04-warmdown-90-900s --warmdown-ratio 0.90", "git_commit": "fdc64f0", "git_dirty": true, "status": "keep", "wall_elapsed_seconds": 963.4, "run_log": "research/run-logs/t04-warmdown-90-900s.log", "checkpoint_path": "out/t04-warmdown-90-900s/final.pt", "training_seconds": 894.6, "budget_seconds": 1800, "target_steps": 5000, "max_train_seconds": 900, "startup_allowance_est": 56.1, "charged_seconds_est": 894.7, "over_budget": false, "total_seconds": 937.6, "compiled": true, "nki_relu2": false, "num_steps": 1095, "total_tokens_M": 143.5, "world_size": 4, "lnc": 2, "seq_len": 2048, "num_params_M": 55.7, "causality_passed": true, "causality_max_abs": 0.0, "public_val_bpb": 1.08254, "eval_seconds": 7.8, "eval_timeout": 1200, "eval_over_timeout": false}
{"timestamp": "2026-09-09T22:40:45+00:00", "label": "t04-wd-005-900s", "solution": "T0.4", "description": "WEIGHT_DECAY 0.10 -> 0.05", "launch_command": "NEURON_LOGICAL_NC_CONFIG=2 torchrun --standalone --nproc_per_node=4 train.py --num-steps 5000 --max-train-seconds 900 --out-dir out/t04-wd-005-900s --weight-decay 0.05", "git_commit": "fdc64f0", "git_dirty": true, "status": "keep", "wall_elapsed_seconds": 963.0, "run_log": "research/run-logs/t04-wd-005-900s.log", "checkpoint_path": "out/t04-wd-005-900s/final.pt", "training_seconds": 894.6, "budget_seconds": 1800, "target_steps": 5000, "max_train_seconds": 900, "startup_allowance_est": 56.1, "charged_seconds_est": 894.8, "over_budget": false, "total_seconds": 938.0, "compiled": true, "nki_relu2": false, "num_steps": 1095, "total_tokens_M": 143.5, "world_size": 4, "lnc": 2, "seq_len": 2048, "num_params_M": 55.7, "causality_passed": true, "causality_max_abs": 0.0, "public_val_bpb": 1.082267, "eval_seconds": 7.6, "eval_timeout": 1200, "eval_over_timeout": false}
{"timestamp": "2026-09-09T22:56:47+00:00", "label": "t04-wd-020-900s", "solution": "T0.4", "description": "WEIGHT_DECAY 0.10 -> 0.20", "launch_command": "NEURON_LOGICAL_NC_CONFIG=2 torchrun --standalone --nproc_per_node=4 train.py --num-steps 5000 --max-train-seconds 900 --out-dir out/t04-wd-020-900s --weight-decay 0.20", "git_commit": "fdc64f0", "git_dirty": true, "status": "keep", "wall_elapsed_seconds": 961.9, "run_log": "research/run-logs/t04-wd-020-900s.log", "checkpoint_path": "out/t04-wd-020-900s/final.pt", "training_seconds": 894.3, "budget_seconds": 1800, "target_steps": 5000, "max_train_seconds": 900, "startup_allowance_est": 55.0, "charged_seconds_est": 894.5, "over_budget": false, "total_seconds": 937.9, "compiled": true, "nki_relu2": false, "num_steps": 1095, "total_tokens_M": 143.5, "world_size": 4, "lnc": 2, "seq_len": 2048, "num_params_M": 55.7, "causality_passed": true, "causality_max_abs": 0.0, "public_val_bpb": 1.081729, "eval_seconds": 7.6, "eval_timeout": 1200, "eval_over_timeout": false}
{"timestamp": "2026-09-10T03:35:14+00:00", "label": "t04-wd-020-900s-v2", "solution": "T0.4", "description": "WEIGHT_DECAY 0.20 paired repeat (-0.000557 is inside the noise band)", "launch_command": "NEURON_LOGICAL_NC_CONFIG=2 torchrun --standalone --nproc_per_node=4 train.py --num-steps 5000 --max-train-seconds 900 --out-dir out/t04-wd-020-900s-v2 --weight-decay 0.20", "git_commit": "fdc64f0", "git_dirty": true, "status": "keep", "wall_elapsed_seconds": 965.7, "run_log": "research/run-logs/t04-wd-020-900s-v2.log", "checkpoint_path": "out/t04-wd-020-900s-v2/final.pt", "training_seconds": 894.4, "budget_seconds": 1800, "target_steps": 5000, "max_train_seconds": 900, "startup_allowance_est": 59.0, "charged_seconds_est": 894.6, "over_budget": false, "total_seconds": 936.7, "compiled": true, "nki_relu2": false, "num_steps": 1096, "total_tokens_M": 143.7, "world_size": 4, "lnc": 2, "seq_len": 2048, "num_params_M": 55.7, "causality_passed": true, "causality_max_abs": 0.0, "public_val_bpb": 1.081753, "eval_seconds": 7.6, "eval_timeout": 1200, "eval_over_timeout": false}
{"timestamp": "2026-09-10T04:07:24+00:00", "label": "t04-wd-020-nodecay-900s", "solution": "T0.4", "description": "WEIGHT_DECAY 0.20 AND WD_DECAY_TO_ZERO off together -- both single-axis moves pointed to more total decay, so test whether they add", "launch_command": "NEURON_LOGICAL_NC_CONFIG=2 torchrun --standalone --nproc_per_node=4 train.py --num-steps 5000 --max-train-seconds 900 --out-dir out/t04-wd-020-nodecay-900s --weight-decay 0.20 --no-wd-decay-to-zero", "git_commit": "fdc64f0", "git_dirty": true, "status": "keep", "wall_elapsed_seconds": 967.1, "run_log": "research/run-logs/t04-wd-020-nodecay-900s.log", "checkpoint_path": "out/t04-wd-020-nodecay-900s/final.pt", "training_seconds": 894.4, "budget_seconds": 1800, "target_steps": 5000, "max_train_seconds": 900, "startup_allowance_est": 60.7, "charged_seconds_est": 894.6, "over_budget": false, "total_seconds": 936.5, "compiled": true, "nki_relu2": false, "num_steps": 1099, "total_tokens_M": 144.0, "world_size": 4, "lnc": 2, "seq_len": 2048, "num_params_M": 55.7, "causality_passed": true, "causality_max_abs": 0.0, "public_val_bpb": 1.084114, "eval_seconds": 7.5, "eval_timeout": 1200, "eval_over_timeout": false}
{"timestamp": "2026-09-10T03:19:08+00:00", "label": "t04-wd-035-900s", "solution": "T0.4", "description": "WEIGHT_DECAY 0.10 -> 0.35 (0.20 was slightly better than 0.10, extending upward)", "launch_command": "NEURON_LOGICAL_NC_CONFIG=2 torchrun --standalone --nproc_per_node=4 train.py --num-steps 5000 --max-train-seconds 900 --out-dir out/t04-wd-035-900s --weight-decay 0.35", "git_commit": "fdc64f0", "git_dirty": true, "status": "keep", "wall_elapsed_seconds": 963.4, "run_log": "research/run-logs/t04-wd-035-900s.log", "checkpoint_path": "out/t04-wd-035-900s/final.pt", "training_seconds": 894.5, "budget_seconds": 1800, "target_steps": 5000, "max_train_seconds": 900, "startup_allowance_est": 56.6, "charged_seconds_est": 894.7, "over_budget": false, "total_seconds": 936.8, "compiled": true, "nki_relu2": false, "num_steps": 1098, "total_tokens_M": 143.9, "world_size": 4, "lnc": 2, "seq_len": 2048, "num_params_M": 55.7, "causality_passed": true, "causality_max_abs": 0.0, "public_val_bpb": 1.081828, "eval_seconds": 7.5, "eval_timeout": 1200, "eval_over_timeout": false}
{"timestamp": "2026-09-09T23:12:50+00:00", "label": "t04-wd-noDecayToZero-900s", "solution": "T0.4", "description": "WD_DECAY_TO_ZERO off (hold WEIGHT_DECAY constant)", "launch_command": "NEURON_LOGICAL_NC_CONFIG=2 torchrun --standalone --nproc_per_node=4 train.py --num-steps 5000 --max-train-seconds 900 --out-dir out/t04-wd-noDecayToZero-900s --no-wd-decay-to-zero", "git_commit": "fdc64f0", "git_dirty": true, "status": "keep", "wall_elapsed_seconds": 963.5, "run_log": "research/run-logs/t04-wd-noDecayToZero-900s.log", "checkpoint_path": "out/t04-wd-noDecayToZero-900s/final.pt", "training_seconds": 894.6, "budget_seconds": 1800, "target_steps": 5000, "max_train_seconds": 900, "startup_allowance_est": 56.8, "charged_seconds_est": 894.8, "over_budget": false, "total_seconds": 937.1, "compiled": true, "nki_relu2": false, "num_steps": 1101, "total_tokens_M": 144.3, "world_size": 4, "lnc": 2, "seq_len": 2048, "num_params_M": 55.7, "causality_passed": true, "causality_max_abs": 0.0, "public_val_bpb": 1.081493, "eval_seconds": 7.6, "eval_timeout": 1200, "eval_over_timeout": false}
{"timestamp": "2026-09-10T03:51:17+00:00", "label": "t04-wd-noDecayToZero-900s-v2", "solution": "T0.4", "description": "WD_DECAY_TO_ZERO off, paired repeat (-0.000793 first pass, inside the <0.003 band so it needs a same-day same-commit pair)", "launch_command": "NEURON_LOGICAL_NC_CONFIG=2 torchrun --standalone --nproc_per_node=4 train.py --num-steps 5000 --max-train-seconds 900 --out-dir out/t04-wd-noDecayToZero-900s-v2 --no-wd-decay-to-zero", "git_commit": "fdc64f0", "git_dirty": true, "status": "keep", "wall_elapsed_seconds": 962.8, "run_log": "research/run-logs/t04-wd-noDecayToZero-900s-v2.log", "checkpoint_path": "out/t04-wd-noDecayToZero-900s-v2/final.pt", "training_seconds": 894.4, "budget_seconds": 1800, "target_steps": 5000, "max_train_seconds": 900, "startup_allowance_est": 56.1, "charged_seconds_est": 894.6, "over_budget": false, "total_seconds": 937.0, "compiled": true, "nki_relu2": false, "num_steps": 1095, "total_tokens_M": 143.5, "world_size": 4, "lnc": 2, "seq_len": 2048, "num_params_M": 55.7, "causality_passed": true, "causality_max_abs": 0.0, "public_val_bpb": 1.081925, "eval_seconds": 7.6, "eval_timeout": 1200, "eval_over_timeout": false}
{"timestamp": "2026-09-09T18:07:00+00:00", "label": "t06-lnc1-8proc-900s", "solution": "T0.6", "description": "LNC=1 / 8 processes under current compiled code (default optlevel), vs LNC=2 / 4 processes", "launch_command": "NEURON_LOGICAL_NC_CONFIG=1 torchrun --standalone --nproc_per_node=8 train.py --num-steps 5000 --max-train-seconds 900 --out-dir out/t06-lnc1-8proc-900s", "git_commit": "fdc64f0", "git_dirty": true, "status": "crash", "wall_elapsed_seconds": 136.2, "run_log": "research/run-logs/t06-lnc1-8proc-900s.log"}
{"timestamp": "2026-09-09T18:30:52+00:00", "label": "t06-lnc1-8proc-noclipforeach-900s", "solution": "T0.6", "description": "LNC=1 / 8 processes, --no-clip-foreach (the foreach l2_norm kernel does not compile at LNC=1)", "launch_command": "NEURON_LOGICAL_NC_CONFIG=1 torchrun --standalone --nproc_per_node=8 train.py --num-steps 5000 --max-train-seconds 900 --out-dir out/t06-lnc1-8proc-noclipforeach-900s --no-clip-foreach", "git_commit": "fdc64f0", "git_dirty": true, "status": "keep", "wall_elapsed_seconds": 1142.8, "run_log": "research/run-logs/t06-lnc1-8proc-noclipforeach-900s.log", "checkpoint_path": "out/t06-lnc1-8proc-noclipforeach-900s/final.pt", "training_seconds": 894.2, "budget_seconds": 1800, "target_steps": 5000, "max_train_seconds": 900, "startup_allowance_est": 208.6, "charged_seconds_est": 894.4, "over_budget": false, "total_seconds": 1118.0, "compiled": true, "nki_relu2": false, "num_steps": 1088, "total_tokens_M": 142.6, "world_size": 8, "lnc": 1, "seq_len": 2048, "num_params_M": 55.7, "causality_passed": true, "causality_max_abs": 0.0, "public_val_bpb": 1.324435, "eval_seconds": 23.9, "eval_timeout": 1200, "eval_over_timeout": false}
{"timestamp": "2026-09-10T08:13:33+00:00", "label": "t06-lnc1-nkioff-900s", "solution": "T0.6", "description": "LNC=1 mechanism probe: all three NKI toggles OFF (rope_norm, softcap_ce, muon) plus GRAD_CLIP 0. If the +0.24 bpb LNC=1 cliff is an LNC=1 NKI-kernel numerics/codegen problem, it should shrink here.", "launch_command": "NEURON_LOGICAL_NC_CONFIG=1 torchrun --standalone --nproc_per_node=8 train.py --num-steps 5000 --max-train-seconds 900 --out-dir out/t06-lnc1-nkioff-900s --no-nki-rope-norm --no-nki-softcap-ce --no-nki-muon --grad-clip 0 --no-clip-foreach", "git_commit": "fdc64f0", "git_dirty": true, "status": "keep", "wall_elapsed_seconds": 1180.3, "run_log": "research/run-logs/t06-lnc1-nkioff-900s.log", "checkpoint_path": "out/t06-lnc1-nkioff-900s/final.pt", "training_seconds": 894.5, "budget_seconds": 1800, "target_steps": 5000, "max_train_seconds": 900, "startup_allowance_est": 268.4, "charged_seconds_est": 894.6, "over_budget": false, "total_seconds": 1154.8, "compiled": true, "nki_relu2": false, "num_steps": 911, "total_tokens_M": 119.4, "world_size": 8, "lnc": 1, "seq_len": 2048, "num_params_M": 55.7, "causality_passed": true, "causality_max_abs": 0.0, "public_val_bpb": 1.33769, "eval_seconds": 8.9, "eval_timeout": 1200, "eval_over_timeout": false}
{"timestamp": "2026-09-10T01:39:46+00:00", "label": "t06-lnc1-noclip-900s", "solution": "T0.6", "description": "LNC=1 mechanism test: GRAD_CLIP=0 so clip-before-all_reduce cannot scale with world_size (needs the LNC=2 GRAD_CLIP=0 control below)", "launch_command": "NEURON_LOGICAL_NC_CONFIG=1 torchrun --standalone --nproc_per_node=8 train.py --num-steps 5000 --max-train-seconds 900 --out-dir out/t06-lnc1-noclip-900s --grad-clip 0 --no-clip-foreach", "git_commit": "fdc64f0", "git_dirty": true, "status": "keep", "wall_elapsed_seconds": 978.2, "run_log": "research/run-logs/t06-lnc1-noclip-900s.log", "checkpoint_path": "out/t06-lnc1-noclip-900s/final.pt", "training_seconds": 894.9, "budget_seconds": 1800, "target_steps": 5000, "max_train_seconds": 900, "startup_allowance_est": 70.3, "charged_seconds_est": 895.1, "over_budget": false, "total_seconds": 951.0, "compiled": true, "nki_relu2": false, "num_steps": 1126, "total_tokens_M": 147.6, "world_size": 8, "lnc": 1, "seq_len": 2048, "num_params_M": 55.7, "causality_passed": true, "causality_max_abs": 0.0, "public_val_bpb": 1.322584, "eval_seconds": 7.8, "eval_timeout": 1200, "eval_over_timeout": false}
{"timestamp": "2026-09-10T01:55:46+00:00", "label": "t06-lnc2-noclip-900s", "solution": "T0.6", "description": "LNC=2 control at GRAD_CLIP=0, pairs with t06-lnc1-noclip-900s", "launch_command": "NEURON_LOGICAL_NC_CONFIG=2 torchrun --standalone --nproc_per_node=4 train.py --num-steps 5000 --max-train-seconds 900 --out-dir out/t06-lnc2-noclip-900s --grad-clip 0 --no-clip-foreach", "git_commit": "fdc64f0", "git_dirty": true, "status": "keep", "wall_elapsed_seconds": 960.4, "run_log": "research/run-logs/t06-lnc2-noclip-900s.log", "checkpoint_path": "out/t06-lnc2-noclip-900s/final.pt", "training_seconds": 894.3, "budget_seconds": 1800, "target_steps": 5000, "max_train_seconds": 900, "startup_allowance_est": 53.8, "charged_seconds_est": 894.5, "over_budget": false, "total_seconds": 936.2, "compiled": true, "nki_relu2": false, "num_steps": 1105, "total_tokens_M": 144.8, "world_size": 4, "lnc": 2, "seq_len": 2048, "num_params_M": 55.7, "causality_passed": true, "causality_max_abs": 0.0, "public_val_bpb": 1.083143, "eval_seconds": 7.6, "eval_timeout": 1200, "eval_over_timeout": false}
{"timestamp": "2026-09-09T18:48:08+00:00", "label": "t06-lnc2-noclipforeach-900s", "solution": "T0.6", "description": "LNC=2 / 4 processes control with --no-clip-foreach, so the LNC comparison is internally consistent", "launch_command": "NEURON_LOGICAL_NC_CONFIG=2 torchrun --standalone --nproc_per_node=4 train.py --num-steps 5000 --max-train-seconds 900 --out-dir out/t06-lnc2-noclipforeach-900s --no-clip-foreach", "git_commit": "fdc64f0", "git_dirty": true, "status": "keep", "wall_elapsed_seconds": 1036.1, "run_log": "research/run-logs/t06-lnc2-noclipforeach-900s.log", "checkpoint_path": "out/t06-lnc2-noclipforeach-900s/final.pt", "training_seconds": 894.5, "budget_seconds": 1800, "target_steps": 5000, "max_train_seconds": 900, "startup_allowance_est": 129.0, "charged_seconds_est": 894.7, "over_budget": false, "total_seconds": 1009.2, "compiled": true, "nki_relu2": false, "num_steps": 1080, "total_tokens_M": 141.6, "world_size": 4, "lnc": 2, "seq_len": 2048, "num_params_M": 55.7, "causality_passed": true, "causality_max_abs": 0.0, "public_val_bpb": 1.083798, "eval_seconds": 7.7, "eval_timeout": 1200, "eval_over_timeout": false}
{"timestamp": "2026-09-09T17:46:45+00:00", "label": "t06-optlevel1-900s", "solution": "T0.6", "description": "NEURON_CC_FLAGS=--optlevel=1 (probe: 816ms vs 838ms baseline step); PACK_FACTOR=4 default", "launch_command": "NEURON_LOGICAL_NC_CONFIG=2 torchrun --standalone --nproc_per_node=4 train.py --num-steps 5000 --max-train-seconds 900 --out-dir out/t06-optlevel1-900s", "git_commit": "fdc64f0", "git_dirty": true, "status": "keep", "wall_elapsed_seconds": 1059.0, "run_log": "research/run-logs/t06-optlevel1-900s.log", "checkpoint_path": "out/t06-optlevel1-900s/final.pt", "training_seconds": 894.6, "budget_seconds": 1800, "target_steps": 5000, "max_train_seconds": 900, "startup_allowance_est": 122.4, "charged_seconds_est": 894.8, "over_budget": false, "total_seconds": 1032.1, "compiled": true, "nki_relu2": false, "num_steps": 1097, "total_tokens_M": 143.8, "world_size": 4, "lnc": 2, "seq_len": 2048, "num_params_M": 55.7, "causality_passed": true, "causality_max_abs": 0.0, "public_val_bpb": 1.081696, "eval_seconds": 25.3, "eval_timeout": 1200, "eval_over_timeout": false}
{"timestamp": "2026-09-09T18:04:44+00:00", "label": "t06-optlevel1-900s-v2", "solution": "T0.6", "description": "optlevel=1 paired repeat (delta -0.001989, needs-a-repeat band)", "launch_command": "NEURON_LOGICAL_NC_CONFIG=2 torchrun --standalone --nproc_per_node=4 train.py --num-steps 5000 --max-train-seconds 900 --out-dir out/t06-optlevel1-900s-v2", "git_commit": "fdc64f0", "git_dirty": true, "status": "keep", "wall_elapsed_seconds": 960.6, "run_log": "research/run-logs/t06-optlevel1-900s-v2.log", "checkpoint_path": "out/t06-optlevel1-900s-v2/final.pt", "training_seconds": 894.9, "budget_seconds": 1800, "target_steps": 5000, "max_train_seconds": 900, "startup_allowance_est": 53.1, "charged_seconds_est": 895.1, "over_budget": false, "total_seconds": 936.9, "compiled": true, "nki_relu2": false, "num_steps": 1098, "total_tokens_M": 143.9, "world_size": 4, "lnc": 2, "seq_len": 2048, "num_params_M": 55.7, "causality_passed": true, "causality_max_abs": 0.0, "public_val_bpb": 1.082876, "eval_seconds": 7.7, "eval_timeout": 1200, "eval_over_timeout": false}
{"timestamp": "2026-09-11T14:52:45+00:00", "label": "t07-seq1024-pf8-900s", "solution": "T0.7", "description": "SEQ_LEN=1024 PACK_FACTOR=8 (holds micro TOKENS and grad_accum=4 fixed vs baseline); its own public_val_bpb IS the bpb@1024", "launch_command": "NEURON_LOGICAL_NC_CONFIG=2 torchrun --standalone --nproc_per_node=4 train.py --num-steps 5000 --max-train-seconds 900 --out-dir out/t07-seq1024-pf8-900s --seq-len 1024 --pack-factor 8", "git_commit": "8973cff", "git_dirty": false, "status": "keep", "wall_elapsed_seconds": 1023.3, "run_log": "research/run-logs/t07-seq1024-pf8-900s.log", "checkpoint_path": "out/t07-seq1024-pf8-900s/final.pt", "training_seconds": 894.6, "budget_seconds": 1800, "target_steps": 5000, "max_train_seconds": 900, "startup_allowance_est": 109.4, "charged_seconds_est": 894.8, "over_budget": false, "total_seconds": 999.8, "compiled": true, "nki_relu2": false, "num_steps": 1077, "total_tokens_M": 141.2, "world_size": 4, "lnc": 2, "seq_len": 1024, "num_params_M": 55.7, "causality_passed": true, "causality_max_abs": 0.0, "public_val_bpb": 1.096998, "eval_seconds": 12.3, "eval_timeout": 1200, "eval_over_timeout": false}
