{"timestamp": "2026-09-05T13:46:40+00:00", "label": "trn2-cliff-diag-420s", "solution": "checklist-5-diag", "description": "diagnose the ~460s throughput cliff seen in trn2-confirmation-fresh: shorter budget to see if cliff still triggers near the same wall-clock mark", "launch_command": "NEURON_LOGICAL_NC_CONFIG=1 torchrun --standalone --nproc_per_node=8 train.py --num-steps 3000 --max-train-seconds 420 --out-dir out/trn2-cliff-diag-420s", "git_commit": "c0d07aa", "git_dirty": true, "status": "crash", "wall_elapsed_seconds": 23.9, "run_log": "research/run-logs/trn2-cliff-diag-420s.log"}
{"timestamp": "2026-09-05T13:58:12+00:00", "label": "trn2-cliff-diag-420s-v2", "solution": "checklist-5-diag", "description": "diagnose the ~460s throughput cliff seen in trn2-confirmation-fresh: shorter budget, no compiler-flag change this time", "launch_command": "NEURON_LOGICAL_NC_CONFIG=1 torchrun --standalone --nproc_per_node=8 train.py --num-steps 3000 --max-train-seconds 420 --out-dir out/trn2-cliff-diag-420s-v2", "git_commit": "e480f50", "git_dirty": true, "status": "keep", "wall_elapsed_seconds": 467.7, "run_log": "research/run-logs/trn2-cliff-diag-420s-v2.log", "checkpoint_path": "out/trn2-cliff-diag-420s-v2/final.pt", "training_seconds": 409.8, "budget_seconds": 1800, "target_steps": 3000, "max_train_seconds": 420, "startup_allowance_est": 32.3, "charged_seconds_est": 410.2, "over_budget": false, "total_seconds": 440.6, "compiled": false, "nki_relu2": false, "num_steps": 113, "total_tokens_M": 7.4, "world_size": 8, "lnc": 1, "seq_len": 1024, "num_params_M": 85.9, "causality_passed": true, "causality_max_abs": 0.0, "public_val_bpb": 1.661084, "eval_seconds": 21.4, "eval_timeout": 1200, "eval_over_timeout": false}
{"timestamp": "2026-09-05T14:16:59+00:00", "label": "trn2-cliff-diag-cooldown", "solution": "checklist-5-diag", "description": "cliff-timing check after ~20min cooldown since last high-load run: does the cliff revert toward ~460s (thermal theory) or stay early?", "launch_command": "NEURON_LOGICAL_NC_CONFIG=1 torchrun --standalone --nproc_per_node=8 train.py --num-steps 3000 --max-train-seconds 600 --out-dir out/trn2-cliff-diag-cooldown", "git_commit": "56171ed", "git_dirty": true, "status": "keep", "wall_elapsed_seconds": 647.5, "run_log": "research/run-logs/trn2-cliff-diag-cooldown.log", "checkpoint_path": "out/trn2-cliff-diag-cooldown/final.pt", "training_seconds": 590.3, "budget_seconds": 1800, "target_steps": 3000, "max_train_seconds": 600, "startup_allowance_est": 31.1, "charged_seconds_est": 590.6, "over_budget": false, "total_seconds": 621.9, "compiled": false, "nki_relu2": false, "num_steps": 162, "total_tokens_M": 10.6, "world_size": 8, "lnc": 1, "seq_len": 1024, "num_params_M": 85.9, "causality_passed": true, "causality_max_abs": 0.0, "public_val_bpb": 1.500344, "eval_seconds": 21.8, "eval_timeout": 1200, "eval_over_timeout": false}
{"timestamp": "2026-09-05T13:38:08+00:00", "label": "trn2-confirmation-fresh", "solution": "checklist-5", "description": "third independent hardware confirmation: fresh init, real submission shape (nproc=8 lnc=1), real 1800s budget, vs GPU numbers 1.165273/1.168849", "launch_command": "NEURON_LOGICAL_NC_CONFIG=1 torchrun --standalone --nproc_per_node=8 train.py --num-steps 3000 --max-train-seconds 1800 --out-dir out/trn2-confirmation-fresh", "git_commit": "51b623a", "git_dirty": true, "status": "keep", "wall_elapsed_seconds": 1847.5, "run_log": "research/run-logs/trn2-confirmation-fresh.log", "checkpoint_path": "out/trn2-confirmation-fresh/final.pt", "training_seconds": 1791.6, "budget_seconds": 1800, "target_steps": 3000, "max_train_seconds": 1800, "startup_allowance_est": 29.7, "charged_seconds_est": 1791.9, "over_budget": false, "total_seconds": 1822.7, "compiled": false, "nki_relu2": false, "num_steps": 478, "total_tokens_M": 31.3, "world_size": 8, "lnc": 1, "seq_len": 1024, "num_params_M": 85.9, "causality_passed": true, "causality_max_abs": 0.0, "public_val_bpb": 1.242326, "eval_seconds": 21.4, "eval_timeout": 1200, "eval_over_timeout": false}
{"timestamp": "2026-09-05T13:05:33+00:00", "label": "trn2-multicore-smoke", "solution": "checklist-4", "description": "first-ever multi-core (nproc_per_node=8, lnc=1) smoke test on any hardware this session", "launch_command": "NEURON_LOGICAL_NC_CONFIG=1 torchrun --standalone --nproc_per_node=8 train.py --num-steps 20 --max-train-seconds 600 --out-dir out/trn2-multicore-smoke", "git_commit": "dc31af0", "git_dirty": true, "status": "keep", "wall_elapsed_seconds": 86.2, "run_log": "research/run-logs/trn2-multicore-smoke.log", "checkpoint_path": "out/trn2-multicore-smoke/final.pt", "training_seconds": 21.7, "budget_seconds": 1800, "target_steps": 20, "max_train_seconds": 600, "startup_allowance_est": 36.0, "charged_seconds_est": 22.0, "over_budget": false, "total_seconds": 59.2, "compiled": false, "nki_relu2": false, "num_steps": 20, "total_tokens_M": 1.3, "world_size": 8, "lnc": 1, "seq_len": 1024, "num_params_M": 85.9, "causality_passed": true, "causality_max_abs": 0.0, "public_val_bpb": 2.082694, "eval_seconds": 24.6, "eval_timeout": 1200, "eval_over_timeout": false}
{"timestamp": "2026-09-05T12:58:14+00:00", "label": "trn2-warmstart-check", "solution": "checklist-2b", "description": "warm-start portability check, single device default", "launch_command": "NEURON_LOGICAL_NC_CONFIG=1 torchrun --standalone --nproc_per_node=1 train.py --num-steps 10 --max-train-seconds 300 --out-dir out/trn2-warmstart-check --init-from checkpoints/final-confirmation-v2.pt", "git_commit": "28af393", "git_dirty": true, "status": "keep", "wall_elapsed_seconds": 333.4, "run_log": "research/run-logs/trn2-warmstart-check.log", "checkpoint_path": "out/trn2-warmstart-check/final.pt", "training_seconds": 30.4, "budget_seconds": 1800, "target_steps": 10, "max_train_seconds": 300, "startup_allowance_est": 160.6, "charged_seconds_est": 30.7, "over_budget": false, "total_seconds": 318.1, "compiled": false, "nki_relu2": false, "num_steps": 10, "total_tokens_M": 0.7, "world_size": 1, "lnc": 1, "seq_len": 1024, "num_params_M": 85.9, "causality_passed": true, "causality_max_abs": 0.0, "public_val_bpb": 1.151113, "eval_seconds": 123.8, "eval_timeout": 1200, "eval_over_timeout": false}
{"timestamp": "2026-09-07T14:14:18+00:00", "label": "valres-900s", "solution": "ValRes", "description": "Value Residual Learning (arXiv:2410.17897, Zhou et al.) real A/B at final locked shape, everything else default (compile ON, beta2=0.95, softcap+CE ON, rope ON)", "launch_command": "NEURON_LOGICAL_NC_CONFIG=2 torchrun --standalone --nproc_per_node=4 train.py --num-steps 5000 --max-train-seconds 900 --out-dir out/valres-900s", "git_commit": "7c44e8f", "git_dirty": true, "status": "keep", "wall_elapsed_seconds": 947.2, "run_log": "research/run-logs/valres-900s.log", "checkpoint_path": "out/valres-900s/final.pt", "training_seconds": 890.8, "budget_seconds": 1800, "target_steps": 5000, "max_train_seconds": 900, "startup_allowance_est": 43.1, "charged_seconds_est": 891.7, "over_budget": false, "total_seconds": 923.6, "compiled": true, "nki_relu2": false, "num_steps": 388, "total_tokens_M": 50.9, "world_size": 4, "lnc": 2, "seq_len": 2048, "num_params_M": 55.7, "causality_passed": true, "causality_max_abs": 0.0, "public_val_bpb": 1.196654, "eval_seconds": 7.6, "eval_timeout": 1200, "eval_over_timeout": false}
{"timestamp": "2026-09-08T09:13:04+00:00", "label": "width512-fullbudget", "solution": "Tier0", "description": "ASPECT_RATIO=80 (n_embd=512) full-1800s width-only test at fixed DEPTH=6 under the new tensor-lr-scalars regime", "launch_command": "NEURON_LOGICAL_NC_CONFIG=2 torchrun --standalone --nproc_per_node=4 train.py --num-steps 5000 --max-train-seconds 1800 --out-dir out/width512-fullbudget", "git_commit": "6a49838", "git_dirty": true, "status": "keep", "wall_elapsed_seconds": 1957.9, "run_log": "research/run-logs/width512-fullbudget.log", "checkpoint_path": "out/width512-fullbudget/final.pt", "training_seconds": 1794.6, "budget_seconds": 1800, "target_steps": 5000, "max_train_seconds": 1800, "startup_allowance_est": 142.6, "charged_seconds_est": 1794.8, "over_budget": false, "total_seconds": 1941.8, "compiled": true, "nki_relu2": false, "num_steps": 2433, "total_tokens_M": 318.9, "world_size": 4, "lnc": 2, "seq_len": 2048, "num_params_M": 39.9, "causality_passed": true, "causality_max_abs": 0.0, "public_val_bpb": 1.05416, "eval_seconds": 6.9, "eval_timeout": 1200, "eval_over_timeout": false}
{"timestamp": "2026-09-08T09:46:58+00:00", "label": "width768-fullbudget", "solution": "Tier0", "description": "ASPECT_RATIO=128 (n_embd=768) full-1800s width-only test at fixed DEPTH=6 under the new tensor-lr-scalars regime", "launch_command": "NEURON_LOGICAL_NC_CONFIG=2 torchrun --standalone --nproc_per_node=4 train.py --num-steps 5000 --max-train-seconds 1800 --out-dir out/width768-fullbudget", "git_commit": "1a66236", "git_dirty": true, "status": "keep", "wall_elapsed_seconds": 1971.9, "run_log": "research/run-logs/width768-fullbudget.log", "checkpoint_path": "out/width768-fullbudget/final.pt", "training_seconds": 1793.9, "budget_seconds": 1800, "target_steps": 5000, "max_train_seconds": 1800, "startup_allowance_est": 165.2, "charged_seconds_est": 1794.2, "over_budget": false, "total_seconds": 1946.4, "compiled": true, "nki_relu2": false, "num_steps": 1623, "total_tokens_M": 212.7, "world_size": 4, "lnc": 2, "seq_len": 2048, "num_params_M": 73.9, "causality_passed": true, "causality_max_abs": 0.0, "public_val_bpb": 1.04415, "eval_seconds": 8.3, "eval_timeout": 1200, "eval_over_timeout": false}
{"timestamp": "2026-09-13T07:58:42+00:00", "label": "x0gate-900s", "solution": "R1.2", "description": "Recursive input-dependent x0 gate: x0 skip scaled by 2*sigmoid(s*mean(x)), one zero-init scalar per layer, bit-identical at step 0", "launch_command": "NEURON_LOGICAL_NC_CONFIG=2 torchrun --standalone --nproc_per_node=4 train.py --num-steps 5000 --max-train-seconds 900 --out-dir out/x0gate-900s --eval-seq-len 1024 --x0-gate", "git_commit": "496befd", "git_dirty": true, "status": "keep", "wall_elapsed_seconds": 1365.2, "run_log": "research/run-logs/x0gate-900s.log", "checkpoint_path": "out/x0gate-900s/final.pt", "training_seconds": 894.6, "budget_seconds": 1800, "target_steps": 5000, "max_train_seconds": 900, "startup_allowance_est": 433.2, "charged_seconds_est": 895.0, "over_budget": false, "total_seconds": 1338.4, "compiled": true, "nki_relu2": false, "ngram_ve": "True tables=2 rows=524288 dim=128 index_gather=True trigram=True opt=rmsprop flat_lr=True bf16=True", "out_bigram": "False bf16=True gate_bias=-2.0 lr=0.0", "oneliners": "relu2_tau=0.0 mlp_sandwich=False head_gate=False hg_norm=True hg_ch=32 hg_mul=2.0 hg_bias=0.0 out_pool=False pool_layers=3 qk_shift=False qk_beta=0.3 qk_freeze=False x0_gate=True block_nudge=False nudge_site=qk qkv_norm_cse=False parallel_block=False par_coalesce=none epoch_shuffle=False epoch_shuffle_seed=1234", "batch_ramp": "False grad_accum=(2, 4, 8) bounds=(0.35, 0.75) lr_exp=0.5 ref_grad_accum=4 last_grad_accum=4", "weight_ema": "False decays=(0.995,) start_frac=0.75 seeded=False updates=0", "num_steps": 951, "total_tokens_M": 124.6, "world_size": 4, "lnc": 2, "seq_len": 2048, "num_params_M": 190.1, "causality_passed": true, "causality_max_abs": 0.0, "public_val_bpb": 1.074042, "eval_seconds": 10.0, "eval_timeout": 1200, "eval_over_timeout": false, "eval_alt_seq_len": 1024, "public_val_bpb_alt": 1.089359, "eval_alt_seconds": 19.4}
{"timestamp": "2026-09-13T07:35:57+00:00", "label": "x0gate-base-900s", "solution": "R1.2", "description": "fresh same-commit 900s control for the input-dependent x0 gate", "launch_command": "NEURON_LOGICAL_NC_CONFIG=2 torchrun --standalone --nproc_per_node=4 train.py --num-steps 5000 --max-train-seconds 900 --out-dir out/x0gate-base-900s --eval-seq-len 1024", "git_commit": "496befd", "git_dirty": true, "status": "keep", "wall_elapsed_seconds": 1172.5, "run_log": "research/run-logs/x0gate-base-900s.log", "checkpoint_path": "out/x0gate-base-900s/final.pt", "training_seconds": 894.8, "budget_seconds": 1800, "target_steps": 5000, "max_train_seconds": 900, "startup_allowance_est": 249.1, "charged_seconds_est": 895.1, "over_budget": false, "total_seconds": 1147.8, "compiled": true, "nki_relu2": false, "ngram_ve": "True tables=2 rows=524288 dim=128 index_gather=True trigram=True opt=rmsprop flat_lr=True bf16=True", "out_bigram": "False bf16=True gate_bias=-2.0 lr=0.0", "oneliners": "relu2_tau=0.0 mlp_sandwich=False head_gate=False hg_norm=True hg_ch=32 hg_mul=2.0 hg_bias=0.0 out_pool=False pool_layers=3 qk_shift=False qk_beta=0.3 qk_freeze=False x0_gate=False block_nudge=False nudge_site=qk qkv_norm_cse=False parallel_block=False par_coalesce=none epoch_shuffle=False epoch_shuffle_seed=1234", "batch_ramp": "False grad_accum=(2, 4, 8) bounds=(0.35, 0.75) lr_exp=0.5 ref_grad_accum=4 last_grad_accum=4", "weight_ema": "False decays=(0.995,) start_frac=0.75 seeded=False updates=0", "num_steps": 1071, "total_tokens_M": 140.4, "world_size": 4, "lnc": 2, "seq_len": 2048, "num_params_M": 190.1, "causality_passed": true, "causality_max_abs": 0.0, "public_val_bpb": 1.065348, "eval_seconds": 8.5, "eval_timeout": 1200, "eval_over_timeout": false, "eval_alt_seq_len": 1024, "public_val_bpb_alt": 1.080936, "eval_alt_seconds": 14.4}
{"timestamp": "2026-09-08T00:00:19+00:00", "label": "xf-fixed300", "solution": "mamba2", "description": "transformer control for the Mamba2 fixed-step A/B: identical optimizer flags, 300 steps", "launch_command": "NEURON_LOGICAL_NC_CONFIG=2 torchrun --standalone --nproc_per_node=4 train.py --num-steps 300 --max-train-seconds 1500 --out-dir out/xf-fixed300 --tensor-lr-scalars --lrm-quantum 0", "git_commit": "eb81ae5", "git_dirty": true, "status": "keep", "wall_elapsed_seconds": 331.5, "run_log": "research/run-logs/xf-fixed300.log", "checkpoint_path": "out/xf-fixed300/final.pt", "training_seconds": 272.1, "budget_seconds": 1800, "target_steps": 300, "max_train_seconds": 1500, "startup_allowance_est": 47.6, "charged_seconds_est": 272.3, "over_budget": false, "total_seconds": 304.5, "compiled": true, "nki_relu2": false, "num_steps": 300, "total_tokens_M": 39.3, "world_size": 4, "lnc": 2, "seq_len": 2048, "num_params_M": 55.7, "causality_passed": true, "causality_max_abs": 0.0, "public_val_bpb": 1.269458, "eval_seconds": 7.6, "eval_timeout": 1200, "eval_over_timeout": false}
{"timestamp": "2026-09-08T16:02:26+00:00", "label": "xf-fixed480", "solution": "R1", "description": "transformer baseline at RWKVs own step count (480) -- equal-steps control for rwkv-pure-900s", "launch_command": "NEURON_LOGICAL_NC_CONFIG=2 torchrun --standalone --nproc_per_node=4 train.py --num-steps 480 --max-train-seconds 1500 --out-dir out/xf-fixed480 --tensor-lr-scalars --lrm-quantum 0", "git_commit": "124dfb7", "git_dirty": true, "status": "keep", "wall_elapsed_seconds": 567.4, "run_log": "research/run-logs/xf-fixed480.log", "checkpoint_path": "out/xf-fixed480/final.pt", "training_seconds": 436.8, "budget_seconds": 1800, "target_steps": 480, "max_train_seconds": 1500, "startup_allowance_est": 118.5, "charged_seconds_est": 437.0, "over_budget": false, "total_seconds": 538.8, "compiled": true, "nki_relu2": false, "num_steps": 480, "total_tokens_M": 62.9, "world_size": 4, "lnc": 2, "seq_len": 2048, "num_params_M": 55.7, "causality_passed": true, "causality_max_abs": 0.0, "public_val_bpb": 1.205611, "eval_seconds": 7.6, "eval_timeout": 1200, "eval_over_timeout": false}
