{"timestamp": "2026-09-17T13:15:29+00:00", "label": "sub1-p2b-autocast-bf16-fullv2", "solution": "sub1", "description": "FULL 1800s bf16 auto-cast WITH optlevel=1, record config seed 42 [trn21] CC=--optlevel=1 --auto-cast matmult --auto-cast-type bf16", "launch_command": "NEURON_LOGICAL_NC_CONFIG=2 torchrun --standalone --nproc_per_node=4 train.py --num-steps 1000000 --max-train-seconds 1800 --out-dir out/sub1-p2b-autocast-bf16-fullv2 --seed 42", "git_commit": "496befd", "git_dirty": true, "status": "keep", "wall_elapsed_seconds": 1862.2, "run_log": "research/run-logs/sub1-p2b-autocast-bf16-fullv2.log", "checkpoint_path": "out/sub1-p2b-autocast-bf16-fullv2/final.pt", "training_seconds": 1784.6, "budget_seconds": 1800, "target_steps": 1000000, "max_train_seconds": 1800, "startup_allowance_est": 62.4, "charged_seconds_est": 1785.6, "over_budget": false, "total_seconds": 1837.2, "compiled": true, "nki_relu2": false, "ngram_ve": "True tables=4 rows=1048576 dim=128 index_gather=True trigram=True opt=rmsprop flat_lr=True bf16=True", "out_bigram": "False bf16=True gate_bias=-2.0 lr=0.0", "oneliners": "relu2_tau=0.0 mlp_sandwich=False head_gate=False hg_norm=True hg_ch=32 hg_mul=2.0 hg_bias=0.0 out_pool=False pool_layers=3 qk_shift=True qk_beta=0.0 qk_freeze=True x0_gate=False block_nudge=False nudge_site=qk qkv_norm_cse=False parallel_block=False par_coalesce=none epoch_shuffle=False epoch_shuffle_seed=1234", "engram": "False site=-1 orders=2,3 heads=1 tables=0 mult=32 mem_dim=128 e_dim=0 key_dim=0 conv_k=4 share=False bf16=True", "batch_ramp": "False grad_accum=(2, 4, 8) bounds=(0.35, 0.75) lr_exp=0.5 ref_grad_accum=4 last_grad_accum=4", "weight_ema": "False decays=(0.995,) start_frac=0.75 seeded=False updates=0", "sched_tricks": "demon_b1=False demon_final=0.55 demon_ref=0.8 demon_start=-1.0 muon_b2=0.9 muon_b2_final=0.0 depth_lr=1.0->1.0 depth_mom=0.0->0.0 depth_mom_ref=0.95", "num_steps": 2719, "total_tokens_M": 356.4, "world_size": 4, "lnc": 2, "seq_len": 2048, "num_params_M": 592.9, "causality_passed": true, "causality_max_abs": 0.0, "public_val_bpb": 1.015549, "eval_seconds": 9.0, "eval_timeout": 1200, "eval_over_timeout": false}
{"timestamp": "2026-09-17T11:59:04+00:00", "label": "sub1-p2b-autocast-bf16-revisit", "solution": "sub1", "description": "REVISIT fast bf16-smoke exact config [trn21] CC=--auto-cast matmult --auto-cast-type bf16", "launch_command": "NEURON_LOGICAL_NC_CONFIG=2 torchrun --standalone --nproc_per_node=4 train.py --num-steps 300 --max-train-seconds 3600 --out-dir out/sub1-p2b-autocast-bf16-revisit --seed 42", "git_commit": "496befd", "git_dirty": true, "status": "keep", "wall_elapsed_seconds": 486.4, "run_log": "research/run-logs/sub1-p2b-autocast-bf16-revisit.log", "checkpoint_path": "out/sub1-p2b-autocast-bf16-revisit/final.pt", "training_seconds": 364.0, "budget_seconds": 1800, "target_steps": 300, "max_train_seconds": 3600, "startup_allowance_est": 106.6, "charged_seconds_est": 365.0, "over_budget": false, "total_seconds": 467.3, "compiled": true, "nki_relu2": false, "ngram_ve": "True tables=4 rows=1048576 dim=128 index_gather=True trigram=True opt=rmsprop flat_lr=True bf16=True", "out_bigram": "False bf16=True gate_bias=-2.0 lr=0.0", "oneliners": "relu2_tau=0.0 mlp_sandwich=False head_gate=False hg_norm=True hg_ch=32 hg_mul=2.0 hg_bias=0.0 out_pool=False pool_layers=3 qk_shift=True qk_beta=0.0 qk_freeze=True x0_gate=False block_nudge=False nudge_site=qk qkv_norm_cse=False parallel_block=False par_coalesce=none epoch_shuffle=False epoch_shuffle_seed=1234", "engram": "False site=-1 orders=2,3 heads=1 tables=0 mult=32 mem_dim=128 e_dim=0 key_dim=0 conv_k=4 share=False bf16=True", "batch_ramp": "False grad_accum=(2, 4, 8) bounds=(0.35, 0.75) lr_exp=0.5 ref_grad_accum=4 last_grad_accum=4", "weight_ema": "False decays=(0.995,) start_frac=0.75 seeded=False updates=0", "sched_tricks": "demon_b1=False demon_final=0.55 demon_ref=0.8 demon_start=-1.0 muon_b2=0.9 muon_b2_final=0.0 depth_lr=1.0->1.0 depth_mom=0.0->0.0 depth_mom_ref=0.95", "num_steps": 300, "total_tokens_M": 39.3, "world_size": 4, "lnc": 2, "seq_len": 2048, "num_params_M": 592.9, "causality_passed": true, "causality_max_abs": 0.0, "public_val_bpb": 1.223397, "eval_seconds": 9.0, "eval_timeout": 1200, "eval_over_timeout": false}
{"timestamp": "2026-09-16T21:38:37+00:00", "label": "sub1-p2b-autocast-bf16-smoke", "solution": "sub1", "description": "compiler auto-cast matmult bf16 CONTROL 300 steps", "launch_command": "NEURON_LOGICAL_NC_CONFIG=2 torchrun --standalone --nproc_per_node=4 train.py --num-steps 300 --max-train-seconds 3600 --out-dir out/sub1-p2b-autocast-bf16-smoke --seed 42", "git_commit": "496befd", "git_dirty": true, "status": "keep", "wall_elapsed_seconds": 636.7, "run_log": "research/run-logs/sub1-p2b-autocast-bf16-smoke.log", "checkpoint_path": "out/sub1-p2b-autocast-bf16-smoke/final.pt", "training_seconds": 192.1, "budget_seconds": 1800, "target_steps": 300, "max_train_seconds": 3600, "startup_allowance_est": 391.7, "charged_seconds_est": 193.2, "over_budget": false, "total_seconds": 617.4, "compiled": true, "nki_relu2": false, "ngram_ve": "True tables=4 rows=1048576 dim=128 index_gather=True trigram=True opt=rmsprop flat_lr=True bf16=True", "out_bigram": "False bf16=True gate_bias=-2.0 lr=0.0", "oneliners": "relu2_tau=0.0 mlp_sandwich=False head_gate=False hg_norm=True hg_ch=32 hg_mul=2.0 hg_bias=0.0 out_pool=False pool_layers=3 qk_shift=True qk_beta=0.0 qk_freeze=True x0_gate=False block_nudge=False nudge_site=qk qkv_norm_cse=False parallel_block=False par_coalesce=none epoch_shuffle=False epoch_shuffle_seed=1234", "engram": "False site=-1 orders=2,3 heads=1 tables=0 mult=32 mem_dim=128 e_dim=0 key_dim=0 conv_k=4 share=False bf16=True", "batch_ramp": "False grad_accum=(2, 4, 8) bounds=(0.35, 0.75) lr_exp=0.5 ref_grad_accum=4 last_grad_accum=4", "weight_ema": "False decays=(0.995,) start_frac=0.75 seeded=False updates=0", "sched_tricks": "demon_b1=False demon_final=0.55 demon_ref=0.8 demon_start=-1.0 muon_b2=0.9 muon_b2_final=0.0 depth_lr=1.0->1.0 depth_mom=0.0->0.0 depth_mom_ref=0.95", "num_steps": 300, "total_tokens_M": 39.3, "world_size": 4, "lnc": 2, "seq_len": 2048, "num_params_M": 592.9, "causality_passed": true, "causality_max_abs": 0.0, "public_val_bpb": 1.225695, "eval_seconds": 28.8, "eval_timeout": 1200, "eval_over_timeout": false}
{"timestamp": "2026-09-17T08:35:09+00:00", "label": "sub1-p2b-autocast-bf16mt-smoke", "solution": "sub1", "description": "bf16 auto-cast matmult + model-type transformer, speed test", "launch_command": "NEURON_LOGICAL_NC_CONFIG=2 torchrun --standalone --nproc_per_node=4 train.py --num-steps 300 --max-train-seconds 3600 --out-dir out/sub1-p2b-autocast-bf16mt-smoke --seed 42", "git_commit": "496befd", "git_dirty": true, "status": "keep", "wall_elapsed_seconds": 1217.9, "run_log": "research/run-logs/sub1-p2b-autocast-bf16mt-smoke.log", "checkpoint_path": "out/sub1-p2b-autocast-bf16mt-smoke/final.pt", "training_seconds": 364.2, "budget_seconds": 1800, "target_steps": 300, "max_train_seconds": 3600, "startup_allowance_est": 793.6, "charged_seconds_est": 365.3, "over_budget": false, "total_seconds": 1191.5, "compiled": true, "nki_relu2": false, "ngram_ve": "True tables=4 rows=1048576 dim=128 index_gather=True trigram=True opt=rmsprop flat_lr=True bf16=True", "out_bigram": "False bf16=True gate_bias=-2.0 lr=0.0", "oneliners": "relu2_tau=0.0 mlp_sandwich=False head_gate=False hg_norm=True hg_ch=32 hg_mul=2.0 hg_bias=0.0 out_pool=False pool_layers=3 qk_shift=True qk_beta=0.0 qk_freeze=True x0_gate=False block_nudge=False nudge_site=qk qkv_norm_cse=False parallel_block=False par_coalesce=none epoch_shuffle=False epoch_shuffle_seed=1234", "engram": "False site=-1 orders=2,3 heads=1 tables=0 mult=32 mem_dim=128 e_dim=0 key_dim=0 conv_k=4 share=False bf16=True", "batch_ramp": "False grad_accum=(2, 4, 8) bounds=(0.35, 0.75) lr_exp=0.5 ref_grad_accum=4 last_grad_accum=4", "weight_ema": "False decays=(0.995,) start_frac=0.75 seeded=False updates=0", "sched_tricks": "demon_b1=False demon_final=0.55 demon_ref=0.8 demon_start=-1.0 muon_b2=0.9 muon_b2_final=0.0 depth_lr=1.0->1.0 depth_mom=0.0->0.0 depth_mom_ref=0.95", "num_steps": 300, "total_tokens_M": 39.3, "world_size": 4, "lnc": 2, "seq_len": 2048, "num_params_M": 592.9, "causality_passed": true, "causality_max_abs": 0.0, "public_val_bpb": 1.222752, "eval_seconds": 33.5, "eval_timeout": 1200, "eval_over_timeout": false}
{"timestamp": "2026-09-17T12:27:46+00:00", "label": "sub1-p2b-autocast-bf16o1-smoke", "solution": "sub1", "description": "bf16 auto-cast WITH optlevel=1 [trn21] CC=--optlevel=1 --auto-cast matmult --auto-cast-type bf16", "launch_command": "NEURON_LOGICAL_NC_CONFIG=2 torchrun --standalone --nproc_per_node=4 train.py --num-steps 300 --max-train-seconds 3600 --out-dir out/sub1-p2b-autocast-bf16o1-smoke --seed 42", "git_commit": "496befd", "git_dirty": true, "status": "keep", "wall_elapsed_seconds": 603.2, "run_log": "research/run-logs/sub1-p2b-autocast-bf16o1-smoke.log", "checkpoint_path": "out/sub1-p2b-autocast-bf16o1-smoke/final.pt", "training_seconds": 194.5, "budget_seconds": 1800, "target_steps": 300, "max_train_seconds": 3600, "startup_allowance_est": 393.7, "charged_seconds_est": 195.5, "over_budget": false, "total_seconds": 577.8, "compiled": true, "nki_relu2": false, "ngram_ve": "True tables=4 rows=1048576 dim=128 index_gather=True trigram=True opt=rmsprop flat_lr=True bf16=True", "out_bigram": "False bf16=True gate_bias=-2.0 lr=0.0", "oneliners": "relu2_tau=0.0 mlp_sandwich=False head_gate=False hg_norm=True hg_ch=32 hg_mul=2.0 hg_bias=0.0 out_pool=False pool_layers=3 qk_shift=True qk_beta=0.0 qk_freeze=True x0_gate=False block_nudge=False nudge_site=qk qkv_norm_cse=False parallel_block=False par_coalesce=none epoch_shuffle=False epoch_shuffle_seed=1234", "engram": "False site=-1 orders=2,3 heads=1 tables=0 mult=32 mem_dim=128 e_dim=0 key_dim=0 conv_k=4 share=False bf16=True", "batch_ramp": "False grad_accum=(2, 4, 8) bounds=(0.35, 0.75) lr_exp=0.5 ref_grad_accum=4 last_grad_accum=4", "weight_ema": "False decays=(0.995,) start_frac=0.75 seeded=False updates=0", "sched_tricks": "demon_b1=False demon_final=0.55 demon_ref=0.8 demon_start=-1.0 muon_b2=0.9 muon_b2_final=0.0 depth_lr=1.0->1.0 depth_mom=0.0->0.0 depth_mom_ref=0.95", "num_steps": 300, "total_tokens_M": 39.3, "world_size": 4, "lnc": 2, "seq_len": 2048, "num_params_M": 592.9, "causality_passed": true, "causality_max_abs": 0.0, "public_val_bpb": 1.223751, "eval_seconds": 9.1, "eval_timeout": 1200, "eval_over_timeout": false}
{"timestamp": "2026-09-17T08:37:39+00:00", "label": "sub1-p2b-autocast-bf16repro-smoke", "solution": "sub1", "description": "bf16 auto-cast matmult repro control, speed test", "launch_command": "NEURON_LOGICAL_NC_CONFIG=2 torchrun --standalone --nproc_per_node=4 train.py --num-steps 300 --max-train-seconds 3600 --out-dir out/sub1-p2b-autocast-bf16repro-smoke --seed 42", "git_commit": "dab464a", "git_dirty": true, "status": "keep", "wall_elapsed_seconds": 1248.0, "run_log": "research/run-logs/sub1-p2b-autocast-bf16repro-smoke.log", "checkpoint_path": "out/sub1-p2b-autocast-bf16repro-smoke/final.pt", "training_seconds": 366.9, "budget_seconds": 1800, "target_steps": 300, "max_train_seconds": 3600, "startup_allowance_est": 816.2, "charged_seconds_est": 367.9, "over_budget": false, "total_seconds": 1221.3, "compiled": true, "nki_relu2": false, "ngram_ve": "True tables=4 rows=1048576 dim=128 index_gather=True trigram=True opt=rmsprop flat_lr=True bf16=True", "out_bigram": "False bf16=True gate_bias=-2.0 lr=0.0", "oneliners": "relu2_tau=0.0 mlp_sandwich=False head_gate=False hg_norm=True hg_ch=32 hg_mul=2.0 hg_bias=0.0 out_pool=False pool_layers=3 qk_shift=True qk_beta=0.0 qk_freeze=True x0_gate=False block_nudge=False nudge_site=qk qkv_norm_cse=False parallel_block=False par_coalesce=none epoch_shuffle=False epoch_shuffle_seed=1234", "engram": "False site=-1 orders=2,3 heads=1 tables=0 mult=32 mem_dim=128 e_dim=0 key_dim=0 conv_k=4 share=False bf16=True", "batch_ramp": "False grad_accum=(2, 4, 8) bounds=(0.35, 0.75) lr_exp=0.5 ref_grad_accum=4 last_grad_accum=4", "weight_ema": "False decays=(0.995,) start_frac=0.75 seeded=False updates=0", "sched_tricks": "demon_b1=False demon_final=0.55 demon_ref=0.8 demon_start=-1.0 muon_b2=0.9 muon_b2_final=0.0 depth_lr=1.0->1.0 depth_mom=0.0->0.0 depth_mom_ref=0.95", "num_steps": 300, "total_tokens_M": 39.3, "world_size": 4, "lnc": 2, "seq_len": 2048, "num_params_M": 592.9, "causality_passed": true, "causality_max_abs": 0.0, "public_val_bpb": 1.224407, "eval_seconds": 36.9, "eval_timeout": 1200, "eval_over_timeout": false}
{"timestamp": "2026-09-17T06:17:21+00:00", "label": "sub1-p2b-autocast-dyn-smoke", "solution": "sub1", "description": "fp8 auto-cast DYNAMIC loss scaling probe 300 steps", "launch_command": "NEURON_LOGICAL_NC_CONFIG=2 torchrun --standalone --nproc_per_node=4 train.py --num-steps 300 --max-train-seconds 3600 --out-dir out/sub1-p2b-autocast-dyn-smoke --loss-scale 1024 --loss-scale-dynamic --seed 42", "git_commit": "496befd", "git_dirty": true, "status": "crash", "wall_elapsed_seconds": 58.2, "run_log": "research/run-logs/sub1-p2b-autocast-dyn-smoke.log"}
{"timestamp": "2026-09-17T06:33:16+00:00", "label": "sub1-p2b-autocast-dyn2-smoke", "solution": "sub1", "description": "fp8 auto-cast DYNAMIC retry after disk fix 300 steps", "launch_command": "NEURON_LOGICAL_NC_CONFIG=2 torchrun --standalone --nproc_per_node=4 train.py --num-steps 300 --max-train-seconds 3600 --out-dir out/sub1-p2b-autocast-dyn2-smoke --loss-scale 1024 --loss-scale-dynamic --seed 42", "git_commit": "496befd", "git_dirty": true, "status": "crash", "wall_elapsed_seconds": 569.3, "run_log": "research/run-logs/sub1-p2b-autocast-dyn2-smoke.log"}
{"timestamp": "2026-09-17T07:09:55+00:00", "label": "sub1-p2b-autocast-dyn256-smoke", "solution": "sub1", "description": "fp8 auto-cast dynamic from 256 300 steps", "launch_command": "NEURON_LOGICAL_NC_CONFIG=2 torchrun --standalone --nproc_per_node=4 train.py --num-steps 300 --max-train-seconds 3600 --out-dir out/sub1-p2b-autocast-dyn256-smoke --loss-scale 256 --loss-scale-dynamic --seed 42", "git_commit": "496befd", "git_dirty": true, "status": "keep", "wall_elapsed_seconds": 1248.1, "run_log": "research/run-logs/sub1-p2b-autocast-dyn256-smoke.log", "checkpoint_path": "out/sub1-p2b-autocast-dyn256-smoke/final.pt", "training_seconds": 374.4, "budget_seconds": 1800, "target_steps": 300, "max_train_seconds": 3600, "startup_allowance_est": 813.2, "charged_seconds_est": 375.5, "over_budget": false, "total_seconds": 1221.8, "compiled": true, "nki_relu2": false, "ngram_ve": "True tables=4 rows=1048576 dim=128 index_gather=True trigram=True opt=rmsprop flat_lr=True bf16=True", "out_bigram": "False bf16=True gate_bias=-2.0 lr=0.0", "oneliners": "relu2_tau=0.0 mlp_sandwich=False head_gate=False hg_norm=True hg_ch=32 hg_mul=2.0 hg_bias=0.0 out_pool=False pool_layers=3 qk_shift=True qk_beta=0.0 qk_freeze=True x0_gate=False block_nudge=False nudge_site=qk qkv_norm_cse=False parallel_block=False par_coalesce=none epoch_shuffle=False epoch_shuffle_seed=1234", "engram": "False site=-1 orders=2,3 heads=1 tables=0 mult=32 mem_dim=128 e_dim=0 key_dim=0 conv_k=4 share=False bf16=True", "batch_ramp": "False grad_accum=(2, 4, 8) bounds=(0.35, 0.75) lr_exp=0.5 ref_grad_accum=4 last_grad_accum=4", "weight_ema": "False decays=(0.995,) start_frac=0.75 seeded=False updates=0", "sched_tricks": "demon_b1=False demon_final=0.55 demon_ref=0.8 demon_start=-1.0 muon_b2=0.9 muon_b2_final=0.0 depth_lr=1.0->1.0 depth_mom=0.0->0.0 depth_mom_ref=0.95", "num_steps": 300, "total_tokens_M": 39.3, "world_size": 4, "lnc": 2, "seq_len": 2048, "num_params_M": 592.9, "causality_passed": true, "causality_max_abs": 0.0, "public_val_bpb": NaN, "eval_seconds": 33.8, "eval_timeout": 1200, "eval_over_timeout": false}
{"timestamp": "2026-09-17T00:27:07+00:00", "label": "sub1-p2b-autocast-nocache-smoke", "solution": "sub1", "description": "fp8 auto-cast with weight-cache OFF probe 300 steps", "launch_command": "NEURON_LOGICAL_NC_CONFIG=2 torchrun --standalone --nproc_per_node=4 train.py --num-steps 300 --max-train-seconds 3600 --out-dir out/sub1-p2b-autocast-nocache-smoke --seed 42", "git_commit": "496befd", "git_dirty": true, "status": "keep", "wall_elapsed_seconds": 252.0, "run_log": "research/run-logs/sub1-p2b-autocast-nocache-smoke.log", "checkpoint_path": "out/sub1-p2b-autocast-nocache-smoke/final.pt", "training_seconds": 184.8, "budget_seconds": 1800, "target_steps": 300, "max_train_seconds": 3600, "startup_allowance_est": 52.9, "charged_seconds_est": 185.8, "over_budget": false, "total_seconds": 227.1, "compiled": true, "nki_relu2": false, "ngram_ve": "True tables=4 rows=1048576 dim=128 index_gather=True trigram=True opt=rmsprop flat_lr=True bf16=True", "out_bigram": "False bf16=True gate_bias=-2.0 lr=0.0", "oneliners": "relu2_tau=0.0 mlp_sandwich=False head_gate=False hg_norm=True hg_ch=32 hg_mul=2.0 hg_bias=0.0 out_pool=False pool_layers=3 qk_shift=True qk_beta=0.0 qk_freeze=True x0_gate=False block_nudge=False nudge_site=qk qkv_norm_cse=False parallel_block=False par_coalesce=none epoch_shuffle=False epoch_shuffle_seed=1234", "engram": "False site=-1 orders=2,3 heads=1 tables=0 mult=32 mem_dim=128 e_dim=0 key_dim=0 conv_k=4 share=False bf16=True", "batch_ramp": "False grad_accum=(2, 4, 8) bounds=(0.35, 0.75) lr_exp=0.5 ref_grad_accum=4 last_grad_accum=4", "weight_ema": "False decays=(0.995,) start_frac=0.75 seeded=False updates=0", "sched_tricks": "demon_b1=False demon_final=0.55 demon_ref=0.8 demon_start=-1.0 muon_b2=0.9 muon_b2_final=0.0 depth_lr=1.0->1.0 depth_mom=0.0->0.0 depth_mom_ref=0.95", "num_steps": 300, "total_tokens_M": 39.3, "world_size": 4, "lnc": 2, "seq_len": 2048, "num_params_M": 592.9, "causality_passed": true, "causality_max_abs": 0.0, "public_val_bpb": 3.23429, "eval_seconds": 9.0, "eval_timeout": 1200, "eval_over_timeout": false}
{"timestamp": "2026-09-17T04:08:52+00:00", "label": "sub1-p2b-autocast-nocompile-smoke", "solution": "sub1", "description": "fp8 auto-cast with full-model compile OFF probe 300 steps", "launch_command": "NEURON_LOGICAL_NC_CONFIG=2 torchrun --standalone --nproc_per_node=4 train.py --num-steps 300 --max-train-seconds 3600 --out-dir out/sub1-p2b-autocast-nocompile-smoke --no-compile --seed 42", "git_commit": "496befd", "git_dirty": true, "status": "keep", "wall_elapsed_seconds": 338.7, "run_log": "research/run-logs/sub1-p2b-autocast-nocompile-smoke.log", "checkpoint_path": "out/sub1-p2b-autocast-nocompile-smoke/final.pt", "training_seconds": 249.2, "budget_seconds": 1800, "target_steps": 300, "max_train_seconds": 3600, "startup_allowance_est": 75.5, "charged_seconds_est": 250.3, "over_budget": false, "total_seconds": 315.3, "compiled": false, "nki_relu2": false, "ngram_ve": "True tables=4 rows=1048576 dim=128 index_gather=True trigram=True opt=rmsprop flat_lr=True bf16=True", "out_bigram": "False bf16=True gate_bias=-2.0 lr=0.0", "oneliners": "relu2_tau=0.0 mlp_sandwich=False head_gate=False hg_norm=True hg_ch=32 hg_mul=2.0 hg_bias=0.0 out_pool=False pool_layers=3 qk_shift=True qk_beta=0.0 qk_freeze=True x0_gate=False block_nudge=False nudge_site=qk qkv_norm_cse=False parallel_block=False par_coalesce=none epoch_shuffle=False epoch_shuffle_seed=1234", "engram": "False site=-1 orders=2,3 heads=1 tables=0 mult=32 mem_dim=128 e_dim=0 key_dim=0 conv_k=4 share=False bf16=True", "batch_ramp": "False grad_accum=(2, 4, 8) bounds=(0.35, 0.75) lr_exp=0.5 ref_grad_accum=4 last_grad_accum=4", "weight_ema": "False decays=(0.995,) start_frac=0.75 seeded=False updates=0", "sched_tricks": "demon_b1=False demon_final=0.55 demon_ref=0.8 demon_start=-1.0 muon_b2=0.9 muon_b2_final=0.0 depth_lr=1.0->1.0 depth_mom=0.0->0.0 depth_mom_ref=0.95", "num_steps": 300, "total_tokens_M": 39.3, "world_size": 4, "lnc": 2, "seq_len": 2048, "num_params_M": 592.9, "causality_passed": true, "causality_max_abs": 0.0, "public_val_bpb": 3.234289, "eval_seconds": 8.9, "eval_timeout": 1200, "eval_over_timeout": false}
