{"timestamp": "2026-09-04T07:57:38+00:00", "label": "baseline", "solution": "0", "description": "unmodified baseline, real reference run", "launch_command": "NEURON_LOGICAL_NC_CONFIG=1 torchrun --standalone --nproc_per_node=1 train.py --num-steps 800 --max-train-seconds 1200 --out-dir out/baseline", "git_commit": "608804f", "git_dirty": true, "status": "keep", "wall_elapsed_seconds": 1039.5, "run_log": "research/run-logs/baseline.log", "checkpoint_path": "out/baseline/final.pt", "training_seconds": 1023.7, "budget_seconds": 1800, "target_steps": 800, "max_train_seconds": 1200, "over_budget": false, "total_seconds": 1023.8, "compiled": false, "nki_relu2": false, "num_steps": 800, "total_tokens_M": 52.4, "world_size": 1, "lnc": 1, "seq_len": 1024, "num_params_M": 59.6, "causality_passed": true, "causality_max_abs": 0.0, "public_val_bpb": 1.273797, "eval_seconds": 13.8, "eval_timeout": 1200, "eval_over_timeout": false}
{"timestamp": "2026-09-08T11:01:29+00:00", "label": "batch262144-fullbudget", "solution": "Tier0", "description": "TOTAL_BATCH_SIZE=262144 full-1800s test at locked DEPTH=6/width=640 under the new tensor-lr-scalars regime", "launch_command": "NEURON_LOGICAL_NC_CONFIG=2 torchrun --standalone --nproc_per_node=4 train.py --num-steps 5000 --max-train-seconds 1800 --out-dir out/batch262144-fullbudget", "git_commit": "252fd6f", "git_dirty": true, "status": "keep", "wall_elapsed_seconds": 1856.7, "run_log": "research/run-logs/batch262144-fullbudget.log", "checkpoint_path": "out/batch262144-fullbudget/final.pt", "training_seconds": 1793.7, "budget_seconds": 1800, "target_steps": 5000, "max_train_seconds": 1800, "startup_allowance_est": 50.9, "charged_seconds_est": 1793.9, "over_budget": false, "total_seconds": 1830.4, "compiled": true, "nki_relu2": false, "num_steps": 1038, "total_tokens_M": 272.1, "world_size": 4, "lnc": 2, "seq_len": 2048, "num_params_M": 55.7, "causality_passed": true, "causality_max_abs": 0.0, "public_val_bpb": 1.051031, "eval_seconds": 7.6, "eval_timeout": 1200, "eval_over_timeout": false}
{"timestamp": "2026-09-08T10:19:21+00:00", "label": "batch65536-fullbudget", "solution": "Tier0", "description": "TOTAL_BATCH_SIZE=65536 full-1800s test at locked DEPTH=6/width=640 under the new tensor-lr-scalars regime", "launch_command": "NEURON_LOGICAL_NC_CONFIG=2 torchrun --standalone --nproc_per_node=4 train.py --num-steps 5000 --max-train-seconds 1800 --out-dir out/batch65536-fullbudget", "git_commit": "1ba3a35", "git_dirty": true, "status": "keep", "wall_elapsed_seconds": 1848.2, "run_log": "research/run-logs/batch65536-fullbudget.log", "checkpoint_path": "out/batch65536-fullbudget/final.pt", "training_seconds": 1794.7, "budget_seconds": 1800, "target_steps": 5000, "max_train_seconds": 1800, "startup_allowance_est": 41.5, "charged_seconds_est": 1794.9, "over_budget": false, "total_seconds": 1825.3, "compiled": true, "nki_relu2": false, "num_steps": 3544, "total_tokens_M": 232.3, "world_size": 4, "lnc": 2, "seq_len": 2048, "num_params_M": 55.7, "causality_passed": true, "causality_max_abs": 0.0, "public_val_bpb": 1.048832, "eval_seconds": 7.6, "eval_timeout": 1200, "eval_over_timeout": false}
{"timestamp": "2026-09-08T08:04:12+00:00", "label": "beta2-0995-900s-v2", "solution": "Tier0", "description": "EMBED_ADAMW_BETA2 recheck under the new ~2000-step regime: 0.995 vs locked 0.95", "launch_command": "NEURON_LOGICAL_NC_CONFIG=2 torchrun --standalone --nproc_per_node=4 train.py --num-steps 5000 --max-train-seconds 900 --out-dir out/beta2-0995-900s-v2", "git_commit": "11ba31c", "git_dirty": true, "status": "keep", "wall_elapsed_seconds": 953.3, "run_log": "research/run-logs/beta2-0995-900s-v2.log", "checkpoint_path": "out/beta2-0995-900s-v2/final.pt", "training_seconds": 894.1, "budget_seconds": 1800, "target_steps": 5000, "max_train_seconds": 900, "startup_allowance_est": 47.0, "charged_seconds_est": 894.3, "over_budget": false, "total_seconds": 926.4, "compiled": true, "nki_relu2": false, "num_steps": 977, "total_tokens_M": 128.1, "world_size": 4, "lnc": 2, "seq_len": 2048, "num_params_M": 55.7, "causality_passed": true, "causality_max_abs": 0.0, "public_val_bpb": 1.097342, "eval_seconds": 7.6, "eval_timeout": 1200, "eval_over_timeout": false}
{"timestamp": "2026-09-07T04:32:21+00:00", "label": "bucket-e-compile-900s", "solution": "E", "description": "torch.compile backend=neuron real speed/quality A/B at final locked shape (softcap+CE kernel + rope kernel ON, XSA off), vs eager baseline sol-c-softcapce-900s (384 steps, 1.198478)", "launch_command": "NEURON_LOGICAL_NC_CONFIG=2 torchrun --standalone --nproc_per_node=4 train.py --num-steps 5000 --max-train-seconds 900 --out-dir out/bucket-e-compile-900s --compile", "git_commit": "28029c0", "git_dirty": true, "status": "keep", "wall_elapsed_seconds": 1009.8, "run_log": "research/run-logs/bucket-e-compile-900s.log", "checkpoint_path": "out/bucket-e-compile-900s/final.pt", "training_seconds": 894.3, "budget_seconds": 1800, "target_steps": 5000, "max_train_seconds": 900, "startup_allowance_est": 103.1, "charged_seconds_est": 894.5, "over_budget": false, "total_seconds": 993.2, "compiled": true, "nki_relu2": false, "num_steps": 406, "total_tokens_M": 53.2, "world_size": 4, "lnc": 2, "seq_len": 2048, "num_params_M": 55.7, "causality_passed": true, "causality_max_abs": 0.0, "public_val_bpb": 1.190086, "eval_seconds": 7.4, "eval_timeout": 1200, "eval_over_timeout": false}
{"timestamp": "2026-09-07T05:04:00+00:00", "label": "bucket-e-compile-fullbudget", "solution": "E", "description": "torch.compile backend=neuron full-1800s confirmation at final locked shape (softcap+CE+rope kernels ON, XSA off) -- confirming the real 900s win before considering a leaderboard submission", "launch_command": "NEURON_LOGICAL_NC_CONFIG=2 torchrun --standalone --nproc_per_node=4 train.py --num-steps 5000 --max-train-seconds 1800 --out-dir out/bucket-e-compile-fullbudget --compile", "git_commit": "0207e14", "git_dirty": true, "status": "keep", "wall_elapsed_seconds": 1852.4, "run_log": "research/run-logs/bucket-e-compile-fullbudget.log", "checkpoint_path": "out/bucket-e-compile-fullbudget/final.pt", "training_seconds": 1793.7, "budget_seconds": 1800, "target_steps": 5000, "max_train_seconds": 1800, "startup_allowance_est": 45.4, "charged_seconds_est": 1793.9, "over_budget": false, "total_seconds": 1825.4, "compiled": true, "nki_relu2": false, "num_steps": 827, "total_tokens_M": 108.4, "world_size": 4, "lnc": 2, "seq_len": 2048, "num_params_M": 55.7, "causality_passed": true, "causality_max_abs": 0.0, "public_val_bpb": 1.113006, "eval_seconds": 7.4, "eval_timeout": 1200, "eval_over_timeout": false}
{"timestamp": "2026-09-07T04:09:09+00:00", "label": "bucket-e-compile-smoke1", "solution": "E", "description": "torch.compile backend=neuron smoke test, rope-norm kernel forced OFF, tiny step count, single device", "launch_command": "NEURON_LOGICAL_NC_CONFIG=1 torchrun --standalone --nproc_per_node=1 train.py --num-steps 20 --max-train-seconds 600 --out-dir out/bucket-e-compile-smoke1 --compile --no-nki-rope-norm", "git_commit": "92a78a7", "git_dirty": true, "status": "keep", "wall_elapsed_seconds": 354.3, "run_log": "research/run-logs/bucket-e-compile-smoke1.log", "checkpoint_path": "out/bucket-e-compile-smoke1/final.pt", "training_seconds": 91.4, "budget_seconds": 1800, "target_steps": 20, "max_train_seconds": 600, "startup_allowance_est": 210.6, "charged_seconds_est": 91.6, "over_budget": false, "total_seconds": 341.5, "compiled": true, "nki_relu2": false, "num_steps": 20, "total_tokens_M": 2.6, "world_size": 1, "lnc": 1, "seq_len": 2048, "num_params_M": 55.7, "causality_passed": true, "causality_max_abs": 0.0, "public_val_bpb": 2.009676, "eval_seconds": 48.0, "eval_timeout": 1200, "eval_over_timeout": false}
{"timestamp": "2026-09-07T04:14:01+00:00", "label": "bucket-e-compile-smoke2", "solution": "E", "description": "torch.compile backend=neuron smoke test, rope-norm kernel ON (default), tiny step count, single device -- checking for silent compile+custom-autograd-Function correctness bug", "launch_command": "NEURON_LOGICAL_NC_CONFIG=1 torchrun --standalone --nproc_per_node=1 train.py --num-steps 20 --max-train-seconds 600 --out-dir out/bucket-e-compile-smoke2 --compile", "git_commit": "fbd4e11", "git_dirty": true, "status": "keep", "wall_elapsed_seconds": 253.5, "run_log": "research/run-logs/bucket-e-compile-smoke2.log", "checkpoint_path": "out/bucket-e-compile-smoke2/final.pt", "training_seconds": 77.6, "budget_seconds": 1800, "target_steps": 20, "max_train_seconds": 600, "startup_allowance_est": 130.5, "charged_seconds_est": 77.8, "over_budget": false, "total_seconds": 240.8, "compiled": true, "nki_relu2": false, "num_steps": 20, "total_tokens_M": 2.6, "world_size": 1, "lnc": 1, "seq_len": 2048, "num_params_M": 55.7, "causality_passed": true, "causality_max_abs": 0.0, "public_val_bpb": 2.011375, "eval_seconds": 41.2, "eval_timeout": 1200, "eval_over_timeout": false}
{"timestamp": "2026-09-07T05:07:32+00:00", "label": "bucket-e-default-check", "solution": "E", "description": "confirm plain launch command (no explicit flags) now compiles by default after flipping --compile to default ON", "launch_command": "NEURON_LOGICAL_NC_CONFIG=1 torchrun --standalone --nproc_per_node=1 train.py --num-steps 10 --max-train-seconds 400 --out-dir out/bucket-e-default-check", "git_commit": "802db00", "git_dirty": true, "status": "keep", "wall_elapsed_seconds": 126.9, "run_log": "research/run-logs/bucket-e-default-check.log", "checkpoint_path": "out/bucket-e-default-check/final.pt", "training_seconds": 26.1, "budget_seconds": 1800, "target_steps": 10, "max_train_seconds": 400, "startup_allowance_est": 54.4, "charged_seconds_est": 26.3, "over_budget": false, "total_seconds": 113.3, "compiled": true, "nki_relu2": false, "num_steps": 10, "total_tokens_M": 1.3, "world_size": 1, "lnc": 1, "seq_len": 2048, "num_params_M": 55.7, "causality_passed": true, "causality_max_abs": 0.0, "public_val_bpb": 2.115386, "eval_seconds": 41.9, "eval_timeout": 1200, "eval_over_timeout": false}
{"timestamp": "2026-09-10T08:47:54+00:00", "label": "cold-cache-fullbudget", "solution": "T0.6", "description": "Cold NEFF cache reproduction of the exact submitted config (bare launch command, current HEAD defaults): /tmp/neuron_backend moved aside and NEURON_COMPILE_CACHE_DIR pointed at a fresh dir, so compilation happens from scratch like a fresh official submission sandbox. Diagnostic for the 1.1495 leaderboard vs 1.034 local gap.", "launch_command": "NEURON_LOGICAL_NC_CONFIG=2 torchrun --standalone --nproc_per_node=4 train.py --num-steps 5000 --max-train-seconds 1800 --out-dir out/cold-cache-fullbudget", "git_commit": "fdc64f0", "git_dirty": true, "status": "keep", "wall_elapsed_seconds": 1864.3, "run_log": "research/run-logs/cold-cache-fullbudget.log", "checkpoint_path": "out/cold-cache-fullbudget/final.pt", "training_seconds": 1794.2, "budget_seconds": 1800, "target_steps": 5000, "max_train_seconds": 1800, "startup_allowance_est": 57.7, "charged_seconds_est": 1794.4, "over_budget": false, "total_seconds": 1836.6, "compiled": true, "nki_relu2": false, "num_steps": 2198, "total_tokens_M": 288.1, "world_size": 4, "lnc": 2, "seq_len": 2048, "num_params_M": 55.7, "causality_passed": true, "causality_max_abs": 0.0, "public_val_bpb": 1.034459, "eval_seconds": 7.5, "eval_timeout": 1200, "eval_over_timeout": false}
{"timestamp": "2026-09-07T22:27:04+00:00", "label": "customop-900s", "solution": "NkiCustomOps", "description": "route both NKI kernels through torch.library custom ops (tfc::rope_norm / tfc::softcap_ce via torch_neuronx nki_op/wrap_nki) instead of torch.autograd.Function, so Dynamo traces them into the graph; baseline to beat: tensorlr-900s 995 steps / 1.094327", "launch_command": "NEURON_LOGICAL_NC_CONFIG=2 torchrun --standalone --nproc_per_node=4 train.py --num-steps 5000 --max-train-seconds 900 --out-dir out/customop-900s --nki-custom-ops", "git_commit": "cc89120", "git_dirty": true, "status": "keep", "wall_elapsed_seconds": 950.6, "run_log": "research/run-logs/customop-900s.log", "checkpoint_path": "out/customop-900s/final.pt", "training_seconds": 894.2, "budget_seconds": 1800, "target_steps": 5000, "max_train_seconds": 900, "startup_allowance_est": 44.5, "charged_seconds_est": 894.4, "over_budget": false, "total_seconds": 925.9, "compiled": true, "nki_relu2": false, "num_steps": 980, "total_tokens_M": 128.5, "world_size": 4, "lnc": 2, "seq_len": 2048, "num_params_M": 55.7, "causality_passed": true, "causality_max_abs": 0.0, "public_val_bpb": 1.095574, "eval_seconds": 7.5, "eval_timeout": 1200, "eval_over_timeout": false}
{"timestamp": "2026-09-07T23:12:12+00:00", "label": "dcmha-compile-fail", "solution": "DCMHA", "description": "DCMHA (arXiv:2405.08553) real-hardware smoke test, single device, compiled, at the locked shape (SEQ_LEN=2048): torch.compile(backend=neuron) FAILS outright", "launch_command": "NEURON_LOGICAL_NC_CONFIG=1 torchrun --standalone --nproc_per_node=1 train.py --num-steps 15 --max-train-seconds 600 --out-dir out/dcmha-smoke --no-mudd --dcmha --eval-tokens 65536", "git_commit": "8f3c4e8", "git_dirty": true, "status": "crash", "wall_elapsed_seconds": 60.0, "run_log": "research/run-logs/dcmha-compile-fail.log", "note": "COMPILATION FAILED: neuronx-cc NCC_EXTP004 -- instructions generated (6560191) exceeds the typical limit of 5000000. The unfused QK^T->mask->compose->softmax->compose->@V sequence at T=2048 is too large a graph for this compiler; decisive real negative independent of quality."}
{"timestamp": "2026-09-07T23:22:15+00:00", "label": "dcmha-eager-smoke", "solution": "DCMHA", "description": "DCMHA real-hardware causality/crash smoke test, single device, eager (--no-compile) since compile fails at this shape: 15-step target", "launch_command": "NEURON_LOGICAL_NC_CONFIG=1 torchrun --standalone --nproc_per_node=1 train.py --num-steps 15 --max-train-seconds 300 --out-dir out/dcmha-eager-smoke --no-mudd --dcmha --no-compile --eval-tokens 65536", "git_commit": "8f3c4e8", "git_dirty": true, "status": "keep", "wall_elapsed_seconds": 850.1, "run_log": "research/run-logs/dcmha-eager-smoke.log", "checkpoint_path": "out/dcmha-eager-smoke/final.pt", "training_seconds": 116.2, "budget_seconds": 1800, "target_steps": 15, "max_train_seconds": 300, "startup_allowance_est": 698.6, "charged_seconds_est": 116.4, "over_budget": false, "total_seconds": 850.1, "compiled": false, "num_steps": 6, "world_size": 1, "lnc": 1, "seq_len": 2048, "num_params_M": 56.1, "causality_passed": true, "causality_max_abs": 0.0, "public_val_bpb": 2.718342, "note": "dt ~116-223s/step vs baseline eager's ~1.2s/step (~100x slower), even setting compile aside entirely -- a second, independent real negative for DCMHA at this locked shape"}
{"timestamp": "2026-09-08T08:38:50+00:00", "label": "depth8-fullbudget", "solution": "Tier0", "description": "DEPTH=8 full-1800s test under the new tensor-lr-scalars regime, ASPECT_RATIO=96 fixed (n_embd=768) -- never confirmed at full budget before", "launch_command": "NEURON_LOGICAL_NC_CONFIG=2 torchrun --standalone --nproc_per_node=4 train.py --num-steps 5000 --max-train-seconds 1800 --out-dir out/depth8-fullbudget", "git_commit": "5f78577", "git_dirty": true, "status": "keep", "wall_elapsed_seconds": 1988.5, "run_log": "research/run-logs/depth8-fullbudget.log", "checkpoint_path": "out/depth8-fullbudget/final.pt", "training_seconds": 1794.7, "budget_seconds": 1800, "target_steps": 5000, "max_train_seconds": 1800, "startup_allowance_est": 169.3, "charged_seconds_est": 1795.0, "over_budget": false, "total_seconds": 1960.6, "compiled": true, "nki_relu2": false, "num_steps": 1217, "total_tokens_M": 159.5, "world_size": 4, "lnc": 2, "seq_len": 2048, "num_params_M": 94.4, "causality_passed": true, "causality_max_abs": 0.0, "public_val_bpb": 1.052406, "eval_seconds": 10.8, "eval_timeout": 1200, "eval_over_timeout": false}
{"timestamp": "2026-09-15T10:12:31+00:00", "label": "depth8w640-arm-900", "solution": "T0.2", "description": "pure depth increase 6->8 at FIXED width n_embd=640 (explicit --n-embd override), decoupled from the confounded 768x8 result; ~900s, step-matched to ~552 steps", "launch_command": "NEURON_LOGICAL_NC_CONFIG=2 torchrun --standalone --nproc_per_node=4 train.py --num-steps 5000 --max-train-seconds 900 --out-dir out/depth8w640-arm-900 --eval-seq-len 1024 --depth 8 --n-embd 640", "git_commit": "496befd", "git_dirty": true, "status": "keep", "wall_elapsed_seconds": 1006.9, "run_log": "research/run-logs/depth8w640-arm-900.log", "checkpoint_path": "out/depth8w640-arm-900/final.pt", "training_seconds": 884.3, "budget_seconds": 1800, "target_steps": 5000, "max_train_seconds": 900, "startup_allowance_est": 84.1, "charged_seconds_est": 885.4, "over_budget": false, "total_seconds": 987.3, "compiled": true, "nki_relu2": false, "ngram_ve": "True tables=4 rows=1048576 dim=128 index_gather=True trigram=True opt=rmsprop flat_lr=True bf16=True", "out_bigram": "False bf16=True gate_bias=-2.0 lr=0.0", "oneliners": "relu2_tau=0.0 mlp_sandwich=False head_gate=False hg_norm=True hg_ch=32 hg_mul=2.0 hg_bias=0.0 out_pool=False pool_layers=3 qk_shift=True qk_beta=0.0 qk_freeze=True x0_gate=False block_nudge=False nudge_site=qk qkv_norm_cse=False parallel_block=False par_coalesce=none epoch_shuffle=False epoch_shuffle_seed=1234", "engram": "False site=-1 orders=2,3 heads=1 tables=0 mult=32 mem_dim=128 e_dim=0 key_dim=0 conv_k=4 share=False bf16=True", "batch_ramp": "False grad_accum=(2, 4, 8) bounds=(0.35, 0.75) lr_exp=0.5 ref_grad_accum=4 last_grad_accum=4", "weight_ema": "False decays=(0.995,) start_frac=0.75 seeded=False updates=0", "sched_tricks": "demon_b1=False demon_final=0.55 demon_ref=0.8 demon_start=-1.0 muon_b2=0.9 muon_b2_final=0.0 depth_lr=1.0->1.0 depth_mom=0.0->0.0 depth_mom_ref=0.95", "num_steps": 548, "total_tokens_M": 71.8, "world_size": 4, "lnc": 2, "seq_len": 2048, "num_params_M": 608.0, "causality_passed": true, "causality_max_abs": 0.0, "public_val_bpb": 1.107724, "eval_seconds": 11.6, "eval_timeout": 1200, "eval_over_timeout": false, "eval_alt_seq_len": 1024, "public_val_bpb_alt": 1.123059, "eval_alt_seconds": 20.1}
{"timestamp": "2026-09-15T09:55:44+00:00", "label": "depth8w640-ctrl-900", "solution": "T0.2", "description": "locked defaults (depth=6, n_embd=640) as-is, step-matched to ~552 steps for the depth=8-fixed-width-640 spot-check", "launch_command": "NEURON_LOGICAL_NC_CONFIG=2 torchrun --standalone --nproc_per_node=4 train.py --num-steps 5000 --max-train-seconds 460 --out-dir out/depth8w640-ctrl-900 --eval-seq-len 1024", "git_commit": "496befd", "git_dirty": true, "status": "keep", "wall_elapsed_seconds": 540.0, "run_log": "research/run-logs/depth8w640-ctrl-900.log", "checkpoint_path": "out/depth8w640-ctrl-900/final.pt", "training_seconds": 444.7, "budget_seconds": 1800, "target_steps": 5000, "max_train_seconds": 460, "startup_allowance_est": 62.3, "charged_seconds_est": 445.7, "over_budget": false, "total_seconds": 515.4, "compiled": true, "nki_relu2": false, "ngram_ve": "True tables=4 rows=1048576 dim=128 index_gather=True trigram=True opt=rmsprop flat_lr=True bf16=True", "out_bigram": "False bf16=True gate_bias=-2.0 lr=0.0", "oneliners": "relu2_tau=0.0 mlp_sandwich=False head_gate=False hg_norm=True hg_ch=32 hg_mul=2.0 hg_bias=0.0 out_pool=False pool_layers=3 qk_shift=True qk_beta=0.0 qk_freeze=True x0_gate=False block_nudge=False nudge_site=qk qkv_norm_cse=False parallel_block=False par_coalesce=none epoch_shuffle=False epoch_shuffle_seed=1234", "engram": "False site=-1 orders=2,3 heads=1 tables=0 mult=32 mem_dim=128 e_dim=0 key_dim=0 conv_k=4 share=False bf16=True", "batch_ramp": "False grad_accum=(2, 4, 8) bounds=(0.35, 0.75) lr_exp=0.5 ref_grad_accum=4 last_grad_accum=4", "weight_ema": "False decays=(0.995,) start_frac=0.75 seeded=False updates=0", "sched_tricks": "demon_b1=False demon_final=0.55 demon_ref=0.8 demon_start=-1.0 muon_b2=0.9 muon_b2_final=0.0 depth_lr=1.0->1.0 depth_mom=0.0->0.0 depth_mom_ref=0.95", "num_steps": 537, "total_tokens_M": 70.4, "world_size": 4, "lnc": 2, "seq_len": 2048, "num_params_M": 592.9, "causality_passed": true, "causality_max_abs": 0.0, "public_val_bpb": 1.112144, "eval_seconds": 9.7, "eval_timeout": 1200, "eval_over_timeout": false, "eval_alt_seq_len": 1024, "public_val_bpb_alt": 1.127645, "eval_alt_seconds": 17.1}
{"timestamp": "2026-09-05T14:48:19+00:00", "label": "diag-gc-enabled", "solution": "checklist-5-diag", "description": "diagnostic: gc.disable() removed (freeze() still active) -- does the throughput cliff still occur?", "launch_command": "NEURON_LOGICAL_NC_CONFIG=1 torchrun --standalone --nproc_per_node=8 train.py --num-steps 3000 --max-train-seconds 500 --out-dir out/diag-gc-enabled", "git_commit": "e71fc0a", "git_dirty": true, "status": "keep", "wall_elapsed_seconds": 552.4, "run_log": "research/run-logs/diag-gc-enabled.log", "checkpoint_path": "out/diag-gc-enabled/final.pt", "training_seconds": 492.7, "budget_seconds": 1800, "target_steps": 3000, "max_train_seconds": 500, "startup_allowance_est": 34.2, "charged_seconds_est": 493.0, "over_budget": false, "total_seconds": 523.5, "compiled": false, "nki_relu2": false, "num_steps": 136, "total_tokens_M": 8.9, "world_size": 8, "lnc": 1, "seq_len": 1024, "num_params_M": 85.9, "causality_passed": true, "causality_max_abs": 0.0, "public_val_bpb": 1.583861, "eval_seconds": 21.4, "eval_timeout": 1200, "eval_over_timeout": false}
