{"timestamp": "2026-09-07T20:01:47+00:00", "label": "tensorlr-fullbudget", "solution": "LrmQuantum", "description": "full-1800s confirmation of the device-tensor lr fix (--tensor-lr-scalars, exact continuous cooldown, one compile instead of one per step); previous full-budget best 847 steps / 1.108697", "launch_command": "NEURON_LOGICAL_NC_CONFIG=2 torchrun --standalone --nproc_per_node=4 train.py --num-steps 5000 --max-train-seconds 1800 --out-dir out/tensorlr-fullbudget --tensor-lr-scalars --lrm-quantum 0", "git_commit": "e6fe55a", "git_dirty": true, "status": "keep", "wall_elapsed_seconds": 1851.6, "run_log": "research/run-logs/tensorlr-fullbudget.log", "checkpoint_path": "out/tensorlr-fullbudget/final.pt", "training_seconds": 1794.4, "budget_seconds": 1800, "target_steps": 5000, "max_train_seconds": 1800, "startup_allowance_est": 45.3, "charged_seconds_est": 1794.5, "over_budget": false, "total_seconds": 1826.2, "compiled": true, "nki_relu2": false, "num_steps": 1995, "total_tokens_M": 261.5, "world_size": 4, "lnc": 2, "seq_len": 2048, "num_params_M": 55.7, "causality_passed": true, "causality_max_abs": 0.0, "public_val_bpb": 1.043489, "eval_seconds": 7.4, "eval_timeout": 1200, "eval_over_timeout": false}
{"timestamp": "2026-09-14T22:51:26+00:00", "label": "ti-bytewte-900s", "solution": "R1.2", "description": "plan 11.1 byte-feature wte init: hashed signed bag of byte 1..3-grams of each token's own bytes (tokenizer decode_single_token_bytes only), column-centered, rescaled to the control's 0.8 row RMS; host-side one-shot, zero training-graph ops, no torch RNG consumed", "launch_command": "NEURON_LOGICAL_NC_CONFIG=2 torchrun --standalone --nproc_per_node=4 train.py --num-steps 5000 --max-train-seconds 900 --out-dir out/ti-bytewte-900s --eval-seq-len 1024 --byte-wte-init", "git_commit": "496befd", "git_dirty": true, "status": "keep", "wall_elapsed_seconds": 986.8, "run_log": "research/run-logs/ti-bytewte-900s.log", "checkpoint_path": "out/ti-bytewte-900s/final.pt", "training_seconds": 884.6, "budget_seconds": 1800, "target_steps": 5000, "max_train_seconds": 900, "startup_allowance_est": 68.0, "charged_seconds_est": 885.7, "over_budget": false, "total_seconds": 957.3, "compiled": true, "nki_relu2": false, "ngram_ve": "True tables=4 rows=1048576 dim=128 index_gather=True trigram=True opt=rmsprop flat_lr=True bf16=True", "out_bigram": "False bf16=True gate_bias=-2.0 lr=0.0", "oneliners": "relu2_tau=0.0 mlp_sandwich=False head_gate=False hg_norm=True hg_ch=32 hg_mul=2.0 hg_bias=0.0 out_pool=False pool_layers=3 qk_shift=True qk_beta=0.0 qk_freeze=True x0_gate=False block_nudge=False nudge_site=qk qkv_norm_cse=False parallel_block=False par_coalesce=none epoch_shuffle=False epoch_shuffle_seed=1234", "engram": "False site=-1 orders=2,3 heads=1 tables=0 mult=32 mem_dim=128 e_dim=0 key_dim=0 conv_k=4 share=False bf16=True", "batch_ramp": "False grad_accum=(2, 4, 8) bounds=(0.35, 0.75) lr_exp=0.5 ref_grad_accum=4 last_grad_accum=4", "weight_ema": "False decays=(0.995,) start_frac=0.75 seeded=False updates=0", "num_steps": 1055, "total_tokens_M": 138.3, "world_size": 4, "lnc": 2, "seq_len": 2048, "num_params_M": 592.9, "causality_passed": true, "causality_max_abs": 0.0, "public_val_bpb": 1.054655, "eval_seconds": 10.0, "eval_timeout": 1200, "eval_over_timeout": false, "eval_alt_seq_len": 1024, "public_val_bpb_alt": 1.069852, "eval_alt_seconds": 17.8}
{"timestamp": "2026-09-15T01:02:49+00:00", "label": "ti-bytewte-mix025-900s", "solution": "R1.2", "description": "byte-feature wte init at mix 0.25 -- second dose-response point", "launch_command": "NEURON_LOGICAL_NC_CONFIG=2 torchrun --standalone --nproc_per_node=4 train.py --num-steps 5000 --max-train-seconds 900 --out-dir out/ti-bytewte-mix025-900s --eval-seq-len 1024 --byte-wte-init --byte-wte-init-mix 0.25", "git_commit": "496befd", "git_dirty": true, "status": "keep", "wall_elapsed_seconds": 975.8, "run_log": "research/run-logs/ti-bytewte-mix025-900s.log", "checkpoint_path": "out/ti-bytewte-mix025-900s/final.pt", "training_seconds": 884.8, "budget_seconds": 1800, "target_steps": 5000, "max_train_seconds": 900, "startup_allowance_est": 56.8, "charged_seconds_est": 885.9, "over_budget": false, "total_seconds": 957.2, "compiled": true, "nki_relu2": false, "ngram_ve": "True tables=4 rows=1048576 dim=128 index_gather=True trigram=True opt=rmsprop flat_lr=True bf16=True", "out_bigram": "False bf16=True gate_bias=-2.0 lr=0.0", "oneliners": "relu2_tau=0.0 mlp_sandwich=False head_gate=False hg_norm=True hg_ch=32 hg_mul=2.0 hg_bias=0.0 out_pool=False pool_layers=3 qk_shift=True qk_beta=0.0 qk_freeze=True x0_gate=False block_nudge=False nudge_site=qk qkv_norm_cse=False parallel_block=False par_coalesce=none epoch_shuffle=False epoch_shuffle_seed=1234", "engram": "False site=-1 orders=2,3 heads=1 tables=0 mult=32 mem_dim=128 e_dim=0 key_dim=0 conv_k=4 share=False bf16=True", "batch_ramp": "False grad_accum=(2, 4, 8) bounds=(0.35, 0.75) lr_exp=0.5 ref_grad_accum=4 last_grad_accum=4", "weight_ema": "False decays=(0.995,) start_frac=0.75 seeded=False updates=0", "num_steps": 1055, "total_tokens_M": 138.3, "world_size": 4, "lnc": 2, "seq_len": 2048, "num_params_M": 592.9, "causality_passed": true, "causality_max_abs": 0.0, "public_val_bpb": 1.053705, "eval_seconds": 10.0, "eval_timeout": 1200, "eval_over_timeout": false, "eval_alt_seq_len": 1024, "public_val_bpb_alt": 1.068946, "eval_alt_seconds": 17.8}
{"timestamp": "2026-09-15T00:46:34+00:00", "label": "ti-bytewte-mix050-900s", "solution": "R1.2", "description": "byte-feature wte init at mix 0.5 (half byte features, half random, row RMS preserved) -- dose-response point for the mix-1.0 +0.00215 read", "launch_command": "NEURON_LOGICAL_NC_CONFIG=2 torchrun --standalone --nproc_per_node=4 train.py --num-steps 5000 --max-train-seconds 900 --out-dir out/ti-bytewte-mix050-900s --eval-seq-len 1024 --byte-wte-init --byte-wte-init-mix 0.5", "git_commit": "496befd", "git_dirty": true, "status": "keep", "wall_elapsed_seconds": 984.4, "run_log": "research/run-logs/ti-bytewte-mix050-900s.log", "checkpoint_path": "out/ti-bytewte-mix050-900s/final.pt", "training_seconds": 884.5, "budget_seconds": 1800, "target_steps": 5000, "max_train_seconds": 900, "startup_allowance_est": 65.7, "charged_seconds_est": 885.6, "over_budget": false, "total_seconds": 957.4, "compiled": true, "nki_relu2": false, "ngram_ve": "True tables=4 rows=1048576 dim=128 index_gather=True trigram=True opt=rmsprop flat_lr=True bf16=True", "out_bigram": "False bf16=True gate_bias=-2.0 lr=0.0", "oneliners": "relu2_tau=0.0 mlp_sandwich=False head_gate=False hg_norm=True hg_ch=32 hg_mul=2.0 hg_bias=0.0 out_pool=False pool_layers=3 qk_shift=True qk_beta=0.0 qk_freeze=True x0_gate=False block_nudge=False nudge_site=qk qkv_norm_cse=False parallel_block=False par_coalesce=none epoch_shuffle=False epoch_shuffle_seed=1234", "engram": "False site=-1 orders=2,3 heads=1 tables=0 mult=32 mem_dim=128 e_dim=0 key_dim=0 conv_k=4 share=False bf16=True", "batch_ramp": "False grad_accum=(2, 4, 8) bounds=(0.35, 0.75) lr_exp=0.5 ref_grad_accum=4 last_grad_accum=4", "weight_ema": "False decays=(0.995,) start_frac=0.75 seeded=False updates=0", "num_steps": 1054, "total_tokens_M": 138.1, "world_size": 4, "lnc": 2, "seq_len": 2048, "num_params_M": 592.9, "causality_passed": true, "causality_max_abs": 0.0, "public_val_bpb": 1.054011, "eval_seconds": 10.1, "eval_timeout": 1200, "eval_over_timeout": false, "eval_alt_seq_len": 1024, "public_val_bpb_alt": 1.069089, "eval_alt_seconds": 17.8}
{"timestamp": "2026-09-14T22:34:59+00:00", "label": "ti-ctrl-900s-r1", "solution": "R1.2", "description": "fresh same-commit 900s control for the byte-wte-init / coalesced-SwiGLU / cautious-WD block", "launch_command": "NEURON_LOGICAL_NC_CONFIG=2 torchrun --standalone --nproc_per_node=4 train.py --num-steps 5000 --max-train-seconds 900 --out-dir out/ti-ctrl-900s-r1 --eval-seq-len 1024", "git_commit": "496befd", "git_dirty": true, "status": "keep", "wall_elapsed_seconds": 984.8, "run_log": "research/run-logs/ti-ctrl-900s-r1.log", "checkpoint_path": "out/ti-ctrl-900s-r1/final.pt", "training_seconds": 884.6, "budget_seconds": 1800, "target_steps": 5000, "max_train_seconds": 900, "startup_allowance_est": 65.9, "charged_seconds_est": 885.6, "over_budget": false, "total_seconds": 956.9, "compiled": true, "nki_relu2": false, "ngram_ve": "True tables=4 rows=1048576 dim=128 index_gather=True trigram=True opt=rmsprop flat_lr=True bf16=True", "out_bigram": "False bf16=True gate_bias=-2.0 lr=0.0", "oneliners": "relu2_tau=0.0 mlp_sandwich=False head_gate=False hg_norm=True hg_ch=32 hg_mul=2.0 hg_bias=0.0 out_pool=False pool_layers=3 qk_shift=True qk_beta=0.0 qk_freeze=True x0_gate=False block_nudge=False nudge_site=qk qkv_norm_cse=False parallel_block=False par_coalesce=none epoch_shuffle=False epoch_shuffle_seed=1234", "engram": "False site=-1 orders=2,3 heads=1 tables=0 mult=32 mem_dim=128 e_dim=0 key_dim=0 conv_k=4 share=False bf16=True", "batch_ramp": "False grad_accum=(2, 4, 8) bounds=(0.35, 0.75) lr_exp=0.5 ref_grad_accum=4 last_grad_accum=4", "weight_ema": "False decays=(0.995,) start_frac=0.75 seeded=False updates=0", "num_steps": 1054, "total_tokens_M": 138.1, "world_size": 4, "lnc": 2, "seq_len": 2048, "num_params_M": 592.9, "causality_passed": true, "causality_max_abs": 0.0, "public_val_bpb": 1.052578, "eval_seconds": 10.0, "eval_timeout": 1200, "eval_over_timeout": false, "eval_alt_seq_len": 1024, "public_val_bpb_alt": 1.067789, "eval_alt_seconds": 17.9}
{"timestamp": "2026-09-15T00:29:40+00:00", "label": "ti-ctrl-900s-r2", "solution": "R1.2", "description": "closing same-commit 900s control: measures this sequence's own drift/noise band", "launch_command": "NEURON_LOGICAL_NC_CONFIG=2 torchrun --standalone --nproc_per_node=4 train.py --num-steps 5000 --max-train-seconds 900 --out-dir out/ti-ctrl-900s-r2 --eval-seq-len 1024", "git_commit": "496befd", "git_dirty": true, "status": "keep", "wall_elapsed_seconds": 984.0, "run_log": "research/run-logs/ti-ctrl-900s-r2.log", "checkpoint_path": "out/ti-ctrl-900s-r2/final.pt", "training_seconds": 884.7, "budget_seconds": 1800, "target_steps": 5000, "max_train_seconds": 900, "startup_allowance_est": 64.9, "charged_seconds_est": 885.7, "over_budget": false, "total_seconds": 957.3, "compiled": true, "nki_relu2": false, "ngram_ve": "True tables=4 rows=1048576 dim=128 index_gather=True trigram=True opt=rmsprop flat_lr=True bf16=True", "out_bigram": "False bf16=True gate_bias=-2.0 lr=0.0", "oneliners": "relu2_tau=0.0 mlp_sandwich=False head_gate=False hg_norm=True hg_ch=32 hg_mul=2.0 hg_bias=0.0 out_pool=False pool_layers=3 qk_shift=True qk_beta=0.0 qk_freeze=True x0_gate=False block_nudge=False nudge_site=qk qkv_norm_cse=False parallel_block=False par_coalesce=none epoch_shuffle=False epoch_shuffle_seed=1234", "engram": "False site=-1 orders=2,3 heads=1 tables=0 mult=32 mem_dim=128 e_dim=0 key_dim=0 conv_k=4 share=False bf16=True", "batch_ramp": "False grad_accum=(2, 4, 8) bounds=(0.35, 0.75) lr_exp=0.5 ref_grad_accum=4 last_grad_accum=4", "weight_ema": "False decays=(0.995,) start_frac=0.75 seeded=False updates=0", "num_steps": 1055, "total_tokens_M": 138.3, "world_size": 4, "lnc": 2, "seq_len": 2048, "num_params_M": 592.9, "causality_passed": true, "causality_max_abs": 0.0, "public_val_bpb": 1.05243, "eval_seconds": 10.0, "eval_timeout": 1200, "eval_over_timeout": false, "eval_alt_seq_len": 1024, "public_val_bpb_alt": 1.067718, "eval_alt_seconds": 18.0}
{"timestamp": "2026-09-14T23:24:06+00:00", "label": "ti-cwd-900s", "solution": "R1.2", "description": "T2.3 cautious weight decay on the AdamW groups with wd != 0 (wte 0.001, lm_head 0.01): decay only where update*p > 0", "launch_command": "NEURON_LOGICAL_NC_CONFIG=2 torchrun --standalone --nproc_per_node=4 train.py --num-steps 5000 --max-train-seconds 900 --out-dir out/ti-cwd-900s --eval-seq-len 1024 --cautious-wd", "git_commit": "496befd", "git_dirty": true, "status": "keep", "wall_elapsed_seconds": 985.1, "run_log": "research/run-logs/ti-cwd-900s.log", "checkpoint_path": "out/ti-cwd-900s/final.pt", "training_seconds": 884.7, "budget_seconds": 1800, "target_steps": 5000, "max_train_seconds": 900, "startup_allowance_est": 66.0, "charged_seconds_est": 885.7, "over_budget": false, "total_seconds": 957.2, "compiled": true, "nki_relu2": false, "ngram_ve": "True tables=4 rows=1048576 dim=128 index_gather=True trigram=True opt=rmsprop flat_lr=True bf16=True", "out_bigram": "False bf16=True gate_bias=-2.0 lr=0.0", "oneliners": "relu2_tau=0.0 mlp_sandwich=False head_gate=False hg_norm=True hg_ch=32 hg_mul=2.0 hg_bias=0.0 out_pool=False pool_layers=3 qk_shift=True qk_beta=0.0 qk_freeze=True x0_gate=False block_nudge=False nudge_site=qk qkv_norm_cse=False parallel_block=False par_coalesce=none epoch_shuffle=False epoch_shuffle_seed=1234", "engram": "False site=-1 orders=2,3 heads=1 tables=0 mult=32 mem_dim=128 e_dim=0 key_dim=0 conv_k=4 share=False bf16=True", "batch_ramp": "False grad_accum=(2, 4, 8) bounds=(0.35, 0.75) lr_exp=0.5 ref_grad_accum=4 last_grad_accum=4", "weight_ema": "False decays=(0.995,) start_frac=0.75 seeded=False updates=0", "num_steps": 1054, "total_tokens_M": 138.1, "world_size": 4, "lnc": 2, "seq_len": 2048, "num_params_M": 592.9, "causality_passed": true, "causality_max_abs": 0.0, "public_val_bpb": 1.052454, "eval_seconds": 10.0, "eval_timeout": 1200, "eval_over_timeout": false, "eval_alt_seq_len": 1024, "public_val_bpb_alt": 1.067736, "eval_alt_seconds": 17.8}
{"timestamp": "2026-09-15T00:13:16+00:00", "label": "ti-sbeta99-lr005-900s", "solution": "R1.2", "description": "T2.4 smoothed scalars: scalar group betas (0.9, 0.99) with SCALAR_LR 0.05", "launch_command": "NEURON_LOGICAL_NC_CONFIG=2 torchrun --standalone --nproc_per_node=4 train.py --num-steps 5000 --max-train-seconds 900 --out-dir out/ti-sbeta99-lr005-900s --eval-seq-len 1024 --scalar-beta2 0.99 --scalar-lr 0.05", "git_commit": "496befd", "git_dirty": true, "status": "keep", "wall_elapsed_seconds": 981.1, "run_log": "research/run-logs/ti-sbeta99-lr005-900s.log", "checkpoint_path": "out/ti-sbeta99-lr005-900s/final.pt", "training_seconds": 884.7, "budget_seconds": 1800, "target_steps": 5000, "max_train_seconds": 900, "startup_allowance_est": 62.0, "charged_seconds_est": 885.7, "over_budget": false, "total_seconds": 957.0, "compiled": true, "nki_relu2": false, "ngram_ve": "True tables=4 rows=1048576 dim=128 index_gather=True trigram=True opt=rmsprop flat_lr=True bf16=True", "out_bigram": "False bf16=True gate_bias=-2.0 lr=0.0", "oneliners": "relu2_tau=0.0 mlp_sandwich=False head_gate=False hg_norm=True hg_ch=32 hg_mul=2.0 hg_bias=0.0 out_pool=False pool_layers=3 qk_shift=True qk_beta=0.0 qk_freeze=True x0_gate=False block_nudge=False nudge_site=qk qkv_norm_cse=False parallel_block=False par_coalesce=none epoch_shuffle=False epoch_shuffle_seed=1234", "engram": "False site=-1 orders=2,3 heads=1 tables=0 mult=32 mem_dim=128 e_dim=0 key_dim=0 conv_k=4 share=False bf16=True", "batch_ramp": "False grad_accum=(2, 4, 8) bounds=(0.35, 0.75) lr_exp=0.5 ref_grad_accum=4 last_grad_accum=4", "weight_ema": "False decays=(0.995,) start_frac=0.75 seeded=False updates=0", "num_steps": 1054, "total_tokens_M": 138.1, "world_size": 4, "lnc": 2, "seq_len": 2048, "num_params_M": 592.9, "causality_passed": true, "causality_max_abs": 0.0, "public_val_bpb": 1.054368, "eval_seconds": 10.0, "eval_timeout": 1200, "eval_over_timeout": false, "eval_alt_seq_len": 1024, "public_val_bpb_alt": 1.069361, "eval_alt_seconds": 17.8}
{"timestamp": "2026-09-14T23:56:55+00:00", "label": "ti-sbeta99-lr010-900s", "solution": "R1.2", "description": "T2.4 smoothed scalars: scalar group betas (0.9, 0.99) with SCALAR_LR 0.10", "launch_command": "NEURON_LOGICAL_NC_CONFIG=2 torchrun --standalone --nproc_per_node=4 train.py --num-steps 5000 --max-train-seconds 900 --out-dir out/ti-sbeta99-lr010-900s --eval-seq-len 1024 --scalar-beta2 0.99 --scalar-lr 0.10", "git_commit": "496befd", "git_dirty": true, "status": "keep", "wall_elapsed_seconds": 986.6, "run_log": "research/run-logs/ti-sbeta99-lr010-900s.log", "checkpoint_path": "out/ti-sbeta99-lr010-900s/final.pt", "training_seconds": 885.0, "budget_seconds": 1800, "target_steps": 5000, "max_train_seconds": 900, "startup_allowance_est": 67.3, "charged_seconds_est": 886.0, "over_budget": false, "total_seconds": 957.9, "compiled": true, "nki_relu2": false, "ngram_ve": "True tables=4 rows=1048576 dim=128 index_gather=True trigram=True opt=rmsprop flat_lr=True bf16=True", "out_bigram": "False bf16=True gate_bias=-2.0 lr=0.0", "oneliners": "relu2_tau=0.0 mlp_sandwich=False head_gate=False hg_norm=True hg_ch=32 hg_mul=2.0 hg_bias=0.0 out_pool=False pool_layers=3 qk_shift=True qk_beta=0.0 qk_freeze=True x0_gate=False block_nudge=False nudge_site=qk qkv_norm_cse=False parallel_block=False par_coalesce=none epoch_shuffle=False epoch_shuffle_seed=1234", "engram": "False site=-1 orders=2,3 heads=1 tables=0 mult=32 mem_dim=128 e_dim=0 key_dim=0 conv_k=4 share=False bf16=True", "batch_ramp": "False grad_accum=(2, 4, 8) bounds=(0.35, 0.75) lr_exp=0.5 ref_grad_accum=4 last_grad_accum=4", "weight_ema": "False decays=(0.995,) start_frac=0.75 seeded=False updates=0", "num_steps": 1055, "total_tokens_M": 138.3, "world_size": 4, "lnc": 2, "seq_len": 2048, "num_params_M": 592.9, "causality_passed": true, "causality_max_abs": 0.0, "public_val_bpb": 1.053657, "eval_seconds": 10.1, "eval_timeout": 1200, "eval_over_timeout": false, "eval_alt_seq_len": 1024, "public_val_bpb_alt": 1.068992, "eval_alt_seconds": 17.8}
{"timestamp": "2026-09-14T23:40:28+00:00", "label": "ti-sbeta99-lr020-900s", "solution": "R1.2", "description": "T2.4 smoothed scalars: scalar group Adam betas (0.9, 0.99) at the current SCALAR_LR 0.20", "launch_command": "NEURON_LOGICAL_NC_CONFIG=2 torchrun --standalone --nproc_per_node=4 train.py --num-steps 5000 --max-train-seconds 900 --out-dir out/ti-sbeta99-lr020-900s --eval-seq-len 1024 --scalar-beta2 0.99", "git_commit": "496befd", "git_dirty": true, "status": "keep", "wall_elapsed_seconds": 981.9, "run_log": "research/run-logs/ti-sbeta99-lr020-900s.log", "checkpoint_path": "out/ti-sbeta99-lr020-900s/final.pt", "training_seconds": 884.3, "budget_seconds": 1800, "target_steps": 5000, "max_train_seconds": 900, "startup_allowance_est": 63.5, "charged_seconds_est": 885.3, "over_budget": false, "total_seconds": 956.8, "compiled": true, "nki_relu2": false, "ngram_ve": "True tables=4 rows=1048576 dim=128 index_gather=True trigram=True opt=rmsprop flat_lr=True bf16=True", "out_bigram": "False bf16=True gate_bias=-2.0 lr=0.0", "oneliners": "relu2_tau=0.0 mlp_sandwich=False head_gate=False hg_norm=True hg_ch=32 hg_mul=2.0 hg_bias=0.0 out_pool=False pool_layers=3 qk_shift=True qk_beta=0.0 qk_freeze=True x0_gate=False block_nudge=False nudge_site=qk qkv_norm_cse=False parallel_block=False par_coalesce=none epoch_shuffle=False epoch_shuffle_seed=1234", "engram": "False site=-1 orders=2,3 heads=1 tables=0 mult=32 mem_dim=128 e_dim=0 key_dim=0 conv_k=4 share=False bf16=True", "batch_ramp": "False grad_accum=(2, 4, 8) bounds=(0.35, 0.75) lr_exp=0.5 ref_grad_accum=4 last_grad_accum=4", "weight_ema": "False decays=(0.995,) start_frac=0.75 seeded=False updates=0", "num_steps": 1054, "total_tokens_M": 138.1, "world_size": 4, "lnc": 2, "seq_len": 2048, "num_params_M": 592.9, "causality_passed": true, "causality_max_abs": 0.0, "public_val_bpb": 1.052756, "eval_seconds": 10.0, "eval_timeout": 1200, "eval_over_timeout": false, "eval_alt_seq_len": 1024, "public_val_bpb_alt": 1.067984, "eval_alt_seconds": 17.8}
{"timestamp": "2026-09-14T23:07:41+00:00", "label": "ti-swiglu-900s", "solution": "R1.2", "description": "parameter-matched coalesced SwiGLU MLP: one Linear(640, 3328) split into gate/up halves at hidden 1664, silu(gate)*up instead of relu(c_fc(x))**2; 592.43M vs 592.92M params, same launch count", "launch_command": "NEURON_LOGICAL_NC_CONFIG=2 torchrun --standalone --nproc_per_node=4 train.py --num-steps 5000 --max-train-seconds 900 --out-dir out/ti-swiglu-900s --eval-seq-len 1024 --coalesced-swiglu", "git_commit": "496befd", "git_dirty": true, "status": "keep", "wall_elapsed_seconds": 974.9, "run_log": "research/run-logs/ti-swiglu-900s.log", "checkpoint_path": "out/ti-swiglu-900s/final.pt", "training_seconds": 885.0, "budget_seconds": 1800, "target_steps": 5000, "max_train_seconds": 900, "startup_allowance_est": 55.7, "charged_seconds_est": 886.0, "over_budget": false, "total_seconds": 957.8, "compiled": true, "nki_relu2": false, "ngram_ve": "True tables=4 rows=1048576 dim=128 index_gather=True trigram=True opt=rmsprop flat_lr=True bf16=True", "out_bigram": "False bf16=True gate_bias=-2.0 lr=0.0", "oneliners": "relu2_tau=0.0 mlp_sandwich=False head_gate=False hg_norm=True hg_ch=32 hg_mul=2.0 hg_bias=0.0 out_pool=False pool_layers=3 qk_shift=True qk_beta=0.0 qk_freeze=True x0_gate=False block_nudge=False nudge_site=qk qkv_norm_cse=False parallel_block=False par_coalesce=none epoch_shuffle=False epoch_shuffle_seed=1234", "engram": "False site=-1 orders=2,3 heads=1 tables=0 mult=32 mem_dim=128 e_dim=0 key_dim=0 conv_k=4 share=False bf16=True", "batch_ramp": "False grad_accum=(2, 4, 8) bounds=(0.35, 0.75) lr_exp=0.5 ref_grad_accum=4 last_grad_accum=4", "weight_ema": "False decays=(0.995,) start_frac=0.75 seeded=False updates=0", "num_steps": 1043, "total_tokens_M": 136.7, "world_size": 4, "lnc": 2, "seq_len": 2048, "num_params_M": 592.4, "causality_passed": true, "causality_max_abs": 0.0, "public_val_bpb": 1.057505, "eval_seconds": 10.0, "eval_timeout": 1200, "eval_over_timeout": false, "eval_alt_seq_len": 1024, "public_val_bpb_alt": 1.072612, "eval_alt_seconds": 18.0}
