{"timestamp": "2026-09-12T00:19:54+00:00", "label": "t22-ema-1800s", "solution": "2.2", "description": "T2.2 weight EMA: decays 0.98/0.995/0.999 all seeded at progress 0.75, raw-vs-EMA compared in-run on identical weights", "launch_command": "NEURON_LOGICAL_NC_CONFIG=2 torchrun --standalone --nproc_per_node=4 train.py --num-steps 5000 --max-train-seconds 1800 --out-dir out/t22-ema-1800s --weight-ema --weight-ema-decay 0.98,0.995,0.999 --eval-seq-len 1024", "git_commit": "496befd", "git_dirty": true, "status": "keep", "wall_elapsed_seconds": 2001.7, "run_log": "research/run-logs/t22-ema-1800s.log", "weight_ema": "True decays=(0.98, 0.995, 0.999) start_frac=0.75 seeded=True updates=536", "checkpoint_path": "out/t22-ema-1800s/final.pt", "training_seconds": 1794.7, "budget_seconds": 1800, "target_steps": 5000, "max_train_seconds": 1800, "startup_allowance_est": 122.3, "charged_seconds_est": 1795.1, "over_budget": false, "total_seconds": 1975.6, "compiled": true, "nki_relu2": false, "ngram_ve": "False tables=0 rows=65536 dim=640 index_gather=True trigram=True opt=rmsprop flat_lr=True bf16=True", "batch_ramp": "False grad_accum=(2, 4, 8) bounds=(0.35, 0.75) lr_exp=0.5 ref_grad_accum=4 last_grad_accum=4", "num_steps": 2185, "total_tokens_M": 286.4, "world_size": 4, "lnc": 2, "seq_len": 2048, "num_params_M": 55.7, "causality_passed": true, "causality_max_abs": 0.0, "public_val_bpb": 1.034745, "eval_seconds": 7.7, "eval_timeout": 1200, "eval_over_timeout": false, "eval_alt_seq_len": 1024, "public_val_bpb_alt": 1.050025, "eval_alt_seconds": 12.5, "public_val_bpb_ema": 1.034635, "ema_delta": -0.00011, "eval_ema_seconds": 59.2, "public_val_bpb_ema_alt": 1.049984, "ema_delta_alt": -4.1e-05, "weight_ema_arms": "raw=1.034745|1.050025 0.98=1.034635/-0.000110|1.049984/-0.000041 0.995=1.035025/+0.000279|1.050395/+0.000370 0.999=1.048900/+0.014154|1.064374/+0.014349"}
{"timestamp": "2026-09-11T21:34:34+00:00", "label": "t31-base-900s", "solution": "3.1", "description": "T3.1 900s paired control (same commit as t31-bi3-900s)", "launch_command": "NEURON_LOGICAL_NC_CONFIG=2 torchrun --standalone --nproc_per_node=4 train.py --num-steps 5000 --max-train-seconds 900 --out-dir out/t31-base-900s --eval-seq-len 1024", "git_commit": "496befd", "git_dirty": true, "status": "keep", "wall_elapsed_seconds": 1039.6, "run_log": "research/run-logs/t31-base-900s.log", "checkpoint_path": "out/t31-base-900s/final.pt", "training_seconds": 894.7, "budget_seconds": 1800, "target_steps": 5000, "max_train_seconds": 900, "startup_allowance_est": 119.8, "charged_seconds_est": 894.9, "over_budget": false, "total_seconds": 1013.3, "compiled": true, "nki_relu2": false, "ngram_ve": "False tables=0 rows=65536 dim=640 index_gather=True trigram=True opt=rmsprop flat_lr=True bf16=True", "num_steps": 1095, "total_tokens_M": 143.5, "world_size": 4, "lnc": 2, "seq_len": 2048, "num_params_M": 55.7, "causality_passed": true, "causality_max_abs": 0.0, "public_val_bpb": 1.081257, "eval_seconds": 7.6, "eval_timeout": 1200, "eval_over_timeout": false, "eval_alt_seq_len": 1024, "public_val_bpb_alt": 1.096963, "eval_alt_seconds": 12.4}
{"timestamp": "2026-09-11T18:43:03+00:00", "label": "t31-base-fixed300", "solution": "T3.1", "description": "T3.1 control: fixed-300-step LR-matched baseline (commit 2793ec1, max-train-seconds 3600 so both arms sit entirely at lrm=1.0)", "launch_command": "NEURON_LOGICAL_NC_CONFIG=2 torchrun --standalone --nproc_per_node=4 train.py --num-steps 300 --max-train-seconds 3600 --out-dir out/t31-base-fixed300", "git_commit": "496befd", "git_dirty": true, "status": "keep", "wall_elapsed_seconds": 374.1, "run_log": "research/run-logs/t31-base-fixed300.log", "checkpoint_path": "out/t31-base-fixed300/final.pt", "training_seconds": 242.8, "budget_seconds": 1800, "target_steps": 300, "max_train_seconds": 3600, "startup_allowance_est": 118.8, "charged_seconds_est": 243.0, "over_budget": false, "total_seconds": 349.8, "compiled": true, "nki_relu2": false, "num_steps": 300, "total_tokens_M": 39.3, "world_size": 4, "lnc": 2, "seq_len": 2048, "num_params_M": 55.7, "causality_passed": true, "causality_max_abs": 0.0, "public_val_bpb": 1.259003, "eval_seconds": 7.7, "eval_timeout": 1200, "eval_over_timeout": false}
{"timestamp": "2026-09-11T21:51:39+00:00", "label": "t31-bi3-m32d128-900s", "solution": "3.1", "description": "T3.1 bigram-only hashed n-gram VE, 262144 rows, dim128, weight[idx] gather; 900s paired A/B", "launch_command": "NEURON_LOGICAL_NC_CONFIG=2 torchrun --standalone --nproc_per_node=4 train.py --num-steps 5000 --max-train-seconds 900 --out-dir out/t31-bi3-m32d128-900s --ngram-ve --no-ngram-ve-trigram --ngram-ve-table-mult 32 --ngram-ve-dim 128 --eval-seq-len 1024", "git_commit": "496befd", "git_dirty": true, "status": "keep", "wall_elapsed_seconds": 1025.5, "run_log": "research/run-logs/t31-bi3-m32d128-900s.log", "checkpoint_path": "out/t31-bi3-m32d128-900s/final.pt", "training_seconds": 894.6, "budget_seconds": 1800, "target_steps": 5000, "max_train_seconds": 900, "startup_allowance_est": 96.4, "charged_seconds_est": 894.9, "over_budget": false, "total_seconds": 999.7, "compiled": true, "nki_relu2": false, "ngram_ve": "True tables=3 rows=262144 dim=128 index_gather=True trigram=False opt=rmsprop flat_lr=True bf16=True", "num_steps": 844, "total_tokens_M": 110.6, "world_size": 4, "lnc": 2, "seq_len": 2048, "num_params_M": 156.6, "causality_passed": true, "causality_max_abs": 0.0, "public_val_bpb": 1.079657, "eval_seconds": 9.0, "eval_timeout": 1200, "eval_over_timeout": false, "eval_alt_seq_len": 1024, "public_val_bpb_alt": 1.095106, "eval_alt_seconds": 19.0}
{"timestamp": "2026-09-11T20:54:04+00:00", "label": "t31-ng-bi3-m32d128-fixed300", "solution": "3.1", "description": "T3.1 bigram-only, 262144 rows, dim128, weight[idx] gather; fixed-300 LR-matched quality vs t31-base-fixed300", "launch_command": "NEURON_LOGICAL_NC_CONFIG=2 torchrun --standalone --nproc_per_node=4 train.py --num-steps 300 --max-train-seconds 3600 --out-dir out/t31-ng-bi3-m32d128-fixed300 --ngram-ve --no-ngram-ve-trigram --ngram-ve-table-mult 32 --ngram-ve-dim 128", "git_commit": "496befd", "git_dirty": true, "status": "keep", "wall_elapsed_seconds": 680.9, "run_log": "research/run-logs/t31-ng-bi3-m32d128-fixed300.log", "checkpoint_path": "out/t31-ng-bi3-m32d128-fixed300/final.pt", "training_seconds": 315.0, "budget_seconds": 1800, "target_steps": 300, "max_train_seconds": 3600, "startup_allowance_est": 348.1, "charged_seconds_est": 315.3, "over_budget": false, "total_seconds": 653.0, "compiled": true, "nki_relu2": false, "ngram_ve": "True tables=3 rows=262144 dim=128 index_gather=True trigram=False opt=rmsprop flat_lr=True bf16=True", "num_steps": 300, "total_tokens_M": 39.3, "world_size": 4, "lnc": 2, "seq_len": 2048, "num_params_M": 156.6, "causality_passed": true, "causality_max_abs": 0.0, "public_val_bpb": 1.235529, "eval_seconds": 9.1, "eval_timeout": 1200, "eval_over_timeout": false}
{"timestamp": "2026-09-11T21:11:51+00:00", "label": "t31-ng-m32d128-fixed300", "solution": "3.1", "description": "T3.1 bigram+trigram, 262144 rows, dim128, weight[idx] gather; fixed-300 LR-matched quality vs t31-base-fixed300", "launch_command": "NEURON_LOGICAL_NC_CONFIG=2 torchrun --standalone --nproc_per_node=4 train.py --num-steps 300 --max-train-seconds 3600 --out-dir out/t31-ng-m32d128-fixed300 --ngram-ve --ngram-ve-table-mult 32 --ngram-ve-dim 128", "git_commit": "496befd", "git_dirty": true, "status": "keep", "wall_elapsed_seconds": 1066.3, "run_log": "research/run-logs/t31-ng-m32d128-fixed300.log", "checkpoint_path": "out/t31-ng-m32d128-fixed300/final.pt", "training_seconds": 376.8, "budget_seconds": 1800, "target_steps": 300, "max_train_seconds": 3600, "startup_allowance_est": 672.7, "charged_seconds_est": 377.3, "over_budget": false, "total_seconds": 1038.4, "compiled": true, "nki_relu2": false, "ngram_ve": "True tables=5 rows=262144 dim=128 index_gather=True trigram=True opt=rmsprop flat_lr=True bf16=True", "num_steps": 300, "total_tokens_M": 39.3, "world_size": 4, "lnc": 2, "seq_len": 2048, "num_params_M": 223.9, "causality_passed": true, "causality_max_abs": 0.0, "public_val_bpb": 1.231173, "eval_seconds": 9.8, "eval_timeout": 1200, "eval_over_timeout": false}
{"timestamp": "2026-09-11T18:52:39+00:00", "label": "t31-ngram-fixed300", "solution": "T3.1", "description": "T3.1 treatment: hashed n-gram VE, 5 tables (b1,b3,b5,t1,t5) x 65536 rows, 265.4M params, rmsprop flat-LR group; fixed-300-step quality-per-step read against t31-base-fixed300", "launch_command": "NEURON_LOGICAL_NC_CONFIG=2 torchrun --standalone --nproc_per_node=4 train.py --num-steps 300 --max-train-seconds 3600 --out-dir out/t31-ngram-fixed300 --ngram-ve", "git_commit": "496befd", "git_dirty": true, "status": "keep", "wall_elapsed_seconds": 575.4, "run_log": "research/run-logs/t31-ngram-fixed300.log", "checkpoint_path": "out/t31-ngram-fixed300/final.pt", "training_seconds": 479.2, "budget_seconds": 1800, "target_steps": 300, "max_train_seconds": 3600, "startup_allowance_est": 80.8, "charged_seconds_est": 479.8, "over_budget": false, "total_seconds": 550.5, "compiled": true, "nki_relu2": false, "num_steps": 300, "total_tokens_M": 39.3, "world_size": 4, "lnc": 2, "seq_len": 2048, "num_params_M": 265.4, "causality_passed": true, "causality_max_abs": 0.0, "public_val_bpb": 1.227918, "eval_seconds": 9.3, "eval_timeout": 1200, "eval_over_timeout": false}
{"timestamp": "2026-09-12T08:48:28+00:00", "label": "t31L-base-1800s", "solution": "3.1", "description": "1800s paired A/B control, no n-gram VE", "launch_command": "NEURON_LOGICAL_NC_CONFIG=2 torchrun --standalone --nproc_per_node=4 train.py --num-steps 5000 --max-train-seconds 1800 --out-dir out/t31L-base-1800s --eval-seq-len 1024", "git_commit": "496befd", "git_dirty": true, "status": "keep", "wall_elapsed_seconds": 1875.9, "run_log": "research/run-logs/t31L-base-1800s.log", "checkpoint_path": "out/t31L-base-1800s/final.pt", "training_seconds": 1794.7, "budget_seconds": 1800, "target_steps": 5000, "max_train_seconds": 1800, "startup_allowance_est": 55.8, "charged_seconds_est": 1794.8, "over_budget": false, "total_seconds": 1850.2, "compiled": true, "nki_relu2": false, "ngram_ve": "False tables=0 rows=65536 dim=640 index_gather=True trigram=True opt=rmsprop flat_lr=True bf16=True", "batch_ramp": "False grad_accum=(2, 4, 8) bounds=(0.35, 0.75) lr_exp=0.5 ref_grad_accum=4 last_grad_accum=4", "weight_ema": "False decays=(0.995,) start_frac=0.75 seeded=False updates=0", "num_steps": 2191, "total_tokens_M": 287.2, "world_size": 4, "lnc": 2, "seq_len": 2048, "num_params_M": 55.7, "causality_passed": true, "causality_max_abs": 0.0, "public_val_bpb": 1.034199, "eval_seconds": 7.7, "eval_timeout": 1200, "eval_over_timeout": false, "eval_alt_seq_len": 1024, "public_val_bpb_alt": 1.049507, "eval_alt_seconds": 12.6}
{"timestamp": "2026-09-12T09:19:53+00:00", "label": "t31L-l5bi-m64-1800s", "solution": "3.1", "description": "T3.1 layer-position fix: bigram only, last layer, mult64 dim128", "launch_command": "NEURON_LOGICAL_NC_CONFIG=2 torchrun --standalone --nproc_per_node=4 train.py --num-steps 5000 --max-train-seconds 1800 --out-dir out/t31L-l5bi-m64-1800s --ngram-ve --no-ngram-ve-trigram --ngram-ve-layers=-1 --ngram-ve-table-mult 64 --ngram-ve-dim 128 --eval-seq-len 1024", "git_commit": "496befd", "git_dirty": true, "status": "keep", "wall_elapsed_seconds": 1885.3, "run_log": "research/run-logs/t31L-l5bi-m64-1800s.log", "checkpoint_path": "out/t31L-l5bi-m64-1800s/final.pt", "training_seconds": 1794.9, "budget_seconds": 1800, "target_steps": 5000, "max_train_seconds": 1800, "startup_allowance_est": 62.8, "charged_seconds_est": 1795.2, "over_budget": false, "total_seconds": 1860.2, "compiled": true, "nki_relu2": false, "ngram_ve": "True tables=1 rows=524288 dim=128 index_gather=True trigram=False opt=rmsprop flat_lr=True bf16=True", "batch_ramp": "False grad_accum=(2, 4, 8) bounds=(0.35, 0.75) lr_exp=0.5 ref_grad_accum=4 last_grad_accum=4", "weight_ema": "False decays=(0.995,) start_frac=0.75 seeded=False updates=0", "num_steps": 2202, "total_tokens_M": 288.6, "world_size": 4, "lnc": 2, "seq_len": 2048, "num_params_M": 122.9, "causality_passed": true, "causality_max_abs": 0.0, "public_val_bpb": 1.022205, "eval_seconds": 8.1, "eval_timeout": 1200, "eval_over_timeout": false, "eval_alt_seq_len": 1024, "public_val_bpb_alt": 1.036938, "eval_alt_seconds": 13.6}
{"timestamp": "2026-09-12T09:51:21+00:00", "label": "t31L-l5tri-m32-1800s", "solution": "3.1", "description": "T3.1 layer-position fix: bigram+trigram, last layer, mult32 dim128", "launch_command": "NEURON_LOGICAL_NC_CONFIG=2 torchrun --standalone --nproc_per_node=4 train.py --num-steps 5000 --max-train-seconds 1800 --out-dir out/t31L-l5tri-m32-1800s --ngram-ve --ngram-ve-trigram --ngram-ve-layers=-1 --ngram-ve-table-mult 32 --ngram-ve-dim 128 --eval-seq-len 1024", "git_commit": "496befd", "git_dirty": true, "status": "keep", "wall_elapsed_seconds": 1887.7, "run_log": "research/run-logs/t31L-l5tri-m32-1800s.log", "checkpoint_path": "out/t31L-l5tri-m32-1800s/final.pt", "training_seconds": 1794.4, "budget_seconds": 1800, "target_steps": 5000, "max_train_seconds": 1800, "startup_allowance_est": 64.5, "charged_seconds_est": 1794.7, "over_budget": false, "total_seconds": 1861.1, "compiled": true, "nki_relu2": false, "ngram_ve": "True tables=2 rows=262144 dim=128 index_gather=True trigram=True opt=rmsprop flat_lr=True bf16=True", "batch_ramp": "False grad_accum=(2, 4, 8) bounds=(0.35, 0.75) lr_exp=0.5 ref_grad_accum=4 last_grad_accum=4", "weight_ema": "False decays=(0.995,) start_frac=0.75 seeded=False updates=0", "num_steps": 2173, "total_tokens_M": 284.8, "world_size": 4, "lnc": 2, "seq_len": 2048, "num_params_M": 123.0, "causality_passed": true, "causality_max_abs": 0.0, "public_val_bpb": 1.020516, "eval_seconds": 8.6, "eval_timeout": 1200, "eval_over_timeout": false, "eval_alt_seq_len": 1024, "public_val_bpb_alt": 1.035626, "eval_alt_seconds": 14.4}
{"timestamp": "2026-09-12T10:26:09+00:00", "label": "t31L-l5tri-m64-1800s", "solution": "3.1", "description": "T3.1 layer-position fix: bigram+trigram, last layer, mult64 dim128", "launch_command": "NEURON_LOGICAL_NC_CONFIG=2 torchrun --standalone --nproc_per_node=4 train.py --num-steps 5000 --max-train-seconds 1800 --out-dir out/t31L-l5tri-m64-1800s --ngram-ve --ngram-ve-trigram --ngram-ve-layers=-1 --ngram-ve-table-mult 64 --ngram-ve-dim 128 --eval-seq-len 1024", "git_commit": "496befd", "git_dirty": true, "status": "keep", "wall_elapsed_seconds": 2087.8, "run_log": "research/run-logs/t31L-l5tri-m64-1800s.log", "checkpoint_path": "out/t31L-l5tri-m64-1800s/final.pt", "training_seconds": 1794.6, "budget_seconds": 1800, "target_steps": 5000, "max_train_seconds": 1800, "startup_allowance_est": 263.8, "charged_seconds_est": 1795.1, "over_budget": false, "total_seconds": 2063.0, "compiled": true, "nki_relu2": false, "ngram_ve": "True tables=2 rows=524288 dim=128 index_gather=True trigram=True opt=rmsprop flat_lr=True bf16=True", "batch_ramp": "False grad_accum=(2, 4, 8) bounds=(0.35, 0.75) lr_exp=0.5 ref_grad_accum=4 last_grad_accum=4", "weight_ema": "False decays=(0.995,) start_frac=0.75 seeded=False updates=0", "num_steps": 2139, "total_tokens_M": 280.4, "world_size": 4, "lnc": 2, "seq_len": 2048, "num_params_M": 190.1, "causality_passed": true, "causality_max_abs": 0.0, "public_val_bpb": 1.018985, "eval_seconds": 8.6, "eval_timeout": 1200, "eval_over_timeout": false, "eval_alt_seq_len": 1024, "public_val_bpb_alt": 1.03405, "eval_alt_seconds": 14.8}
{"timestamp": "2026-09-12T11:03:36+00:00", "label": "t31M-l5tri-m128-1800s", "solution": "3.1", "description": "T3.1 capacity push: bigram+trigram last layer, mult128 dim128", "launch_command": "NEURON_LOGICAL_NC_CONFIG=2 torchrun --standalone --nproc_per_node=4 train.py --num-steps 5000 --max-train-seconds 1800 --out-dir out/t31M-l5tri-m128-1800s --ngram-ve --ngram-ve-trigram --ngram-ve-layers=-1 --ngram-ve-table-mult 128 --ngram-ve-dim 128 --eval-seq-len 1024", "git_commit": "496befd", "git_dirty": true, "status": "keep", "wall_elapsed_seconds": 2103.8, "run_log": "research/run-logs/t31M-l5tri-m128-1800s.log", "checkpoint_path": "out/t31M-l5tri-m128-1800s/final.pt", "training_seconds": 1794.7, "budget_seconds": 1800, "target_steps": 5000, "max_train_seconds": 1800, "startup_allowance_est": 274.5, "charged_seconds_est": 1795.3, "over_budget": false, "total_seconds": 2071.5, "compiled": true, "nki_relu2": false, "ngram_ve": "True tables=2 rows=1048576 dim=128 index_gather=True trigram=True opt=rmsprop flat_lr=True bf16=True", "batch_ramp": "False grad_accum=(2, 4, 8) bounds=(0.35, 0.75) lr_exp=0.5 ref_grad_accum=4 last_grad_accum=4", "weight_ema": "False decays=(0.995,) start_frac=0.75 seeded=False updates=0", "num_steps": 2067, "total_tokens_M": 270.9, "world_size": 4, "lnc": 2, "seq_len": 2048, "num_params_M": 324.3, "causality_passed": true, "causality_max_abs": 0.0, "public_val_bpb": 1.019171, "eval_seconds": 8.7, "eval_timeout": 1200, "eval_over_timeout": false, "eval_alt_seq_len": 1024, "public_val_bpb_alt": 1.033889, "eval_alt_seconds": 17.1}
{"timestamp": "2026-09-12T11:38:34+00:00", "label": "t31M-l5tri-m64-d256-1800s", "solution": "3.1", "description": "T3.1 capacity push: bigram+trigram last layer, mult64 dim256", "launch_command": "NEURON_LOGICAL_NC_CONFIG=2 torchrun --standalone --nproc_per_node=4 train.py --num-steps 5000 --max-train-seconds 1800 --out-dir out/t31M-l5tri-m64-d256-1800s --ngram-ve --ngram-ve-trigram --ngram-ve-layers=-1 --ngram-ve-table-mult 64 --ngram-ve-dim 256 --eval-seq-len 1024", "git_commit": "496befd", "git_dirty": true, "status": "keep", "wall_elapsed_seconds": 2097.8, "run_log": "research/run-logs/t31M-l5tri-m64-d256-1800s.log", "checkpoint_path": "out/t31M-l5tri-m64-d256-1800s/final.pt", "training_seconds": 1794.8, "budget_seconds": 1800, "target_steps": 5000, "max_train_seconds": 1800, "startup_allowance_est": 268.6, "charged_seconds_est": 1795.4, "over_budget": false, "total_seconds": 2081.2, "compiled": true, "nki_relu2": false, "ngram_ve": "True tables=2 rows=524288 dim=256 index_gather=True trigram=True opt=rmsprop flat_lr=True bf16=True", "batch_ramp": "False grad_accum=(2, 4, 8) bounds=(0.35, 0.75) lr_exp=0.5 ref_grad_accum=4 last_grad_accum=4", "weight_ema": "False decays=(0.995,) start_frac=0.75 seeded=False updates=0", "num_steps": 2069, "total_tokens_M": 271.2, "world_size": 4, "lnc": 2, "seq_len": 2048, "num_params_M": 324.5, "causality_passed": true, "causality_max_abs": 0.0, "public_val_bpb": 1.018483, "eval_seconds": 8.7, "eval_timeout": 1200, "eval_over_timeout": false, "eval_alt_seq_len": 1024, "public_val_bpb_alt": 1.033143, "eval_alt_seconds": 17.1}
{"timestamp": "2026-09-12T07:29:29+00:00", "label": "t31l-base-900s", "solution": "3.1", "description": "T3.1 layer-position A/B: baseline, no n-gram tables", "launch_command": "NEURON_LOGICAL_NC_CONFIG=2 torchrun --standalone --nproc_per_node=4 train.py --num-steps 5000 --max-train-seconds 900 --out-dir out/t31l-base-900s --eval-seq-len 1024", "git_commit": "496befd", "git_dirty": true, "status": "keep", "wall_elapsed_seconds": 1040.9, "run_log": "research/run-logs/t31l-base-900s.log", "checkpoint_path": "out/t31l-base-900s/final.pt", "training_seconds": 894.6, "budget_seconds": 1800, "target_steps": 5000, "max_train_seconds": 900, "startup_allowance_est": 121.1, "charged_seconds_est": 894.7, "over_budget": false, "total_seconds": 1013.6, "compiled": true, "nki_relu2": false, "ngram_ve": "False tables=0 rows=65536 dim=640 index_gather=True trigram=True opt=rmsprop flat_lr=True bf16=True", "batch_ramp": "False grad_accum=(2, 4, 8) bounds=(0.35, 0.75) lr_exp=0.5 ref_grad_accum=4 last_grad_accum=4", "weight_ema": "False decays=(0.995,) start_frac=0.75 seeded=False updates=0", "num_steps": 1094, "total_tokens_M": 143.4, "world_size": 4, "lnc": 2, "seq_len": 2048, "num_params_M": 55.7, "causality_passed": true, "causality_max_abs": 0.0, "public_val_bpb": 1.081306, "eval_seconds": 7.7, "eval_timeout": 1200, "eval_over_timeout": false, "eval_alt_seq_len": 1024, "public_val_bpb_alt": 1.09708, "eval_alt_seconds": 12.5}
{"timestamp": "2026-09-12T07:49:21+00:00", "label": "t31l-l5m64-900s", "solution": "3.1", "description": "T3.1: ONE bigram table on the LAST layer (NGRAM_VE_LAYERS=-1), 64x8192=524288 rows, dim 128. Free on wall clock (r_step=0.973).", "launch_command": "NEURON_LOGICAL_NC_CONFIG=2 torchrun --standalone --nproc_per_node=4 train.py --num-steps 5000 --max-train-seconds 900 --out-dir out/t31l-l5m64-900s --ngram-ve --no-ngram-ve-trigram --ngram-ve-layers=-1 --ngram-ve-table-mult 64 --ngram-ve-dim 128 --eval-seq-len 1024", "git_commit": "496befd", "git_dirty": true, "status": "keep", "wall_elapsed_seconds": 1192.3, "run_log": "research/run-logs/t31l-l5m64-900s.log", "checkpoint_path": "out/t31l-l5m64-900s/final.pt", "training_seconds": 894.6, "budget_seconds": 1800, "target_steps": 5000, "max_train_seconds": 900, "startup_allowance_est": 266.3, "charged_seconds_est": 894.9, "over_budget": false, "total_seconds": 1165.3, "compiled": true, "nki_relu2": false, "ngram_ve": "True tables=1 rows=524288 dim=128 index_gather=True trigram=False opt=rmsprop flat_lr=True bf16=True", "batch_ramp": "False grad_accum=(2, 4, 8) bounds=(0.35, 0.75) lr_exp=0.5 ref_grad_accum=4 last_grad_accum=4", "weight_ema": "False decays=(0.995,) start_frac=0.75 seeded=False updates=0", "num_steps": 1099, "total_tokens_M": 144.0, "world_size": 4, "lnc": 2, "seq_len": 2048, "num_params_M": 122.9, "causality_passed": true, "causality_max_abs": 0.0, "public_val_bpb": 1.068101, "eval_seconds": 8.3, "eval_timeout": 1200, "eval_over_timeout": false, "eval_alt_seq_len": 1024, "public_val_bpb_alt": 1.083657, "eval_alt_seconds": 14.9}
