{"timestamp": "2026-09-11T12:01:44+00:00", "label": "dress-rehearsal-newbox", "solution": "submission-fix-verification", "description": "Dress rehearsal (new standing rule, post-NUM_STEPS-fix): ran the EXACT bare real-submission launch command directly (no run_experiment.py, which always forces --num-steps 5000), on the freshly re-provisioned Trn2 box, to confirm the NUM_STEPS=1_000_000 fix (ba37f86) actually removes the step cap on real hardware. num_steps landed at 2192 (vs the capped 1000 that produced the 1.1495 board score) -- fix confirmed. Ran prepare.py eval-public separately afterward (no in-process eval since --no-eval-public was used, matching the real submission): seq_len=2048/2M-tokens -> 1.033421 (matches the local ~1.034 pattern almost exactly); seq_len=1024/2M-tokens -> 1.049535 (close to the real board score of 1.0548 from the actual 9/10 23:59 PT submission that used this exact fix) -- strong evidence the official scorer evaluates at seq_len=1024, not 2048.", "launch_command": "NEURON_LOGICAL_NC_CONFIG=2 torchrun --standalone --nproc_per_node=4 train.py --no-eval-public --num-steps 1000000 --out-dir out/dress-rehearsal-newbox", "git_commit": "0d8d856", "git_dirty": false, "status": "keep", "wall_elapsed_seconds": 1828.9, "run_log": "research/run-logs/dress-rehearsal-newbox.log", "checkpoint_path": "out/dress-rehearsal-newbox/final.pt", "training_seconds": 1794.7, "budget_seconds": 1800, "target_steps": 1000000, "max_train_seconds": 1800, "startup_allowance_est": 51.9, "charged_seconds_est": 1794.9, "over_budget": false, "total_seconds": 1828.9, "compiled": true, "num_steps": 2192, "total_tokens_M": 287.3, "world_size": 4, "lnc": 2, "seq_len": 2048, "num_params_M": 55.7, "public_val_bpb": 1.033421, "public_val_bpb_seq1024_2M": 1.049535, "real_board_score_20260910": 1.0548, "eval_seconds": 62.19, "eval_timeout": 1200, "eval_over_timeout": false, "public_val_bpb_seq1024_20M": 1.0557118258740184}
{"timestamp": "2026-09-08T07:11:12+00:00", "label": "eager-fixed-900s-v2", "solution": "Tier0", "description": "Eager mode, tensor-lr-scalars fix ON, real A/B vs compiled baseline once both sides are bug-free", "launch_command": "NEURON_LOGICAL_NC_CONFIG=2 torchrun --standalone --nproc_per_node=4 train.py --num-steps 5000 --max-train-seconds 900 --out-dir out/eager-fixed-900s-v2 --no-compile --tensor-lr-scalars", "git_commit": "eb81ae5", "git_dirty": true, "status": "keep", "wall_elapsed_seconds": 933.8, "run_log": "research/run-logs/eager-fixed-900s-v2.log", "checkpoint_path": "out/eager-fixed-900s-v2/final.pt", "training_seconds": 894.1, "budget_seconds": 1800, "target_steps": 5000, "max_train_seconds": 900, "startup_allowance_est": 27.9, "charged_seconds_est": 894.3, "over_budget": false, "total_seconds": 910.5, "compiled": false, "nki_relu2": false, "num_steps": 918, "total_tokens_M": 120.3, "world_size": 4, "lnc": 2, "seq_len": 2048, "num_params_M": 55.7, "causality_passed": true, "causality_max_abs": 0.0, "public_val_bpb": 1.103575, "eval_seconds": 7.6, "eval_timeout": 1200, "eval_over_timeout": false}
{"timestamp": "2026-09-07T21:59:20+00:00", "label": "eager-recompile-check-fixed", "solution": "Tier0", "description": "Fixed path under eager: --no-compile --tensor-lr-scalars. Does compile still win once both sides are bug-free?", "launch_command": "NEURON_LOGICAL_NC_CONFIG=2 torchrun --standalone --nproc_per_node=4 train.py --num-steps 5000 --max-train-seconds 900 --out-dir out/eager-recompile-check-fixed --no-compile --tensor-lr-scalars", "git_commit": "3523269", "git_dirty": true, "status": "crash", "wall_elapsed_seconds": 26.1, "run_log": "research/run-logs/eager-recompile-check-fixed.log"}
{"timestamp": "2026-09-07T21:58:01+00:00", "label": "eager-recompile-check-old", "solution": "Tier0", "description": "Does eager mode (--no-compile) ALSO suffer the alpha= python-float recompile bug during LR cooldown, or was it compile-specific? OLD buggy path.", "launch_command": "NEURON_LOGICAL_NC_CONFIG=2 torchrun --standalone --nproc_per_node=4 train.py --num-steps 5000 --max-train-seconds 900 --out-dir out/eager-recompile-check-old --no-compile --no-tensor-lr-scalars", "git_commit": "e6fe55a", "git_dirty": true, "status": "keep", "wall_elapsed_seconds": 952.9, "run_log": "research/run-logs/eager-recompile-check-old.log", "checkpoint_path": "out/eager-recompile-check-old/final.pt", "training_seconds": 891.0, "budget_seconds": 1800, "target_steps": 5000, "max_train_seconds": 900, "startup_allowance_est": 50.0, "charged_seconds_est": 891.2, "over_budget": false, "total_seconds": 929.7, "compiled": false, "nki_relu2": false, "num_steps": 408, "total_tokens_M": 53.5, "world_size": 4, "lnc": 2, "seq_len": 2048, "num_params_M": 55.7, "causality_passed": true, "causality_max_abs": 0.0, "public_val_bpb": 1.189091, "eval_seconds": 7.4, "eval_timeout": 1200, "eval_over_timeout": false}
{"timestamp": "2026-09-13T07:08:05+00:00", "label": "epochshuf-frozen-1800s", "solution": "T1.x", "description": "frozen qk-shift beta=0 (a verified identity, +9.2% steps) PLUS --epoch-shuffle at the full 1800s budget. Tests whether the data wall is a fixable ordering artifact: the arm crosses into epoch 2 for ~155 steps, but those steps now draw from a uniform shuffle of the whole rank-local corpus instead of replaying its opening 28% contiguously. Controls in hand: qkfreeze-base-1800s 2155/1.018303, qkfreeze-frozen-1648s 2149/1.018967, qkfreeze-frozen-1800s 2354/1.021278.", "launch_command": "NEURON_LOGICAL_NC_CONFIG=2 torchrun --standalone --nproc_per_node=4 train.py --num-steps 5000 --max-train-seconds 1800 --out-dir out/epochshuf-frozen-1800s --eval-seq-len 1024 --qk-shift --qk-shift-beta 0.0 --qk-shift-freeze --epoch-shuffle", "git_commit": "496befd", "git_dirty": true, "status": "keep", "wall_elapsed_seconds": 2012.4, "run_log": "research/run-logs/epochshuf-frozen-1800s.log", "checkpoint_path": "out/epochshuf-frozen-1800s/final.pt", "training_seconds": 1794.6, "budget_seconds": 1800, "target_steps": 5000, "max_train_seconds": 1800, "startup_allowance_est": 187.2, "charged_seconds_est": 1795.0, "over_budget": false, "total_seconds": 1988.3, "compiled": true, "nki_relu2": false, "ngram_ve": "True tables=2 rows=524288 dim=128 index_gather=True trigram=True opt=rmsprop flat_lr=True bf16=True", "out_bigram": "False bf16=True gate_bias=-2.0 lr=0.0", "oneliners": "relu2_tau=0.0 mlp_sandwich=False head_gate=False hg_norm=True hg_ch=32 hg_mul=2.0 hg_bias=0.0 out_pool=False pool_layers=3 qk_shift=True qk_beta=0.0 qk_freeze=True x0_gate=False block_nudge=False nudge_site=qk qkv_norm_cse=False parallel_block=False par_coalesce=none epoch_shuffle=True epoch_shuffle_seed=1234", "batch_ramp": "False grad_accum=(2, 4, 8) bounds=(0.35, 0.75) lr_exp=0.5 ref_grad_accum=4 last_grad_accum=4", "weight_ema": "False decays=(0.995,) start_frac=0.75 seeded=False updates=0", "num_steps": 2341, "total_tokens_M": 306.8, "world_size": 4, "lnc": 2, "seq_len": 2048, "num_params_M": 190.1, "causality_passed": true, "causality_max_abs": 0.0, "public_val_bpb": 1.023799, "eval_seconds": 9.1, "eval_timeout": 1200, "eval_over_timeout": false, "eval_alt_seq_len": 1024, "public_val_bpb_alt": 1.03889, "eval_alt_seconds": 15.8}
{"timestamp": "2026-09-04T12:30:28+00:00", "label": "final-confirmation", "solution": "99", "description": "Final cumulative config (Sol 1-7,9a,10; 8 and 9b discarded) at longer horizon", "launch_command": "NEURON_LOGICAL_NC_CONFIG=1 torchrun --standalone --nproc_per_node=1 train.py --num-steps 1450 --max-train-seconds 1450 --out-dir out/final-confirmation", "git_commit": "9792868", "git_dirty": true, "status": "keep", "wall_elapsed_seconds": 1427.1, "run_log": "research/run-logs/final-confirmation.log", "checkpoint_path": "out/final-confirmation/final.pt", "training_seconds": 1409.7, "budget_seconds": 1800, "target_steps": 1450, "max_train_seconds": 1450, "over_budget": false, "total_seconds": 1409.8, "compiled": false, "nki_relu2": false, "num_steps": 1450, "total_tokens_M": 95.0, "world_size": 1, "lnc": 1, "seq_len": 1024, "num_params_M": 85.9, "causality_passed": true, "causality_max_abs": 0.0, "public_val_bpb": 1.111741, "eval_seconds": 15.1, "eval_timeout": 1200, "eval_over_timeout": false}
{"timestamp": "2026-09-08T23:14:54+00:00", "label": "foreach-off-900s-v1", "solution": "R1", "description": "paired OFF control for foreach-optim-900s*: identical command with --no-foreach-optim, same code and same day, to measure the OFF step-count mean at matching tightness", "launch_command": "NEURON_LOGICAL_NC_CONFIG=2 torchrun --standalone --nproc_per_node=4 train.py --num-steps 5000 --max-train-seconds 900 --out-dir out/foreach-off-900s-v1 --no-foreach-optim --tensor-lr-scalars --lrm-quantum 0", "git_commit": "124dfb7", "git_dirty": true, "status": "keep", "wall_elapsed_seconds": 953.3, "run_log": "research/run-logs/foreach-off-900s-v1.log", "checkpoint_path": "out/foreach-off-900s-v1/final.pt", "training_seconds": 894.7, "budget_seconds": 1800, "target_steps": 5000, "max_train_seconds": 900, "startup_allowance_est": 46.5, "charged_seconds_est": 894.9, "over_budget": false, "total_seconds": 927.3, "compiled": true, "nki_relu2": false, "num_steps": 974, "total_tokens_M": 127.7, "world_size": 4, "lnc": 2, "seq_len": 2048, "num_params_M": 55.7, "causality_passed": true, "causality_max_abs": 0.0, "public_val_bpb": 1.096378, "eval_seconds": 7.7, "eval_timeout": 1200, "eval_over_timeout": false}
{"timestamp": "2026-09-08T23:30:46+00:00", "label": "foreach-off-900s-v2", "solution": "R1", "description": "paired OFF control for foreach-optim-900s*: identical command with --no-foreach-optim, same code and same day, to measure the OFF step-count mean at matching tightness", "launch_command": "NEURON_LOGICAL_NC_CONFIG=2 torchrun --standalone --nproc_per_node=4 train.py --num-steps 5000 --max-train-seconds 900 --out-dir out/foreach-off-900s-v2 --no-foreach-optim --tensor-lr-scalars --lrm-quantum 0", "git_commit": "124dfb7", "git_dirty": true, "status": "keep", "wall_elapsed_seconds": 952.3, "run_log": "research/run-logs/foreach-off-900s-v2.log", "checkpoint_path": "out/foreach-off-900s-v2/final.pt", "training_seconds": 894.1, "budget_seconds": 1800, "target_steps": 5000, "max_train_seconds": 900, "startup_allowance_est": 45.9, "charged_seconds_est": 894.3, "over_budget": false, "total_seconds": 927.2, "compiled": true, "nki_relu2": false, "num_steps": 968, "total_tokens_M": 126.9, "world_size": 4, "lnc": 2, "seq_len": 2048, "num_params_M": 55.7, "causality_passed": true, "causality_max_abs": 0.0, "public_val_bpb": 1.096809, "eval_seconds": 7.7, "eval_timeout": 1200, "eval_over_timeout": false}
{"timestamp": "2026-09-09T00:41:10+00:00", "label": "foreach-off-fullbudget", "solution": "R1", "description": "paired OFF control at the full 1800s budget, same code and same day as foreach-optim-fullbudget", "launch_command": "NEURON_LOGICAL_NC_CONFIG=2 torchrun --standalone --nproc_per_node=4 train.py --num-steps 5000 --max-train-seconds 1800 --out-dir out/foreach-off-fullbudget --no-foreach-optim --tensor-lr-scalars --lrm-quantum 0", "git_commit": "124dfb7", "git_dirty": true, "status": "keep", "wall_elapsed_seconds": 1843.6, "run_log": "research/run-logs/foreach-off-fullbudget.log", "checkpoint_path": "out/foreach-off-fullbudget/final.pt", "training_seconds": 1794.3, "budget_seconds": 1800, "target_steps": 5000, "max_train_seconds": 1800, "startup_allowance_est": 36.6, "charged_seconds_est": 1794.5, "over_budget": false, "total_seconds": 1827.8, "compiled": true, "nki_relu2": false, "num_steps": 1934, "total_tokens_M": 253.5, "world_size": 4, "lnc": 2, "seq_len": 2048, "num_params_M": 55.7, "causality_passed": true, "causality_max_abs": 0.0, "public_val_bpb": 1.045602, "eval_seconds": 7.8, "eval_timeout": 1200, "eval_over_timeout": false}
{"timestamp": "2026-09-08T22:21:58+00:00", "label": "foreach-optim-900s", "solution": "R1", "description": "USE_FOREACH_OPTIM=True: batch optimizer per-parameter work into torch._foreach_* (bit-identical math) to cut optimizer-step dispatch overhead", "launch_command": "NEURON_LOGICAL_NC_CONFIG=2 torchrun --standalone --nproc_per_node=4 train.py --num-steps 5000 --max-train-seconds 900 --out-dir out/foreach-optim-900s --foreach-optim --tensor-lr-scalars --lrm-quantum 0", "git_commit": "124dfb7", "git_dirty": true, "status": "keep", "wall_elapsed_seconds": 953.3, "run_log": "research/run-logs/foreach-optim-900s.log", "checkpoint_path": "out/foreach-optim-900s/final.pt", "training_seconds": 894.7, "budget_seconds": 1800, "target_steps": 5000, "max_train_seconds": 900, "startup_allowance_est": 46.3, "charged_seconds_est": 894.9, "over_budget": false, "total_seconds": 927.3, "compiled": true, "nki_relu2": false, "num_steps": 1002, "total_tokens_M": 131.3, "world_size": 4, "lnc": 2, "seq_len": 2048, "num_params_M": 55.7, "causality_passed": true, "causality_max_abs": 0.0, "public_val_bpb": 1.093909, "eval_seconds": 7.7, "eval_timeout": 1200, "eval_over_timeout": false}
{"timestamp": "2026-09-08T22:41:35+00:00", "label": "foreach-optim-900s-v2", "solution": "R1", "description": "repeat of foreach-optim-900s: USE_FOREACH_OPTIM=True at 900s, replicate to separate the win from the ~3pct step-count noise band", "launch_command": "NEURON_LOGICAL_NC_CONFIG=2 torchrun --standalone --nproc_per_node=4 train.py --num-steps 5000 --max-train-seconds 900 --out-dir out/foreach-optim-900s-v2 --foreach-optim --tensor-lr-scalars --lrm-quantum 0", "git_commit": "124dfb7", "git_dirty": true, "status": "keep", "wall_elapsed_seconds": 951.2, "run_log": "research/run-logs/foreach-optim-900s-v2.log", "checkpoint_path": "out/foreach-optim-900s-v2/final.pt", "training_seconds": 894.3, "budget_seconds": 1800, "target_steps": 5000, "max_train_seconds": 900, "startup_allowance_est": 44.9, "charged_seconds_est": 894.5, "over_budget": false, "total_seconds": 926.8, "compiled": true, "nki_relu2": false, "num_steps": 1004, "total_tokens_M": 131.6, "world_size": 4, "lnc": 2, "seq_len": 2048, "num_params_M": 55.7, "causality_passed": true, "causality_max_abs": 0.0, "public_val_bpb": 1.093671, "eval_seconds": 7.6, "eval_timeout": 1200, "eval_over_timeout": false}
{"timestamp": "2026-09-08T22:57:28+00:00", "label": "foreach-optim-900s-v3", "solution": "R1", "description": "repeat of foreach-optim-900s: USE_FOREACH_OPTIM=True at 900s, replicate to separate the win from the ~3pct step-count noise band", "launch_command": "NEURON_LOGICAL_NC_CONFIG=2 torchrun --standalone --nproc_per_node=4 train.py --num-steps 5000 --max-train-seconds 900 --out-dir out/foreach-optim-900s-v3 --foreach-optim --tensor-lr-scalars --lrm-quantum 0", "git_commit": "124dfb7", "git_dirty": true, "status": "keep", "wall_elapsed_seconds": 953.3, "run_log": "research/run-logs/foreach-optim-900s-v3.log", "checkpoint_path": "out/foreach-optim-900s-v3/final.pt", "training_seconds": 894.6, "budget_seconds": 1800, "target_steps": 5000, "max_train_seconds": 900, "startup_allowance_est": 46.8, "charged_seconds_est": 894.8, "over_budget": false, "total_seconds": 927.0, "compiled": true, "nki_relu2": false, "num_steps": 1003, "total_tokens_M": 131.5, "world_size": 4, "lnc": 2, "seq_len": 2048, "num_params_M": 55.7, "causality_passed": true, "causality_max_abs": 0.0, "public_val_bpb": 1.093991, "eval_seconds": 7.5, "eval_timeout": 1200, "eval_over_timeout": false}
{"timestamp": "2026-09-09T00:10:26+00:00", "label": "foreach-optim-fullbudget", "solution": "R1", "description": "USE_FOREACH_OPTIM=True at the full 1800s budget, ON side of the paired full-budget record", "launch_command": "NEURON_LOGICAL_NC_CONFIG=2 torchrun --standalone --nproc_per_node=4 train.py --num-steps 5000 --max-train-seconds 1800 --out-dir out/foreach-optim-fullbudget --foreach-optim --tensor-lr-scalars --lrm-quantum 0", "git_commit": "124dfb7", "git_dirty": true, "status": "keep", "wall_elapsed_seconds": 1853.8, "run_log": "research/run-logs/foreach-optim-fullbudget.log", "checkpoint_path": "out/foreach-optim-fullbudget/final.pt", "training_seconds": 1794.2, "budget_seconds": 1800, "target_steps": 5000, "max_train_seconds": 1800, "startup_allowance_est": 46.9, "charged_seconds_est": 1794.4, "over_budget": false, "total_seconds": 1827.9, "compiled": true, "nki_relu2": false, "num_steps": 1987, "total_tokens_M": 260.4, "world_size": 4, "lnc": 2, "seq_len": 2048, "num_params_M": 55.7, "causality_passed": true, "causality_max_abs": 0.0, "public_val_bpb": 1.043651, "eval_seconds": 7.7, "eval_timeout": 1200, "eval_over_timeout": false}
{"timestamp": "2026-09-09T02:50:48+00:00", "label": "gradclip1-900s", "solution": "Scavenger", "description": "GRAD_CLIP 0.0->1.0 (HLAT precedent), never tested on Trn2, real A/B at current locked config", "launch_command": "NEURON_LOGICAL_NC_CONFIG=2 torchrun --standalone --nproc_per_node=4 train.py --num-steps 5000 --max-train-seconds 900 --out-dir out/gradclip1-900s", "git_commit": "124dfb7", "git_dirty": true, "status": "keep", "wall_elapsed_seconds": 965.9, "run_log": "research/run-logs/gradclip1-900s.log", "checkpoint_path": "out/gradclip1-900s/final.pt", "training_seconds": 894.2, "budget_seconds": 1800, "target_steps": 5000, "max_train_seconds": 900, "startup_allowance_est": 59.3, "charged_seconds_est": 894.4, "over_budget": false, "total_seconds": 934.8, "compiled": true, "nki_relu2": false, "num_steps": 999, "total_tokens_M": 130.9, "world_size": 4, "lnc": 2, "seq_len": 2048, "num_params_M": 55.7, "causality_passed": true, "causality_max_abs": 0.0, "public_val_bpb": 1.0912, "eval_seconds": 7.6, "eval_timeout": 1200, "eval_over_timeout": false}
{"timestamp": "2026-09-09T03:07:36+00:00", "label": "gradclip1-900s-v2", "solution": "Scavenger", "description": "GRAD_CLIP=1.0 repeat to confirm the real gain seen in gradclip1-900s", "launch_command": "NEURON_LOGICAL_NC_CONFIG=2 torchrun --standalone --nproc_per_node=4 train.py --num-steps 5000 --max-train-seconds 900 --out-dir out/gradclip1-900s-v2", "git_commit": "124dfb7", "git_dirty": true, "status": "keep", "wall_elapsed_seconds": 943.1, "run_log": "research/run-logs/gradclip1-900s-v2.log", "checkpoint_path": "out/gradclip1-900s-v2/final.pt", "training_seconds": 894.2, "budget_seconds": 1800, "target_steps": 5000, "max_train_seconds": 900, "startup_allowance_est": 37.0, "charged_seconds_est": 894.4, "over_budget": false, "total_seconds": 927.6, "compiled": true, "nki_relu2": false, "num_steps": 1002, "total_tokens_M": 131.3, "world_size": 4, "lnc": 2, "seq_len": 2048, "num_params_M": 55.7, "causality_passed": true, "causality_max_abs": 0.0, "public_val_bpb": 1.090864, "eval_seconds": 7.6, "eval_timeout": 1200, "eval_over_timeout": false}
{"timestamp": "2026-09-09T03:39:02+00:00", "label": "gradclip1-fullbudget", "solution": "Scavenger", "description": "GRAD_CLIP=1.0 full-1800s confirmation, real repeat-confirmed win at 900s", "launch_command": "NEURON_LOGICAL_NC_CONFIG=2 torchrun --standalone --nproc_per_node=4 train.py --num-steps 5000 --max-train-seconds 1800 --out-dir out/gradclip1-fullbudget", "git_commit": "9dc9873", "git_dirty": true, "status": "keep", "wall_elapsed_seconds": 1853.8, "run_log": "research/run-logs/gradclip1-fullbudget.log", "checkpoint_path": "out/gradclip1-fullbudget/final.pt", "training_seconds": 1794.8, "budget_seconds": 1800, "target_steps": 5000, "max_train_seconds": 1800, "startup_allowance_est": 47.1, "charged_seconds_est": 1794.9, "over_budget": false, "total_seconds": 1827.8, "compiled": true, "nki_relu2": false, "num_steps": 2000, "total_tokens_M": 262.1, "world_size": 4, "lnc": 2, "seq_len": 2048, "num_params_M": 55.7, "causality_passed": true, "causality_max_abs": 0.0, "public_val_bpb": 1.042278, "eval_seconds": 7.6, "eval_timeout": 1200, "eval_over_timeout": false}
{"timestamp": "2026-09-07T17:42:35+00:00", "label": "lc-off-300s", "solution": "LocalConv", "description": "matched back-to-back local_conv A/B from ONE binary, 300s, idle box", "launch_command": "NEURON_LOGICAL_NC_CONFIG=2 torchrun --standalone --nproc_per_node=4 train.py --num-steps 5000 --max-train-seconds 300 --out-dir out/lc-off-300s --eval-tokens 65536 --no-local-conv", "git_commit": "e6fe55a", "git_dirty": true, "status": "keep", "wall_elapsed_seconds": 426.9, "run_log": "research/run-logs/lc-off-300s.log", "checkpoint_path": "out/lc-off-300s/final.pt", "training_seconds": 0.0, "budget_seconds": 1800, "target_steps": 5000, "max_train_seconds": 300, "startup_allowance_est": 421.1, "charged_seconds_est": 0.2, "over_budget": false, "total_seconds": 402.6, "compiled": true, "nki_relu2": false, "num_steps": 5, "total_tokens_M": 0.7, "world_size": 4, "lnc": 2, "seq_len": 2048, "num_params_M": 55.7, "causality_passed": true, "causality_max_abs": 0.0, "public_val_bpb": 3.079601, "eval_seconds": 0.4, "eval_timeout": 1200, "eval_over_timeout": false}
{"timestamp": "2026-09-07T18:00:22+00:00", "label": "lc-off-300s-v2", "solution": "LocalConv", "description": "matched local_conv A/B, both graphs pre-warmed via --compile-only, contention-monitored", "launch_command": "NEURON_LOGICAL_NC_CONFIG=2 torchrun --standalone --nproc_per_node=4 train.py --num-steps 5000 --max-train-seconds 300 --out-dir out/lc-off-300s-v2 --eval-tokens 65536 --no-local-conv", "git_commit": "e6fe55a", "git_dirty": true, "status": "keep", "wall_elapsed_seconds": 372.1, "run_log": "research/run-logs/lc-off-300s-v2.log", "checkpoint_path": "out/lc-off-300s-v2/final.pt", "training_seconds": 285.9, "budget_seconds": 1800, "target_steps": 5000, "max_train_seconds": 300, "startup_allowance_est": 80.4, "charged_seconds_est": 286.1, "over_budget": false, "total_seconds": 343.0, "compiled": true, "nki_relu2": false, "num_steps": 38, "total_tokens_M": 5.0, "world_size": 4, "lnc": 2, "seq_len": 2048, "num_params_M": 55.7, "causality_passed": true, "causality_max_abs": 0.0, "public_val_bpb": 1.978906, "eval_seconds": 0.4, "eval_timeout": 1200, "eval_over_timeout": false}
