{"timestamp": "2026-09-15T11:54:57+00:00", "label": "ngmlr-ctrl-900s-r2", "solution": "T3.1", "description": "closing same-commit 900s control: measures this block's own drift/noise band", "launch_command": "NEURON_LOGICAL_NC_CONFIG=2 torchrun --standalone --nproc_per_node=4 train.py --num-steps 5000 --max-train-seconds 900 --out-dir out/ngmlr-ctrl-900s-r2 --eval-seq-len 1024", "git_commit": "95038a2", "git_dirty": true, "status": "keep", "wall_elapsed_seconds": 981.3, "run_log": "research/run-logs/ngmlr-ctrl-900s-r2.log", "checkpoint_path": "out/ngmlr-ctrl-900s-r2/final.pt", "training_seconds": 884.4, "budget_seconds": 1800, "target_steps": 5000, "max_train_seconds": 900, "startup_allowance_est": 63.1, "charged_seconds_est": 885.4, "over_budget": false, "total_seconds": 956.0, "compiled": true, "nki_relu2": false, "ngram_ve": "True tables=4 rows=1048576 dim=128 index_gather=True trigram=True opt=rmsprop flat_lr=True bf16=True", "out_bigram": "False bf16=True gate_bias=-2.0 lr=0.0", "oneliners": "relu2_tau=0.0 mlp_sandwich=False head_gate=False hg_norm=True hg_ch=32 hg_mul=2.0 hg_bias=0.0 out_pool=False pool_layers=3 qk_shift=True qk_beta=0.0 qk_freeze=True x0_gate=False block_nudge=False nudge_site=qk qkv_norm_cse=False parallel_block=False par_coalesce=none epoch_shuffle=False epoch_shuffle_seed=1234", "engram": "False site=-1 orders=2,3 heads=1 tables=0 mult=32 mem_dim=128 e_dim=0 key_dim=0 conv_k=4 share=False bf16=True", "batch_ramp": "False grad_accum=(2, 4, 8) bounds=(0.35, 0.75) lr_exp=0.5 ref_grad_accum=4 last_grad_accum=4", "weight_ema": "False decays=(0.995,) start_frac=0.75 seeded=False updates=0", "sched_tricks": "demon_b1=False demon_final=0.55 demon_ref=0.8 demon_start=-1.0 muon_b2=0.9 muon_b2_final=0.0 depth_lr=1.0->1.0 depth_mom=0.0->0.0 depth_mom_ref=0.95", "num_steps": 1053, "total_tokens_M": 138.0, "world_size": 4, "lnc": 2, "seq_len": 2048, "num_params_M": 592.9, "causality_passed": true, "causality_max_abs": 0.0, "public_val_bpb": 1.052543, "eval_seconds": 9.9, "eval_timeout": 1200, "eval_over_timeout": false, "eval_alt_seq_len": 1024, "public_val_bpb_alt": 1.067877, "eval_alt_seconds": 17.6}
{"timestamp": "2026-09-15T12:44:05+00:00", "label": "ngmveopt-arm-900s", "solution": "T3.1", "description": "--ngram-ve-opt adamw (Recursive's stated fallback arm: identical group, betas=(0.8,EMBED_ADAMW_BETA2=0.95) like the unigram VE tables; max-train-seconds pre-scaled 900->915s per the calibration's measured +1.68% s/step cost to land at matched steps)", "launch_command": "NEURON_LOGICAL_NC_CONFIG=2 torchrun --standalone --nproc_per_node=4 train.py --num-steps 5000 --max-train-seconds 915 --out-dir out/ngmveopt-arm-900s --eval-seq-len 1024 --ngram-ve-opt adamw", "git_commit": "95038a2", "git_dirty": true, "status": "keep", "wall_elapsed_seconds": 1003.1, "run_log": "research/run-logs/ngmveopt-arm-900s.log", "checkpoint_path": "out/ngmveopt-arm-900s/final.pt", "training_seconds": 899.6, "budget_seconds": 1800, "target_steps": 5000, "max_train_seconds": 915, "startup_allowance_est": 69.4, "charged_seconds_est": 900.6, "over_budget": false, "total_seconds": 972.4, "compiled": true, "nki_relu2": false, "ngram_ve": "True tables=4 rows=1048576 dim=128 index_gather=True trigram=True opt=adamw flat_lr=True bf16=True", "out_bigram": "False bf16=True gate_bias=-2.0 lr=0.0", "oneliners": "relu2_tau=0.0 mlp_sandwich=False head_gate=False hg_norm=True hg_ch=32 hg_mul=2.0 hg_bias=0.0 out_pool=False pool_layers=3 qk_shift=True qk_beta=0.0 qk_freeze=True x0_gate=False block_nudge=False nudge_site=qk qkv_norm_cse=False parallel_block=False par_coalesce=none epoch_shuffle=False epoch_shuffle_seed=1234", "engram": "False site=-1 orders=2,3 heads=1 tables=0 mult=32 mem_dim=128 e_dim=0 key_dim=0 conv_k=4 share=False bf16=True", "batch_ramp": "False grad_accum=(2, 4, 8) bounds=(0.35, 0.75) lr_exp=0.5 ref_grad_accum=4 last_grad_accum=4", "weight_ema": "False decays=(0.995,) start_frac=0.75 seeded=False updates=0", "sched_tricks": "demon_b1=False demon_final=0.55 demon_ref=0.8 demon_start=-1.0 muon_b2=0.9 muon_b2_final=0.0 depth_lr=1.0->1.0 depth_mom=0.0->0.0 depth_mom_ref=0.95", "num_steps": 1053, "total_tokens_M": 138.0, "world_size": 4, "lnc": 2, "seq_len": 2048, "num_params_M": 592.9, "causality_passed": true, "causality_max_abs": 0.0, "public_val_bpb": 1.055048, "eval_seconds": 10.0, "eval_timeout": 1200, "eval_over_timeout": false, "eval_alt_seq_len": 1024, "public_val_bpb_alt": 1.070276, "eval_alt_seconds": 17.8}
{"timestamp": "2026-09-15T13:35:36+00:00", "label": "ngmveopt-arm-900s-r2", "solution": "T3.1", "description": "same-day confirming-repeat arm for --ngram-ve-opt adamw, max-train-seconds pre-scaled 900->915s as in the first pair", "launch_command": "NEURON_LOGICAL_NC_CONFIG=2 torchrun --standalone --nproc_per_node=4 train.py --num-steps 5000 --max-train-seconds 915 --out-dir out/ngmveopt-arm-900s-r2 --eval-seq-len 1024 --ngram-ve-opt adamw", "git_commit": "95038a2", "git_dirty": true, "status": "keep", "wall_elapsed_seconds": 998.9, "run_log": "research/run-logs/ngmveopt-arm-900s-r2.log", "checkpoint_path": "out/ngmveopt-arm-900s-r2/final.pt", "training_seconds": 899.5, "budget_seconds": 1800, "target_steps": 5000, "max_train_seconds": 915, "startup_allowance_est": 65.1, "charged_seconds_est": 900.5, "over_budget": false, "total_seconds": 971.9, "compiled": true, "nki_relu2": false, "ngram_ve": "True tables=4 rows=1048576 dim=128 index_gather=True trigram=True opt=adamw flat_lr=True bf16=True", "out_bigram": "False bf16=True gate_bias=-2.0 lr=0.0", "oneliners": "relu2_tau=0.0 mlp_sandwich=False head_gate=False hg_norm=True hg_ch=32 hg_mul=2.0 hg_bias=0.0 out_pool=False pool_layers=3 qk_shift=True qk_beta=0.0 qk_freeze=True x0_gate=False block_nudge=False nudge_site=qk qkv_norm_cse=False parallel_block=False par_coalesce=none epoch_shuffle=False epoch_shuffle_seed=1234", "engram": "False site=-1 orders=2,3 heads=1 tables=0 mult=32 mem_dim=128 e_dim=0 key_dim=0 conv_k=4 share=False bf16=True", "batch_ramp": "False grad_accum=(2, 4, 8) bounds=(0.35, 0.75) lr_exp=0.5 ref_grad_accum=4 last_grad_accum=4", "weight_ema": "False decays=(0.995,) start_frac=0.75 seeded=False updates=0", "sched_tricks": "demon_b1=False demon_final=0.55 demon_ref=0.8 demon_start=-1.0 muon_b2=0.9 muon_b2_final=0.0 depth_lr=1.0->1.0 depth_mom=0.0->0.0 depth_mom_ref=0.95", "num_steps": 1057, "total_tokens_M": 138.5, "world_size": 4, "lnc": 2, "seq_len": 2048, "num_params_M": 592.9, "causality_passed": true, "causality_max_abs": 0.0, "public_val_bpb": 1.054695, "eval_seconds": 10.0, "eval_timeout": 1200, "eval_over_timeout": false, "eval_alt_seq_len": 1024, "public_val_bpb_alt": 1.070097, "eval_alt_seconds": 17.8}
{"timestamp": "2026-09-15T12:27:22+00:00", "label": "ngmveopt-ctrl-900s-r1", "solution": "T3.1", "description": "fresh same-commit 900s control for the --ngram-ve-opt isolation A/B, flag at locked default (rmsprop, no first moment, betas=(0.0,0.999))", "launch_command": "NEURON_LOGICAL_NC_CONFIG=2 torchrun --standalone --nproc_per_node=4 train.py --num-steps 5000 --max-train-seconds 900 --out-dir out/ngmveopt-ctrl-900s-r1 --eval-seq-len 1024 --ngram-ve-opt rmsprop", "git_commit": "95038a2", "git_dirty": true, "status": "keep", "wall_elapsed_seconds": 973.4, "run_log": "research/run-logs/ngmveopt-ctrl-900s-r1.log", "checkpoint_path": "out/ngmveopt-ctrl-900s-r1/final.pt", "training_seconds": 884.2, "budget_seconds": 1800, "target_steps": 5000, "max_train_seconds": 900, "startup_allowance_est": 55.0, "charged_seconds_est": 885.2, "over_budget": false, "total_seconds": 956.7, "compiled": true, "nki_relu2": false, "ngram_ve": "True tables=4 rows=1048576 dim=128 index_gather=True trigram=True opt=rmsprop flat_lr=True bf16=True", "out_bigram": "False bf16=True gate_bias=-2.0 lr=0.0", "oneliners": "relu2_tau=0.0 mlp_sandwich=False head_gate=False hg_norm=True hg_ch=32 hg_mul=2.0 hg_bias=0.0 out_pool=False pool_layers=3 qk_shift=True qk_beta=0.0 qk_freeze=True x0_gate=False block_nudge=False nudge_site=qk qkv_norm_cse=False parallel_block=False par_coalesce=none epoch_shuffle=False epoch_shuffle_seed=1234", "engram": "False site=-1 orders=2,3 heads=1 tables=0 mult=32 mem_dim=128 e_dim=0 key_dim=0 conv_k=4 share=False bf16=True", "batch_ramp": "False grad_accum=(2, 4, 8) bounds=(0.35, 0.75) lr_exp=0.5 ref_grad_accum=4 last_grad_accum=4", "weight_ema": "False decays=(0.995,) start_frac=0.75 seeded=False updates=0", "sched_tricks": "demon_b1=False demon_final=0.55 demon_ref=0.8 demon_start=-1.0 muon_b2=0.9 muon_b2_final=0.0 depth_lr=1.0->1.0 depth_mom=0.0->0.0 depth_mom_ref=0.95", "num_steps": 1052, "total_tokens_M": 137.9, "world_size": 4, "lnc": 2, "seq_len": 2048, "num_params_M": 592.9, "causality_passed": true, "causality_max_abs": 0.0, "public_val_bpb": 1.052999, "eval_seconds": 10.0, "eval_timeout": 1200, "eval_over_timeout": false, "eval_alt_seq_len": 1024, "public_val_bpb_alt": 1.068294, "eval_alt_seconds": 17.8}
{"timestamp": "2026-09-15T13:00:29+00:00", "label": "ngmveopt-ctrl-900s-r2", "solution": "T3.1", "description": "closing same-commit 900s control: measures this block's own drift/noise band", "launch_command": "NEURON_LOGICAL_NC_CONFIG=2 torchrun --standalone --nproc_per_node=4 train.py --num-steps 5000 --max-train-seconds 900 --out-dir out/ngmveopt-ctrl-900s-r2 --eval-seq-len 1024 --ngram-ve-opt rmsprop", "git_commit": "95038a2", "git_dirty": true, "status": "keep", "wall_elapsed_seconds": 983.1, "run_log": "research/run-logs/ngmveopt-ctrl-900s-r2.log", "checkpoint_path": "out/ngmveopt-ctrl-900s-r2/final.pt", "training_seconds": 884.6, "budget_seconds": 1800, "target_steps": 5000, "max_train_seconds": 900, "startup_allowance_est": 64.4, "charged_seconds_est": 885.6, "over_budget": false, "total_seconds": 956.8, "compiled": true, "nki_relu2": false, "ngram_ve": "True tables=4 rows=1048576 dim=128 index_gather=True trigram=True opt=rmsprop flat_lr=True bf16=True", "out_bigram": "False bf16=True gate_bias=-2.0 lr=0.0", "oneliners": "relu2_tau=0.0 mlp_sandwich=False head_gate=False hg_norm=True hg_ch=32 hg_mul=2.0 hg_bias=0.0 out_pool=False pool_layers=3 qk_shift=True qk_beta=0.0 qk_freeze=True x0_gate=False block_nudge=False nudge_site=qk qkv_norm_cse=False parallel_block=False par_coalesce=none epoch_shuffle=False epoch_shuffle_seed=1234", "engram": "False site=-1 orders=2,3 heads=1 tables=0 mult=32 mem_dim=128 e_dim=0 key_dim=0 conv_k=4 share=False bf16=True", "batch_ramp": "False grad_accum=(2, 4, 8) bounds=(0.35, 0.75) lr_exp=0.5 ref_grad_accum=4 last_grad_accum=4", "weight_ema": "False decays=(0.995,) start_frac=0.75 seeded=False updates=0", "sched_tricks": "demon_b1=False demon_final=0.55 demon_ref=0.8 demon_start=-1.0 muon_b2=0.9 muon_b2_final=0.0 depth_lr=1.0->1.0 depth_mom=0.0->0.0 depth_mom_ref=0.95", "num_steps": 1054, "total_tokens_M": 138.1, "world_size": 4, "lnc": 2, "seq_len": 2048, "num_params_M": 592.9, "causality_passed": true, "causality_max_abs": 0.0, "public_val_bpb": 1.052781, "eval_seconds": 10.0, "eval_timeout": 1200, "eval_over_timeout": false, "eval_alt_seq_len": 1024, "public_val_bpb_alt": 1.06808, "eval_alt_seconds": 17.9}
{"timestamp": "2026-09-15T13:18:57+00:00", "label": "ngmveopt-ctrl-900s-r3", "solution": "T3.1", "description": "same-day confirming-repeat control for --ngram-ve-opt, locked default (rmsprop)", "launch_command": "NEURON_LOGICAL_NC_CONFIG=2 torchrun --standalone --nproc_per_node=4 train.py --num-steps 5000 --max-train-seconds 900 --out-dir out/ngmveopt-ctrl-900s-r3 --eval-seq-len 1024 --ngram-ve-opt rmsprop", "git_commit": "95038a2", "git_dirty": true, "status": "keep", "wall_elapsed_seconds": 984.3, "run_log": "research/run-logs/ngmveopt-ctrl-900s-r3.log", "checkpoint_path": "out/ngmveopt-ctrl-900s-r3/final.pt", "training_seconds": 884.9, "budget_seconds": 1800, "target_steps": 5000, "max_train_seconds": 900, "startup_allowance_est": 65.2, "charged_seconds_est": 885.9, "over_budget": false, "total_seconds": 956.8, "compiled": true, "nki_relu2": false, "ngram_ve": "True tables=4 rows=1048576 dim=128 index_gather=True trigram=True opt=rmsprop flat_lr=True bf16=True", "out_bigram": "False bf16=True gate_bias=-2.0 lr=0.0", "oneliners": "relu2_tau=0.0 mlp_sandwich=False head_gate=False hg_norm=True hg_ch=32 hg_mul=2.0 hg_bias=0.0 out_pool=False pool_layers=3 qk_shift=True qk_beta=0.0 qk_freeze=True x0_gate=False block_nudge=False nudge_site=qk qkv_norm_cse=False parallel_block=False par_coalesce=none epoch_shuffle=False epoch_shuffle_seed=1234", "engram": "False site=-1 orders=2,3 heads=1 tables=0 mult=32 mem_dim=128 e_dim=0 key_dim=0 conv_k=4 share=False bf16=True", "batch_ramp": "False grad_accum=(2, 4, 8) bounds=(0.35, 0.75) lr_exp=0.5 ref_grad_accum=4 last_grad_accum=4", "weight_ema": "False decays=(0.995,) start_frac=0.75 seeded=False updates=0", "sched_tricks": "demon_b1=False demon_final=0.55 demon_ref=0.8 demon_start=-1.0 muon_b2=0.9 muon_b2_final=0.0 depth_lr=1.0->1.0 depth_mom=0.0->0.0 depth_mom_ref=0.95", "num_steps": 1055, "total_tokens_M": 138.3, "world_size": 4, "lnc": 2, "seq_len": 2048, "num_params_M": 592.9, "causality_passed": true, "causality_max_abs": 0.0, "public_val_bpb": 1.052269, "eval_seconds": 9.9, "eval_timeout": 1200, "eval_over_timeout": false, "eval_alt_seq_len": 1024, "public_val_bpb_alt": 1.067544, "eval_alt_seconds": 17.8}
{"timestamp": "2026-09-15T13:51:50+00:00", "label": "ngmveopt-ctrl-900s-r4", "solution": "T3.1", "description": "closing confirming-repeat control: measures this block's own drift/noise band", "launch_command": "NEURON_LOGICAL_NC_CONFIG=2 torchrun --standalone --nproc_per_node=4 train.py --num-steps 5000 --max-train-seconds 900 --out-dir out/ngmveopt-ctrl-900s-r4 --eval-seq-len 1024 --ngram-ve-opt rmsprop", "git_commit": "95038a2", "git_dirty": true, "status": "keep", "wall_elapsed_seconds": 973.8, "run_log": "research/run-logs/ngmveopt-ctrl-900s-r4.log", "checkpoint_path": "out/ngmveopt-ctrl-900s-r4/final.pt", "training_seconds": 884.9, "budget_seconds": 1800, "target_steps": 5000, "max_train_seconds": 900, "startup_allowance_est": 54.1, "charged_seconds_est": 885.9, "over_budget": false, "total_seconds": 957.7, "compiled": true, "nki_relu2": false, "ngram_ve": "True tables=4 rows=1048576 dim=128 index_gather=True trigram=True opt=rmsprop flat_lr=True bf16=True", "out_bigram": "False bf16=True gate_bias=-2.0 lr=0.0", "oneliners": "relu2_tau=0.0 mlp_sandwich=False head_gate=False hg_norm=True hg_ch=32 hg_mul=2.0 hg_bias=0.0 out_pool=False pool_layers=3 qk_shift=True qk_beta=0.0 qk_freeze=True x0_gate=False block_nudge=False nudge_site=qk qkv_norm_cse=False parallel_block=False par_coalesce=none epoch_shuffle=False epoch_shuffle_seed=1234", "engram": "False site=-1 orders=2,3 heads=1 tables=0 mult=32 mem_dim=128 e_dim=0 key_dim=0 conv_k=4 share=False bf16=True", "batch_ramp": "False grad_accum=(2, 4, 8) bounds=(0.35, 0.75) lr_exp=0.5 ref_grad_accum=4 last_grad_accum=4", "weight_ema": "False decays=(0.995,) start_frac=0.75 seeded=False updates=0", "sched_tricks": "demon_b1=False demon_final=0.55 demon_ref=0.8 demon_start=-1.0 muon_b2=0.9 muon_b2_final=0.0 depth_lr=1.0->1.0 depth_mom=0.0->0.0 depth_mom_ref=0.95", "num_steps": 1052, "total_tokens_M": 137.9, "world_size": 4, "lnc": 2, "seq_len": 2048, "num_params_M": 592.9, "causality_passed": true, "causality_max_abs": 0.0, "public_val_bpb": 1.052969, "eval_seconds": 10.1, "eval_timeout": 1200, "eval_over_timeout": false, "eval_alt_seq_len": 1024, "public_val_bpb_alt": 1.06817, "eval_alt_seconds": 18.1}
{"timestamp": "2026-09-09T05:34:01+00:00", "label": "nkimuon-900s", "solution": "muon-nki-fusion", "description": "USE_NKI_MUON on: NKI fusion of Muon NS elementwise ops + sign-gated update, bit-exact, 92 of 320 device launches removed", "launch_command": "NEURON_LOGICAL_NC_CONFIG=2 torchrun --standalone --nproc_per_node=4 train.py --num-steps 5000 --max-train-seconds 900 --out-dir out/nkimuon-900s --nki-muon", "git_commit": "fdc64f0", "git_dirty": true, "status": "keep", "wall_elapsed_seconds": 951.5, "run_log": "research/run-logs/nkimuon-900s.log", "checkpoint_path": "out/nkimuon-900s/final.pt", "training_seconds": 894.8, "budget_seconds": 1800, "target_steps": 5000, "max_train_seconds": 900, "startup_allowance_est": 44.7, "charged_seconds_est": 895.0, "over_budget": false, "total_seconds": 934.5, "compiled": true, "nki_relu2": false, "num_steps": 1019, "total_tokens_M": 133.6, "world_size": 4, "lnc": 2, "seq_len": 2048, "num_params_M": 55.7, "causality_passed": true, "causality_max_abs": 0.0, "public_val_bpb": 1.089758, "eval_seconds": 7.5, "eval_timeout": 1200, "eval_over_timeout": false}
{"timestamp": "2026-09-09T06:29:11+00:00", "label": "nkimuon-fullbudget", "solution": "muon-nki-fusion", "description": "full 1800s budget, USE_NKI_MUON on (now default)", "launch_command": "NEURON_LOGICAL_NC_CONFIG=2 torchrun --standalone --nproc_per_node=4 train.py --num-steps 5000 --max-train-seconds 1800 --out-dir out/nkimuon-fullbudget --nki-muon", "git_commit": "fdc64f0", "git_dirty": true, "status": "keep", "wall_elapsed_seconds": 1923.0, "run_log": "research/run-logs/nkimuon-fullbudget.log", "checkpoint_path": "out/nkimuon-fullbudget/final.pt", "training_seconds": 1794.3, "budget_seconds": 1800, "target_steps": 5000, "max_train_seconds": 1800, "startup_allowance_est": 116.6, "charged_seconds_est": 1794.5, "over_budget": false, "total_seconds": 1897.4, "compiled": true, "nki_relu2": false, "num_steps": 2043, "total_tokens_M": 267.8, "world_size": 4, "lnc": 2, "seq_len": 2048, "num_params_M": 55.7, "causality_passed": true, "causality_max_abs": 0.0, "public_val_bpb": 1.041139, "eval_seconds": 7.5, "eval_timeout": 1200, "eval_over_timeout": false}
{"timestamp": "2026-09-09T05:50:14+00:00", "label": "nkimuon-off-900s", "solution": "muon-nki-fusion", "description": "control at same commit: USE_NKI_MUON off (eager _muon_step verbatim)", "launch_command": "NEURON_LOGICAL_NC_CONFIG=2 torchrun --standalone --nproc_per_node=4 train.py --num-steps 5000 --max-train-seconds 900 --out-dir out/nkimuon-off-900s --no-nki-muon", "git_commit": "fdc64f0", "git_dirty": true, "status": "keep", "wall_elapsed_seconds": 953.8, "run_log": "research/run-logs/nkimuon-off-900s.log", "checkpoint_path": "out/nkimuon-off-900s/final.pt", "training_seconds": 894.9, "budget_seconds": 1800, "target_steps": 5000, "max_train_seconds": 900, "startup_allowance_est": 46.9, "charged_seconds_est": 895.1, "over_budget": false, "total_seconds": 928.1, "compiled": true, "nki_relu2": false, "num_steps": 1004, "total_tokens_M": 131.6, "world_size": 4, "lnc": 2, "seq_len": 2048, "num_params_M": 55.7, "causality_passed": true, "causality_max_abs": 0.0, "public_val_bpb": 1.090677, "eval_seconds": 7.5, "eval_timeout": 1200, "eval_over_timeout": false}
{"timestamp": "2026-09-09T07:00:24+00:00", "label": "nkimuon-off-fullbudget", "solution": "muon-nki-fusion", "description": "full 1800s budget control at same commit, USE_NKI_MUON off", "launch_command": "NEURON_LOGICAL_NC_CONFIG=2 torchrun --standalone --nproc_per_node=4 train.py --num-steps 5000 --max-train-seconds 1800 --out-dir out/nkimuon-off-fullbudget --no-nki-muon", "git_commit": "fdc64f0", "git_dirty": true, "status": "keep", "wall_elapsed_seconds": 1853.3, "run_log": "research/run-logs/nkimuon-off-fullbudget.log", "checkpoint_path": "out/nkimuon-off-fullbudget/final.pt", "training_seconds": 1794.3, "budget_seconds": 1800, "target_steps": 5000, "max_train_seconds": 1800, "startup_allowance_est": 46.9, "charged_seconds_est": 1794.5, "over_budget": false, "total_seconds": 1827.6, "compiled": true, "nki_relu2": false, "num_steps": 2011, "total_tokens_M": 263.6, "world_size": 4, "lnc": 2, "seq_len": 2048, "num_params_M": 55.7, "causality_passed": true, "causality_max_abs": 0.0, "public_val_bpb": 1.042049, "eval_seconds": 7.6, "eval_timeout": 1200, "eval_over_timeout": false}
{"timestamp": "2026-09-09T03:59:55+00:00", "label": "packfactor4-900s", "solution": "Scavenger", "description": "PACK_FACTOR 2->4 resweep under the new regime", "launch_command": "NEURON_LOGICAL_NC_CONFIG=2 torchrun --standalone --nproc_per_node=4 train.py --num-steps 5000 --max-train-seconds 900 --out-dir out/packfactor4-900s", "git_commit": "9dc9873", "git_dirty": true, "status": "keep", "wall_elapsed_seconds": 1018.8, "run_log": "research/run-logs/packfactor4-900s.log", "checkpoint_path": "out/packfactor4-900s/final.pt", "training_seconds": 894.3, "budget_seconds": 1800, "target_steps": 5000, "max_train_seconds": 900, "startup_allowance_est": 112.4, "charged_seconds_est": 894.5, "over_budget": false, "total_seconds": 1001.1, "compiled": true, "nki_relu2": false, "num_steps": 776, "total_tokens_M": 101.7, "world_size": 4, "lnc": 2, "seq_len": 2048, "num_params_M": 55.7, "causality_passed": true, "causality_max_abs": 0.0, "public_val_bpb": 1.113876, "eval_seconds": 7.5, "eval_timeout": 1200, "eval_over_timeout": false}
