{"timestamp": "2026-09-07T00:29:34+00:00", "label": "sol-c-softcapce-explicit-off-check", "solution": "Bucket C", "description": "verify --no-nki-softcap-ce disables it", "launch_command": "NEURON_LOGICAL_NC_CONFIG=1 torchrun --standalone --nproc_per_node=1 train.py --num-steps 15 --max-train-seconds 200 --out-dir out/sol-c-softcapce-explicit-off-check --eval-tokens 65536 --no-nki-softcap-ce", "git_commit": "e94c9af", "git_dirty": true, "status": "keep", "wall_elapsed_seconds": 96.9, "run_log": "research/run-logs/sol-c-softcapce-explicit-off-check.log", "checkpoint_path": "out/sol-c-softcapce-explicit-off-check/final.pt", "training_seconds": 54.0, "budget_seconds": 1800, "target_steps": 15, "max_train_seconds": 200, "startup_allowance_est": 37.7, "charged_seconds_est": 54.2, "over_budget": false, "total_seconds": 84.8, "compiled": false, "nki_relu2": false, "num_steps": 15, "total_tokens_M": 2.0, "world_size": 1, "lnc": 1, "seq_len": 2048, "num_params_M": 55.7, "causality_passed": true, "causality_max_abs": 0.0, "public_val_bpb": 2.075319, "eval_seconds": 1.4, "eval_timeout": 1200, "eval_over_timeout": false}
{"timestamp": "2026-09-07T00:03:09+00:00", "label": "sol-c-softcapce-smoke", "solution": "Bucket C", "description": "Bucket C: fused softcap+cross-entropy NKI kernel, real-hardware correctness smoke test, single device", "launch_command": "NEURON_LOGICAL_NC_CONFIG=1 torchrun --standalone --nproc_per_node=1 train.py --num-steps 15 --max-train-seconds 200 --out-dir out/sol-c-softcapce-smoke --eval-tokens 65536 --nki-softcap-ce", "git_commit": "0d6e5b6", "git_dirty": true, "status": "keep", "wall_elapsed_seconds": 93.9, "run_log": "research/run-logs/sol-c-softcapce-smoke.log", "checkpoint_path": "out/sol-c-softcapce-smoke/final.pt", "training_seconds": 49.0, "budget_seconds": 1800, "target_steps": 15, "max_train_seconds": 200, "startup_allowance_est": 39.6, "charged_seconds_est": 49.2, "over_budget": false, "total_seconds": 80.7, "compiled": false, "nki_relu2": false, "num_steps": 15, "total_tokens_M": 2.0, "world_size": 1, "lnc": 1, "seq_len": 2048, "num_params_M": 55.7, "causality_passed": true, "causality_max_abs": 0.0, "public_val_bpb": 2.091488, "eval_seconds": 1.5, "eval_timeout": 1200, "eval_over_timeout": false}
{"timestamp": "2026-09-07T02:12:33+00:00", "label": "sol-d-xsa-900s", "solution": "Bucket D", "description": "Bucket D: Exclusive Self Attention (XSA) real speed/quality A/B at final locked shape", "launch_command": "NEURON_LOGICAL_NC_CONFIG=2 torchrun --standalone --nproc_per_node=4 train.py --num-steps 5000 --max-train-seconds 900 --out-dir out/sol-d-xsa-900s", "git_commit": "dbe5922", "git_dirty": true, "status": "keep", "wall_elapsed_seconds": 955.7, "run_log": "research/run-logs/sol-d-xsa-900s.log", "checkpoint_path": "out/sol-d-xsa-900s/final.pt", "training_seconds": 891.7, "budget_seconds": 1800, "target_steps": 5000, "max_train_seconds": 900, "startup_allowance_est": 44.6, "charged_seconds_est": 891.9, "over_budget": false, "total_seconds": 929.2, "compiled": false, "nki_relu2": false, "num_steps": 368, "total_tokens_M": 48.2, "world_size": 4, "lnc": 2, "seq_len": 2048, "num_params_M": 55.7, "causality_passed": true, "causality_max_abs": 0.0, "public_val_bpb": 1.208657, "eval_seconds": 9.9, "eval_timeout": 1200, "eval_over_timeout": false}
{"timestamp": "2026-09-07T01:56:08+00:00", "label": "sol-d-xsa-smoke", "solution": "Bucket D", "description": "Bucket D: Exclusive Self Attention (XSA), correctness smoke test", "launch_command": "NEURON_LOGICAL_NC_CONFIG=1 torchrun --standalone --nproc_per_node=1 train.py --num-steps 15 --max-train-seconds 200 --out-dir out/sol-d-xsa-smoke --eval-tokens 65536", "git_commit": "a842162", "git_dirty": true, "status": "keep", "wall_elapsed_seconds": 122.5, "run_log": "research/run-logs/sol-d-xsa-smoke.log", "checkpoint_path": "out/sol-d-xsa-smoke/final.pt", "training_seconds": 58.9, "budget_seconds": 1800, "target_steps": 15, "max_train_seconds": 200, "startup_allowance_est": 53.4, "charged_seconds_est": 59.1, "over_budget": false, "total_seconds": 110.4, "compiled": false, "nki_relu2": false, "num_steps": 15, "total_tokens_M": 2.0, "world_size": 1, "lnc": 1, "seq_len": 2048, "num_params_M": 55.7, "causality_passed": true, "causality_max_abs": 0.0, "public_val_bpb": 2.097001, "eval_seconds": 1.7, "eval_timeout": 1200, "eval_over_timeout": false}
{"timestamp": "2026-09-04T19:28:59+00:00", "label": "sol-docmask-off-smoke", "solution": "9", "description": "doc-boundary mask refactor no-op check (USE_DOC_MASK=False), PACK_FACTOR=2 base", "launch_command": "NEURON_LOGICAL_NC_CONFIG=1 torchrun --standalone --nproc_per_node=1 train.py --num-steps 15 --max-train-seconds 300 --out-dir out/sol-docmask-off-smoke --eval-tokens 65536", "git_commit": "2d585a2", "git_dirty": true, "status": "keep", "wall_elapsed_seconds": 19.6, "run_log": "research/run-logs/sol-docmask-off-smoke.log", "checkpoint_path": "out/sol-docmask-off-smoke/final.pt", "training_seconds": 10.4, "budget_seconds": 1800, "target_steps": 15, "max_train_seconds": 300, "over_budget": false, "total_seconds": 16.4, "compiled": false, "nki_relu2": false, "num_steps": 15, "total_tokens_M": 1.0, "world_size": 1, "lnc": 1, "seq_len": 1024, "num_params_M": 85.9, "causality_passed": true, "causality_max_abs": 0.0, "public_val_bpb": 2.131932, "eval_seconds": 0.5, "eval_timeout": 1200, "eval_over_timeout": false}
{"timestamp": "2026-09-04T19:45:16+00:00", "label": "sol-docmask-on", "solution": "9", "description": "USE_DOC_MASK=True (on top of Sol1-7,9a,10, PACK_FACTOR=2)", "launch_command": "NEURON_LOGICAL_NC_CONFIG=1 torchrun --standalone --nproc_per_node=1 train.py --num-steps 800 --max-train-seconds 1000 --out-dir out/sol-docmask-on", "git_commit": "be1dfc9", "git_dirty": true, "status": "keep", "wall_elapsed_seconds": 886.9, "run_log": "research/run-logs/sol-docmask-on.log", "checkpoint_path": "out/sol-docmask-on/final.pt", "training_seconds": 863.0, "budget_seconds": 1800, "target_steps": 800, "max_train_seconds": 1000, "over_budget": false, "total_seconds": 883.8, "compiled": false, "nki_relu2": false, "num_steps": 800, "total_tokens_M": 52.4, "world_size": 1, "lnc": 1, "seq_len": 1024, "num_params_M": 85.9, "causality_passed": true, "causality_max_abs": 0.0, "public_val_bpb": 1.171596, "eval_seconds": 15.2, "eval_timeout": 1200, "eval_over_timeout": false}
{"timestamp": "2026-09-04T19:29:58+00:00", "label": "sol-docmask-on-smoke", "solution": "9", "description": "USE_DOC_MASK=True smoke test", "launch_command": "NEURON_LOGICAL_NC_CONFIG=1 torchrun --standalone --nproc_per_node=1 train.py --num-steps 15 --max-train-seconds 300 --out-dir out/sol-docmask-on-smoke --eval-tokens 65536", "git_commit": "dd4db02", "git_dirty": true, "status": "keep", "wall_elapsed_seconds": 19.5, "run_log": "research/run-logs/sol-docmask-on-smoke.log", "checkpoint_path": "out/sol-docmask-on-smoke/final.pt", "training_seconds": 10.5, "budget_seconds": 1800, "target_steps": 15, "max_train_seconds": 300, "over_budget": false, "total_seconds": 16.5, "compiled": false, "nki_relu2": false, "num_steps": 15, "total_tokens_M": 1.0, "world_size": 1, "lnc": 1, "seq_len": 1024, "num_params_M": 85.9, "causality_passed": true, "causality_max_abs": 0.0, "public_val_bpb": 2.12773, "eval_seconds": 0.5, "eval_timeout": 1200, "eval_over_timeout": false}
{"timestamp": "2026-09-06T21:34:16+00:00", "label": "sol-e-compile-final-shape-900s", "solution": "Bucket E", "description": "Bucket E: torch.compile(backend=neuron) real speed/quality A/B at final locked shape, kernel ON (default)", "launch_command": "NEURON_LOGICAL_NC_CONFIG=2 torchrun --standalone --nproc_per_node=4 train.py --num-steps 5000 --max-train-seconds 900 --out-dir out/sol-e-compile-final-shape-900s --compile", "git_commit": "d64cba0", "git_dirty": true, "status": "keep", "wall_elapsed_seconds": 1069.9, "run_log": "research/run-logs/sol-e-compile-final-shape-900s.log", "checkpoint_path": "out/sol-e-compile-final-shape-900s/final.pt", "training_seconds": 892.2, "budget_seconds": 1800, "target_steps": 5000, "max_train_seconds": 900, "startup_allowance_est": 165.2, "charged_seconds_est": 892.5, "over_budget": false, "total_seconds": 1043.1, "compiled": true, "nki_relu2": false, "num_steps": 386, "total_tokens_M": 50.6, "world_size": 4, "lnc": 2, "seq_len": 2048, "num_params_M": 55.7, "causality_passed": true, "causality_max_abs": 0.0, "public_val_bpb": 1.197115, "eval_seconds": 7.4, "eval_timeout": 1200, "eval_over_timeout": false}
{"timestamp": "2026-09-06T21:10:16+00:00", "label": "sol-e-compile-smoke-nokernel", "solution": "Bucket E", "description": "Bucket E step 1: torch.compile(backend=neuron) smoke test, rope+QK-norm kernel forced OFF, tiny step count, single device", "launch_command": "NEURON_LOGICAL_NC_CONFIG=1 torchrun --standalone --nproc_per_node=1 train.py --num-steps 15 --max-train-seconds 300 --out-dir out/sol-e-compile-smoke-nokernel --eval-tokens 65536 --compile --no-nki-rope-norm", "git_commit": "33a8d5b", "git_dirty": true, "status": "keep", "wall_elapsed_seconds": 371.2, "run_log": "research/run-logs/sol-e-compile-smoke-nokernel.log", "checkpoint_path": "out/sol-e-compile-smoke-nokernel/final.pt", "training_seconds": 45.2, "budget_seconds": 1800, "target_steps": 15, "max_train_seconds": 300, "startup_allowance_est": 296.6, "charged_seconds_est": 45.4, "over_budget": false, "total_seconds": 358.5, "compiled": true, "nki_relu2": false, "num_steps": 12, "total_tokens_M": 1.6, "world_size": 1, "lnc": 1, "seq_len": 2048, "num_params_M": 55.7, "causality_passed": true, "causality_max_abs": 0.0, "public_val_bpb": 2.155121, "eval_seconds": 10.3, "eval_timeout": 1200, "eval_over_timeout": false}
{"timestamp": "2026-09-06T21:15:26+00:00", "label": "sol-e-compile-smoke-withkernel", "solution": "Bucket E", "description": "Bucket E step 2: torch.compile(backend=neuron) smoke test, rope+QK-norm kernel ON (default), single device", "launch_command": "NEURON_LOGICAL_NC_CONFIG=1 torchrun --standalone --nproc_per_node=1 train.py --num-steps 15 --max-train-seconds 400 --out-dir out/sol-e-compile-smoke-withkernel --eval-tokens 65536 --compile", "git_commit": "d0bea08", "git_dirty": true, "status": "keep", "wall_elapsed_seconds": 263.9, "run_log": "research/run-logs/sol-e-compile-smoke-withkernel.log", "checkpoint_path": "out/sol-e-compile-smoke-withkernel/final.pt", "training_seconds": 54.4, "budget_seconds": 1800, "target_steps": 15, "max_train_seconds": 400, "startup_allowance_est": 202.8, "charged_seconds_est": 54.6, "over_budget": false, "total_seconds": 252.0, "compiled": true, "nki_relu2": false, "num_steps": 15, "total_tokens_M": 2.0, "world_size": 1, "lnc": 1, "seq_len": 2048, "num_params_M": 55.7, "causality_passed": true, "causality_max_abs": 0.0, "public_val_bpb": 2.062125, "eval_seconds": 1.4, "eval_timeout": 1200, "eval_over_timeout": false}
{"timestamp": "2026-09-06T17:15:08+00:00", "label": "sol-seqlen2048", "solution": "Solution 11 (context-length)", "description": "Context-length resweep at final locked shape: SEQ_LEN=2048", "launch_command": "NEURON_LOGICAL_NC_CONFIG=2 torchrun --standalone --nproc_per_node=4 train.py --num-steps 5000 --max-train-seconds 900 --out-dir out/sol-seqlen2048", "git_commit": "526048b", "git_dirty": true, "status": "keep", "wall_elapsed_seconds": 986.2, "run_log": "research/run-logs/sol-seqlen2048.log", "checkpoint_path": "out/sol-seqlen2048/final.pt", "training_seconds": 893.1, "budget_seconds": 1800, "target_steps": 5000, "max_train_seconds": 900, "startup_allowance_est": 61.4, "charged_seconds_est": 893.3, "over_budget": false, "total_seconds": 960.0, "compiled": false, "nki_relu2": false, "num_steps": 387, "total_tokens_M": 50.7, "world_size": 4, "lnc": 2, "seq_len": 2048, "num_params_M": 55.7, "causality_passed": true, "causality_max_abs": 0.0, "public_val_bpb": 1.198086, "eval_seconds": 15.5, "eval_timeout": 1200, "eval_over_timeout": false}
{"timestamp": "2026-09-06T19:29:08+00:00", "label": "sol-seqlen2048-fullbudget", "solution": "Solution 11 (context-length)", "description": "Full-1800s confirmation of current best combo: DEPTH=6, n_embd=640, TOTAL_BATCH_SIZE=131072, SEQ_LEN=2048, kernel ON, USE_CAUSAL_FASTPATH=True, LNC=2", "launch_command": "NEURON_LOGICAL_NC_CONFIG=2 torchrun --standalone --nproc_per_node=4 train.py --num-steps 5000 --max-train-seconds 1800 --out-dir out/sol-seqlen2048-fullbudget", "git_commit": "6079f5c", "git_dirty": true, "status": "keep", "wall_elapsed_seconds": 1834.9, "run_log": "research/run-logs/sol-seqlen2048-fullbudget.log", "checkpoint_path": "out/sol-seqlen2048-fullbudget/final.pt", "training_seconds": 1793.6, "budget_seconds": 1800, "target_steps": 5000, "max_train_seconds": 1800, "startup_allowance_est": 28.3, "charged_seconds_est": 1793.8, "over_budget": false, "total_seconds": 1809.5, "compiled": false, "nki_relu2": false, "num_steps": 746, "total_tokens_M": 97.8, "world_size": 4, "lnc": 2, "seq_len": 2048, "num_params_M": 55.7, "causality_passed": true, "causality_max_abs": 0.0, "public_val_bpb": 1.122271, "eval_seconds": 7.4, "eval_timeout": 1200, "eval_over_timeout": false}
{"timestamp": "2026-09-06T17:35:22+00:00", "label": "sol-seqlen4096", "solution": "Solution 11 (context-length)", "description": "Context-length resweep at final locked shape: SEQ_LEN=4096", "launch_command": "NEURON_LOGICAL_NC_CONFIG=2 torchrun --standalone --nproc_per_node=4 train.py --num-steps 5000 --max-train-seconds 900 --out-dir out/sol-seqlen4096", "git_commit": "9f475cb", "git_dirty": true, "status": "keep", "wall_elapsed_seconds": 1003.1, "run_log": "research/run-logs/sol-seqlen4096.log", "checkpoint_path": "out/sol-seqlen4096/final.pt", "training_seconds": 889.7, "budget_seconds": 1800, "target_steps": 5000, "max_train_seconds": 900, "startup_allowance_est": 81.4, "charged_seconds_est": 889.9, "over_budget": false, "total_seconds": 977.9, "compiled": false, "nki_relu2": false, "num_steps": 396, "total_tokens_M": 51.9, "world_size": 4, "lnc": 2, "seq_len": 4096, "num_params_M": 55.7, "causality_passed": true, "causality_max_abs": 0.0, "public_val_bpb": 1.209781, "eval_seconds": 14.3, "eval_timeout": 1200, "eval_over_timeout": false}
{"timestamp": "2026-09-06T16:55:07+00:00", "label": "sol-seqlen512", "solution": "Solution 11 (context-length)", "description": "Context-length resweep at final locked shape: SEQ_LEN=512", "launch_command": "NEURON_LOGICAL_NC_CONFIG=2 torchrun --standalone --nproc_per_node=4 train.py --num-steps 5000 --max-train-seconds 900 --out-dir out/sol-seqlen512", "git_commit": "01171e2", "git_dirty": true, "status": "keep", "wall_elapsed_seconds": 993.6, "run_log": "research/run-logs/sol-seqlen512.log", "checkpoint_path": "out/sol-seqlen512/final.pt", "training_seconds": 890.1, "budget_seconds": 1800, "target_steps": 5000, "max_train_seconds": 900, "startup_allowance_est": 53.9, "charged_seconds_est": 890.3, "over_budget": false, "total_seconds": 969.1, "compiled": false, "nki_relu2": false, "num_steps": 253, "total_tokens_M": 33.2, "world_size": 4, "lnc": 2, "seq_len": 512, "num_params_M": 55.7, "causality_passed": true, "causality_max_abs": 0.0, "public_val_bpb": 1.332677, "eval_seconds": 34.2, "eval_timeout": 1200, "eval_over_timeout": false}
{"timestamp": "2026-09-04T08:16:05+00:00", "label": "sol1-wd05-final0", "solution": "1", "description": "WARMDOWN_RATIO=0.5 FINAL_LR_FRAC=0.0", "launch_command": "NEURON_LOGICAL_NC_CONFIG=1 torchrun --standalone --nproc_per_node=1 train.py --num-steps 800 --max-train-seconds 1050 --out-dir out/sol1-wd05-final0", "git_commit": "8a6076d", "git_dirty": true, "status": "keep", "wall_elapsed_seconds": 1041.0, "run_log": "research/run-logs/sol1-wd05-final0.log", "checkpoint_path": "out/sol1-wd05-final0/final.pt", "training_seconds": 1024.8, "budget_seconds": 1800, "target_steps": 800, "max_train_seconds": 1050, "over_budget": false, "total_seconds": 1024.9, "compiled": false, "nki_relu2": false, "num_steps": 800, "total_tokens_M": 52.4, "world_size": 1, "lnc": 1, "seq_len": 1024, "num_params_M": 59.6, "causality_passed": true, "causality_max_abs": 0.0, "public_val_bpb": 1.216659, "eval_seconds": 13.9, "eval_timeout": 1200, "eval_over_timeout": false}
{"timestamp": "2026-09-04T08:34:24+00:00", "label": "sol1-wd075-final0", "solution": "1", "description": "WARMDOWN_RATIO=0.75 FINAL_LR_FRAC=0.0", "launch_command": "NEURON_LOGICAL_NC_CONFIG=1 torchrun --standalone --nproc_per_node=1 train.py --num-steps 800 --max-train-seconds 1050 --out-dir out/sol1-wd075-final0", "git_commit": "598ed26", "git_dirty": true, "status": "keep", "wall_elapsed_seconds": 1043.5, "run_log": "research/run-logs/sol1-wd075-final0.log", "checkpoint_path": "out/sol1-wd075-final0/final.pt", "training_seconds": 1027.5, "budget_seconds": 1800, "target_steps": 800, "max_train_seconds": 1050, "over_budget": false, "total_seconds": 1027.6, "compiled": false, "nki_relu2": false, "num_steps": 800, "total_tokens_M": 52.4, "world_size": 1, "lnc": 1, "seq_len": 1024, "num_params_M": 59.6, "causality_passed": true, "causality_max_abs": 0.0, "public_val_bpb": 1.216602, "eval_seconds": 13.9, "eval_timeout": 1200, "eval_over_timeout": false}
{"timestamp": "2026-09-04T08:52:40+00:00", "label": "sol1-wd075-final005", "solution": "1", "description": "WARMDOWN_RATIO=0.75 FINAL_LR_FRAC=0.05", "launch_command": "NEURON_LOGICAL_NC_CONFIG=1 torchrun --standalone --nproc_per_node=1 train.py --num-steps 800 --max-train-seconds 1050 --out-dir out/sol1-wd075-final005", "git_commit": "f765ad1", "git_dirty": true, "status": "keep", "wall_elapsed_seconds": 1044.7, "run_log": "research/run-logs/sol1-wd075-final005.log", "checkpoint_path": "out/sol1-wd075-final005/final.pt", "training_seconds": 1028.2, "budget_seconds": 1800, "target_steps": 800, "max_train_seconds": 1050, "over_budget": false, "total_seconds": 1028.3, "compiled": false, "nki_relu2": false, "num_steps": 800, "total_tokens_M": 52.4, "world_size": 1, "lnc": 1, "seq_len": 1024, "num_params_M": 59.6, "causality_passed": true, "causality_max_abs": 0.0, "public_val_bpb": 1.215996, "eval_seconds": 13.9, "eval_timeout": 1200, "eval_over_timeout": false}
{"timestamp": "2026-09-04T12:05:48+00:00", "label": "sol10-weightcache", "solution": "10", "description": "USE_WEIGHT_CACHE=True (on top of Sol1-7,9a)", "launch_command": "NEURON_LOGICAL_NC_CONFIG=1 torchrun --standalone --nproc_per_node=1 train.py --num-steps 800 --max-train-seconds 780 --out-dir out/sol10-weightcache", "git_commit": "efda777", "git_dirty": true, "status": "keep", "wall_elapsed_seconds": 795.8, "run_log": "research/run-logs/sol10-weightcache.log", "checkpoint_path": "out/sol10-weightcache/final.pt", "training_seconds": 778.4, "budget_seconds": 1800, "target_steps": 800, "max_train_seconds": 780, "over_budget": false, "total_seconds": 778.5, "compiled": false, "nki_relu2": false, "num_steps": 800, "total_tokens_M": 52.4, "world_size": 1, "lnc": 1, "seq_len": 1024, "num_params_M": 85.9, "causality_passed": true, "causality_max_abs": 0.0, "public_val_bpb": 1.172216, "eval_seconds": 15.1, "eval_timeout": 1200, "eval_over_timeout": false}
{"timestamp": "2026-09-04T11:52:13+00:00", "label": "sol10-weightcache-smoke", "solution": "10", "description": "USE_WEIGHT_CACHE=True smoke test", "launch_command": "NEURON_LOGICAL_NC_CONFIG=1 torchrun --standalone --nproc_per_node=1 train.py --num-steps 15 --max-train-seconds 300 --out-dir out/sol10-weightcache-smoke --eval-tokens 65536", "git_commit": "6c87f7c", "git_dirty": true, "status": "keep", "wall_elapsed_seconds": 18.1, "run_log": "research/run-logs/sol10-weightcache-smoke.log", "checkpoint_path": "out/sol10-weightcache-smoke/final.pt", "training_seconds": 15.2, "budget_seconds": 1800, "target_steps": 15, "max_train_seconds": 300, "over_budget": false, "total_seconds": 15.3, "compiled": false, "nki_relu2": false, "num_steps": 15, "total_tokens_M": 1.0, "world_size": 1, "lnc": 1, "seq_len": 1024, "num_params_M": 85.9, "causality_passed": true, "causality_max_abs": 0.0, "public_val_bpb": 2.153023, "eval_seconds": 0.5, "eval_timeout": 1200, "eval_over_timeout": false}
{"timestamp": "2026-09-05T21:54:13+00:00", "label": "sol11-batch131072-900s", "solution": "11", "description": "Solution 11 batch sweep at fixed DEPTH=6: TOTAL_BATCH_SIZE=131072 (double), fixed 900s wall-clock, real submission shape", "launch_command": "NEURON_LOGICAL_NC_CONFIG=1 torchrun --standalone --nproc_per_node=8 train.py --num-steps 3000 --max-train-seconds 900 --out-dir out/sol11-batch131072-900s", "git_commit": "8163b4e", "git_dirty": true, "status": "keep", "wall_elapsed_seconds": 939.2, "run_log": "research/run-logs/sol11-batch131072-900s.log", "checkpoint_path": "out/sol11-batch131072-900s/final.pt", "training_seconds": 894.3, "budget_seconds": 1800, "target_steps": 3000, "max_train_seconds": 900, "startup_allowance_est": 28.2, "charged_seconds_est": 894.4, "over_budget": false, "total_seconds": 915.4, "compiled": false, "nki_relu2": false, "num_steps": 257, "total_tokens_M": 33.7, "world_size": 8, "lnc": 1, "seq_len": 1024, "num_params_M": 26.4, "causality_passed": true, "causality_max_abs": 0.0, "public_val_bpb": 1.290674, "eval_seconds": 12.7, "eval_timeout": 1200, "eval_over_timeout": false}
