{"timestamp": "2026-09-17T04:26:08+00:00", "label": "sub1-p2b-autocast-nomuoncompile-smoke", "solution": "sub1", "description": "fp8 auto-cast with Muon-compile OFF probe 300 steps", "launch_command": "NEURON_LOGICAL_NC_CONFIG=2 torchrun --standalone --nproc_per_node=4 train.py --num-steps 300 --max-train-seconds 3600 --out-dir out/sub1-p2b-autocast-nomuoncompile-smoke --no-compile-muon --seed 42", "git_commit": "496befd", "git_dirty": true, "status": "keep", "wall_elapsed_seconds": 308.2, "run_log": "research/run-logs/sub1-p2b-autocast-nomuoncompile-smoke.log", "checkpoint_path": "out/sub1-p2b-autocast-nomuoncompile-smoke/final.pt", "training_seconds": 194.4, "budget_seconds": 1800, "target_steps": 300, "max_train_seconds": 3600, "startup_allowance_est": 99.0, "charged_seconds_est": 195.4, "over_budget": false, "total_seconds": 291.3, "compiled": true, "nki_relu2": false, "ngram_ve": "True tables=4 rows=1048576 dim=128 index_gather=True trigram=True opt=rmsprop flat_lr=True bf16=True", "out_bigram": "False bf16=True gate_bias=-2.0 lr=0.0", "oneliners": "relu2_tau=0.0 mlp_sandwich=False head_gate=False hg_norm=True hg_ch=32 hg_mul=2.0 hg_bias=0.0 out_pool=False pool_layers=3 qk_shift=True qk_beta=0.0 qk_freeze=True x0_gate=False block_nudge=False nudge_site=qk qkv_norm_cse=False parallel_block=False par_coalesce=none epoch_shuffle=False epoch_shuffle_seed=1234", "engram": "False site=-1 orders=2,3 heads=1 tables=0 mult=32 mem_dim=128 e_dim=0 key_dim=0 conv_k=4 share=False bf16=True", "batch_ramp": "False grad_accum=(2, 4, 8) bounds=(0.35, 0.75) lr_exp=0.5 ref_grad_accum=4 last_grad_accum=4", "weight_ema": "False decays=(0.995,) start_frac=0.75 seeded=False updates=0", "sched_tricks": "demon_b1=False demon_final=0.55 demon_ref=0.8 demon_start=-1.0 muon_b2=0.9 muon_b2_final=0.0 depth_lr=1.0->1.0 depth_mom=0.0->0.0 depth_mom_ref=0.95", "num_steps": 300, "total_tokens_M": 39.3, "world_size": 4, "lnc": 2, "seq_len": 2048, "num_params_M": 592.9, "causality_passed": true, "causality_max_abs": 0.0, "public_val_bpb": 3.23429, "eval_seconds": 9.1, "eval_timeout": 1200, "eval_over_timeout": false}
{"timestamp": "2026-09-17T04:55:24+00:00", "label": "sub1-p2b-autocast-ocp-smoke", "solution": "sub1", "description": "fp8 auto-cast with OCP scale computation probe 300 steps", "launch_command": "NEURON_LOGICAL_NC_CONFIG=2 torchrun --standalone --nproc_per_node=4 train.py --num-steps 300 --max-train-seconds 3600 --out-dir out/sub1-p2b-autocast-ocp-smoke --seed 42", "git_commit": "496befd", "git_dirty": true, "status": "keep", "wall_elapsed_seconds": 635.8, "run_log": "research/run-logs/sub1-p2b-autocast-ocp-smoke.log", "checkpoint_path": "out/sub1-p2b-autocast-ocp-smoke/final.pt", "training_seconds": 185.0, "budget_seconds": 1800, "target_steps": 300, "max_train_seconds": 3600, "startup_allowance_est": 391.5, "charged_seconds_est": 193.7, "over_budget": false, "total_seconds": 608.4, "compiled": true, "nki_relu2": false, "ngram_ve": "True tables=4 rows=1048576 dim=128 index_gather=True trigram=True opt=rmsprop flat_lr=True bf16=True", "out_bigram": "False bf16=True gate_bias=-2.0 lr=0.0", "oneliners": "relu2_tau=0.0 mlp_sandwich=False head_gate=False hg_norm=True hg_ch=32 hg_mul=2.0 hg_bias=0.0 out_pool=False pool_layers=3 qk_shift=True qk_beta=0.0 qk_freeze=True x0_gate=False block_nudge=False nudge_site=qk qkv_norm_cse=False parallel_block=False par_coalesce=none epoch_shuffle=False epoch_shuffle_seed=1234", "engram": "False site=-1 orders=2,3 heads=1 tables=0 mult=32 mem_dim=128 e_dim=0 key_dim=0 conv_k=4 share=False bf16=True", "batch_ramp": "False grad_accum=(2, 4, 8) bounds=(0.35, 0.75) lr_exp=0.5 ref_grad_accum=4 last_grad_accum=4", "weight_ema": "False decays=(0.995,) start_frac=0.75 seeded=False updates=0", "sched_tricks": "demon_b1=False demon_final=0.55 demon_ref=0.8 demon_start=-1.0 muon_b2=0.9 muon_b2_final=0.0 depth_lr=1.0->1.0 depth_mom=0.0->0.0 depth_mom_ref=0.95", "num_steps": 300, "total_tokens_M": 39.3, "world_size": 4, "lnc": 2, "seq_len": 2048, "num_params_M": 592.9, "causality_passed": true, "causality_max_abs": 0.0, "public_val_bpb": 3.23429, "eval_seconds": 27.5, "eval_timeout": 1200, "eval_over_timeout": false}
{"timestamp": "2026-09-17T06:07:47+00:00", "label": "sub1-p2b-autocast-s128-smoke", "solution": "sub1", "description": "fp8 auto-cast loss-scale 128 probe 300 steps", "launch_command": "NEURON_LOGICAL_NC_CONFIG=2 torchrun --standalone --nproc_per_node=4 train.py --num-steps 300 --max-train-seconds 3600 --out-dir out/sub1-p2b-autocast-s128-smoke --loss-scale 128 --seed 42", "git_commit": "496befd", "git_dirty": true, "status": "crash", "wall_elapsed_seconds": 139.5, "run_log": "research/run-logs/sub1-p2b-autocast-s128-smoke.log"}
{"timestamp": "2026-09-17T07:11:40+00:00", "label": "sub1-p2b-autocast-s256-smoke", "solution": "sub1", "description": "fp8 auto-cast static S256 300 steps", "launch_command": "NEURON_LOGICAL_NC_CONFIG=2 torchrun --standalone --nproc_per_node=4 train.py --num-steps 300 --max-train-seconds 3600 --out-dir out/sub1-p2b-autocast-s256-smoke --loss-scale 256 --seed 42", "git_commit": "dab464a", "git_dirty": true, "status": "keep", "wall_elapsed_seconds": 1262.0, "run_log": "research/run-logs/sub1-p2b-autocast-s256-smoke.log", "checkpoint_path": "out/sub1-p2b-autocast-s256-smoke/final.pt", "training_seconds": 362.9, "budget_seconds": 1800, "target_steps": 300, "max_train_seconds": 3600, "startup_allowance_est": 836.5, "charged_seconds_est": 364.0, "over_budget": false, "total_seconds": 1234.7, "compiled": true, "nki_relu2": false, "ngram_ve": "True tables=4 rows=1048576 dim=128 index_gather=True trigram=True opt=rmsprop flat_lr=True bf16=True", "out_bigram": "False bf16=True gate_bias=-2.0 lr=0.0", "oneliners": "relu2_tau=0.0 mlp_sandwich=False head_gate=False hg_norm=True hg_ch=32 hg_mul=2.0 hg_bias=0.0 out_pool=False pool_layers=3 qk_shift=True qk_beta=0.0 qk_freeze=True x0_gate=False block_nudge=False nudge_site=qk qkv_norm_cse=False parallel_block=False par_coalesce=none epoch_shuffle=False epoch_shuffle_seed=1234", "engram": "False site=-1 orders=2,3 heads=1 tables=0 mult=32 mem_dim=128 e_dim=0 key_dim=0 conv_k=4 share=False bf16=True", "batch_ramp": "False grad_accum=(2, 4, 8) bounds=(0.35, 0.75) lr_exp=0.5 ref_grad_accum=4 last_grad_accum=4", "weight_ema": "False decays=(0.995,) start_frac=0.75 seeded=False updates=0", "sched_tricks": "demon_b1=False demon_final=0.55 demon_ref=0.8 demon_start=-1.0 muon_b2=0.9 muon_b2_final=0.0 depth_lr=1.0->1.0 depth_mom=0.0->0.0 depth_mom_ref=0.95", "num_steps": 300, "total_tokens_M": 39.3, "world_size": 4, "lnc": 2, "seq_len": 2048, "num_params_M": 592.9, "causality_passed": true, "causality_max_abs": 0.0, "public_val_bpb": 3.178319, "eval_seconds": 34.8, "eval_timeout": 1200, "eval_over_timeout": false}
{"timestamp": "2026-09-17T12:12:40+00:00", "label": "sub1-p2b-autocast-s32-revisit", "solution": "sub1", "description": "REVISIT fast s32 exact config [trn22] CC=--auto-cast matmult --auto-cast-type fp8_e4m3", "launch_command": "NEURON_LOGICAL_NC_CONFIG=2 torchrun --standalone --nproc_per_node=4 train.py --num-steps 300 --max-train-seconds 3600 --out-dir out/sub1-p2b-autocast-s32-revisit --loss-scale 32 --seed 42", "git_commit": "dab464a", "git_dirty": true, "status": "keep", "wall_elapsed_seconds": 1182.8, "run_log": "research/run-logs/sub1-p2b-autocast-s32-revisit.log", "checkpoint_path": "out/sub1-p2b-autocast-s32-revisit/final.pt", "training_seconds": 364.5, "budget_seconds": 1800, "target_steps": 300, "max_train_seconds": 3600, "startup_allowance_est": 801.6, "charged_seconds_est": 365.6, "over_budget": false, "total_seconds": 1155.2, "compiled": true, "nki_relu2": false, "ngram_ve": "True tables=4 rows=1048576 dim=128 index_gather=True trigram=True opt=rmsprop flat_lr=True bf16=True", "out_bigram": "False bf16=True gate_bias=-2.0 lr=0.0", "oneliners": "relu2_tau=0.0 mlp_sandwich=False head_gate=False hg_norm=True hg_ch=32 hg_mul=2.0 hg_bias=0.0 out_pool=False pool_layers=3 qk_shift=True qk_beta=0.0 qk_freeze=True x0_gate=False block_nudge=False nudge_site=qk qkv_norm_cse=False parallel_block=False par_coalesce=none epoch_shuffle=False epoch_shuffle_seed=1234", "engram": "False site=-1 orders=2,3 heads=1 tables=0 mult=32 mem_dim=128 e_dim=0 key_dim=0 conv_k=4 share=False bf16=True", "batch_ramp": "False grad_accum=(2, 4, 8) bounds=(0.35, 0.75) lr_exp=0.5 ref_grad_accum=4 last_grad_accum=4", "weight_ema": "False decays=(0.995,) start_frac=0.75 seeded=False updates=0", "sched_tricks": "demon_b1=False demon_final=0.55 demon_ref=0.8 demon_start=-1.0 muon_b2=0.9 muon_b2_final=0.0 depth_lr=1.0->1.0 depth_mom=0.0->0.0 depth_mom_ref=0.95", "num_steps": 300, "total_tokens_M": 39.3, "world_size": 4, "lnc": 2, "seq_len": 2048, "num_params_M": 592.9, "causality_passed": true, "causality_max_abs": 0.0, "public_val_bpb": 3.234289, "eval_seconds": 9.3, "eval_timeout": 1200, "eval_over_timeout": false}
{"timestamp": "2026-09-17T06:19:09+00:00", "label": "sub1-p2b-autocast-s32-smoke", "solution": "sub1", "description": "fp8 auto-cast loss-scale 32 probe 300 steps", "launch_command": "NEURON_LOGICAL_NC_CONFIG=2 torchrun --standalone --nproc_per_node=4 train.py --num-steps 300 --max-train-seconds 3600 --out-dir out/sub1-p2b-autocast-s32-smoke --loss-scale 32 --seed 42", "git_commit": "dab464a", "git_dirty": true, "status": "keep", "wall_elapsed_seconds": 703.7, "run_log": "research/run-logs/sub1-p2b-autocast-s32-smoke.log", "checkpoint_path": "out/sub1-p2b-autocast-s32-smoke/final.pt", "training_seconds": 195.8, "budget_seconds": 1800, "target_steps": 300, "max_train_seconds": 3600, "startup_allowance_est": 454.2, "charged_seconds_est": 196.8, "over_budget": false, "total_seconds": 678.6, "compiled": true, "nki_relu2": false, "ngram_ve": "True tables=4 rows=1048576 dim=128 index_gather=True trigram=True opt=rmsprop flat_lr=True bf16=True", "out_bigram": "False bf16=True gate_bias=-2.0 lr=0.0", "oneliners": "relu2_tau=0.0 mlp_sandwich=False head_gate=False hg_norm=True hg_ch=32 hg_mul=2.0 hg_bias=0.0 out_pool=False pool_layers=3 qk_shift=True qk_beta=0.0 qk_freeze=True x0_gate=False block_nudge=False nudge_site=qk qkv_norm_cse=False parallel_block=False par_coalesce=none epoch_shuffle=False epoch_shuffle_seed=1234", "engram": "False site=-1 orders=2,3 heads=1 tables=0 mult=32 mem_dim=128 e_dim=0 key_dim=0 conv_k=4 share=False bf16=True", "batch_ramp": "False grad_accum=(2, 4, 8) bounds=(0.35, 0.75) lr_exp=0.5 ref_grad_accum=4 last_grad_accum=4", "weight_ema": "False decays=(0.995,) start_frac=0.75 seeded=False updates=0", "sched_tricks": "demon_b1=False demon_final=0.55 demon_ref=0.8 demon_start=-1.0 muon_b2=0.9 muon_b2_final=0.0 depth_lr=1.0->1.0 depth_mom=0.0->0.0 depth_mom_ref=0.95", "num_steps": 300, "total_tokens_M": 39.3, "world_size": 4, "lnc": 2, "seq_len": 2048, "num_params_M": 592.9, "causality_passed": true, "causality_max_abs": 0.0, "public_val_bpb": 3.23429, "eval_seconds": 27.9, "eval_timeout": 1200, "eval_over_timeout": false}
{"timestamp": "2026-09-17T12:30:01+00:00", "label": "sub1-p2b-autocast-s32o1-smoke", "solution": "sub1", "description": "fp8 S32 auto-cast WITH optlevel=1 [trn22] CC=--optlevel=1 --auto-cast matmult --auto-cast-type fp8_e4m3", "launch_command": "NEURON_LOGICAL_NC_CONFIG=2 torchrun --standalone --nproc_per_node=4 train.py --num-steps 300 --max-train-seconds 3600 --out-dir out/sub1-p2b-autocast-s32o1-smoke --loss-scale 32 --seed 42", "git_commit": "dab464a", "git_dirty": true, "status": "keep", "wall_elapsed_seconds": 617.7, "run_log": "research/run-logs/sub1-p2b-autocast-s32o1-smoke.log", "checkpoint_path": "out/sub1-p2b-autocast-s32o1-smoke/final.pt", "training_seconds": 195.9, "budget_seconds": 1800, "target_steps": 300, "max_train_seconds": 3600, "startup_allowance_est": 406.6, "charged_seconds_est": 196.9, "over_budget": false, "total_seconds": 593.4, "compiled": true, "nki_relu2": false, "ngram_ve": "True tables=4 rows=1048576 dim=128 index_gather=True trigram=True opt=rmsprop flat_lr=True bf16=True", "out_bigram": "False bf16=True gate_bias=-2.0 lr=0.0", "oneliners": "relu2_tau=0.0 mlp_sandwich=False head_gate=False hg_norm=True hg_ch=32 hg_mul=2.0 hg_bias=0.0 out_pool=False pool_layers=3 qk_shift=True qk_beta=0.0 qk_freeze=True x0_gate=False block_nudge=False nudge_site=qk qkv_norm_cse=False parallel_block=False par_coalesce=none epoch_shuffle=False epoch_shuffle_seed=1234", "engram": "False site=-1 orders=2,3 heads=1 tables=0 mult=32 mem_dim=128 e_dim=0 key_dim=0 conv_k=4 share=False bf16=True", "batch_ramp": "False grad_accum=(2, 4, 8) bounds=(0.35, 0.75) lr_exp=0.5 ref_grad_accum=4 last_grad_accum=4", "weight_ema": "False decays=(0.995,) start_frac=0.75 seeded=False updates=0", "sched_tricks": "demon_b1=False demon_final=0.55 demon_ref=0.8 demon_start=-1.0 muon_b2=0.9 muon_b2_final=0.0 depth_lr=1.0->1.0 depth_mom=0.0->0.0 depth_mom_ref=0.95", "num_steps": 300, "total_tokens_M": 39.3, "world_size": 4, "lnc": 2, "seq_len": 2048, "num_params_M": 592.9, "causality_passed": true, "causality_max_abs": 0.0, "public_val_bpb": 3.23429, "eval_seconds": 9.2, "eval_timeout": 1200, "eval_over_timeout": false}
{"timestamp": "2026-09-17T06:02:20+00:00", "label": "sub1-p2b-autocast-scale-smoke", "solution": "sub1", "description": "fp8 auto-cast with loss-scale 1024 probe 300 steps", "launch_command": "NEURON_LOGICAL_NC_CONFIG=2 torchrun --standalone --nproc_per_node=4 train.py --num-steps 300 --max-train-seconds 3600 --out-dir out/sub1-p2b-autocast-scale-smoke --loss-scale 1024 --seed 42", "git_commit": "496befd", "git_dirty": true, "status": "crash", "wall_elapsed_seconds": 556.5, "run_log": "research/run-logs/sub1-p2b-autocast-scale-smoke.log"}
{"timestamp": "2026-09-16T19:51:42+00:00", "label": "sub1-p2b-autocast-smoke", "solution": "sub1", "description": "compiler auto-cast matmult fp8e4m3 smoke 300 steps", "launch_command": "NEURON_LOGICAL_NC_CONFIG=2 torchrun --standalone --nproc_per_node=4 train.py --num-steps 300 --max-train-seconds 3600 --out-dir out/sub1-p2b-autocast-smoke --seed 42", "git_commit": "496befd", "git_dirty": true, "status": "keep", "wall_elapsed_seconds": 640.1, "run_log": "research/run-logs/sub1-p2b-autocast-smoke.log", "checkpoint_path": "out/sub1-p2b-autocast-smoke/final.pt", "training_seconds": 185.0, "budget_seconds": 1800, "target_steps": 300, "max_train_seconds": 3600, "startup_allowance_est": 396.9, "charged_seconds_est": 186.0, "over_budget": false, "total_seconds": 615.1, "compiled": true, "nki_relu2": false, "ngram_ve": "True tables=4 rows=1048576 dim=128 index_gather=True trigram=True opt=rmsprop flat_lr=True bf16=True", "out_bigram": "False bf16=True gate_bias=-2.0 lr=0.0", "oneliners": "relu2_tau=0.0 mlp_sandwich=False head_gate=False hg_norm=True hg_ch=32 hg_mul=2.0 hg_bias=0.0 out_pool=False pool_layers=3 qk_shift=True qk_beta=0.0 qk_freeze=True x0_gate=False block_nudge=False nudge_site=qk qkv_norm_cse=False parallel_block=False par_coalesce=none epoch_shuffle=False epoch_shuffle_seed=1234", "engram": "False site=-1 orders=2,3 heads=1 tables=0 mult=32 mem_dim=128 e_dim=0 key_dim=0 conv_k=4 share=False bf16=True", "batch_ramp": "False grad_accum=(2, 4, 8) bounds=(0.35, 0.75) lr_exp=0.5 ref_grad_accum=4 last_grad_accum=4", "weight_ema": "False decays=(0.995,) start_frac=0.75 seeded=False updates=0", "sched_tricks": "demon_b1=False demon_final=0.55 demon_ref=0.8 demon_start=-1.0 muon_b2=0.9 muon_b2_final=0.0 depth_lr=1.0->1.0 depth_mom=0.0->0.0 depth_mom_ref=0.95", "num_steps": 300, "total_tokens_M": 39.3, "world_size": 4, "lnc": 2, "seq_len": 2048, "num_params_M": 592.9, "causality_passed": true, "causality_max_abs": 0.0, "public_val_bpb": 3.23429, "eval_seconds": 34.5, "eval_timeout": 1200, "eval_over_timeout": false}
{"timestamp": "2026-09-16T17:51:27+00:00", "label": "sub1-p3-b256k-lr14-full", "solution": "sub1", "description": "batch262144 x matrix-lr 0.028 (1.4x), joint arm B mirror, seed42", "launch_command": "NEURON_LOGICAL_NC_CONFIG=2 torchrun --standalone --nproc_per_node=4 train.py --num-steps 1000000 --max-train-seconds 1800 --out-dir out/sub1-p3-b256k-lr14-full --matrix-lr 0.028 --seed 42", "git_commit": "dab464a", "git_dirty": true, "status": "keep", "wall_elapsed_seconds": 1859.5, "run_log": "research/run-logs/sub1-p3-b256k-lr14-full.log", "checkpoint_path": "out/sub1-p3-b256k-lr14-full/final.pt", "training_seconds": 1784.4, "budget_seconds": 1800, "target_steps": 1000000, "max_train_seconds": 1800, "startup_allowance_est": 58.7, "charged_seconds_est": 1785.4, "over_budget": false, "total_seconds": 1842.4, "compiled": true, "nki_relu2": false, "ngram_ve": "True tables=4 rows=1048576 dim=128 index_gather=True trigram=True opt=rmsprop flat_lr=True bf16=True", "out_bigram": "False bf16=True gate_bias=-2.0 lr=0.0", "oneliners": "relu2_tau=0.0 mlp_sandwich=False head_gate=False hg_norm=True hg_ch=32 hg_mul=2.0 hg_bias=0.0 out_pool=False pool_layers=3 qk_shift=True qk_beta=0.0 qk_freeze=True x0_gate=False block_nudge=False nudge_site=qk qkv_norm_cse=False parallel_block=False par_coalesce=none epoch_shuffle=False epoch_shuffle_seed=1234", "engram": "False site=-1 orders=2,3 heads=1 tables=0 mult=32 mem_dim=128 e_dim=0 key_dim=0 conv_k=4 share=False bf16=True", "batch_ramp": "False grad_accum=(2, 4, 8) bounds=(0.35, 0.75) lr_exp=0.5 ref_grad_accum=8 last_grad_accum=8", "weight_ema": "False decays=(0.995,) start_frac=0.75 seeded=False updates=0", "sched_tricks": "demon_b1=False demon_final=0.55 demon_ref=0.8 demon_start=-1.0 muon_b2=0.9 muon_b2_final=0.0 depth_lr=1.0->1.0 depth_mom=0.0->0.0 depth_mom_ref=0.95", "num_steps": 1148, "total_tokens_M": 300.9, "world_size": 4, "lnc": 2, "seq_len": 2048, "num_params_M": 592.9, "causality_passed": true, "causality_max_abs": 0.0, "public_val_bpb": 1.008174, "eval_seconds": 10.1, "eval_timeout": 1200, "eval_over_timeout": false}
{"timestamp": "2026-09-16T16:10:01+00:00", "label": "sub1-p3-b64k-lr07-full", "solution": "sub1", "description": "batch65536 x matrix-lr 0.014 (0.7x), joint arm A, seed42", "launch_command": "NEURON_LOGICAL_NC_CONFIG=2 torchrun --standalone --nproc_per_node=4 train.py --num-steps 1000000 --max-train-seconds 1800 --out-dir out/sub1-p3-b64k-lr07-full --matrix-lr 0.014 --seed 42", "git_commit": "dab464a", "git_dirty": true, "status": "keep", "wall_elapsed_seconds": 2163.7, "run_log": "research/run-logs/sub1-p3-b64k-lr07-full.log", "checkpoint_path": "out/sub1-p3-b64k-lr07-full/final.pt", "training_seconds": 1784.7, "budget_seconds": 1800, "target_steps": 1000000, "max_train_seconds": 1800, "startup_allowance_est": 362.2, "charged_seconds_est": 1785.7, "over_budget": false, "total_seconds": 2138.9, "compiled": true, "nki_relu2": false, "ngram_ve": "True tables=4 rows=1048576 dim=128 index_gather=True trigram=True opt=rmsprop flat_lr=True bf16=True", "out_bigram": "False bf16=True gate_bias=-2.0 lr=0.0", "oneliners": "relu2_tau=0.0 mlp_sandwich=False head_gate=False hg_norm=True hg_ch=32 hg_mul=2.0 hg_bias=0.0 out_pool=False pool_layers=3 qk_shift=True qk_beta=0.0 qk_freeze=True x0_gate=False block_nudge=False nudge_site=qk qkv_norm_cse=False parallel_block=False par_coalesce=none epoch_shuffle=False epoch_shuffle_seed=1234", "engram": "False site=-1 orders=2,3 heads=1 tables=0 mult=32 mem_dim=128 e_dim=0 key_dim=0 conv_k=4 share=False bf16=True", "batch_ramp": "False grad_accum=(2, 4, 8) bounds=(0.35, 0.75) lr_exp=0.5 ref_grad_accum=2 last_grad_accum=2", "weight_ema": "False decays=(0.995,) start_frac=0.75 seeded=False updates=0", "sched_tricks": "demon_b1=False demon_final=0.55 demon_ref=0.8 demon_start=-1.0 muon_b2=0.9 muon_b2_final=0.0 depth_lr=1.0->1.0 depth_mom=0.0->0.0 depth_mom_ref=0.95", "num_steps": 3698, "total_tokens_M": 242.4, "world_size": 4, "lnc": 2, "seq_len": 2048, "num_params_M": 592.9, "causality_passed": true, "causality_max_abs": 0.0, "public_val_bpb": 1.015859, "eval_seconds": 10.1, "eval_timeout": 1200, "eval_over_timeout": false}
{"timestamp": "2026-09-16T15:38:03+00:00", "label": "sub1-p3-w768-full", "solution": "sub1", "description": "width 768 (n_head 6) full 1800s seed42, retest stale closure", "launch_command": "NEURON_LOGICAL_NC_CONFIG=2 torchrun --standalone --nproc_per_node=4 train.py --num-steps 1000000 --max-train-seconds 1800 --out-dir out/sub1-p3-w768-full --n-embd 768 --seed 42", "git_commit": "496befd", "git_dirty": true, "status": "keep", "wall_elapsed_seconds": 2231.0, "run_log": "research/run-logs/sub1-p3-w768-full.log", "checkpoint_path": "out/sub1-p3-w768-full/final.pt", "training_seconds": 1784.4, "budget_seconds": 1800, "target_steps": 1000000, "max_train_seconds": 1800, "startup_allowance_est": 414.2, "charged_seconds_est": 1785.5, "over_budget": false, "total_seconds": 2213.9, "compiled": true, "nki_relu2": false, "ngram_ve": "True tables=4 rows=1048576 dim=128 index_gather=True trigram=True opt=rmsprop flat_lr=True bf16=True", "out_bigram": "False bf16=True gate_bias=-2.0 lr=0.0", "oneliners": "relu2_tau=0.0 mlp_sandwich=False head_gate=False hg_norm=True hg_ch=32 hg_mul=2.0 hg_bias=0.0 out_pool=False pool_layers=3 qk_shift=True qk_beta=0.0 qk_freeze=True x0_gate=False block_nudge=False nudge_site=qk qkv_norm_cse=False parallel_block=False par_coalesce=none epoch_shuffle=False epoch_shuffle_seed=1234", "engram": "False site=-1 orders=2,3 heads=1 tables=0 mult=32 mem_dim=128 e_dim=0 key_dim=0 conv_k=4 share=False bf16=True", "batch_ramp": "False grad_accum=(2, 4, 8) bounds=(0.35, 0.75) lr_exp=0.5 ref_grad_accum=4 last_grad_accum=4", "weight_ema": "False decays=(0.995,) start_frac=0.75 seeded=False updates=0", "sched_tricks": "demon_b1=False demon_final=0.55 demon_ref=0.8 demon_start=-1.0 muon_b2=0.9 muon_b2_final=0.0 depth_lr=1.0->1.0 depth_mom=0.0->0.0 depth_mom_ref=0.95", "num_steps": 1811, "total_tokens_M": 237.4, "world_size": 4, "lnc": 2, "seq_len": 2048, "num_params_M": 611.2, "causality_passed": true, "causality_max_abs": 0.0, "public_val_bpb": 1.011509, "eval_seconds": 11.1, "eval_timeout": 1200, "eval_over_timeout": false}
